,City,Country,Datetime,District,Event Date,Event ID,Event Sentence,Event Text,Headline,ISO Week,Intensity,Latitude,Longitude,Month,Province,Publisher,Sentence Number,Source,Source Country,Source Name,Source Sectors,Story ID,Target Country,Target Name,Target Sectors,Year
391,Manbij,Syria,2016-08-16,NULL,2016-08-16,ICEWS24849616,"Turkey blames the cleric, Fethullah Gulen, for the July 15 failed putsch and wants the United States to extradite him.",Accuse,"Turkey, U.S. foreign ministers discuss extradition of cleric Gulen: Turkish foreign minister sources","(2016, 33, 3)",-2,36.5281,37.9549,8,Muhafazat Halab,Reuters News,3,Factiva,Turkey,Turkey,NULL,41951145,Turkey,Fethullah Gulen,"National Religious,Social,Education",2016
392,NULL,Bahrain,2016-08-16,NULL,2016-08-16,ICEWS24849664,"The experts called on the Bahrain government to end arbitrary arrests, release those detained and lift travel bans.",Appeal for release of persons or property,UN rights experts concerned over Bahrain persecution of Shias,"(2016, 33, 3)",-0.3,26.2154,50.5832,8,NULL,FARS News Agency,4,Factiva,NULL,United Nations,"Global,International Government Organization,Global Diplomatic IGOs",41951157,Bahrain,Bahrain,NULL,2016
393,NULL,Bahrain,2016-08-16,NULL,2016-08-16,ICEWS24849665,"The experts called on the Bahrain government to end arbitrary arrests, release those detained and lift travel bans.",Criticize or denounce,UN rights experts concerned over Bahrain persecution of Shias,"(2016, 33, 3)",-2,26.2154,50.5832,8,NULL,FARS News Agency,4,Factiva,NULL,United Nations,"Global,International Government Organization,Global Diplomatic IGOs",41951157,Bahrain,Bahrain,NULL,2016
394,Manbij,Syria,2016-08-16,NULL,2016-08-16,ICEWS24849577,"Mevlut Cavusoglu and Kerry also discussed the latest developments in Syria, including the situation in Manbij and Aleppo, the sources said.",Consult,"Turkey, US foreign ministers discuss extradition of cleric Gulen - Turkish foreign ministry sources","(2016, 33, 3)",1,36.5281,37.9549,8,Muhafazat Halab,Channel NewsAsia,2,Factiva,Turkey,Mevlut Cavusoglu,"Executive,Foreign Ministry,Government,Legislative / Parliamentary,Unicameral",41951167,United States,John Kerry,"Upper House,Government,Parties,(National) Major Party,Legislative / Parliamentary,Executive,Cabinet,Center Left,Ideological,Foreign Ministry",2016
395,Manbij,Syria,2016-08-16,NULL,2016-08-16,ICEWS24849578,"Mevlut Cavusoglu and Kerry also discussed the latest developments in Syria, including the situation in Manbij and Aleppo, the sources said.",Consult,"Turkey, US foreign ministers discuss extradition of cleric Gulen - Turkish foreign ministry sources","(2016, 33, 3)",1,36.5281,37.9549,8,Muhafazat Halab,Channel NewsAsia,2,Factiva,United States,John Kerry,"Upper House,Government,Parties,(National) Major Party,Legislative / Parliamentary,Executive,Cabinet,Center Left,Ideological,Foreign Ministry",41951167,Turkey,Mevlut Cavusoglu,"Executive,Foreign Ministry,Government,Legislative / Parliamentary,Unicameral",2016
396,Manbij,Syria,2016-08-16,NULL,2016-08-16,ICEWS24849580,"Turkey blames the cleric, Fethullah Gulen, for the July 15 failed putsch and wants the United States to extradite him.",Accuse,"Turkey, US foreign ministers discuss extradition of cleric Gulen - Turkish foreign ministry sources","(2016, 33, 3)",-2,36.5281,37.9549,8,Muhafazat Halab,Channel NewsAsia,3,Factiva,Turkey,Turkey,NULL,41951167,Turkey,Fethullah Gulen,"National Religious,Social,Education",2016
398,Ash Shamil,Syria,2016-08-16,NULL,2016-08-16,ICEWS24849817,"According to Humud, the Nusra Front may have calculated its split with al-Qaeda in order to 'focus its attacks on the Syrian government.'",Use conventional military force,Formal Nusra Front Split With Al-Qaeda to ‘Complicate’ US Strategy in Syria - Report,"(2016, 33, 3)",-10,36.7673,38.0108,8,Muhafazat Halab,Unknown,5,Factiva,Syria,Jabhat al-Nusra,"Radicals / Extremists / Fundamentalists,Dissident",41951437,Syria,Government (Syria),Government,2016
399,Sinjar,Iraq,2016-08-16,NULL,2016-08-16,ICEWS24849918,"The Kurdish security forces, backed by coalition warplanes, killed at least 27 IS militants and destroyed several vehicles, Khansouri said.",Use conventional military force,Iraqi forces free 4 villages from IS in southern Mosul,"(2016, 33, 3)",-10,36.3209,41.8766,8,Muhafazat Ninawa,Xinhua News Agency,6,Factiva,Iraq,Military Personnel - Special (Iraq),"Government,Military",41951513,Iraq,Militant (Iraq),Unidentified Forces,2016
400,Damascus,Syria,2016-08-16,NULL,2016-08-16,ICEWS24850014,Iran decided to support Syrian President Bashar al-Assad and Turkey decided to support Assad’s opposition and any group willing to topple the regime in Damascus.,Express intent to engage in diplomatic cooperation (such as policy support),"Iran and Turkey, a rollercoaster of a relationship","(2016, 33, 3)",4.5,33.5102,36.2913,8,Dimashq,Al Arabiya,6,Factiva,Iran,Iran,NULL,41951556,Syria,Bashar al-Assad,"Social,Ideological,Executive,Executive Office,National Ethnic,Far Right,Shia,Government,Religious Minority,(National) Major Party,Parties,International Religious,National Religious,National Ethnic Minority",2016
401,Damascus,Syria,2016-08-16,NULL,2016-08-16,ICEWS24850015,Iran decided to support Syrian President Bashar al-Assad and Turkey decided to support Assad’s opposition and any group willing to topple the regime in Damascus.,Express intent to engage in diplomatic cooperation (such as policy support),"Iran and Turkey, a rollercoaster of a relationship","(2016, 33, 3)",4.5,33.5102,36.2913,8,Dimashq,Al Arabiya,6,Factiva,Turkey,Turkey,NULL,41951556,Syria,Bashar al-Assad,"Social,Ideological,Executive,Executive Office,National Ethnic,Far Right,Shia,Government,Religious Minority,(National) Major Party,Parties,International Religious,National Religious,National Ethnic Minority",2016
402,Deir ez-Zor,Syria,2016-08-16,NULL,2016-08-16,ICEWS24849906,"Russia's defense ministry on Tuesday said long-range bombers and fighter jets took off from the Hamedan base in western Iran and 'conducted a group air strike against targets of the Islamic State and Jabhat al-Nusra terrorist groups in the provinces of Aleppo, Deir Ezzor and Idlib.'",Make statement,Russia warned US ahead of bombing run from Iran: official,"(2016, 33, 3)",0,35.3359,40.1408,8,Dayr az Zawr,Agence France-Presse,6,Factiva,Russian Federation,Defense / Security Ministry (Russia),"Defense / Security Ministry,Government,Executive",41951564,Syria,Fighter Bomber (Syria),"Government,Military",2016
403,Aleppo,Syria,2016-08-16,NULL,2016-08-16,ICEWS24849994,A spokesperson for the defense ministry told Interfax that all Russian aircraft returned to their bases after 'the successful completion' of the mission.,Make statement,Russian bombers strike jihadist positions from Iran's Hamadan airbase,"(2016, 33, 3)",0,36.2012,37.1612,8,Muhafazat Halab,EFE News Service,6,Factiva,Russian Federation,Media Personnel (Russia),"Media,Social",41951568,Russian Federation,Russia,NULL,2016
404,Mosul,Iraq,2016-08-16,NULL,2016-08-16,ICEWS24849922,"Al-Jaburi also stressed that the forces managed to kill more than 33 IS members, including three suicide bombers with explosive belts in the clashes that culminated in the release of the two villages.",Use conventional military force,Iraqi army retakes 2 villages from IS near Mosul,"(2016, 33, 3)",-10,36.335,43.1189,8,Muhafazat Ninawa,EFE News Service,4,Factiva,Iraq,Military (Iraq),"Government,Military",41951572,Iraq,Citizen (Iraq),"General Population / Civilian / Social,Social",2016
405,Manbij,Syria,2016-08-16,NULL,2016-08-16,ICEWS24849794,"Russia and a number of international actors have repeatedly called on Turkey to seal its porous border with Syria to stop the flow of foreign fighters, weapons and munitions destined for the Islamic State and other extremist groups.",Make an appeal or request,US Still Assessing if Syria-Turkey Border Closed to Islamic State Fighters - Pentagon,"(2016, 33, 3)",3,36.5281,37.9549,8,Muhafazat Halab,Unknown,6,Factiva,Russian Federation,Russia,NULL,41951573,Turkey,Turkey,NULL,2016
406,NULL,Syria,2016-08-16,NULL,2016-08-16,ICEWS24849957,"WASHINGTON, August 16 (Sputnik) - Russian airstrikes in Syria initiated from an airbase in Iran have had no impact on operations of the US-led coalition against the Islamic State (IS) in Syria and Iraq, Operation Inherent Resolve spokesman Army Col. Christopher Garver told reporters on Tuesday.",Employ aerial weapons,US-led Coalition Operations Against IS Unaffected by Russian Flights From Iran - Pentagon,"(2016, 33, 3)",-10,33.5102,36.2913,8,NULL,Unknown,1,Factiva,Russian Federation,Russia,NULL,41951577,Syria,Syria,NULL,2016
407,Beirut,Lebanon,2016-08-16,NULL,2016-08-16,ICEWS24849807,"BEIRUT, Aug. 16 (Xinhua) -- The visiting Egyptian Foreign Minister Sameh Shukry said on Tuesday that his country will help Lebanon to overcome its political crisis.",Make statement,Egypt says to help Lebanon overcome political deadlock,"(2016, 33, 3)",0,33.8889,35.4944,8,Beyrouth,Xinhua News Agency,1,Factiva,Egypt,Foreign Affairs (Egypt),"Foreign Ministry,Government,Executive",41951603,Egypt,Egypt,NULL,2016
408,Beirut,Lebanon,2016-08-16,NULL,2016-08-16,ICEWS24849809,"'We will provide the needed support to help Lebanon out of its political crisis,' Shukry said after separate meetings with Lebanese Speaker Nabih Berri, Prime Minister Tammam Salam and Foreign Minister Gebran Bassil.",Consult,Egypt says to help Lebanon overcome political deadlock,"(2016, 33, 3)",1,33.8889,35.4944,8,Beyrouth,Xinhua News Agency,2,Factiva,Egypt,Foreign Affairs (Egypt),"Foreign Ministry,Government,Executive",41951603,Lebanon,Nabih Berri,"Unicameral,Shia,Legislative / Parliamentary,(National) Minor Party,Center Right,Ideological,Government,International Religious,Parties",2016
409,Beirut,Lebanon,2016-08-16,NULL,2016-08-16,ICEWS24849810,"'We will provide the needed support to help Lebanon out of its political crisis,' Shukry said after separate meetings with Lebanese Speaker Nabih Berri, Prime Minister Tammam Salam and Foreign Minister Gebran Bassil.",Consult,Egypt says to help Lebanon overcome political deadlock,"(2016, 33, 3)",1,33.8889,35.4944,8,Beyrouth,Xinhua News Agency,2,Factiva,Egypt,Foreign Affairs (Egypt),"Foreign Ministry,Government,Executive",41951603,Lebanon,Tammam Salam,"Government,Executive Office,Elite,Executive",2016
410,Beirut,Lebanon,2016-08-16,NULL,2016-08-16,ICEWS24849811,"'We will provide the needed support to help Lebanon out of its political crisis,' Shukry said after separate meetings with Lebanese Speaker Nabih Berri, Prime Minister Tammam Salam and Foreign Minister Gebran Bassil.",Consult,Egypt says to help Lebanon overcome political deadlock,"(2016, 33, 3)",1,33.8889,35.4944,8,Beyrouth,Xinhua News Agency,2,Factiva,Egypt,Foreign Affairs (Egypt),"Foreign Ministry,Government,Executive",41951603,Lebanon,Gebran Bassil,"Government,Executive,Foreign Ministry",2016
411,Beirut,Lebanon,2016-08-16,NULL,2016-08-16,ICEWS24849812,"'We will provide the needed support to help Lebanon out of its political crisis,' Shukry said after separate meetings with Lebanese Speaker Nabih Berri, Prime Minister Tammam Salam and Foreign Minister Gebran Bassil.",Consult,Egypt says to help Lebanon overcome political deadlock,"(2016, 33, 3)",1,33.8889,35.4944,8,Beyrouth,Xinhua News Agency,2,Factiva,Lebanon,Nabih Berri,"Unicameral,Shia,Legislative / Parliamentary,(National) Minor Party,Center Right,Ideological,Government,International Religious,Parties",41951603,Egypt,Foreign Affairs (Egypt),"Foreign Ministry,Government,Executive",2016
412,Beirut,Lebanon,2016-08-16,NULL,2016-08-16,ICEWS24849813,"'We will provide the needed support to help Lebanon out of its political crisis,' Shukry said after separate meetings with Lebanese Speaker Nabih Berri, Prime Minister Tammam Salam and Foreign Minister Gebran Bassil.",Consult,Egypt says to help Lebanon overcome political deadlock,"(2016, 33, 3)",1,33.8889,35.4944,8,Beyrouth,Xinhua News Agency,2,Factiva,Lebanon,Tammam Salam,"Government,Executive Office,Elite,Executive",41951603,Egypt,Foreign Affairs (Egypt),"Foreign Ministry,Government,Executive",2016
413,Beirut,Lebanon,2016-08-16,NULL,2016-08-16,ICEWS24849814,"'We will provide the needed support to help Lebanon out of its political crisis,' Shukry said after separate meetings with Lebanese Speaker Nabih Berri, Prime Minister Tammam Salam and Foreign Minister Gebran Bassil.",Consult,Egypt says to help Lebanon overcome political deadlock,"(2016, 33, 3)",1,33.8889,35.4944,8,Beyrouth,Xinhua News Agency,2,Factiva,Lebanon,Gebran Bassil,"Government,Executive,Foreign Ministry",41951603,Egypt,Foreign Affairs (Egypt),"Foreign Ministry,Government,Executive",2016
414,Beirut,Lebanon,2016-08-16,NULL,2016-08-16,ICEWS24849808,"Shukry said Egypt seeks stability and peace in the world and region, reiterating his country's keenness for constant contacts with all Lebanese factions.",Make statement,Egypt says to help Lebanon overcome political deadlock,"(2016, 33, 3)",0,33.8889,35.4944,8,Beyrouth,Xinhua News Agency,3,Factiva,Egypt,Foreign Affairs (Egypt),"Foreign Ministry,Government,Executive",41951603,Egypt,Egypt,NULL,2016
415,NULL,Syria,2016-08-16,NULL,2016-08-16,ICEWS24849880,The bombers previously carried out precision airstrikes against Daesh targets in Syria from Russian airspace.,Employ aerial weapons,Russia Notifies US-Led Coalition of Strikes in Syria From Iranian Airbase,"(2016, 33, 3)",-10,33.5102,36.2913,8,NULL,Unknown,5,Factiva,Syria,Citizen (Syria),"Social,General Population / Civilian / Social",41951624,Iraq,Islamic State of Iraq and the Levant,"Sunni,Ideological,Fundamentalist,Dissident,Insurgents,International Religious,Muslim",2016
416,Aleppo,Syria,2016-08-16,NULL,2016-08-16,ICEWS24849819,(JURIST) - Amnesty International said Thursday that a suspected chlorine gas attack in Aleppo could amount to a war crime.,Make statement,Amnesty: Syria chlorine gas attack could be war crime,"(2016, 33, 3)",0,36.2012,37.1612,8,Muhafazat Halab,FARS News Agency,1,Factiva,NULL,Amnesty International,"Nongovernmental Organization (International),Human Rights IGOs",41951696,Syria,Syria,NULL,2016
421,Manbij,Syria,2016-08-16,NULL,2016-08-16,ICEWS24850117,"Last Thursday, Biden told Turkish Prime Minister Binali Yildirim that the U.S. would work with Turkey on the extradition of Fetullah Gulen.",Express intent to engage in diplomatic cooperation (such as policy support),Turkey's FM discusses Gulen's extradition with Kerry,"(2016, 33, 3)",4.5,36.5281,37.9549,8,Muhafazat Halab,Xinhua News Agency,4,Factiva,United States,United States,NULL,41952008,Turkey,Turkey,NULL,2016
422,NULL,Iraq,2016-08-16,NULL,2016-08-16,ICEWS24850086,"Earlier this month, Defence Minister Khaled al-Obeidi accused Speaker Salim al-Juburi and several lawmakers of involvement in corruption.","Accuse of crime, corruption",Iraq PM surprised by judiciary's speed on graft case,"(2016, 33, 3)",-2,33.3406,44.4009,8,NULL,Agence France-Presse,2,Factiva,Iraq,Khaled al-Obeidi,"Executive,Government,Defense / Security Ministry",41952061,Iraq,Salim al-Juburi,"Government,Legislative / Parliamentary",2016
423,NULL,Iraq,2016-08-16,NULL,2016-08-16,ICEWS24850087,"Earlier this month, Defence Minister Khaled al-Obeidi accused Speaker Salim al-Juburi and several lawmakers of involvement in corruption.","Accuse of crime, corruption",Iraq PM surprised by judiciary's speed on graft case,"(2016, 33, 3)",-2,33.3406,44.4009,8,NULL,Agence France-Presse,2,Factiva,Iraq,Khaled al-Obeidi,"Executive,Government,Defense / Security Ministry",41952061,Iraq,Lawmaker (Iraq),"Government,Legislative / Parliamentary",2016
442,Aleppo,Syria,2016-08-16,NULL,2016-08-16,ICEWS24850267,"Russian Foreign Minister Sergey Lavrov has discussed with US Secretary of State John Kerry coordinated actions to fight terrorists in Syria and to ensure cessation of hostilities, the Russian Foreign Ministry reports after their telephone conversation, TASS reported.",Engage in negotiation,"Lavrov, Kerry discuss actions to ensure ceasefire in Syria","(2016, 33, 3)",7,36.2012,37.1612,8,Muhafazat Halab,Unknown,1,Factiva,Russian Federation,Sergey Viktorovich Lavrov,"Foreign Ministry,Parties,(National) Major Party,Center Right,Ideological,Government,Cabinet,Executive",41952217,United States,Cabinet / Council of Ministers / Advisors (United States),"Government,Cabinet,Executive",2016
443,Aleppo,Syria,2016-08-16,NULL,2016-08-16,ICEWS24850268,"Russian Foreign Minister Sergey Lavrov has discussed with US Secretary of State John Kerry coordinated actions to fight terrorists in Syria and to ensure cessation of hostilities, the Russian Foreign Ministry reports after their telephone conversation, TASS reported.",Engage in negotiation,"Lavrov, Kerry discuss actions to ensure ceasefire in Syria","(2016, 33, 3)",7,36.2012,37.1612,8,Muhafazat Halab,Unknown,1,Factiva,United States,Cabinet / Council of Ministers / Advisors (United States),"Government,Cabinet,Executive",41952217,Russian Federation,Sergey Viktorovich Lavrov,"Foreign Ministry,Parties,(National) Major Party,Center Right,Ideological,Government,Cabinet,Executive",2016
444,Aleppo,Syria,2016-08-16,NULL,2016-08-16,ICEWS24850305,"In the 1070 housing development, a combat between government troops and militants has been lasting for several hours.",Use conventional military force,Syrian Army Destroys Militants’ Vehicles Heading to Aleppo’s South-West,"(2016, 33, 3)",-10,36.2012,37.1612,8,Muhafazat Halab,Unknown,5,Factiva,Syria,Military (Syria),"Military,Government",41952285,Syria,Militant (Syria),Unidentified Forces,2016
445,Aleppo,Syria,2016-08-16,NULL,2016-08-16,ICEWS24850306,"In the 1070 housing development, a combat between government troops and militants has been lasting for several hours.",Use unconventional violence,Syrian Army Destroys Militants’ Vehicles Heading to Aleppo’s South-West,"(2016, 33, 3)",-9,36.2012,37.1612,8,Muhafazat Halab,Unknown,5,Factiva,Syria,Militant (Syria),Unidentified Forces,41952285,Syria,Military (Syria),"Military,Government",2016
446,Aleppo,Syria,2016-08-16,NULL,2016-08-16,ICEWS24850363,"The Syrian army has recaptured vast areas in the Southern countryside of Aleppo City, Jeish al-Fatah terrorists confirmed.",Occupy territory,"Report: Turkey Allows 1,000 Terrorists to Cross Border into Syria's Idlib","(2016, 33, 3)",-9.5,36.2012,37.1612,8,Muhafazat Halab,FARS News Agency,6,Factiva,Syria,Military (Syria),"Military,Government",41952351,Syria,Syria,NULL,2016
452,Deir ez-Zor,Syria,2016-08-16,NULL,2016-08-16,ICEWS24850539,"MOSCOW, August 16 (Sputnik) – Russia delivered more than 26 metric tons of humanitarian aid to the Syria’s provinces of Latakia and al-Quneitra as well as to the city of Deir ez-Zor besieged by Islamic State (IS, or ISIS) jihadists, a daily bulletin published on the Russian Defense Ministry’s website on Tuesday said.",Provide humanitarian aid,Russia Delivers Over 26 Tonnes of Humanitarian Aid to Syria – Defense Ministry,"(2016, 33, 3)",7.4,35.3359,40.1408,8,Dayr az Zawr,Unknown,1,Factiva,Russian Federation,Russia,NULL,41952799,Syria,Syria,NULL,2016
453,Damascus,Syria,2016-08-16,NULL,2016-08-16,ICEWS24850496,The Chinese military will provide aid and training to the Syrian government under a deal reached between a Beijing envoy and Syria's defence minister in Damascus on Sunday.,Sign formal agreement,china's military to give aid to Syria,"(2016, 33, 3)",8,33.5102,36.2913,8,Dimashq,South China Morning Post,2,Factiva,China,Envoy (China),"Executive,Government,Foreign Ministry",41952824,Syria,Ministry of Defense,"Government,Defense / Security Ministry,Executive",2016
454,Damascus,Syria,2016-08-16,NULL,2016-08-16,ICEWS24850497,The Chinese military will provide aid and training to the Syrian government under a deal reached between a Beijing envoy and Syria's defence minister in Damascus on Sunday.,Sign formal agreement,china's military to give aid to Syria,"(2016, 33, 3)",8,33.5102,36.2913,8,Dimashq,South China Morning Post,2,Factiva,Syria,Ministry of Defense,"Government,Defense / Security Ministry,Executive",41952824,China,Envoy (China),"Executive,Government,Foreign Ministry",2016
455,NULL,Iraq,2016-08-16,NULL,2016-08-16,ICEWS24850489,He did repeat his false claim that he opposed the Iraq war from the outset.,Reject,Opinion: What Trump didn’t say is more important than what he said,"(2016, 33, 3)",-4,33.3406,44.4009,8,NULL,Deutsche Welle,5,Factiva,Iraq,Presidential Candidate (Iraq),Parties,41952854,Iraq,Iraq,NULL,2016
456,Najran,Saudi Arabia,2016-08-16,NULL,2016-08-16,ICEWS24850534,"'It killed four citizens and three residents,' the civil defence spokesman in Najran city said of the rocket strike, the official Saudi Press Agency reported.",Make statement,Rocket kills 7 civilians in Saudi as Yemen probe begins,"(2016, 33, 3)",0,17.4924,44.1277,8,Mintaqat Najran,Agence France-Presse,3,Factiva,Saudi Arabia,Media Personnel (Saudi Arabia),"Social,Media",41952879,Saudi Arabia,Saudi Press Agency,"Social,Media",2016
457,Najran,Saudi Arabia,2016-08-16,NULL,2016-08-16,ICEWS24850503,"'It killed four citizens and three residents,' the civil defence spokesman in Najran city said of the rocket strike, the official Saudi Press Agency reported.",Make statement,Seven civilians dead as Yemen rocket hits Saudi: civil defence,"(2016, 33, 3)",0,17.4924,44.1277,8,Mintaqat Najran,Agence France-Presse,3,Factiva,Saudi Arabia,Media Personnel (Saudi Arabia),"Social,Media",41952920,Saudi Arabia,Saudi Press Agency,"Social,Media",2016
458,Najran,Saudi Arabia,2016-08-16,NULL,2016-08-16,ICEWS24850493,A spokesman for the coalition did not immediately respond to a Reuters request for comment.,Reject,"Houthi shelling kills seven in Saudi Arabia, nine Yemenis die in air strike","(2016, 33, 3)",-4,17.4924,44.1277,8,Mintaqat Najran,Channel NewsAsia,4,Factiva,Saudi Arabia,Media Personnel (Saudi Arabia),"Social,Media",41952945,United Kingdom,Reuters,"Media,News,Social",2016
473,Aleppo,Syria,2016-08-16,NULL,2016-08-16,ICEWS24850788,UNITED NATIONS (Reuters) - United Nations Secretary-General Ban Ki-moon warned on Tuesday of an unprecedented 'humanitarian catastrophe' in Syria's Aleppo and urged Russia and the United States to quickly reach a deal on a ceasefire in the city and elsewhere in the country.,Appeal for economic cooperation,U.N. chief warns of unprecedented 'catastrophe' in Syria's Aleppo,"(2016, 33, 3)",3.4,36.2012,37.1612,8,Muhafazat Halab,Reuters News,1,Factiva,South Korea,Ban Ki Moon,"Government,Global Diplomatic IGOs,Elite,Global,Foreign Ministry,International Government Organization,Executive",41953570,Russian Federation,Russia,NULL,2016
474,Aleppo,Syria,2016-08-16,NULL,2016-08-16,ICEWS24850789,UNITED NATIONS (Reuters) - United Nations Secretary-General Ban Ki-moon warned on Tuesday of an unprecedented 'humanitarian catastrophe' in Syria's Aleppo and urged Russia and the United States to quickly reach a deal on a ceasefire in the city and elsewhere in the country.,Appeal for economic cooperation,U.N. chief warns of unprecedented 'catastrophe' in Syria's Aleppo,"(2016, 33, 3)",3.4,36.2012,37.1612,8,Muhafazat Halab,Reuters News,1,Factiva,South Korea,Ban Ki Moon,"Government,Global Diplomatic IGOs,Elite,Global,Foreign Ministry,International Government Organization,Executive",41953570,United States,United States,NULL,2016
477,Aleppo,Syria,2016-08-16,NULL,2016-08-16,ICEWS24850821,UNITED NATIONS: United Nations Secretary-General Ban Ki-moon warned on Tuesday of an unprecedented 'humanitarian catastrophe' in Syria's Aleppo and urged Russia and the United States to quickly reach a deal on a ceasefire in the city and elsewhere in the country.,Appeal for economic cooperation,UN chief warns of unprecedented 'catastrophe' in Syria's Aleppo,"(2016, 33, 3)",3.4,36.2012,37.1612,8,Muhafazat Halab,Channel NewsAsia,1,Factiva,South Korea,Ban Ki Moon,"Executive,Government,Foreign Ministry,Elite,Global Diplomatic IGOs,International Government Organization,Global",41953791,Russian Federation,Russia,NULL,2016
478,Aleppo,Syria,2016-08-16,NULL,2016-08-16,ICEWS24850822,UNITED NATIONS: United Nations Secretary-General Ban Ki-moon warned on Tuesday of an unprecedented 'humanitarian catastrophe' in Syria's Aleppo and urged Russia and the United States to quickly reach a deal on a ceasefire in the city and elsewhere in the country.,Appeal for economic cooperation,UN chief warns of unprecedented 'catastrophe' in Syria's Aleppo,"(2016, 33, 3)",3.4,36.2012,37.1612,8,Muhafazat Halab,Channel NewsAsia,1,Factiva,South Korea,Ban Ki Moon,"Executive,Government,Foreign Ministry,Elite,Global Diplomatic IGOs,International Government Organization,Global",41953791,United States,United States,NULL,2016
495,Deir ez-Zor,Syria,2016-08-17,NULL,2016-08-17,ICEWS24851217,"The Russian defence ministry said a group of long-range Tupolev Tu-22M3 bombers and Sukhoi Su-34 fighter bombers took off from Hamadan in the southwest of Tehran, and carried out strikes in the provinces of Aleppo, Deir ez-Zor and Idlib against Islamist militants fighting for Islamic State and Jabhat al-Nusra, which has rebranded itself Jabhat Fatah al-Sham after revoking direct ties to al-Qaeda.",Use unconventional violence,Russia uses Iranian base to launch its bombing raids on Syria for first time,"(2016, 33, 3)",-9,35.3359,40.1408,8,Dayr az Zawr,Irish Times,2,Factiva,Iran,Citizen (Iran),"General Population / Civilian / Social,Social",41954931,Syria,Syria,NULL,2016
