,City,Country,Datetime,District,Event Date,Event ID,Event Sentence,Event Text,Headline,ISO Week,Intensity,Latitude,Longitude,Month,Province,Publisher,Sentence Number,Source,Source Country,Source Name,Source Sectors,Story ID,Target Country,Target Name,Target Sectors,Year
1345,NULL,Egypt,2016-11-04,NULL,2016-11-04,ICEWS25135036,"Egyptian Prime Minister Sharif Ismail said on Friday the government did not have the luxury of postponing reforms, a day after the currency was devalued and fuel prices were raised.",Make statement,Egypt did not have luxury of postponing reforms: PM,"(2016, 44, 3)",0,30.0626,31.2497,11,NULL,Agence France-Presse,1,Factiva,Egypt,Sherif Ismail,"Energy Ministry,Government,Executive Office,Executive",42626203,Egypt,Egypt,NULL,2016
1346,Mosul,Iraq,2016-11-04,NULL,2016-11-04,ICEWS25135082,"Earlier in the day, the station's correspondent said that some neighbourhood in Mosul witnessed 'popular uprisings' against the so-called Islamic State militant group.",Make statement,Iraqi TV airs video clip of 'popular uprising' in Mosul,"(2016, 44, 3)",0,36.335,43.1189,11,Muhafazat Ninawa,BBC Monitoring Newsfile,6,Factiva,Iraq,Media Personnel (Iraq),"Media,Social",42626236,Iraq,Iraq,NULL,2016
1347,Mosul,Iraq,2016-11-04,NULL,2016-11-04,ICEWS25135117,"Islamic State group militants killed seven members of Iraq's security forces Friday during a raid south of the jihadist bastion Mosul which pro-government troops are battling to recapture, officials said.",Use unconventional violence,IS kills seven Iraq security personnel south of Mosul: officials,"(2016, 44, 3)",-9,36.335,43.1189,11,Muhafazat Ninawa,Agence France-Presse,1,Factiva,Iraq,Militant (Iraq),Unidentified Forces,42626331,Iraq,Military Personnel - Special (Iraq),"Government,Military",2016
1348,Sharqat,Iraq,2016-11-04,NULL,2016-11-04,ICEWS25135118,"The militants crossed the Tigris River early in the morning and clashed with security personnel in the Sharqat area about 90 kilometres (55 miles) from Mosul, police officers said.",Use unconventional violence,IS kills seven Iraq security personnel south of Mosul: officials,"(2016, 44, 3)",-9,35.5172,43.2281,11,Muhafazat Salah ad Din,Agence France-Presse,3,Factiva,Iraq,Militant (Iraq),Unidentified Forces,42626331,Iraq,Military Personnel - Special (Iraq),"Government,Military",2016
1349,Sharqat,Iraq,2016-11-04,NULL,2016-11-04,ICEWS25135119,"The militants crossed the Tigris River early in the morning and clashed with security personnel in the Sharqat area about 90 kilometres (55 miles) from Mosul, police officers said.",Use conventional military force,IS kills seven Iraq security personnel south of Mosul: officials,"(2016, 44, 3)",-10,35.5172,43.2281,11,Muhafazat Salah ad Din,Agence France-Presse,3,Factiva,Iraq,Military Personnel - Special (Iraq),"Government,Military",42626331,Iraq,Militant (Iraq),Unidentified Forces,2016
1350,Sharqat,Iraq,2016-11-04,NULL,2016-11-04,ICEWS25135120,"The militants killed four soldiers, two tribal militiamen and one policeman, according to the police officers, who said that clashes in the area were still ongoing.",Use unconventional violence,IS kills seven Iraq security personnel south of Mosul: officials,"(2016, 44, 3)",-9,35.5172,43.2281,11,Muhafazat Salah ad Din,Agence France-Presse,4,Factiva,Iraq,Militant (Iraq),Unidentified Forces,42626331,Iraq,Military (Iraq),"Government,Military",2016
1351,Sharqat,Iraq,2016-11-04,NULL,2016-11-04,ICEWS25135121,"The militants killed four soldiers, two tribal militiamen and one policeman, according to the police officers, who said that clashes in the area were still ongoing.",Use unconventional violence,IS kills seven Iraq security personnel south of Mosul: officials,"(2016, 44, 3)",-9,35.5172,43.2281,11,Muhafazat Salah ad Din,Agence France-Presse,4,Factiva,Iraq,Militant (Iraq),Unidentified Forces,42626331,Iraq,Militia (Iraq),Unidentified Forces,2016
1352,Sharqat,Iraq,2016-11-04,NULL,2016-11-04,ICEWS25135122,"The militants killed four soldiers, two tribal militiamen and one policeman, according to the police officers, who said that clashes in the area were still ongoing.",Use unconventional violence,IS kills seven Iraq security personnel south of Mosul: officials,"(2016, 44, 3)",-9,35.5172,43.2281,11,Muhafazat Salah ad Din,Agence France-Presse,4,Factiva,Iraq,Militant (Iraq),Unidentified Forces,42626331,Iraq,Police (Iraq),"Government,Police",2016
1353,Sharqat,Iraq,2016-11-04,NULL,2016-11-04,ICEWS25135116,"One of the officers, a lieutenant colonel, said that the jihadists had planted bombs in the area.","Conduct suicide, car, or other non-military bombing",IS kills seven Iraq security personnel south of Mosul: officials,"(2016, 44, 3)",-10,35.5172,43.2281,11,Muhafazat Salah ad Din,Agence France-Presse,5,Factiva,Iraq,Citizen (Iraq),"General Population / Civilian / Social,Social",42626331,Iraq,Iraq,NULL,2016
1355,Damascus,Syria,2016-11-04,NULL,2016-11-04,ICEWS25135317,"DAMASCUS, November 4 (Sputnik) - Syrian government army on Friday repelled an attack of by Jabhat Fatah al Sham terrorist group, previously known as the Nusra Front, near Damascus, media reported.",Use conventional military force,Syrian Gov't Army Repels Nusra Front Attack Near Damascus - Reports,"(2016, 44, 3)",-10,33.5102,36.2913,11,Dimashq,Unknown,1,Factiva,Syria,Military (Syria),"Government,Military",42626892,Syria,Syria,NULL,2016
1356,Damascus,Syria,2016-11-04,NULL,2016-11-04,ICEWS25135316,"Militants are retreating from the area under government forces offensive, the broadcaster reported.",Retreat or surrender militarily,Syrian Gov't Army Repels Nusra Front Attack Near Damascus - Reports,"(2016, 44, 3)",10,33.5102,36.2913,11,Dimashq,Unknown,3,Factiva,Syria,Militant (Syria),Unidentified Forces,42626892,Syria,Syria,NULL,2016
1373,NULL,Syria,2016-11-04,NULL,2016-11-04,ICEWS25135434,It said the rebels can leave the city through the Castello road and the Souk al-Khair crossing toward rebel-held areas in the northwestern province of Idlib.,Make statement,1st LD: Rebels in Aleppo fire rockets blocking evacuation of militants,"(2016, 44, 3)",0,35.7667,36.6667,11,Idlib,Xinhua News Agency,5,Factiva,Syria,Military (Syria),"Military,Government",42627151,Syria,Armed Rebel (Syria),"Rebel,Dissident",2016
1374,Aleppo,Syria,2016-11-04,NULL,2016-11-04,ICEWS25135502,"Two Russian servicemen of the reconciliation center received minor wounds as militants shelled a humanitarian corridor near the western part of the Castello road in Aleppo opened for the withdrawal of armed groups, Russia’s defense ministry said on Friday.",fight with small arms and light weapons,Two Russian servicemen wounded in shelling carried out by Syrian militants,"(2016, 44, 3)",-10,36.2012,37.1612,11,Muhafazat Halab,Unknown,1,Factiva,Syria,Militant (Syria),Unidentified Forces,42627157,Russian Federation,Russia,NULL,2016
1375,Amman,Jordan,2016-11-04,NULL,2016-11-04,ICEWS25135583,"AMMAN (Reuters) - At least two U.S. military trainers were shot dead in Jordan on Friday when the car they were in failed to stop at the gate of a military base and was fired on by Jordanian security forces, a Jordanian military source said.",fight with small arms and light weapons,At least two U.S. trainers killed in Jordan shooting: source,"(2016, 44, 3)",-10,31.9552,35.945,11,Muhafazat `Amman,Reuters News,1,Factiva,Jordan,Military Personnel - Special (Jordan),"Government,Military",42627163,United States,Citizen (United States),"General Population / Civilian / Social,Social",2016
1376,Mosul,Iraq,2016-11-04,NULL,2016-11-04,ICEWS25135397,"The executed IS members had been accused of desertion, while another 180 victims were former civil servants who were killed before the terror group retreated from an area in the east of Mosul.",Retreat or surrender militarily,"EFE News Briefs for Friday, Nov. 4 (1300 GMT)","(2016, 44, 3)",10,36.335,43.1189,11,Muhafazat Ninawa,EFE News Service,4,Factiva,Iraq,Islamic State of Iraq and the Levant,"Ideological,Muslim,Dissident,Sunni,Insurgents,Fundamentalist,International Religious",42627206,Iraq,Iraq,NULL,2016
1377,Cairo,Egypt,2016-11-04,NULL,2016-11-04,ICEWS25135559,"Brussels, Nov 04, 2016 (PR Newswire/All Africa Global Media via COMTEX) -- Six Members of the European Parliament's Delegation for relations with the Mashreq countries, headed by Marisa Matias (GUE/NGL), conducted a working visit to Cairo, Egypt, from 30 October to 3 November 2016 in the framework of the 11th Inter-parliamentary meeting between the European Parliament and the Egyptian Parliament.",Make a visit,European Parliament Delegation Encourages Stronger Ties Between Egypt and the European Union [press release],"(2016, 44, 3)",1.9,30.0626,31.2497,11,Muhafazat al Qahirah,All Africa,1,Factiva,NULL,European Parliament,"Regional,International Government Organization,Regional Diplomatic IGOs",42627256,Egypt,Egypt,NULL,2016
1378,Cairo,Egypt,2016-11-04,NULL,2016-11-04,ICEWS25135560,"Brussels, Nov 04, 2016 (PR Newswire/All Africa Global Media via COMTEX) -- Six Members of the European Parliament's Delegation for relations with the Mashreq countries, headed by Marisa Matias (GUE/NGL), conducted a working visit to Cairo, Egypt, from 30 October to 3 November 2016 in the framework of the 11th Inter-parliamentary meeting between the European Parliament and the Egyptian Parliament.",Host a visit,European Parliament Delegation Encourages Stronger Ties Between Egypt and the European Union [press release],"(2016, 44, 3)",2.8,30.0626,31.2497,11,Muhafazat al Qahirah,All Africa,1,Factiva,Egypt,Egypt,NULL,42627256,NULL,European Parliament,"Regional,International Government Organization,Regional Diplomatic IGOs",2016
1379,Aleppo,Syria,2016-11-04,NULL,2016-11-04,ICEWS25135444,"Syrian state media said rebels fired rockets at one of the eight evacuation passages open for civilians and rebels, and accused opposition fighters of preventing residents from fleeing.",Make statement,Russian-declared Aleppo ceasefire under way,"(2016, 44, 3)",0,36.2012,37.1612,11,Muhafazat Halab,Agence France-Presse,2,Factiva,Syria,State Media (Syria),"State Media,Information / Communication / Transparency Ministry,Executive,Government",42627344,Syria,Armed Rebel (Syria),"Rebel,Dissident",2016
1384,Aleppo,Syria,2016-11-04,NULL,2016-11-04,ICEWS25135688,"At 1103 gmt the Qatari-funded pro-opposition Al Jazeera news channel reported that seven fighters from Lebanese Hezbollah, which is fighting alongside Syrian government troops, had been killed in fighting in the Aleppo.",Use unconventional violence,Breaches reported as 'humanitarian pause' takes effect in Syria's Aleppo,"(2016, 44, 3)",-9,36.2012,37.1612,11,Muhafazat Halab,BBC Monitoring Middle East,6,Factiva,Lebanon,Combatant (Hezbollah),"Shia,National Religious,Social,(National) Minor Party,International Religious,Dissident,Ideological,Organized Violent,Parties,Far Left",42627606,Syria,Military (Syria),"Government,Military",2016
1385,Aleppo,Syria,2016-11-04,NULL,2016-11-04,ICEWS25135689,"At 1103 gmt the Qatari-funded pro-opposition Al Jazeera news channel reported that seven fighters from Lebanese Hezbollah, which is fighting alongside Syrian government troops, had been killed in fighting in the Aleppo.",Use conventional military force,Breaches reported as 'humanitarian pause' takes effect in Syria's Aleppo,"(2016, 44, 3)",-10,36.2012,37.1612,11,Muhafazat Halab,BBC Monitoring Middle East,6,Factiva,Syria,Military (Syria),"Government,Military",42627606,Lebanon,Combatant (Hezbollah),"Shia,National Religious,Social,(National) Minor Party,International Religious,Dissident,Ideological,Organized Violent,Parties,Far Left",2016
1386,Amman,Jordan,2016-11-04,NULL,2016-11-04,ICEWS25135637,"AMMAN, Nov 4 (Reuters) - At least two U.S. military trainers were shot dead in Jordan on Friday when the car they were in failed to stop at the gate of a military base and was fired on by Jordanian security forces, a Jordanian military source said.",fight with small arms and light weapons,UPDATE 1-At least two U.S. trainers killed in Jordan shooting - source,"(2016, 44, 3)",-10,31.9552,35.945,11,Muhafazat `Amman,Reuters News,2,Factiva,Jordan,Military Personnel - Special (Jordan),"Military,Government",42627692,United States,Citizen (United States),"General Population / Civilian / Social,Social",2016
1387,NULL,Iraq,2016-11-04,NULL,2016-11-04,ICEWS25135690,Last week a man was apprehended for rushing into a concession place at Skinner Field.,"Arrest, detain, or charge with legal action",Father of an offender accused for robbery and disloyalty.,"(2016, 44, 3)",-5,33.3406,44.4009,11,NULL,FARS News Agency,3,Factiva,Iraq,Iraq,NULL,42627763,Iraq,Men (Iraq),"General Population / Civilian / Social,Social",2016
1388,Damascus,Syria,2016-11-04,NULL,2016-11-04,ICEWS25135738,"Militants are retreating from the area amid the Syrian army's advance, the broadcaster reported.",Retreat or surrender militarily,Syrian Army Repels al-Nusra Front Attack Near Damascus,"(2016, 44, 3)",10,33.5102,36.2913,11,Dimashq,Unknown,3,Factiva,Syria,Militant (Syria),Unidentified Forces,42627799,Syria,Syria,NULL,2016
1389,Aleppo,Syria,2016-11-04,NULL,2016-11-04,ICEWS25135820,"The humanitarian corridor that is open for the exit of armed militants from Aleppo and located in the western part of Aleppo's Castello Road was shelled by militants from the east of the city on Friday, the ministry said.",fight with small arms and light weapons,Two Russian Officers Injured in Militants' Attack Near Castello Road in Aleppo,"(2016, 44, 3)",-10,36.2012,37.1612,11,Muhafazat Halab,Unknown,2,Factiva,Syria,Militant (Syria),Unidentified Forces,42627806,Syria,Syria,NULL,2016
1411,Al Jafr,Jordan,2016-11-04,NULL,2016-11-04,ICEWS25135885,"One Jordanian officer was also wounded, apparently shot in the neck by the US service members.",fight with small arms and light weapons,Pentagon Clarifies Only 1 US Service Member Killed in Shooting at Jordan Airbase - Reports,"(2016, 44, 3)",-10,30.2946,36.2122,11,Muhafazat Ma`an,Unknown,4,Factiva,United States,United States,NULL,42628032,Jordan,Police (Jordan),"Police,Government",2016
1412,Cairo,Egypt,2016-11-04,NULL,2016-11-04,ICEWS25135886,"CAIRO, Nov 4 (Reuters) - Egyptian authorities said on Friday they had arrested members of two recently emerged militant groups, along with weapons, explosives and proof that the organisations had been set up by the Muslim Brotherhood.","Arrest, detain, or charge with legal action","CORRECTED-Egypt says arrests militants, links them to Muslim Brotherhood","(2016, 44, 3)",-5,30.0626,31.2497,11,Muhafazat al Qahirah,Reuters News,3,Factiva,Egypt,Other Authorities / Officials (Egypt),Government,42628046,Egypt,Citizen (Egypt),"General Population / Civilian / Social,Social",2016
1413,Cairo,Egypt,2016-11-04,NULL,2016-11-04,ICEWS25135887,"Police detained five leaders and other members of the Hasam Movement and Louwaa al-Thawra, the interior ministry said - both groups that have claimed responsibility for assassination attempts on judges, policemen and military officers in recent months.","Arrest, detain, or charge with legal action","CORRECTED-Egypt says arrests militants, links them to Muslim Brotherhood","(2016, 44, 3)",-5,30.0626,31.2497,11,Muhafazat al Qahirah,Reuters News,4,Factiva,Egypt,Police (Egypt),"Government,Police",42628046,Egypt,Citizen (Egypt),"General Population / Civilian / Social,Social",2016
1414,Latakia,Syria,2016-11-04,NULL,2016-11-04,ICEWS25135958,The Russian Ministry said all the Russian military personnel survived the incident and landed safely at the Humeimim Airbase in Lattakia.,Make statement,Syria: Russian Pilots Survive ISIL Missile Attack East of Homs,"(2016, 44, 3)",0,35.5317,35.7901,11,Muhafazat al Ladhiqiyah,FARS News Agency,4,Factiva,Russian Federation,Ministry (Russia),Government,42628115,Russian Federation,Military (Russia),"Military,Government",2016
1415,Latakia,Syria,2016-11-04,NULL,2016-11-04,ICEWS25135959,The Russian Ministry said all the Russian military personnel survived the incident and landed safely at the Humeimim Airbase in Lattakia.,Make a visit,Syria: Russian Pilots Survive ISIL Missile Attack East of Homs,"(2016, 44, 3)",1.9,35.5317,35.7901,11,Muhafazat al Ladhiqiyah,FARS News Agency,4,Factiva,Russian Federation,Military (Russia),"Military,Government",42628115,Syria,Syria,NULL,2016
1416,Latakia,Syria,2016-11-04,NULL,2016-11-04,ICEWS25135960,The Russian Ministry said all the Russian military personnel survived the incident and landed safely at the Humeimim Airbase in Lattakia.,Host a visit,Syria: Russian Pilots Survive ISIL Missile Attack East of Homs,"(2016, 44, 3)",2.8,35.5317,35.7901,11,Muhafazat al Ladhiqiyah,FARS News Agency,4,Factiva,Syria,Syria,NULL,42628115,Russian Federation,Military (Russia),"Military,Government",2016
1417,Tall `Afar,Iraq,2016-11-04,NULL,2016-11-04,ICEWS25136009,TEHRAN (FNA)- The Iraqi popular forces said that they have thus far liberated over 45 villages West of Mosul as they continue their offensive against ISIL's positions towards the town of Tal Afar.,Use conventional military force,Iraqi Popular Forces Confirm Liberation of 45 Villages West of Mosul,"(2016, 44, 3)",-10,36.3791,42.4481,11,Muhafazat Ninawa,FARS News Agency,1,Factiva,Iraq,Military (Iraq),"Government,Military",42628116,Iraq,Islamic State of Iraq and the Levant,"Insurgents,Dissident,Fundamentalist,International Religious,Ideological,Sunni,Muslim",2016
1418,Aleppo,Syria,2016-11-04,NULL,2016-11-04,ICEWS25135895,"BEIRUT (Reuters) - Syrian rebels and civilians showed no sign of leaving the besieged opposition-held sector of Aleppo on Friday, despite a Russian deadline to resume bombing Syria's largest city at nightfall after a 17-day pause.","Defy norms, law",Rebel-held zone of Syria's Aleppo braces for renewed bombardment,"(2016, 44, 3)",-5,36.2012,37.1612,11,Muhafazat Halab,Reuters News,1,Factiva,Syria,Armed Rebel (Syria),"Rebel,Dissident",42628165,Russian Federation,Russia,NULL,2016
1419,Aleppo,Syria,2016-11-04,NULL,2016-11-04,ICEWS25135896,The rebels' own shelling of residential parts of government-held western Aleppo has meanwhile killed dozens in the past week as insurgent groups staged a counter-attack from outside the city aimed at breaking the siege on areas they control.,fight with artillery and tanks,Rebel-held zone of Syria's Aleppo braces for renewed bombardment,"(2016, 44, 3)",-10,36.2012,37.1612,11,Muhafazat Halab,Reuters News,2,Factiva,Syria,Armed Rebel (Syria),"Rebel,Dissident",42628165,Syria,Syria,NULL,2016
1420,Cairo,Egypt,2016-11-04,NULL,2016-11-04,ICEWS25135994,"CAIRO (Reuters) - Egyptian authorities said on Friday they had arrested members of two recently emerged militant groups, along with weapons, explosives and proof that the organizations had been set up by the Muslim Brotherhood.","Arrest, detain, or charge with legal action","Egypt says arrests militants, links them to Muslim Brotherhood","(2016, 44, 3)",-5,30.0626,31.2497,11,Muhafazat al Qahirah,Reuters News,1,Factiva,Egypt,Other Authorities / Officials (Egypt),Government,42628200,Egypt,Citizen (Egypt),"General Population / Civilian / Social,Social",2016
1421,Cairo,Egypt,2016-11-04,NULL,2016-11-04,ICEWS25135995,"Police detained five leaders and other members of the Hasam Movement and Louwaa al-Thawra, the interior ministry said - both groups that have claimed responsibility for assassination attempts on judges, policemen and military officers in recent months.","Arrest, detain, or charge with legal action","Egypt says arrests militants, links them to Muslim Brotherhood","(2016, 44, 3)",-5,30.0626,31.2497,11,Muhafazat al Qahirah,Reuters News,2,Factiva,Egypt,Police (Egypt),"Government,Police",42628200,Egypt,Citizen (Egypt),"General Population / Civilian / Social,Social",2016
1422,Aleppo,Syria,2016-11-04,NULL,2016-11-04,ICEWS25135909,"Russia and the Syrian army told rebels in Aleppo on Wednesday to leave by Friday evening, signalling an extended moratorium on air strikes in the city.",Make statement,UPDATE 1-U.N. says can't use Russian Aleppo pause to send aid,"(2016, 44, 3)",0,36.2012,37.1612,11,Muhafazat Halab,Reuters News,4,Factiva,Russian Federation,Russia,NULL,42628202,Syria,Armed Rebel (Syria),"Rebel,Dissident",2016
1423,Aleppo,Syria,2016-11-04,NULL,2016-11-04,ICEWS25135910,"Russia and the Syrian army told rebels in Aleppo on Wednesday to leave by Friday evening, signalling an extended moratorium on air strikes in the city.",Make statement,UPDATE 1-U.N. says can't use Russian Aleppo pause to send aid,"(2016, 44, 3)",0,36.2012,37.1612,11,Muhafazat Halab,Reuters News,4,Factiva,Syria,Military (Syria),"Military,Government",42628202,Syria,Armed Rebel (Syria),"Rebel,Dissident",2016
1424,Mosul,Iraq,2016-11-04,NULL,2016-11-04,ICEWS25135858,"Iraqi special forces stepped up attacks against ISIL in Mosul on Friday, seeking to expand the army's foothold in the east of the city after the leader of the armed group told his men there could be no retreat.",Use conventional military force,Battle for Mosul: Iraq army says six ISIL areas seized,"(2016, 44, 3)",-10,36.335,43.1189,11,Muhafazat Ninawa,Al Jazeera English,2,Factiva,Iraq,Military Personnel - Special (Iraq),"Government,Military",42628243,Iraq,Islamic State of Iraq and the Levant,"Insurgents,Dissident,Fundamentalist,International Religious,Ideological,Sunni,Muslim",2016
1427,Baghdad,Iraq,2016-11-04,NULL,2016-11-04,ICEWS25136144,"BAGHDAD (AP) — Heavy fighting erupted in the eastern neighborhoods of Mosul on Friday as Iraqi special forces launched an assault deeper into the urban areas of the city and swung round to attack Islamic State militants from a second entry point, to the northeast.",Use conventional military force,Mosul Today: heaviest fighting yet in campaign to expel IS,"(2016, 44, 3)",-10,33.3406,44.4009,11,Muhafazat Baghdad,Associated Press Newswires,1,Factiva,Iraq,Iraq,NULL,42628528,Iraq,Militant (Iraq),Unidentified Forces,2016
1428,Al Jafr,Jordan,2016-11-04,NULL,2016-11-04,ICEWS25136057,"One Jordanian officer was also wounded, apparently shot in the neck by the US service members.",fight with small arms and light weapons,Pentagon Clarifies Only 1 US Service Member Killed in Shooting at Jordan Airbase,"(2016, 44, 3)",-10,30.2946,36.2122,11,Muhafazat Ma`an,Unknown,5,Factiva,United States,United States,NULL,42628600,Jordan,Police (Jordan),"Police,Government",2016
1429,Ismailia,Egypt,2016-11-04,NULL,2016-11-04,ICEWS25136081,"ISMAILIA, Egypt (Reuters) - A senior Egyptian general was shot dead by militants on Friday near his home in North Sinai where an Islamic State insurgency is raging, health and security sources said, the second such incident in as many weeks.",fight with small arms and light weapons,Second Egyptian general killed in Sinai in as many weeks: sources,"(2016, 44, 3)",-10,30.6043,32.2723,11,Ismailia Governorate,Reuters News,1,Factiva,Egypt,Militant (Egypt),Unidentified Forces,42628613,Egypt,Citizen (Egypt),"Social,General Population / Civilian / Social",2016
1430,Arish,Egypt,2016-11-04,NULL,2016-11-04,ICEWS25136082,"Gunmen opened fire on Brigadier General Hesham Mahmoud Abualazm, 47, on the street from a moving car in Arish city, North Sinai's provincial capital, the sources said.",fight with small arms and light weapons,Second Egyptian general killed in Sinai in as many weeks: sources,"(2016, 44, 3)",-10,31.1316,33.7984,11,Muhafazat Shamal Sina',Reuters News,2,Factiva,Egypt,Armed Gang (Egypt),Unidentified Forces,42628613,Egypt,High Ranking Military Personnel (Egypt),"Military,Government",2016
1445,Beirut,Lebanon,2016-11-04,NULL,2016-11-04,ICEWS25136201,"In addition to pledges of economic growth and security, Aoun also said in his oath of office that Lebanon must work to ensure Syrian refugees to 'return quickly' to their country.",Demand diplomatic cooperation (such as policy support),Lebanon's president pledges unified foreign policy,"(2016, 44, 3)",-5,33.8889,35.4944,11,Beyrouth,Xinhua News Agency,6,Factiva,Lebanon,Michel Aoun,"Parties,Ideological,Center Right,Unicameral,Government,(National) Minor Party,Legislative / Parliamentary",42628877,Lebanon,Lebanon,NULL,2016
1446,Beirut,Lebanon,2016-11-04,NULL,2016-11-04,ICEWS25136361,"The Hezbollah chief called for the formation of a national unity government and the cooperation of all forces, pointing that Prime Minister-designate Saad Hariri 'has said that he will exert efforts in this direction.'",Make statement,Hezbollah won't join new government in Lebanon without Speaker Berri: official,"(2016, 44, 3)",0,33.8889,35.4944,11,Beyrouth,Xinhua News Agency,6,Factiva,Lebanon,Saad Hariri,"Parties,Elite,Ideological,Center Right,Sunni,(National) Minor Party,International Religious",42628879,Lebanon,Hezbollah,"Shia,Social,Parties,Far Left,National Religious,Organized Violent,Ideological,Dissident,(National) Minor Party,International Religious",2016
1447,Cairo,Egypt,2016-11-04,NULL,2016-11-04,ICEWS25136269,"CAIRO, Nov 4 (Reuters) - Egyptian authorities said on Friday they had arrested members of two recently emerged militant groups, along with weapons, explosives and evidence that the organisations had been set up by the Muslim Brotherhood.","Arrest, detain, or charge with legal action","UPDATE 1-Egypt arrests militants, links them to Muslim Brotherhood","(2016, 44, 3)",-5,30.0626,31.2497,11,Muhafazat al Qahirah,Reuters News,3,Factiva,Egypt,Other Authorities / Officials (Egypt),Government,42628925,Egypt,Citizen (Egypt),"Social,General Population / Civilian / Social",2016
