,City,Country,Datetime,District,Event Date,Event ID,Event Sentence,Event Text,Headline,ISO Week,Intensity,Latitude,Longitude,Month,Province,Publisher,Sentence Number,Source,Source Country,Source Name,Source Sectors,Story ID,Target Country,Target Name,Target Sectors,Year
1090,Riyadh,Saudi Arabia,2016-10-27,NULL,2016-10-27,ICEWS25105961,"At the conclusion of her visit to Riyadh, Ms. Christine Lagarde, Managing Director of the International Monetary Fund (IMF), said, “It has been a great pleasure to visit Riyadh, Saudi Arabia, where I had the privilege of meeting His Majesty King Salman Bin Abdulaziz Al Saud.",Host a visit,IMF MD Christine Lagarde says Saudi has begun ‘a major policy shift’,"(2016, 43, 3)",2.8,24.6877,46.7219,10,Mintaqat ar Riyad,Mist News,2,Factiva,Saudi Arabia,Saudi Arabia,NULL,42555587,France,Christine Lagarde,"Ideological,Center Right,International Government Organization,Global,Global Economic/Financial/Trade IGOs,Elite,Parties,(National) Major Party",2016
1091,Mosul,Iraq,2016-10-27,NULL,2016-10-27,ICEWS25106201,"MOSCOW, October 27 (Sputnik) - The Islamic State (IS) militants executed on Thursday 22 residents of the Iraqi city of Mosul, which has become a battlefield between the Iraqi Armed Forces and jihadists, local media reported, citing sources.",Use conventional military force,IS Militants Execute 22 Residents of Iraq's Mosul - Reports,"(2016, 43, 3)",-10,36.335,43.1189,10,Muhafazat Ninawa,Unknown,1,Factiva,Iraq,Military (Iraq),"Military,Government",42555653,Iraq,Citizen (Iraq),"General Population / Civilian / Social,Social",2016
1092,Mosul,Iraq,2016-10-27,NULL,2016-10-27,ICEWS25106202,"MOSCOW, October 27 (Sputnik) - The Islamic State (IS) militants executed on Thursday 22 residents of the Iraqi city of Mosul, which has become a battlefield between the Iraqi Armed Forces and jihadists, local media reported, citing sources.",Use unconventional violence,IS Militants Execute 22 Residents of Iraq's Mosul - Reports,"(2016, 43, 3)",-9,36.335,43.1189,10,Muhafazat Ninawa,Unknown,1,Factiva,Iraq,Citizen (Iraq),"General Population / Civilian / Social,Social",42555653,Iraq,Military (Iraq),"Military,Government",2016
1093,Raqqa,Syria,2016-10-27,NULL,2016-10-27,ICEWS25106110,The top U.S. military commander said on Wednesday that Kurdish YPG fighters would be included as a part of the force to isolate the Islamic State-held Syrian city of Raqqa.,Make statement,"Turkey asked U.S. not to allow Kurdish militia into Raqqa, minister tells TRT Haber","(2016, 43, 3)",0,35.9528,39.0079,10,Ar Raqqah,Reuters News,2,Factiva,United States,Military Personnel (United States),"Military,Government",42555658,Turkey,Combatant (Turkish Kurds),"International Ethnic,Kurd (Ethnic Group)",2016
1094,Manbij,Syria,2016-10-27,NULL,2016-10-27,ICEWS25106132,"Earlier on Thursday, President Tayyip Erdogan said Turkey's military operation in northern Syria will target the town of Manbij, recently liberated from Islamic State by Kurdish-led forces, and Raqqa after the town of al-Bab.",Make statement,"Turkey asked U.S. not to allow Kurdish militia into Raqqa, minister tells TRT Haber","(2016, 43, 3)",0,36.5281,37.9549,10,Muhafazat Halab,Reuters News,4,Factiva,Turkey,Recep Tayyip Erdoğan,"Sunni,Ideological,Center Right,Government,Executive Office,International Religious,Executive,(National) Major Party,Parties,Elite",42555658,Turkey,Turkey,NULL,2016
1095,Raqqa,Syria,2016-10-27,NULL,2016-10-27,ICEWS25106203,A top U.S. military commander said on Wednesday YPG fighters will be included in the force to isolate Raqqa.,Make statement,Erdogan says Turkish offensive will target Syrian towns of Manbij and Raqqa,"(2016, 43, 3)",0,35.9528,39.0079,10,Ar Raqqah,Reuters News,6,Factiva,United States,Military Personnel (United States),"Military,Government",42555659,Syria,Combatant (People's Protection Units),"Separatists,Dissident",2016
1096,Mosul,Iraq,2016-10-27,NULL,2016-10-27,ICEWS25105976,The US want to clarify the results of its airstrikes near Mosul,Employ aerial weapons,THE AMERICANS REQUESTED ASSISTANCE FROM THE HAND OF MOSCOW,"(2016, 43, 3)",-10,36.335,43.1189,10,Muhafazat Ninawa,WPS: What the Papers Say,1,Factiva,United States,United States,NULL,42555711,Iraq,Iraq,NULL,2016
1097,NULL,Syria,2016-10-27,NULL,2016-10-27,ICEWS25106053,"The Syrian Observatory for Human Rights said that Wednesday's aerial bombardment on a school in Idlib province killed 11 minors, seven women and injured dozens.",Make statement,Death toll from Syria school airstrike rises to 35,"(2016, 43, 3)",0,35.7667,36.6667,10,Idlib,EFE News Service,3,Factiva,Syria,Syrian Observatory for Human Rights,"Exiles,Dissident",42555724,Syria,Education (Syria),"Education,Social",2016
1098,NULL,Syria,2016-10-27,NULL,2016-10-27,ICEWS25106054,The Russian air force carried out at least six airstrikes against the school and its surroundings.,Employ aerial weapons,Death toll from Syria school airstrike rises to 35,"(2016, 43, 3)",-10,35.7667,36.6667,10,Idlib,EFE News Service,4,Factiva,Russian Federation,Russian Air Force,"Military,Government,Air Force",42555724,Syria,Education (Syria),"Education,Social",2016
1099,Ba`shiqah,Iraq,2016-10-27,NULL,2016-10-27,ICEWS25106083,Relations between Turkey and Iraq deteriorated after Turkey dispatched its troops in Iraq allegedly to fight the IS in late 2015.,Mobilize or increase armed forces,Turkey May Strengthen Military Presence in Iraq Due to Increased Threat From IS - Reports,"(2016, 43, 3)",-7.2,36.4495,43.3518,10,Muhafazat Ninawa,Unknown,2,Factiva,Turkey,Turkey,NULL,42555735,Iraq,Iraq,NULL,2016
1100,Baghdad,Iraq,2016-10-27,NULL,2016-10-27,ICEWS25106082,"On October 17, a Turkish delegation visited Iraq and presented the document to the authorities in Baghdad, the publication said citing its sources.",Make a visit,Turkey May Strengthen Military Presence in Iraq Due to Increased Threat From IS - Reports,"(2016, 43, 3)",1.9,33.3406,44.4009,10,Muhafazat Baghdad,Unknown,5,Factiva,Turkey,Turkey,NULL,42555735,Iraq,Iraq,NULL,2016
1101,Baghdad,Iraq,2016-10-27,NULL,2016-10-27,ICEWS25106084,"On October 17, a Turkish delegation visited Iraq and presented the document to the authorities in Baghdad, the publication said citing its sources.",Host a visit,Turkey May Strengthen Military Presence in Iraq Due to Increased Threat From IS - Reports,"(2016, 43, 3)",2.8,33.3406,44.4009,10,Muhafazat Baghdad,Unknown,5,Factiva,Iraq,Iraq,NULL,42555735,Turkey,Turkey,NULL,2016
1102,Sharm ash Shaykh,Egypt,2016-10-27,NULL,2016-10-27,ICEWS25106098,Egypt's Interior Minister Magdy Abdel Ghaffar has said that police do not get enough 'popular support' in facing the 'terrorist plot' against Egypt.,Make statement,Egypt interior minister urges more popular support to police,"(2016, 43, 3)",0,27.9158,34.3299,10,Muhafazat Janub Sina',BBC Monitoring Middle East,2,Factiva,Egypt,Domestic Affairs (Egypt),"Government,Executive,Interior / Home Ministry",42555827,Egypt,Police (Egypt),"Police,Government",2016
1105,Raqqa,Syria,2016-10-27,NULL,2016-10-27,ICEWS25106340,Turkey's president is telling his American counterpart that Turkey is ready to kick the Islamic State group out of their capital Raqqa in Syria.,Make statement,The Latest: Erdogan tells Obama that Ankara targeting Raqqa,"(2016, 43, 3)",0,35.9528,39.0079,10,Ar Raqqah,Associated Press Newswires,3,Factiva,Turkey,Head of Government (Turkey),"Executive,Executive Office,Government",42556102,Turkey,Turkey,NULL,2016
1106,Manbij,Syria,2016-10-27,NULL,2016-10-27,ICEWS25106341,Recep Tayyip Erdogan said on Thursday that Turkey-backed opposition fighters inside Syria will eventually reach Raqqa after securing the towns of al-Bab and Manbij.,Make statement,The Latest: Erdogan tells Obama that Ankara targeting Raqqa,"(2016, 43, 3)",0,36.5281,37.9549,10,Muhafazat Halab,Associated Press Newswires,4,Factiva,Turkey,Recep Tayyip Erdoğan,"Executive Office,International Religious,Ideological,Sunni,Government,Center Right,Executive,Parties,(National) Major Party,Elite",42556102,Syria,Combatant (Syria),Unidentified Forces,2016
1107,NULL,Syria,2016-10-27,NULL,2016-10-27,ICEWS25106228,"'On 27 October 2016, the Council added 10 persons to the list of those targeted by EU restrictive measures against the Syrian regime for being responsible for the violent repression against the civilian population in Syria, benefiting from or supporting the regime, and/or being associated with such persons,' the statement read.",Praise or endorse,EU Sanctions Ten More People Linked to Syrian Government - Statement,"(2016, 43, 3)",3.4,33.5102,36.2913,10,NULL,Unknown,2,Factiva,NULL,European Union,"International Government Organization,Regional Diplomatic IGOs,Regional",42556112,Syria,Government (Syria),Government,2016
1108,Mosul,Iraq,2016-10-27,NULL,2016-10-27,ICEWS25106395,'The members of the self-defense forces have broke into Daesh headquarters in the western part of Mosul.,Seize or damage property,Iraqi Self-Defense Forces Take Control Over Key Daesh Facility in Mosul,"(2016, 43, 3)",-9.2,36.335,43.1189,10,Muhafazat Ninawa,Unknown,2,Factiva,Japan,Japan Self-Defense Forces,"Government,Military",42556116,Iraq,Islamic State of Iraq and the Levant,"Muslim,Fundamentalist,International Religious,Ideological,Sunni,Dissident,Insurgents",2016
1109,Mosul,Iraq,2016-10-27,NULL,2016-10-27,ICEWS25106233,"MOSCOW (Sputnik) — The Daesh terrorist group executed on Thursday 22 residents of the Iraqi city of Mosul, which has become a battlefield between the Iraqi Armed Forces and jihadists, local media reported, citing sources.",Use conventional military force,Daesh Militants Execute 22 Residents of Iraq's Mosul,"(2016, 43, 3)",-10,36.335,43.1189,10,Muhafazat Ninawa,Unknown,2,Factiva,Iraq,Military (Iraq),"Military,Government",42556118,Iraq,Citizen (Iraq),"General Population / Civilian / Social,Social",2016
1110,Mosul,Iraq,2016-10-27,NULL,2016-10-27,ICEWS25106234,"MOSCOW (Sputnik) — The Daesh terrorist group executed on Thursday 22 residents of the Iraqi city of Mosul, which has become a battlefield between the Iraqi Armed Forces and jihadists, local media reported, citing sources.",Use unconventional violence,Daesh Militants Execute 22 Residents of Iraq's Mosul,"(2016, 43, 3)",-9,36.335,43.1189,10,Muhafazat Ninawa,Unknown,2,Factiva,Iraq,Citizen (Iraq),"General Population / Civilian / Social,Social",42556118,Iraq,Military (Iraq),"Military,Government",2016
1111,Baghdad,Iraq,2016-10-27,NULL,2016-10-27,ICEWS25106415,"On October 17, a Turkish delegation visited Iraq and presented the document to the authorities in Baghdad, the publication said citing its sources.",Make a visit,Turkey May Strengthen Military Presence in Iraq Due to Increased Daesh Threat,"(2016, 43, 3)",1.9,33.3406,44.4009,10,Muhafazat Baghdad,Unknown,5,Factiva,Turkey,Turkey,NULL,42556119,Iraq,Iraq,NULL,2016
1112,Baghdad,Iraq,2016-10-27,NULL,2016-10-27,ICEWS25106417,"On October 17, a Turkish delegation visited Iraq and presented the document to the authorities in Baghdad, the publication said citing its sources.",Host a visit,Turkey May Strengthen Military Presence in Iraq Due to Increased Daesh Threat,"(2016, 43, 3)",2.8,33.3406,44.4009,10,Muhafazat Baghdad,Unknown,5,Factiva,Iraq,Iraq,NULL,42556119,Turkey,Turkey,NULL,2016
1113,Aleppo,Syria,2016-10-27,NULL,2016-10-27,ICEWS25106297,Militants strike Syrian army's and militia's positions near the 1070 district of Aleppo.,Use unconventional violence,Terrorists Use Grad Missile Systems to Launch Offensive in Aleppo's South-West,"(2016, 43, 3)",-9,36.2012,37.1612,10,Muhafazat Halab,Unknown,3,Factiva,Syria,Militant (Syria),Unidentified Forces,42556120,Syria,Military (Syria),"Government,Military",2016
1114,Aleppo,Syria,2016-10-27,NULL,2016-10-27,ICEWS25106298,Militants strike Syrian army's and militia's positions near the 1070 district of Aleppo.,Use unconventional violence,Terrorists Use Grad Missile Systems to Launch Offensive in Aleppo's South-West,"(2016, 43, 3)",-9,36.2012,37.1612,10,Muhafazat Halab,Unknown,3,Factiva,Syria,Militant (Syria),Unidentified Forces,42556120,Syria,Militia (Syria),Unidentified Forces,2016
1115,Raqqa,Syria,2016-10-27,NULL,2016-10-27,ICEWS25106288,TURKISH DEFENCE MINISTER SAYS ASKED UNITED STATES NOT TO ALLOW KURDISH YPG MILITIA TO ENTER RAQQA - TRT HABER,Make an appeal or request,TURKISH DEFENCE MINISTER SAYS ASKED UNITED STATES NOT TO ALLOW KURDISH YPG MILITIA TO ENTER RAQQA - TRT HABER,"(2016, 43, 3)",3,35.9528,39.0079,10,Ar Raqqah,Reuters News,1,Factiva,Turkey,Defense / Security Ministry (Turkey),"Executive,Defense / Security Ministry,Government",42556190,United States,United States,NULL,2016
1116,Mosul,Iraq,2016-10-27,NULL,2016-10-27,ICEWS25106235,"Iraqi President Fuad Masum has arrived in Nineveh to visit the operations command headquarters as the military operation to retake Mosul from the Islamic State (IS) militant group is under way for the second week, pro-Kurds Shafaq news website reported on 27 October.",Make a visit,Iraqi president visits operations command in Nineveh,"(2016, 43, 3)",1.9,36.335,43.1189,10,Muhafazat Ninawa,BBC Monitoring Newsfile,2,Factiva,Iraq,Fuad Masum,"(National) Minor Party,Kurd (Ethnic Group),International Religious,Ideological,International Ethnic,Sunni,Center Left,Parties,Executive,Executive Office,Nationalist,Government",42556257,Iraq,Iraq,NULL,2016
1117,Mosul,Iraq,2016-10-27,NULL,2016-10-27,ICEWS25106236,"Iraqi President Fuad Masum has arrived in Nineveh to visit the operations command headquarters as the military operation to retake Mosul from the Islamic State (IS) militant group is under way for the second week, pro-Kurds Shafaq news website reported on 27 October.",Host a visit,Iraqi president visits operations command in Nineveh,"(2016, 43, 3)",2.8,36.335,43.1189,10,Muhafazat Ninawa,BBC Monitoring Newsfile,2,Factiva,Iraq,Iraq,NULL,42556257,Iraq,Fuad Masum,"(National) Minor Party,Kurd (Ethnic Group),International Religious,Ideological,International Ethnic,Sunni,Center Left,Parties,Executive,Executive Office,Nationalist,Government",2016
1118,Mosul,Iraq,2016-10-27,NULL,2016-10-27,ICEWS25106239,"The offensive, launched on October 17, is seeing tens of thousands of Iraqi fighters advancing on Mosul from the south, east and north in a bid retake the last major Iraqi city under IS control.",Mobilize or increase armed forces,US says up to 900 jihadists killed in Mosul battle,"(2016, 43, 3)",-7.2,36.335,43.1189,10,Muhafazat Ninawa,Agence France-Presse,3,Factiva,Iraq,Combatant (Iraq),Unidentified Forces,42556268,Iraq,Iraq,NULL,2016
1119,Mosul,Iraq,2016-10-27,NULL,2016-10-27,ICEWS25106406,"The militants shot dead dozens of prisoners there, most of them former members of the Iraqi police and army, taken from villages the group has been forced to abandon as the troops advanced, officials in the region said on Wednesday.",fight with small arms and light weapons,Iraqi army tries to reach site of Islamic State executions south of Mosul,"(2016, 43, 3)",-10,36.335,43.1189,10,Muhafazat Ninawa,Reuters News,3,Factiva,Iraq,Militant (Iraq),Unidentified Forces,42556331,Iraq,Citizen (Iraq),"General Population / Civilian / Social,Social",2016
1120,Mosul,Iraq,2016-10-27,NULL,2016-10-27,ICEWS25106404,U.N. human rights spokesman Rupert Colville on Tuesday said Islamic State fighters had reportedly killed scores of people around Mosul in the last week.,Make statement,Iraqi army tries to reach site of Islamic State executions south of Mosul,"(2016, 43, 3)",0,36.335,43.1189,10,Muhafazat Ninawa,Reuters News,6,Factiva,NULL,Rupert Colville,"Global,International Government Organization,Media,Social,Global Diplomatic IGOs,Global Human Rights IGOs",42556331,Iraq,Combatant (Iraq),Unidentified Forces,2016
1121,Mosul,Iraq,2016-10-27,NULL,2016-10-27,ICEWS25106405,U.N. human rights spokesman Rupert Colville on Tuesday said Islamic State fighters had reportedly killed scores of people around Mosul in the last week.,Use unconventional violence,Iraqi army tries to reach site of Islamic State executions south of Mosul,"(2016, 43, 3)",-9,36.335,43.1189,10,Muhafazat Ninawa,Reuters News,6,Factiva,Iraq,Combatant (Iraq),Unidentified Forces,42556331,Iraq,Citizen (Iraq),"General Population / Civilian / Social,Social",2016
1134,NULL,Saudi Arabia,2016-10-27,NULL,2016-10-27,ICEWS25106538,"Saudi Arabia’s Deputy Crown Prince Mohammed bin Salman, the Second Deputy Prime Minister and Minister of Defense, met US Treasury Secretary Jack Lew on Wednesday night, who is currently visiting the Kingdom to participate in the meeting of the Finance Committee between the Gulf Cooperation countries and the United States.",Consult,Saudi deputy crown prince meets US Treasury Secretary,"(2016, 43, 3)",1,24.6877,46.7219,10,NULL,Al Arabiya,3,Factiva,Saudi Arabia,Royal Administration (Saudi Arabia),Government,42556703,United States,Jacob J. Lew,"Executive,Government,Center Left,Finance / Economy / Commerce / Trade Ministry,Ideological,Parties,(National) Major Party",2016
1135,Riyadh,Saudi Arabia,2016-10-27,NULL,2016-10-27,ICEWS25106634,"The pirates fired a rocket-propelled grenade at LNG tanker Melati Satu, Assiri said.",fight with small arms and light weapons,Pirates attack oil tanker near Bab al-Mandab,"(2016, 43, 3)",-10,24.6877,46.7219,10,Mintaqat ar Riyad,Al Arabiya,3,Factiva,Saudi Arabia,Criminal (Saudi Arabia),"Criminals / Gangs,Dissident",42556708,Saudi Arabia,Transport (Saudi Arabia),"Business,Social",2016
1136,NULL,Syria,2016-10-27,NULL,2016-10-27,ICEWS25106614,"Russia calls on international organizations to immediately investigate the killing of 20 school children in Syria’s Idlib, Russian Foreign Ministry spokeswoman, Maria Zakharova, said on Thursday.",Appeal for intelligence,Russia calls for immediate investigation into Idlib school attack - Foreign Ministry,"(2016, 43, 3)",3.4,35.7667,36.6667,10,Idlib,Unknown,1,Factiva,Russian Federation,Russia,NULL,42556718,NULL,International Government Organizations,International Government Organization,2016
1137,Aleppo,Syria,2016-10-27,NULL,2016-10-27,ICEWS25106596,"Earlier in the day, speaking in front of the UN Security Council, Under-Secretary-General for Humanitarian Affairs and Emergency Relief Coordinator O'Brien leveled harsh criticism at Russia's actions in Syria, which was rebuffed by Churkin.",Reject,Russia Wants to Help UN Bring Humanitarian Aid to Aleppo - De Mistura’s Special Advisor,"(2016, 43, 3)",-4,36.2012,37.1612,10,Muhafazat Halab,Unknown,3,Factiva,Russian Federation,Vitaly Ivanovich Churkin,"International Government Organization,Foreign Ministry,Global Diplomatic IGOs,Government,Global,Executive",42556828,Syria,Syria,NULL,2016
1138,NULL,Saudi Arabia,2016-10-27,NULL,2016-10-27,ICEWS25106633,"In his speech, Al Assaf said the Kingdom is facing national and international financial and economical challenges in a strong position.",Make statement,Al Assaf: Challenges create opportunities,"(2016, 43, 3)",0,24.6877,46.7219,10,NULL,Mist News,6,Factiva,Saudi Arabia,Treasury/Finance Ministry (Saudi Arabia),"Government,Executive,Finance / Economy / Commerce / Trade Ministry",42556834,Saudi Arabia,Saudi Arabia,NULL,2016
1139,NULL,Syria,2016-10-27,NULL,2016-10-27,ICEWS25106519,Zakharova said claims that Russian and Syrian warplanes had conducted the deadly air strikes in Idlib on Wednesday were 'a lie.',Employ aerial weapons,Russia says has nothing to do with strike on Syria school,"(2016, 43, 3)",-10,35.7667,36.6667,10,Idlib,Agence France-Presse,3,Factiva,Russian Federation,Russia,NULL,42556863,Syria,Syria,NULL,2016
1154,Mosul,Iraq,2016-10-27,NULL,2016-10-27,ICEWS25106671,"The offensive, launched on October 17, is seeing tens of thousands of Iraqi fighters advancing on Mosul from the south, east and north in a bid to retake the last major Iraqi city under IS control.",Mobilize or increase armed forces,"Up to 900 jihadists killed in Mosul battle, US says","(2016, 43, 3)",-7.2,36.335,43.1189,10,Muhafazat Ninawa,Agence France-Presse,3,Factiva,Iraq,Combatant (Iraq),Unidentified Forces,42557197,Iraq,Iraq,NULL,2016
1155,Aleppo,Syria,2016-10-27,NULL,2016-10-27,ICEWS25106750,"Yet Britain, while indignant about Russian action in Aleppo, is happy to sell arms to the Saudi coalition besieging the city of Hodeida, where children are dying of hunger.",Use conventional military force,Mr Corbyn is right,"(2016, 43, 3)",-10,36.2012,37.1612,10,Muhafazat Halab,London Evening Standard,6,Factiva,United Kingdom,United Kingdom,NULL,42557227,Yemen,Yemen,NULL,2016
1163,Raqqa,Syria,2016-10-27,NULL,2016-10-27,ICEWS25106861,* Turkey is battling YPG which it sees as terrorist,Use conventional military force,Turkey-Kurdish rivalry complicates push against IS in Syria's Raqqa,"(2016, 43, 3)",-10,35.9528,39.0079,10,Ar Raqqah,Reuters News,3,Factiva,Turkey,Turkey,NULL,42557827,Syria,People's Protection Units,"Separatists,Dissident",2016
1164,Raqqa,Syria,2016-10-27,NULL,2016-10-27,ICEWS25106862,* Turkey is battling YPG which it sees as terrorist,Use conventional military force,Turkey-Kurdish rivalry complicates push against IS in Syria's Raqqa,"(2016, 43, 3)",-10,35.9528,39.0079,10,Ar Raqqah,Reuters News,3,Factiva,Syria,People's Protection Units,"Separatists,Dissident",42557827,Turkey,Turkey,NULL,2016
1165,Aleppo,Syria,2016-10-27,NULL,2016-10-27,ICEWS25107083,"Earlier in the day, speaking in front of the UN Security Council, Under-Secretary-General for Humanitarian Affairs and Emergency Relief Coordinator O'Brien leveled harsh criticism at Russia's actions in Syria, which was rebuffed by Churkin.",Reject,Russia Wants to Help UN Bring Humanitarian Aid to Aleppo - Official,"(2016, 43, 3)",-4,36.2012,37.1612,10,Muhafazat Halab,Unknown,4,Factiva,Russian Federation,Vitaly Ivanovich Churkin,"International Government Organization,Foreign Ministry,Global Diplomatic IGOs,Executive,Government,Global",42557882,Syria,Syria,NULL,2016
1166,Arbil,Iraq,2016-10-27,NULL,2016-10-27,ICEWS25107108,"Kurdistan Regional Government (KRG) Prime Minister Nechirvan Barzani has discussed the Mosul operation, relations with Baghdad and the current situation in the Kurdistan Region in a speech delivered at a forum in Arbil on 26 October.",Consider policy option,"Iraqi Kurdish premier discusses Mosul, Baghdad ties, finance","(2016, 43, 3)",0,36.1926,44.0106,10,Muhafazat Arbil,BBC Monitoring Middle East,2,Factiva,Iraq,Nechervan Barzani,"Provincial,Government,Kurd (Ethnic Group),International Ethnic,Local,Executive,Sunni,Executive Office,International Religious",42557939,Iraq,Iraq,NULL,2016
1167,Baghdad,Iraq,2016-10-27,NULL,2016-10-27,ICEWS25107110,"Barzani praised coordination between the KRG and Baghdad, as well as with the international coalition, during the Mosul operation.",Praise or endorse,"Iraqi Kurdish premier discusses Mosul, Baghdad ties, finance","(2016, 43, 3)",3.4,33.3406,44.4009,10,Muhafazat Baghdad,BBC Monitoring Middle East,5,Factiva,Iraq,Nechervan Barzani,"Provincial,Government,Kurd (Ethnic Group),International Ethnic,Local,Executive,Sunni,Executive Office,International Religious",42557939,Iraq,Iraqi Kurdistan,"International Ethnic,Kurd (Ethnic Group)",2016
1168,Baghdad,Iraq,2016-10-27,NULL,2016-10-27,ICEWS25107111,"He said that in line with the outcome of the negotiations, the KRG had allowed the Iraqi army to enter its lands for the first time in 25 years.",Yield,"Iraqi Kurdish premier discusses Mosul, Baghdad ties, finance","(2016, 43, 3)",5,33.3406,44.4009,10,Muhafazat Baghdad,BBC Monitoring Middle East,6,Factiva,Iraq,Iraqi Kurdistan,"International Ethnic,Kurd (Ethnic Group)",42557939,Iraq,Military (Iraq),"Government,Military",2016
1173,Aleppo,Syria,2016-10-27,NULL,2016-10-27,ICEWS25107185,Gen. Igor Konashenkov said Thursday that militants in the Northern Syrian city of Aleppo with their sniper fire derailed a Russian and Syrian attempt to evacuate some 40 people from Eastern districts of the city to safe zones.,Make statement,Militants Derail Attempt to Evacuate 40 Civilians From Eastern Aleppo,"(2016, 43, 3)",0,36.2012,37.1612,10,Muhafazat Halab,FARS News Agency,2,Factiva,Syria,High Ranking Military Personnel (Syria),"Government,Military",42558166,Syria,Militant (Syria),Unidentified Forces,2016
1174,Aleppo,Syria,2016-10-27,NULL,2016-10-27,ICEWS25107186,"Fighting in the city of Aleppo intensified after the Syrian army declared an end to the week-long ceasefire on September 23, blaming militants for numerous violations that made the cessation of hostilities unreasonable.",Accuse of aggression,Militants Derail Attempt to Evacuate 40 Civilians From Eastern Aleppo,"(2016, 43, 3)",-2,36.2012,37.1612,10,Muhafazat Halab,FARS News Agency,5,Factiva,Syria,Military (Syria),"Government,Military",42558166,Syria,Militant (Syria),Unidentified Forces,2016
1175,Mosul,Iraq,2016-10-27,NULL,2016-10-27,ICEWS25107340,"TEHRAN (FNA)- ISIL executed over 230 civilians in Mosul as the battle to liberate the Iraqi city from the terrorist group has gained momentum, an Iraqi official said.",Use unconventional violence,Official: ISIL Executes over 230 Iraqi Civilians in Mosul,"(2016, 43, 3)",-9,36.335,43.1189,10,Muhafazat Ninawa,FARS News Agency,1,Factiva,Iraq,Islamic State of Iraq and the Levant,"Sunni,International Religious,Ideological,Muslim,Fundamentalist,Insurgents,Dissident",42558167,Iraq,Citizen (Iraq),"Social,General Population / Civilian / Social",2016
1176,Mosul,Iraq,2016-10-27,NULL,2016-10-27,ICEWS25107339,Shamri also called on Iraqi Prime Minister Haider al-Abadi to facilitate the airlifting of civilians from ISIL-held areas in Mosul as the terrorists are using them as human shields.,Make an appeal or request,Official: ISIL Executes over 230 Iraqi Civilians in Mosul,"(2016, 43, 3)",3,36.335,43.1189,10,Muhafazat Ninawa,FARS News Agency,4,Factiva,Iraq,Citizen (Iraq),"Social,General Population / Civilian / Social",42558167,Iraq,Haider Al-Abadi,"(National) Major Party,Government,Parties,Shia,Lower House,Legislative / Parliamentary,Fundamentalist,International Religious,Executive,Executive Office,Ideological,Muslim",2016
