,City,Country,Datetime,District,Event Date,Event ID,Event Sentence,Event Text,Headline,ISO Week,Intensity,Latitude,Longitude,Month,Province,Publisher,Sentence Number,Source,Source Country,Source Name,Source Sectors,Story ID,Target Country,Target Name,Target Sectors,Year
0,Aleppo,Syria,2016-10-12,NULL,2016-10-12,ICEWS25126809,French officials' growing anger over a Russian-backed Syrian government onslaught against rebel-held areas of the city of Aleppo had led them to reconsider whether to host Putin on October 19.,Criticize or denounce,Putin cancels visit to France as diplomatic anger over Syria builds,"(2016, 41, 3)",-2,36.2012,37.1612,10,Muhafazat Halab,Unknown,3,Factiva,France,France,NULL,42606587,Syria,Syria,NULL,2016
10,Aleppo,Syria,2016-10-25,NULL,2016-10-25,ICEWS25120055,'all honor') to Israel's religious leaders who call on Jews to speak out against the slaughter of innocent civilians.,Make an appeal or request,"From Aleppo to Darfur, Jews must not stay silent","(2016, 43, 3)",3,36.2012,37.1612,10,Muhafazat Halab,The Jerusalem Post,2,Factiva,Israel,Israel,NULL,42589718,Israel,Jew (Israel),"International Religious,Jewish,National Religious,Social",2016
11,Aleppo,Syria,2016-10-25,NULL,2016-10-25,ICEWS25120056,'all honor') to Israel's religious leaders who call on Jews to speak out against the slaughter of innocent civilians.,Criticize or denounce,"From Aleppo to Darfur, Jews must not stay silent","(2016, 43, 3)",-2,36.2012,37.1612,10,Muhafazat Halab,The Jerusalem Post,2,Factiva,Israel,Jew (Israel),"International Religious,Jewish,National Religious,Social",42589718,Israel,Citizen (Israel),"Social,General Population / Civilian / Social",2016
12,Alexandria,Egypt,2016-10-25,NULL,2016-10-25,ICEWS25120029,"He said Govrin had met with members of the tiny Jewish community, visited its Eliyahu Hanavi synagogue and met the governor of Alexandria during his visit.",Make statement,"Reports on Israeli consul in Egypt spark anger. 'Cairo should pressure Jerusalem, not reopen consulates,' says Egyptian MP","(2016, 43, 3)",0,31.2156,29.9553,10,Muhafazat al Iskandariyah,The Jerusalem Post,4,Factiva,Israel,Emmanuel Nahshon,"Executive,Foreign Ministry,Government",42589725,Egypt,Alexandria,"Local,Municipal,Provincial,Government",2016
13,NULL,Jordan,2016-10-26,NULL,2016-10-26,ICEWS25119900,The Jordanians and the Palestinians said they understood this 'hesitance as a retreat from the consensual language.',Make statement,PM: UNESCO's theater of the absurd just continues. Palestinians warn nations not to oppose text of today's resolution. Kara to appeal to Pope Francis,"(2016, 43, 3)",0,31.9552,35.945,10,NULL,The Jerusalem Post,5,Factiva,Jordan,Jordan,NULL,42589715,Occupied Palestinian Territory,"Palestinian Territory, Occupied",NULL,2016
18,NULL,Egypt,2016-10-27,NULL,2016-10-27,ICEWS25124273,It is unclear how the mistake occurred as Abu Amar was carrying out maintenance work with a group of Israeli contractors and the work had been coordinated by the IDF with the Egyptian Army.,Engage in diplomatic cooperation,IDF: Egyptian security forces killed Israeli teen. Eyewitnesses provide conflicting accounts of death of 15-year-old,"(2016, 43, 3)",3.5,29.5,34,10,Sinai Peninsula,The Jerusalem Post,3,Factiva,Israel,Israeli Defense Forces,"Military,Government",42599714,Egypt,Egyptian Army,"Military,Government,Army",2016
44,Mosul,Iraq,2016-10-30,NULL,2016-10-30,ICEWS25122063,The Head of US Central Command General Joseph Votel told AFP recently that 800 to 900 ISIS fighters were killed during the current battle carried out by Iraqi forces with US military support in Mosul.,Make statement,Nouri al-Maliki’s dangerous speech,"(2016, 43, 3)",0,36.335,43.1189,10,Muhafazat Ninawa,Al Arabiya,2,Factiva,United States,United States Central Command,"Military,Government",42595231,Iraq,Combatant (Islamic State of Iraq and the Levant),"Fundamentalist,International Religious,Muslim,Insurgents,Dissident,Sunni,Ideological",2016
45,Aleppo,Syria,2016-10-30,NULL,2016-10-30,ICEWS25122015,"The rebels, including both Free Syrian Army factions and militants, are seeking to end the siege by seizing government-held areas of Aleppo, in an effort to link the city’s rebel-held east with rebel-held rural areas to the west of the city.",Occupy territory,Aleppo fighting spreads amid claims of gas attack,"(2016, 43, 3)",-9.5,36.2012,37.1612,10,Muhafazat Halab,Al Arabiya,3,Factiva,Syria,Armed Rebel (Syria),"Rebel,Dissident",42595232,Syria,Syria,NULL,2016
46,Hamdaniyah,Syria,2016-10-30,NULL,2016-10-30,ICEWS25122013,"Syrian state media said militants had fired shells containing chlorine gas at a residential area of the government-held western part of the city, al-Hamdaniya.",Make statement,Aleppo fighting spreads amid claims of gas attack,"(2016, 43, 3)",0,35.4247,36.8546,10,Idlib,Al Arabiya,4,Factiva,Syria,State Media (Syria),"Government,Executive,State Media,Information / Communication / Transparency Ministry",42595232,Syria,Militant (Syria),Unidentified Forces,2016
47,Hamdaniyah,Syria,2016-10-30,NULL,2016-10-30,ICEWS25122014,"Rebels denied that, and said government forces had fired poison gas on another frontline.",Make statement,Aleppo fighting spreads amid claims of gas attack,"(2016, 43, 3)",0,35.4247,36.8546,10,Idlib,Al Arabiya,5,Factiva,Syria,Armed Rebel (Syria),"Rebel,Dissident",42595232,Syria,Military (Syria),"Government,Military",2016
55,Doha,Qatar,2016-10-30,NULL,2016-10-30,ICEWS25132201,Palestinian Authority President Mahmoud Abbas and Hamas Politburo Chief Khaled Mashaal met in Doha on Thursday for the first time in more than two years in an effort to revive reconciliation talks.,Consult,News in brief,"(2016, 43, 3)",1,25.2793,51.5224,10,Baladiyat ad Dawhah,The Jerusalem Post,2,Factiva,Occupied Palestinian Territory,Mahmoud Abbas,"Executive Office,Government,Elite,Executive",42619737,Occupied Palestinian Territory,Hamas,"Parties,(National) Major Party,International Religious,Dissident,Nongovernmental Organization (International),Muslim",2016
56,Doha,Qatar,2016-10-30,NULL,2016-10-30,ICEWS25132202,Palestinian Authority President Mahmoud Abbas and Hamas Politburo Chief Khaled Mashaal met in Doha on Thursday for the first time in more than two years in an effort to revive reconciliation talks.,Consult,News in brief,"(2016, 43, 3)",1,25.2793,51.5224,10,Baladiyat ad Dawhah,The Jerusalem Post,2,Factiva,Occupied Palestinian Territory,Hamas,"Parties,(National) Major Party,International Religious,Dissident,Nongovernmental Organization (International),Muslim",42619737,Occupied Palestinian Territory,Mahmoud Abbas,"Executive Office,Government,Elite,Executive",2016
68,Baghdad,Iraq,2016-10-31,NULL,2016-10-31,ICEWS25118851,"Iraqi and Iranian judicial authorities have signed a memorandum of understanding mainly tackling counter-terrorism and arms smuggling, according to state-run Al-Sabah daily on 31 October.",Sign formal agreement,"Iraq, Iran sign judicial memo on counter-terrorism","(2016, 44, 3)",8,33.3406,44.4009,10,Muhafazat Baghdad,BBC Monitoring Middle East,2,Factiva,Iraq,Iraq,NULL,42587105,Iran,Other Authorities / Officials (Iran),Government,2016
69,Baghdad,Iraq,2016-10-31,NULL,2016-10-31,ICEWS25118852,"Iraqi and Iranian judicial authorities have signed a memorandum of understanding mainly tackling counter-terrorism and arms smuggling, according to state-run Al-Sabah daily on 31 October.",Sign formal agreement,"Iraq, Iran sign judicial memo on counter-terrorism","(2016, 44, 3)",8,33.3406,44.4009,10,Muhafazat Baghdad,BBC Monitoring Middle East,2,Factiva,Iran,Other Authorities / Officials (Iran),Government,42587105,Iraq,Iraq,NULL,2016
70,Mosul,Iraq,2016-10-31,NULL,2016-10-31,ICEWS25118766,"On October 17, Iraqi Prime Minister Haider Abadi announced the start of a military operation to recapture Mosul from IS, outlawed in Russia, with the help of airstrikes by the US-led international coalition.",Make statement,IS Executes 50 Members Over Fleeing Positions During Mosul Operation - Reports,"(2016, 44, 3)",0,36.335,43.1189,10,Muhafazat Ninawa,Unknown,6,Factiva,Iraq,Haider Al-Abadi,"Executive,Ideological,Muslim,Shia,Executive Office,Government,Parties,(National) Major Party,Fundamentalist,International Religious,Legislative / Parliamentary,Lower House",42587132,Iraq,Iraq,NULL,2016
71,Mosul,Iraq,2016-10-31,NULL,2016-10-31,ICEWS25118937,"'The battle of Mosul will not be a picnic,' Hadi al-Amiri, leader of the Badr Organisation, the largest Shi'ite militia fighting with Iraqi government forces, said from the southern frontline.",Use unconventional violence,Iraqi forces attempt first push into Mosul as offensive enters third week,"(2016, 44, 3)",-9,36.335,43.1189,10,Muhafazat Ninawa,Reuters News,3,Factiva,Iraq,Militia (Iraq),Unidentified Forces,42587149,Iraq,Military (Iraq),"Government,Military",2016
72,Mosul,Iraq,2016-10-31,NULL,2016-10-31,ICEWS25118938,"'The battle of Mosul will not be a picnic,' Hadi al-Amiri, leader of the Badr Organisation, the largest Shi'ite militia fighting with Iraqi government forces, said from the southern frontline.",Use conventional military force,Iraqi forces attempt first push into Mosul as offensive enters third week,"(2016, 44, 3)",-10,36.335,43.1189,10,Muhafazat Ninawa,Reuters News,3,Factiva,Iraq,Military (Iraq),"Government,Military",42587149,Iraq,Militia (Iraq),Unidentified Forces,2016
73,Mosul,Iraq,2016-10-31,NULL,2016-10-31,ICEWS25118978,"As Iraqi forces close in on Mosul, the jihadists' last main bastion in the country, officials say IS has fighters deployed at or near archaeological sites.",Mobilize or increase armed forces,Iraqi heritage sites again at risk in Mosul operation,"(2016, 44, 3)",-7.2,36.335,43.1189,10,Muhafazat Ninawa,Agence France-Presse,3,Factiva,Iraq,Combatant (Iraq),Unidentified Forces,42587191,Iraq,Iraq,NULL,2016
74,Mosul,Iraq,2016-10-31,NULL,2016-10-31,ICEWS25118745,"Earlier in the day, the Iraqi government forces resumed the offensive on Mosul after a three-day pause.",Use conventional military force,Powerful Blast Rocks Mosul During IS Commanders' Meeting - Reports,"(2016, 44, 3)",-10,36.335,43.1189,10,Muhafazat Ninawa,Unknown,5,Factiva,Iraq,Military (Iraq),"Government,Military",42587202,Iraq,Iraq,NULL,2016
86,Mosul,Iraq,2016-10-31,NULL,2016-10-31,ICEWS25119158,"According to the media outlet, also on Monday, Fazil Barwari, the commander of the Iraqi Golden Force, said that by this evening the Iraqi forces would invade Mosul.",Make statement,Iraqi Troops Half Mile Away From IS-Held Mosul - Military,"(2016, 44, 3)",0,36.335,43.1189,10,Muhafazat Ninawa,Unknown,4,Factiva,Iraq,Military Personnel (Iraq),"Government,Military",42587663,Iraq,Military (Iraq),"Government,Military",2016
87,Qaryat Bazwaya,Iraq,2016-10-31,NULL,2016-10-31,ICEWS25119051,"BAZWAYA, Iraq--Iraqi special forces advanced on Islamic State-held city of Mosul from the east Monday, taking heavy fire but entering the last village before the city limits and clearing a path that was followed by army units.",Mobilize or increase armed forces,Iraqi Special Forces Near Mosul From East,"(2016, 44, 3)",-7.2,36.3692,43.2951,10,Muhafazat Ninawa,Dow Jones News Service,1,Factiva,Iraq,Military Personnel - Special (Iraq),"Government,Military",42587675,Iraq,Iraq,NULL,2016
88,Mosul,Iraq,2016-10-31,NULL,2016-10-31,ICEWS25119078,"Lieutenant Colonel Muntadhar al-Shimmari said CTS had recaptured Bazwaya, one of two IS-held villages that had been standing between Iraqi forces and the eastern edges of Mosul.",Make statement,Advancing Iraqi forces near Mosul city limits,"(2016, 44, 3)",0,36.335,43.1189,10,Muhafazat Ninawa,Agence France-Presse,4,Factiva,Iraq,Military Personnel (Iraq),"Government,Military",42587692,Iraq,Islamic State of Iraq and the Levant,"International Religious,Fundamentalist,Dissident,Insurgents,Muslim,Ideological,Sunni",2016
89,Qaryat Kukjali,Iraq,2016-10-31,NULL,2016-10-31,ICEWS25119079,"CTS forces had entered the second village, Gogjali, and were battling to retake it, Staff Lieutenant General Abdelwahab al-Saadi, a senior CTS commander, told AFP by telephone.",Discuss by telephone,Advancing Iraqi forces near Mosul city limits,"(2016, 44, 3)",1,36.3574,43.2478,10,Muhafazat Ninawa,Agence France-Presse,6,Factiva,France,Agence France-Presse,"Social,Media,News",42587692,Iraq,Military Personnel (Iraq),"Government,Military",2016
90,Qaryat Kukjali,Iraq,2016-10-31,NULL,2016-10-31,ICEWS25119080,"CTS forces had entered the second village, Gogjali, and were battling to retake it, Staff Lieutenant General Abdelwahab al-Saadi, a senior CTS commander, told AFP by telephone.",Discuss by telephone,Advancing Iraqi forces near Mosul city limits,"(2016, 44, 3)",1,36.3574,43.2478,10,Muhafazat Ninawa,Agence France-Presse,6,Factiva,Iraq,Military Personnel (Iraq),"Government,Military",42587692,France,Agence France-Presse,"Social,Media,News",2016
91,Cairo,Egypt,2016-10-31,NULL,2016-10-31,ICEWS25119190,"CAIRO - A ceremonial welcome with a military guard-of-honour greeted President Tony Tan Keng Yam at the Ittihadeya Palace on Monday(Oct 31), marking his first state visit to Egypt.",Make a visit,"President Tony Tan Keng Yam meets President Sisi, lauds close partnership with Egypt","(2016, 44, 3)",1.9,30.0626,31.2497,10,Muhafazat al Qahirah,Unknown,1,Factiva,Singapore,Tony Tan Keng Yam,"Executive,Government,Executive Office,Elite",42587703,Egypt,Egypt,NULL,2016
92,Cairo,Egypt,2016-10-31,NULL,2016-10-31,ICEWS25119191,"CAIRO - A ceremonial welcome with a military guard-of-honour greeted President Tony Tan Keng Yam at the Ittihadeya Palace on Monday(Oct 31), marking his first state visit to Egypt.",Host a visit,"President Tony Tan Keng Yam meets President Sisi, lauds close partnership with Egypt","(2016, 44, 3)",2.8,30.0626,31.2497,10,Muhafazat al Qahirah,Unknown,1,Factiva,Egypt,Egypt,NULL,42587703,Singapore,Tony Tan Keng Yam,"Executive,Government,Executive Office,Elite",2016
93,NULL,Lebanon,2016-10-31,NULL,2016-10-31,ICEWS25119143,"Former general Michel Aoun, who was elected Lebanese president Monday, was once in the vanguard of opposition to Syria's regime before an about-face that saw him join forces with Hezbollah.",Engage in material cooperation,Lebanon's Aoun: ex-general who long dreamed of presidency,"(2016, 44, 3)",6,33.8889,35.4944,10,NULL,Agence France-Presse,1,Factiva,Lebanon,Michel Aoun,"Government,Parties,Center Right,Ideological,Unicameral,Legislative / Parliamentary,(National) Minor Party",42587732,Lebanon,Hezbollah,"International Religious,Parties,Dissident,Shia,Far Left,Ideological,Social,National Religious,Organized Violent,(National) Minor Party",2016
94,NULL,Lebanon,2016-10-31,NULL,2016-10-31,ICEWS25119144,"Former general Michel Aoun, who was elected Lebanese president Monday, was once in the vanguard of opposition to Syria's regime before an about-face that saw him join forces with Hezbollah.",Engage in material cooperation,Lebanon's Aoun: ex-general who long dreamed of presidency,"(2016, 44, 3)",6,33.8889,35.4944,10,NULL,Agence France-Presse,1,Factiva,Lebanon,Hezbollah,"International Religious,Parties,Dissident,Shia,Far Left,Ideological,Social,National Religious,Organized Violent,(National) Minor Party",42587732,Lebanon,Michel Aoun,"Government,Parties,Center Right,Ideological,Unicameral,Legislative / Parliamentary,(National) Minor Party",2016
95,Beirut,Lebanon,2016-10-31,NULL,2016-10-31,ICEWS25119074,"Aoun, an 81-year-old Christian former army chief, was elected president earlier on Monday in the Lebanese parliament.",Praise or endorse,"2nd LD: Aoun sworn in as Lebanese president, ending 2.5-year vacancy","(2016, 44, 3)",3.4,33.8889,35.4944,10,Beyrouth,Xinhua News Agency,2,Factiva,Lebanon,Legislature (Lebanon),"Government,Legislative / Parliamentary",42587799,Lebanon,Michel Aoun,"Government,Parties,Center Right,Ideological,Unicameral,Legislative / Parliamentary,(National) Minor Party",2016
96,NULL,Lebanon,2016-10-31,NULL,2016-10-31,ICEWS25119206,"After four rounds of voting, including two unexpected repeat votes, Aoun won support from 83 lawmakers, easily clearing the 50-percent-plus-one majority required.",Praise or endorse,"Lebanon's Aoun elected president, ending power vacuum","(2016, 44, 3)",3.4,33.8889,35.4944,10,NULL,Agence France-Presse,2,Factiva,Lebanon,Lawmaker (Lebanon),"Government,Legislative / Parliamentary",42587833,Lebanon,Michel Aoun,"Government,Parties,Center Right,Ideological,Unicameral,Legislative / Parliamentary,(National) Minor Party",2016
97,Cairo,Egypt,2016-10-31,NULL,2016-10-31,ICEWS25119164,This is Dr Tan's first state visit to the Middle East.,Make a visit,President Tony Tan hails close partnership with Egypt,"(2016, 44, 3)",1.9,30.0626,31.2497,10,Muhafazat al Qahirah,Channel NewsAsia,3,Factiva,Singapore,Tony Tan Keng Yam,"Executive,Government,Executive Office,Elite",42587909,NULL,Middle East,NULL,2016
98,Cairo,Egypt,2016-10-31,NULL,2016-10-31,ICEWS25119165,This is Dr Tan's first state visit to the Middle East.,Host a visit,President Tony Tan hails close partnership with Egypt,"(2016, 44, 3)",2.8,30.0626,31.2497,10,Muhafazat al Qahirah,Channel NewsAsia,3,Factiva,NULL,Middle East,NULL,42587909,Singapore,Tony Tan Keng Yam,"Executive,Government,Executive Office,Elite",2016
102,Qada' Talkif,Iraq,2016-10-31,NULL,2016-10-31,ICEWS25119385,"The Russian General Staff said Friday that a US Air Force tactical aircraft hit a school building in Tall Kayf on October 24, leaving multiple casualties.",Make statement,US-Led Coalition Probes Reports of Friendly Fire on Iraqi Military Near Mosul - Spokesman,"(2016, 44, 3)",0,36.4911,43.1203,10,Muhafazat Ninawa,Unknown,6,Factiva,Russian Federation,Russia,NULL,42588151,United States,United States,NULL,2016
103,Mosul,Iraq,2016-10-31,NULL,2016-10-31,ICEWS25119244,"By midafternoon, however, there was no confirmation that the forces had breached the city proper though a commander announced on state television that troops were within a few hundred meters of the city limits.",Make statement,Iraqi Forces Look to Make Push Into Mosul,"(2016, 44, 3)",0,36.335,43.1189,10,Muhafazat Ninawa,Dow Jones News Service,2,Factiva,Iraq,Military Personnel (Iraq),"Government,Military",42588160,Iraq,Military (Iraq),"Government,Military",2016
104,NULL,Lebanon,2016-10-31,NULL,2016-10-31,ICEWS25119320,The 81-year-old leader of the Free Patriotic Movement won support of the majority of lawmakers.,Praise or endorse,Christian politician Michel Aoun elected Lebanon’s new president,"(2016, 44, 3)",3.4,33.8889,35.4944,10,NULL,Unknown,2,Factiva,Lebanon,Lawmaker (Lebanon),"Legislative / Parliamentary,Government",42588184,Lebanon,Free Patriotic Movement,"Parties,(National) Minor Party,Center Right,Ideological",2016
105,Beirut,Lebanon,2016-10-31,NULL,2016-10-31,ICEWS25119291,"Aoun, who is backed by the Shiite Islamic political party Hezbollah, took the oath of office and delivered a speech.",Praise or endorse,UPDATE 1 - Michel Aoun Elected President of Lebanon,"(2016, 44, 3)",3.4,33.8889,35.4944,10,Beyrouth,Unknown,4,Factiva,Lebanon,Hezbollah,"National Religious,Organized Violent,Far Left,Parties,Shia,Ideological,International Religious,Social,(National) Minor Party,Dissident",42588206,Lebanon,Michel Aoun,"Government,Parties,Center Right,Ideological,Unicameral,Legislative / Parliamentary,(National) Minor Party",2016
106,NULL,Syria,2016-10-31,NULL,2016-10-31,ICEWS25119365,The comment comes less than a week after the United States and the United Nations Children's Fund (UNICEF) director accused Russia and Syria of being behind Wednesday's airstrike in the Idlib province that allegedly hit a school and resulted in the deaths of 22 children and six teachers.,Accuse,Anti-Russian Defamation Over Syria Campaign Helps Terrorists - Foreign Ministry,"(2016, 44, 3)",-2,35.7667,36.6667,10,Idlib,Unknown,4,Factiva,United States,United States,NULL,42588208,Russian Federation,Russia,NULL,2016
107,NULL,Syria,2016-10-31,NULL,2016-10-31,ICEWS25119366,The comment comes less than a week after the United States and the United Nations Children's Fund (UNICEF) director accused Russia and Syria of being behind Wednesday's airstrike in the Idlib province that allegedly hit a school and resulted in the deaths of 22 children and six teachers.,Accuse,Anti-Russian Defamation Over Syria Campaign Helps Terrorists - Foreign Ministry,"(2016, 44, 3)",-2,35.7667,36.6667,10,Idlib,Unknown,4,Factiva,United States,United States,NULL,42588208,Syria,Syria,NULL,2016
108,Beirut,Lebanon,2016-10-31,NULL,2016-10-31,ICEWS25119250,He headed to the French Embassy in an armored vehicle before going into exile in France.,Make a visit,"Factbox: Michel Aoun, Lebanon's new president","(2016, 44, 3)",1.9,33.8889,35.4944,10,Beyrouth,Reuters News,6,Factiva,Lebanon,Michel Aoun,"Government,Parties,Center Right,Ideological,Unicameral,Legislative / Parliamentary,(National) Minor Party",42588210,France,Foreign Affairs (France),"Executive,Government,Foreign Ministry",2016
109,Beirut,Lebanon,2016-10-31,NULL,2016-10-31,ICEWS25119251,He headed to the French Embassy in an armored vehicle before going into exile in France.,Host a visit,"Factbox: Michel Aoun, Lebanon's new president","(2016, 44, 3)",2.8,33.8889,35.4944,10,Beyrouth,Reuters News,6,Factiva,France,Foreign Affairs (France),"Executive,Government,Foreign Ministry",42588210,Lebanon,Michel Aoun,"Government,Parties,Center Right,Ideological,Unicameral,Legislative / Parliamentary,(National) Minor Party",2016
110,Arbil,Iraq,2016-10-31,NULL,2016-10-31,ICEWS25119344,"ERBIL, Iraq, Oct 31 (Reuters) - An elderly Christian widow who survived two years of Islamic State rule over her northern Iraqi town said the jihadists threatened to kill her, forced her to spit on a crucifix and made her stamp on an image of the Virgin Mary.",Threaten with military force,Two years of fear: Christian widow survives Islamic State,"(2016, 44, 3)",-7,-12.7333,45.1333,10,Muhafazat Arbil,Reuters News,5,Factiva,Iraq,Citizen (Iraq),"Social,General Population / Civilian / Social",42588212,Iraq,Christian (Iraq),"Social,International Religious,Christian,National Religious",2016
111,Qada' al Hamdaniyah,Iraq,2016-10-31,NULL,2016-10-31,ICEWS25119343,"Zarifa Badoos Daddo, 77, was reunited with her family on Sunday after Iraqi forces drove Islamic State from Qaraqosh as they advanced on Mosul, the militants' last major urban bastion in the country.",Mobilize or increase armed forces,Two years of fear: Christian widow survives Islamic State,"(2016, 44, 3)",-7.2,36.2709,43.3776,10,Muhafazat Ninawa,Reuters News,6,Factiva,Iraq,Military (Iraq),"Government,Military",42588212,Iraq,Iraq,NULL,2016
112,NULL,Lebanon,2016-10-31,NULL,2016-10-31,ICEWS25119416,"Lebanon's Michel Aoun, a former general backed by the powerful Hezbollah movement as well as longtime rivals, was elected president Monday ending a political vacuum of more than two years.",Praise or endorse,"Lebanon elects Aoun president, ending two-year vacuum","(2016, 44, 3)",3.4,33.8889,35.4944,10,NULL,Agence France-Presse,1,Factiva,Lebanon,Hezbollah,"National Religious,Organized Violent,Far Left,Parties,Shia,Ideological,International Religious,Social,(National) Minor Party,Dissident",42588232,Lebanon,Michel Aoun,"Government,Parties,Center Right,Ideological,Unicameral,Legislative / Parliamentary,(National) Minor Party",2016
113,Beirut,Lebanon,2016-10-31,NULL,2016-10-31,ICEWS25119417,"The deeply divided parliament took four rounds of voting to elect Aoun, whose supporters flooded streets and squares across the country to celebrate his victory.",Praise or endorse,"Lebanon elects Aoun president, ending two-year vacuum","(2016, 44, 3)",3.4,33.8889,35.4944,10,Beyrouth,Agence France-Presse,2,Factiva,Lebanon,Lebanon,NULL,42588232,Lebanon,Michel Aoun,"Government,Parties,Center Right,Ideological,Unicameral,Legislative / Parliamentary,(National) Minor Party",2016
114,Beirut,Lebanon,2016-10-31,NULL,2016-10-31,ICEWS25119418,"The 81-year-old former army chief had long eyed the presidency, and his candidacy was backed from the beginning by Shiite movement Hezbollah, his ally since a surprise rapprochement in 2006.",Praise or endorse,"Lebanon elects Aoun president, ending two-year vacuum","(2016, 44, 3)",3.4,33.8889,35.4944,10,Beyrouth,Agence France-Presse,5,Factiva,Lebanon,Hezbollah,"National Religious,Organized Violent,Far Left,Parties,Shia,Ideological,International Religious,Social,(National) Minor Party,Dissident",42588232,Lebanon,Army Personnel (Lebanon),"Government,Military",2016
115,Aleppo,Syria,2016-10-31,NULL,2016-10-31,ICEWS25119402,"BEIRUT (Reuters) - Syria's army said in a statement on Monday that the Nusra Front and what it called other terrorist groups had killed 84 people, mostly women and children, in Aleppo during the past three days in a bombardment that included chemical weapons and rocket fire.",Make statement,Syrian army says rebel bombardment of Aleppo killed 84 in three days,"(2016, 44, 3)",0,36.2012,37.1612,10,Muhafazat Halab,Reuters News,1,Factiva,Syria,Military (Syria),"Government,Military",42588319,Syria,Jabhat al-Nusra,"Dissident,Radicals / Extremists / Fundamentalists",2016
116,Mosul,Iraq,2016-10-31,NULL,2016-10-31,ICEWS25119321,"'Asaib Ahl al-Haq [League of the Righteous People] militants have stormed Gayaa village in the western axis of Nineveh Province and besieged Islamic State [IS] militants in it,' Iraqi pro-Sadrist TV channel Al-Ahd quoted League commander Jawad al-Talabwi as saying in an 'urgent' screen caption at 1226 gmt on 31 October.",Use unconventional violence,Iraqi Shia militia 'storm' village in Mosul western axis,"(2016, 44, 3)",-9,36.335,43.1189,10,Muhafazat Ninawa,BBC Monitoring Newsfile,2,Factiva,Iraq,Militant (Asa'ib Ahl al-Haq),"Shia,Ideological,Insurgents,Dissident,Fundamentalist,International Religious",42588337,Iraq,Militant (Iraq),Unidentified Forces,2016
