,City,Country,Datetime,District,Event Date,Event ID,Event Sentence,Event Text,Headline,ISO Week,Intensity,Latitude,Longitude,Month,Province,Publisher,Sentence Number,Source,Source Country,Source Name,Source Sectors,Story ID,Target Country,Target Name,Target Sectors,Year
338,NULL,Saudi Arabia,2018-01-30,NULL,2018-01-30,ICEWS28485154,"Sixty-five people are still being detained by Saudi Arabia for investigations into a corruption probe, Saudi-funded Al-Arabiya TV reported in a breaking news caption on 30 January.","Arrest, detain, or charge with legal action",Sixty-five people 'still detained' in Saudi corruption probe,"(2018, 5, 3)",-5,24.6877,46.7219,1,NULL,BBC Monitoring Newsfile,2,Factiva,Saudi Arabia,Saudi Arabia,NULL,46439125,Saudi Arabia,Citizen (Saudi Arabia),"Social,General Population / Civilian / Social",2018
339,Ariha,Syria,2018-01-30,NULL,2018-01-30,ICEWS28485231,Opposition Orient News TV reported that the death toll in 'Russian attacks' on Ariha had risen to 15.,Use conventional military force,Strikes hit northern Syria as Russia hosts talks,"(2018, 5, 3)",-10,35.8137,36.6096,1,Idlib,BBC Monitoring Middle East,4,Factiva,Russian Federation,Russia,NULL,46439127,Syria,Syria,NULL,2018
340,NULL,Saudi Arabia,2018-01-30,NULL,2018-01-30,ICEWS28485158,"Saudi authorities launched an unprecedented anti-corruption drive in early November and arrested hundreds of royals, businessmen and officials.","Arrest, detain, or charge with legal action",Saudi attorney general says 56 graft suspects still held,"(2018, 5, 3)",-5,24.6877,46.7219,1,NULL,Agence France-Presse,5,Factiva,Saudi Arabia,Other Authorities / Officials (Saudi Arabia),Government,46439135,Saudi Arabia,Businessperson (Saudi Arabia),"Social,Business",2018
341,NULL,Saudi Arabia,2018-01-30,NULL,2018-01-30,ICEWS28485159,"Saudi authorities launched an unprecedented anti-corruption drive in early November and arrested hundreds of royals, businessmen and officials.","Arrest, detain, or charge with legal action",Saudi attorney general says 56 graft suspects still held,"(2018, 5, 3)",-5,24.6877,46.7219,1,NULL,Agence France-Presse,5,Factiva,Saudi Arabia,Other Authorities / Officials (Saudi Arabia),Government,46439135,Saudi Arabia,Citizen (Saudi Arabia),"Social,General Population / Civilian / Social",2018
342,Afrin,Syria,2018-01-30,NULL,2018-01-30,ICEWS28485217,Turkish air strikes pounded the Syrian border region of Afrin and fighting raged on two fronts as Ankara pursued its offensive against the Kurdish enclave on Tuesday.,Use conventional military force,Turkish air strikes pound Kurdish fighters in Syria,"(2018, 5, 3)",-10,36.5119,36.8695,1,Muhafazat Halab,Agence France-Presse,1,Factiva,Turkey,Turkey,NULL,46439138,Syria,Syrian Kurds,"National Ethnic Minority,International Ethnic,Social,National Ethnic,Kurd (Ethnic Group)",2018
343,Afrin,Syria,2018-01-30,NULL,2018-01-30,ICEWS28485216,"Syrian rebels backed by Turkey 'were engaged in fierce battles against Kurdish forces' in the two towns, said Rami Abdel Rahman, the head of the Britain-based Observatory, which uses a network of sources to monitor Syria's war.",Cooperate militarily,Turkish air strikes pound Kurdish fighters in Syria,"(2018, 5, 3)",7.4,36.5119,36.8695,1,Muhafazat Halab,Agence France-Presse,6,Factiva,Turkey,Turkey,NULL,46439138,Syria,Armed Rebel (Syria),"Rebel,Dissident",2018
344,Afrin,Syria,2018-01-30,NULL,2018-01-30,ICEWS28485182,"Some 649 militants have been “neutralized” since the beginning of Turkey’s Operation Olive Branch in Syria’s northwestern district of Afrin, the Turkish Armed Forces announced on Jan. 30, Hurriyet Daily News reports.",Make statement,649 militants ‘neutralized’ in Turkey’s operation in Syria’s Afrin,"(2018, 5, 3)",0,36.5119,36.8695,1,Muhafazat Halab,Unknown,1,Factiva,Turkey,Turkish Armed Forces,"Military,Government",46439144,Turkey,Hürriyet Daily News,"Print News,News,Media,Social,Online News",2018
345,NULL,Bahrain,2018-01-30,NULL,2018-01-30,ICEWS28485285,"The Iranian official went on to criticize the current state of affairs in Bahrain with outsiders and extremist leaders in charge of the country's domestic affairs, noting in a sarcastic tone that it would not be too far-fetched if the nationality of the Bahraini King himself were to be one day revoked by the court.",Criticize or denounce,Iranian Speaker's Advisor Blasts Nationality Revocation of Bahrain's Senior Cleric,"(2018, 5, 3)",-2,26.2154,50.5832,1,NULL,FARS News Agency,5,Factiva,Iran,Iran,NULL,46439317,Bahrain,Bahrain,NULL,2018
346,Riyadh,Saudi Arabia,2018-01-30,NULL,2018-01-30,ICEWS28485262,"Over week earlier, Saudi Arabia's former Finance Minister Ibrahim al-Assaf was reportedly also released from the Ritz-Carlton and was cleared from all charges, which allows him to retain his positions as both a minister and king's adviser.","Return, release person(s)",All Detainees in Saudi Corruption Probe Released from Ritz Carlton - Reports,"(2018, 5, 3)",7,24.6877,46.7219,1,Mintaqat ar Riyad,FARS News Agency,4,Factiva,Saudi Arabia,Saudi Arabia,NULL,46439319,Saudi Arabia,Ibrahim Abd al-Aziz al-Assaf,"Executive,Government,Cabinet",2018
347,NULL,Saudi Arabia,2018-01-30,NULL,2018-01-30,ICEWS28485263,"Few days later, a number of former and incumbent Saudi officials, as well as princes, were detained by the authorities amid the anti-corruption campaign, including 11 princes from the ruling family and four ministers from the current government.","Arrest, detain, or charge with legal action",All Detainees in Saudi Corruption Probe Released from Ritz Carlton - Reports,"(2018, 5, 3)",-5,24.6877,46.7219,1,NULL,FARS News Agency,6,Factiva,Saudi Arabia,Other Authorities / Officials (Saudi Arabia),Government,46439319,Saudi Arabia,Royal Administration (Saudi Arabia),Government,2018
348,Arbil,Iraq,2018-01-30,NULL,2018-01-30,ICEWS28485301,"He stressed Iran's positive role in the Middle-East, and said an Iranian delegation is due to visit Erbil in the future.",Express intent to meet or negotiate,"KRG Official: Kurds, Baghdad Trust Iran for Mediation","(2018, 5, 3)",4,-12.7333,45.1333,1,Muhafazat Arbil,FARS News Agency,3,Factiva,Iran,Iran,NULL,46439325,Iraq,Iraq,NULL,2018
349,NULL,Iraq,2018-01-30,NULL,2018-01-30,ICEWS28485300,"In relevant remarks earlier this month, Iraq's Kurdistan Regional Government Prime Minister Nechirvan Barzani announced that Iran is one of the most important neighbors of Iraq.",Make statement,"KRG Official: Kurds, Baghdad Trust Iran for Mediation","(2018, 5, 3)",0,36.2267,44.7611,1,Kurdistan,FARS News Agency,6,Factiva,Iraq,Nechervan Barzani,"Government,Executive Office,Executive,Sunni,International Religious,Local,Kurd (Ethnic Group),Provincial,International Ethnic",46439325,Iran,Iran,NULL,2018
350,Afrin,Syria,2018-01-30,NULL,2018-01-30,ICEWS28485272,The sources said that the Kurdish combatants shot down a Turkish army's spying drone in Bolboleh region in Northwestern Afrin.,fight with artillery and tanks,Kurdish Fighters Down Turkish Army Drone in Northern Syria,"(2018, 5, 3)",-10,36.5119,36.8695,1,Muhafazat Halab,FARS News Agency,2,Factiva,Turkey,Combatant (Turkish Kurds),"International Ethnic,Kurd (Ethnic Group)",46439326,Turkey,Turkish Army,"Government,Military,Army",2018
351,Afrin,Syria,2018-01-30,NULL,2018-01-30,ICEWS28485302,"The statement said that the Turkish Air Force conducted heavy raids on three military centers of the Kurds, including arms depots and positions.",Use conventional military force,650 Kurdish Fighters Killed in Turkish Army Operation in Syria's Afrin,"(2018, 5, 3)",-10,36.5119,36.8695,1,Muhafazat Halab,FARS News Agency,2,Factiva,Turkey,Turkish Air Force,"Government,Military,Air Force",46439331,Turkey,Citizen (Turkey),"General Population / Civilian / Social,Social",2018
352,Afrin,Syria,2018-01-30,NULL,2018-01-30,ICEWS28485303,Relevant reports said on Sunday that the Kurdish forces repelled the Turkish army attacks in Afrin on the 8th day of the Operation Olive Branch as the Turkey-backed militants claimed winning a number of regions.,Use conventional military force,650 Kurdish Fighters Killed in Turkish Army Operation in Syria's Afrin,"(2018, 5, 3)",-10,36.5119,36.8695,1,Muhafazat Halab,FARS News Agency,4,Factiva,Turkey,Turkish Kurds,"International Ethnic,Kurd (Ethnic Group)",46439331,Syria,Syria,NULL,2018
353,Afrin,Syria,2018-01-30,NULL,2018-01-30,ICEWS28485304,Relevant reports said on Sunday that the Kurdish forces repelled the Turkish army attacks in Afrin on the 8th day of the Operation Olive Branch as the Turkey-backed militants claimed winning a number of regions.,Use conventional military force,650 Kurdish Fighters Killed in Turkish Army Operation in Syria's Afrin,"(2018, 5, 3)",-10,36.5119,36.8695,1,Muhafazat Halab,FARS News Agency,4,Factiva,Turkey,Turkey,NULL,46439331,Syria,Syria,NULL,2018
354,Afrin,Syria,2018-01-30,NULL,2018-01-30,ICEWS28485305,Relevant reports said on Sunday that the Kurdish forces repelled the Turkish army attacks in Afrin on the 8th day of the Operation Olive Branch as the Turkey-backed militants claimed winning a number of regions.,Use conventional military force,650 Kurdish Fighters Killed in Turkish Army Operation in Syria's Afrin,"(2018, 5, 3)",-10,36.5119,36.8695,1,Muhafazat Halab,FARS News Agency,4,Factiva,Turkey,Turkish Kurds,"International Ethnic,Kurd (Ethnic Group)",46439331,Turkey,Turkey,NULL,2018
355,Damascus,Syria,2018-01-30,NULL,2018-01-30,ICEWS28485279,"In the meantime, media activists said that several Russian warplanes pounded the Turkish convoy that tried to go through the regions that are under the Syrian Army control near al-Eis and near the highway that connects Aleppo to Damascus.",Employ aerial weapons,Syrian Army Targets Turkish Military Column in Southern Aleppo,"(2018, 5, 3)",-10,33.5102,36.2913,1,Dimashq,FARS News Agency,3,Factiva,Russian Federation,Russia,NULL,46439332,Turkey,Citizen (Turkey),"General Population / Civilian / Social,Social",2018
356,Amman,Jordan,2018-01-30,NULL,2018-01-30,ICEWS28485297,"The Israeli embassy staff was expelled from Amman after Israel didn't offer an apology for the incident when two Jordanians were killed by a security guard for the Israeli embassy, which provoked resentment in Jordan.",Expel or deport individuals,Israel Announces Reopening of Its Embassy in Jordan After Diplomatic Row Settled,"(2018, 5, 3)",-5,31.9552,35.945,1,Muhafazat `Amman,Unknown,6,Factiva,Jordan,Jordan,NULL,46439362,Israel,Foreign Affairs (Israel),"Foreign Ministry,Executive,Government",2018
357,Amman,Jordan,2018-01-30,NULL,2018-01-30,ICEWS28485298,"The Israeli embassy staff was expelled from Amman after Israel didn't offer an apology for the incident when two Jordanians were killed by a security guard for the Israeli embassy, which provoked resentment in Jordan.",Use unconventional violence,Israel Announces Reopening of Its Embassy in Jordan After Diplomatic Row Settled,"(2018, 5, 3)",-9,31.9552,35.945,1,Muhafazat `Amman,Unknown,6,Factiva,Israel,Citizen (Israel),"Social,General Population / Civilian / Social",46439362,Jordan,Citizen (Jordan),"Social,General Population / Civilian / Social",2018
358,Beirut,Lebanon,2018-01-30,NULL,2018-01-30,ICEWS28485451,BEIRUT (Reuters) - Lebanese President Michel Aoun on Tuesday called on leaders to assume their responsibility in protecting the country's stability and security after a political row involving his son-in-law triggered street protests.,Make an appeal or request,Lebanon's Aoun urges stability after street protests,"(2018, 5, 3)",3,33.8889,35.4944,1,Beyrouth,Reuters News,1,Factiva,Lebanon,Michel Aoun,"(National) Minor Party,Parties,Ideological,Center Right,Government,Unicameral,Executive Office,Legislative / Parliamentary,Executive",46439776,Lebanon,Citizen (Lebanon),"General Population / Civilian / Social,Social",2018
359,Beirut,Lebanon,2018-01-30,NULL,2018-01-30,ICEWS28485452,"Supporters of Parliament Speaker Nabih Berri, a long time political adversary of Aoun, set ablaze tyres and blocked roads on Monday in protest against comments made by Aoun's son-in-law, Foreign Minister Gebran Bassil who had called him 'a thug'.",Demonstrate or rally,Lebanon's Aoun urges stability after street protests,"(2018, 5, 3)",-6.5,33.8889,35.4944,1,Beyrouth,Reuters News,2,Factiva,Lebanon,Citizen (Lebanon),"General Population / Civilian / Social,Social",46439776,Lebanon,Gebran Bassil,"Government,Foreign Ministry,Executive",2018
360,Beirut,Lebanon,2018-01-30,NULL,2018-01-30,ICEWS28485431,"BEIRUT (Reuters) - In Burj al-Barajneh camp, Amira Nassar fears for the future after the United States cut aid to the U.N. agency that helps her and many others among the estimated 170,000 Palestinian refugees in Lebanon.",Reduce or stop material aid,"In Lebanese camp for Palestinian refugees, fears after aid cut","(2018, 5, 3)",-5.6,33.8889,35.4944,1,Beyrouth,Reuters News,1,Factiva,United States,United States,NULL,46439842,NULL,United Nations,"Global Diplomatic IGOs,International Government Organization,Global",2018
361,Cairo,Egypt,2018-01-30,NULL,2018-01-30,ICEWS28485432,"The same story tops the front page of the Sudan Tribune, with a main headline confirming that 'Sudan, Egypt and Ethiopia agree to cooperate on Grand Renaissance Dam'.",Express intent to engage in diplomatic cooperation (such as policy support),African Press Review 30 January 2018,"(2018, 5, 3)",4.5,30.0626,31.2497,1,Muhafazat al Qahirah,Unknown,6,Factiva,Sudan,Sudan,NULL,46439865,Egypt,Egypt,NULL,2018
362,Cairo,Egypt,2018-01-30,NULL,2018-01-30,ICEWS28485433,"The same story tops the front page of the Sudan Tribune, with a main headline confirming that 'Sudan, Egypt and Ethiopia agree to cooperate on Grand Renaissance Dam'.",Express intent to engage in diplomatic cooperation (such as policy support),African Press Review 30 January 2018,"(2018, 5, 3)",4.5,30.0626,31.2497,1,Muhafazat al Qahirah,Unknown,6,Factiva,Ethiopia,Ethiopia,NULL,46439865,Egypt,Egypt,NULL,2018
363,Cairo,Egypt,2018-01-30,NULL,2018-01-30,ICEWS28485434,"The same story tops the front page of the Sudan Tribune, with a main headline confirming that 'Sudan, Egypt and Ethiopia agree to cooperate on Grand Renaissance Dam'.",Express intent to engage in diplomatic cooperation (such as policy support),African Press Review 30 January 2018,"(2018, 5, 3)",4.5,30.0626,31.2497,1,Muhafazat al Qahirah,Unknown,6,Factiva,Egypt,Egypt,NULL,46439865,Sudan,Sudan,NULL,2018
364,Cairo,Egypt,2018-01-30,NULL,2018-01-30,ICEWS28485435,"The same story tops the front page of the Sudan Tribune, with a main headline confirming that 'Sudan, Egypt and Ethiopia agree to cooperate on Grand Renaissance Dam'.",Express intent to engage in diplomatic cooperation (such as policy support),African Press Review 30 January 2018,"(2018, 5, 3)",4.5,30.0626,31.2497,1,Muhafazat al Qahirah,Unknown,6,Factiva,Ethiopia,Ethiopia,NULL,46439865,Sudan,Sudan,NULL,2018
365,Cairo,Egypt,2018-01-30,NULL,2018-01-30,ICEWS28485436,"The same story tops the front page of the Sudan Tribune, with a main headline confirming that 'Sudan, Egypt and Ethiopia agree to cooperate on Grand Renaissance Dam'.",Express intent to engage in diplomatic cooperation (such as policy support),African Press Review 30 January 2018,"(2018, 5, 3)",4.5,30.0626,31.2497,1,Muhafazat al Qahirah,Unknown,6,Factiva,Egypt,Egypt,NULL,46439865,Ethiopia,Ethiopia,NULL,2018
366,Cairo,Egypt,2018-01-30,NULL,2018-01-30,ICEWS28485437,"The same story tops the front page of the Sudan Tribune, with a main headline confirming that 'Sudan, Egypt and Ethiopia agree to cooperate on Grand Renaissance Dam'.",Express intent to engage in diplomatic cooperation (such as policy support),African Press Review 30 January 2018,"(2018, 5, 3)",4.5,30.0626,31.2497,1,Muhafazat al Qahirah,Unknown,6,Factiva,Sudan,Sudan,NULL,46439865,Ethiopia,Ethiopia,NULL,2018
367,Alexandria,Egypt,2018-01-30,NULL,2018-01-30,ICEWS28485512,"Alexandria Criminal Court also accused the woman of joining the now-banned Muslim Brotherhood (MB) group and attempting to undermine national security and inciting violence against state institutions, private Youm7 website said on 30 January.",Accuse,Egypt court jails woman over running anti-state Facebook pages,"(2018, 5, 3)",-2,31.2156,29.9553,1,Muhafazat al Iskandariyah,BBC Monitoring Middle East,3,Factiva,Egypt,Alexandria,"Municipal,Government,Local,Provincial",46439995,Egypt,Women (Egypt),"Social,General Population / Civilian / Social",2018
368,Alexandria,Egypt,2018-01-30,NULL,2018-01-30,ICEWS28485511,"Moreover, private Al-Wafd website reported that the woman has been running 19 pages on Facebook and several other groups that support the policies of 'terrorist' MB and oppose the ruling regime.",Criticize or denounce,Egypt court jails woman over running anti-state Facebook pages,"(2018, 5, 3)",-2,31.2156,29.9553,1,Muhafazat al Iskandariyah,BBC Monitoring Middle East,4,Factiva,Egypt,New Wafd Party,"Center Right,Ideological,Parties,(National) Major Party",46439995,Egypt,Government (Egypt),Government,2018
369,NULL,Syria,2018-01-30,NULL,2018-01-30,ICEWS28485533,SYRIAN OPPOSITION DELEGATION HEAD AHMED TOMAH SAYS BEFORE LEAVING SOCHI THAT TURKISH DELEGATION 'WILL CARRY OUR DEMANDS',Make statement,SYRIAN OPPOSITION DELEGATION HEAD AHMED TOMAH SAYS BEFORE LEAVING SOCHI THAT TURKISH DELEGATION 'WILL CARRY OUR DEMANDS',"(2018, 5, 3)",0,33.5102,36.2913,1,NULL,Reuters News,1,Factiva,Syria,Syria,NULL,46440046,Turkey,Turkey,NULL,2018
370,Afrin,Syria,2018-01-30,NULL,2018-01-30,ICEWS28485523,Turkey's political leaders have been debating over Turkish military alliance with the Free Syrian Army (FSA) forces in the operations in northern Syria.,Consider policy option,Turkish leaders debate over Turkey-Syrian rebels alliance,"(2018, 5, 3)",0,36.5119,36.8695,1,Muhafazat Halab,BBC Monitoring European,2,Factiva,Turkey,Turkey,NULL,46440058,Syria,Free Syrian Army,"Insurgents,Dissident",2018
371,Cairo,Egypt,2018-01-30,NULL,2018-01-30,ICEWS28485532,CAIRO (AP) — Egypt's state news agency says a court has sentenced six alleged Muslim Brotherhood members to life in prison over charges including the attempted murder of soldiers and police.,"Arrest, detain, or charge with legal action",Egypt sentences 6 alleged Islamists to life over violence,"(2018, 5, 3)",-5,30.0626,31.2497,1,Muhafazat al Qahirah,Associated Press Newswires,1,Factiva,Egypt,Egypt,NULL,46440065,Egypt,Muslim Brotherhood,"Sunni,Ideological,Social,Fundamentalist,International Religious,Muslim,Parties,(National) Major Party,National Religious",2018
372,Cairo,Egypt,2018-01-30,NULL,2018-01-30,ICEWS28485531,"MENA says Tuesday's ruling by the Cairo Criminal Court sentenced four other defendants to 15 years on similar charges, including belonging to a terrorist group, murder and planning attacks against the state.",Make statement,Egypt sentences 6 alleged Islamists to life over violence,"(2018, 5, 3)",0,30.0626,31.2497,1,Muhafazat al Qahirah,Associated Press Newswires,2,Factiva,Egypt,Middle East News Agency,"Government,Executive,State Media,Information / Communication / Transparency Ministry",46440065,Egypt,Egypt,NULL,2018
378,Afrin,Syria,2018-01-30,NULL,2018-01-30,ICEWS28485623,"'Earlier in the day, Turkey said that its troops and the 'Free Syrian Army' [FSA] had captured the villages of Sulaiman Khalil and Sati Shakhyan in Afrin.",Make statement,Kurds say clashes ongoing in areas claimed captured by Turkey,"(2018, 5, 3)",0,36.5119,36.8695,1,Muhafazat Halab,BBC Monitoring Middle East,4,Factiva,Turkey,Turkey,NULL,46440184,Turkey,Military (Turkey),"Government,Military",2018
379,Afrin,Syria,2018-01-30,NULL,2018-01-30,ICEWS28485624,"'Earlier in the day, Turkey said that its troops and the 'Free Syrian Army' [FSA] had captured the villages of Sulaiman Khalil and Sati Shakhyan in Afrin.",Make statement,Kurds say clashes ongoing in areas claimed captured by Turkey,"(2018, 5, 3)",0,36.5119,36.8695,1,Muhafazat Halab,BBC Monitoring Middle East,4,Factiva,Turkey,Turkey,NULL,46440184,Syria,Free Syrian Army,"Insurgents,Dissident",2018
380,Afrin,Syria,2018-01-30,NULL,2018-01-30,ICEWS28485625,"'Earlier in the day, Turkey said that its troops and the 'Free Syrian Army' [FSA] had captured the villages of Sulaiman Khalil and Sati Shakhyan in Afrin.",Occupy territory,Kurds say clashes ongoing in areas claimed captured by Turkey,"(2018, 5, 3)",-9.5,36.5119,36.8695,1,Muhafazat Halab,BBC Monitoring Middle East,4,Factiva,Turkey,Military (Turkey),"Government,Military",46440184,Turkey,Citizen (Turkey),"General Population / Civilian / Social,Social",2018
381,Afrin,Syria,2018-01-30,NULL,2018-01-30,ICEWS28485626,"'Earlier in the day, Turkey said that its troops and the 'Free Syrian Army' [FSA] had captured the villages of Sulaiman Khalil and Sati Shakhyan in Afrin.",Occupy territory,Kurds say clashes ongoing in areas claimed captured by Turkey,"(2018, 5, 3)",-9.5,36.5119,36.8695,1,Muhafazat Halab,BBC Monitoring Middle East,4,Factiva,Syria,Free Syrian Army,"Insurgents,Dissident",46440184,Turkey,Citizen (Turkey),"General Population / Civilian / Social,Social",2018
382,Afrin,Syria,2018-01-30,NULL,2018-01-30,ICEWS28485565,Reports of civilian deaths in Turkish air strikes on Afrin and ongoing protests against the Turkey's military offensive in Afrin featured prominently in Kurmanji-Kurdish language reporting on Turkey on 29-30 January.,Employ aerial weapons,Turkey: Kurmanji-Kurdish media focus on Afrin operation,"(2018, 5, 3)",-10,36.5119,36.8695,1,Muhafazat Halab,BBC Monitoring European,2,Factiva,Turkey,Turkey,NULL,46440187,Turkey,Citizen (Turkey),"General Population / Civilian / Social,Social",2018
384,Beirut,Lebanon,2018-01-30,NULL,2018-01-30,ICEWS28485711,"Supporters of Parliament Speaker Nabih Berri, a long time political adversary of Aoun, set ablaze tyres and blocked roads on Monday in protest against comments made by Aoun's son-in-law, Foreign Minister Gebran Bassil who had called him 'a thug'.",Demonstrate or rally,"UPDATE 1-Lebanon's Aoun urges stability, forgiveness after protests","(2018, 5, 3)",-6.5,33.8889,35.4944,1,Beyrouth,Reuters News,3,Factiva,Lebanon,Citizen (Lebanon),"General Population / Civilian / Social,Social",46440398,Lebanon,Gebran Bassil,"Executive,Foreign Ministry,Government",2018
385,NULL,Saudi Arabia,2018-01-30,NULL,2018-01-30,ICEWS28485696,Saudi Arabia's Attorney General Sheikh Saud al-Mojeb said that the kingdom has seized more than $100bn in anti-corruption settlements.,Make statement,Saudi Arabia seizes more than $100bn in settlements,"(2018, 5, 3)",0,24.6877,46.7219,1,NULL,Al Jazeera English,2,Factiva,Saudi Arabia,Attorney General (Saudi Arabia),"Judicial,Government",46440557,Saudi Arabia,Royal Administration (Saudi Arabia),Government,2018
387,NULL,Syria,2018-01-30,NULL,2018-01-30,ICEWS28486033,"United Nations Secretary General Antonio Guterres has sent his special envoy for Syria, Staffan de Mistura, to the Syrian peace conference in Russia.",Make a visit,"Iran, China Discuss Syria in Sochi","(2018, 5, 3)",1.9,33.5102,36.2913,1,NULL,FARS News Agency,6,Factiva,Portugal,António Manuel de Oliveira Guterres,"(National) Minor Party,Ideological,Center Left,Government,International Religious,Catholic,Global,International Government Organization,Global Diplomatic IGOs,Elite,Parties",46441180,Syria,Syria,NULL,2018
388,NULL,Syria,2018-01-30,NULL,2018-01-30,ICEWS28486035,"United Nations Secretary General Antonio Guterres has sent his special envoy for Syria, Staffan de Mistura, to the Syrian peace conference in Russia.",Host a visit,"Iran, China Discuss Syria in Sochi","(2018, 5, 3)",2.8,33.5102,36.2913,1,NULL,FARS News Agency,6,Factiva,Syria,Syria,NULL,46441180,Portugal,António Manuel de Oliveira Guterres,"(National) Minor Party,Ideological,Center Left,Government,International Religious,Catholic,Global,International Government Organization,Global Diplomatic IGOs,Elite,Parties",2018
389,NULL,Syria,2018-01-30,NULL,2018-01-30,ICEWS28486020,"United Nations Secretary General Antonio Guterres has sent his special envoy for Syria, Staffan de Mistura, to the Syrian peace conference in Russia.",Make a visit,Iranian FM's Senior Aide: Sochi Commission Set Up to Discuss Syria's Constitution,"(2018, 5, 3)",1.9,33.5102,36.2913,1,NULL,FARS News Agency,6,Factiva,Portugal,António Manuel de Oliveira Guterres,"(National) Minor Party,Ideological,Center Left,Government,International Religious,Catholic,Global,International Government Organization,Global Diplomatic IGOs,Elite,Parties",46441182,Syria,Syria,NULL,2018
390,NULL,Syria,2018-01-30,NULL,2018-01-30,ICEWS28486022,"United Nations Secretary General Antonio Guterres has sent his special envoy for Syria, Staffan de Mistura, to the Syrian peace conference in Russia.",Host a visit,Iranian FM's Senior Aide: Sochi Commission Set Up to Discuss Syria's Constitution,"(2018, 5, 3)",2.8,33.5102,36.2913,1,NULL,FARS News Agency,6,Factiva,Syria,Syria,NULL,46441182,Portugal,António Manuel de Oliveira Guterres,"(National) Minor Party,Ideological,Center Left,Government,International Religious,Catholic,Global,International Government Organization,Global Diplomatic IGOs,Elite,Parties",2018
391,Hamah,Syria,2018-01-30,NULL,2018-01-30,ICEWS28486027,"The fighter jets pounded the terrorists-held towns of Kafr Zita and al-Latamina in Northern Hama, destroying a number of terrorists' positions and killing or wounding several militants.",Use conventional military force,Syrian Army Keeps Rolling on Terrorist Centers in Hama,"(2018, 5, 3)",-10,35.1318,36.7578,1,Muhafazat Hamah,FARS News Agency,5,Factiva,Syria,Fighter Bomber (Syria),"Government,Military",46441183,Syria,Militant (Syria),Unidentified Forces,2018
