,City,Country,Datetime,District,Event Date,Event ID,Event Sentence,Event Text,Headline,ISO Week,Intensity,Latitude,Longitude,Month,Province,Publisher,Sentence Number,Source,Source Country,Source Name,Source Sectors,Story ID,Target Country,Target Name,Target Sectors,Year
1737,Tadmur,Syria,2016-12-16,NULL,2016-12-16,ICEWS25282121,A large number of Hezbollah combatants arrived in Eastern Homs to assist the army to repel ISIL's attack on T4 airbase and take part in an imminent offensive to recapture the ancient city of Palmyra and energy-rich fields with the back up of the Russian and Syrian fighter jets.,Provide aid,Syria: Lebanese Hezbollah Fighters Arrive in Homs to Combat ISIL Terrorists,"(2016, 50, 3)",7,34.5608,38.2805,12,Muhafazat Hims,FARS News Agency,2,Factiva,Lebanon,Combatant (Hezbollah),"International Religious,Social,Parties,Ideological,Far Left,National Religious,Dissident,Organized Violent,(National) Minor Party,Shia",42999909,Syria,Military (Syria),"Government,Military",2016
1738,Tadmur,Syria,2016-12-16,NULL,2016-12-16,ICEWS25282046,"TEHRAN (FNA)- At least 52 terrorists of ISIL, including non-Syrian commanders, were killed and many more were wounded in the Syrian army troops' attacks near the ancient city of Palmyra (Tadmur).",Use conventional military force,Over 50 More ISIL Terrorists Including Commanders Killed in Syrian Army Attacks in Palmyra,"(2016, 50, 3)",-10,34.5608,38.2805,12,Muhafazat Hims,FARS News Agency,1,Factiva,Syria,Military (Syria),"Government,Military",42999912,Syria,Syria,NULL,2016
1739,Tadmur,Syria,2016-12-16,NULL,2016-12-16,ICEWS25282047,"Reports said earlier today that the Syrian Air Force carried out several combat flights over ISIL's positions in the Western and Southwestern directions of the ancient city of Palmyra (Tadmur) in Eastern Homs, killing 116 militants and wounding many more.",Use conventional military force,Over 50 More ISIL Terrorists Including Commanders Killed in Syrian Army Attacks in Palmyra,"(2016, 50, 3)",-10,34.5608,38.2805,12,Muhafazat Hims,FARS News Agency,6,Factiva,Syria,Air Force (Syria),"Government,Air Force,Military",42999912,Syria,Militant (Syria),Unidentified Forces,2016
1740,Aleppo,Syria,2016-12-16,NULL,2016-12-16,ICEWS25282178,"In relevant remarks on Wednesday, Secretary of Iran's Supreme National Security Council (SNSC) Ali Shamkhani hailed the recent victories of the Syrian army against terrorist groups in the city of Aleppo and elsewhere, but meantime renewed Iran's stance on reaching a political solution to the ongoing crisis in Syria.",Praise or endorse,Envoy Calls on West to Stop Supporting Terrorist Groups in Syria,"(2016, 50, 3)",3.4,36.2012,37.1612,12,Muhafazat Halab,FARS News Agency,4,Factiva,Iran,Supreme National Security Council,"Government,Defense / Security Ministry,Executive",42999914,Syria,Military (Syria),"Government,Military",2016
1741,Aleppo,Syria,2016-12-16,NULL,2016-12-16,ICEWS25282012,The Turkish media have recent engaged in propaganda war against Iran and Russia to blame them for violation of ceasefire in the city of Aleppo.,Accuse of aggression,"Embassy Blasts Some Turkish Media for Supporting Terrorism, Waging Anti-Iran Propaganda","(2016, 50, 3)",-2,36.2012,37.1612,12,Muhafazat Halab,FARS News Agency,6,Factiva,Turkey,Media (Turkey),"Social,Media",42999918,Iran,Iran,NULL,2016
1742,Cairo,Egypt,2016-12-16,NULL,2016-12-16,ICEWS25281986,"DUBAI, December 16 (Sputnik) - The members of the Gulf Cooperation Council (GCC) condemns Egypt's statements on alleged links between Qatar and a recent terrorist attack in Cairo, GCC Secretary General Abdullatif bin Rashid Al Zayani said Friday.",Criticize or denounce,Gulf Cooperation Council Rebukes Egypt Over Claims on Alleged Qatari Ties to Cairo Attack,"(2016, 50, 3)",-2,30.0626,31.2497,12,Muhafazat al Qahirah,Unknown,1,Factiva,NULL,Gulf Cooperation Council,"Regional,International Government Organization,Regional Diplomatic IGOs",42999937,Egypt,Egypt,NULL,2016
1743,Aleppo,Syria,2016-12-16,NULL,2016-12-16,ICEWS25282195,"Aleppo has recently become a major battleground for Syrian government forces fighting against militants and extremists in an effort to liberate the city and save civilians thousands of whom have no access to food, water, electricity or medical assistance.",Use conventional military force,"Turkey, Iran to Work Together on Providing Humanitarian Aid in Aleppo","(2016, 50, 3)",-10,36.2012,37.1612,12,Muhafazat Halab,Unknown,6,Factiva,Syria,Military (Syria),"Government,Military",42999992,Syria,Militant (Syria),Unidentified Forces,2016
1744,Aleppo,Syria,2016-12-16,NULL,2016-12-16,ICEWS25282196,"Aleppo has recently become a major battleground for Syrian government forces fighting against militants and extremists in an effort to liberate the city and save civilians thousands of whom have no access to food, water, electricity or medical assistance.",Use conventional military force,"Turkey, Iran to Work Together on Providing Humanitarian Aid in Aleppo","(2016, 50, 3)",-10,36.2012,37.1612,12,Muhafazat Halab,Unknown,6,Factiva,Syria,Military (Syria),"Government,Military",42999992,Syria,Extremist (Syria),"Radicals / Extremists / Fundamentalists,Dissident",2016
1745,Aleppo,Syria,2016-12-16,NULL,2016-12-16,ICEWS25282197,"Aleppo has recently become a major battleground for Syrian government forces fighting against militants and extremists in an effort to liberate the city and save civilians thousands of whom have no access to food, water, electricity or medical assistance.",Use unconventional violence,"Turkey, Iran to Work Together on Providing Humanitarian Aid in Aleppo","(2016, 50, 3)",-9,36.2012,37.1612,12,Muhafazat Halab,Unknown,6,Factiva,Syria,Militant (Syria),Unidentified Forces,42999992,Syria,Military (Syria),"Government,Military",2016
1746,Aleppo,Syria,2016-12-16,NULL,2016-12-16,ICEWS25282198,"Aleppo has recently become a major battleground for Syrian government forces fighting against militants and extremists in an effort to liberate the city and save civilians thousands of whom have no access to food, water, electricity or medical assistance.",Use conventional military force,"Turkey, Iran to Work Together on Providing Humanitarian Aid in Aleppo","(2016, 50, 3)",-10,36.2012,37.1612,12,Muhafazat Halab,Unknown,6,Factiva,Syria,Extremist (Syria),"Radicals / Extremists / Fundamentalists,Dissident",42999992,Syria,Military (Syria),"Government,Military",2016
1747,Aleppo,Syria,2016-12-16,NULL,2016-12-16,ICEWS25282117,"Moreover, only the Syrian government and Russia currently provide Aleppo civilians with humanitarian aid, while no Western country or international organization does it.",Provide humanitarian aid,Major Portion of Russian Humanitarian Aid Goes Directly to Aleppo - Envoy to UN,"(2016, 50, 3)",7.4,36.2012,37.1612,12,Muhafazat Halab,Unknown,6,Factiva,Syria,Government (Syria),Government,42999994,Syria,Citizen (Syria),"General Population / Civilian / Social,Social",2016
1748,Aleppo,Syria,2016-12-16,NULL,2016-12-16,ICEWS25282118,"Moreover, only the Syrian government and Russia currently provide Aleppo civilians with humanitarian aid, while no Western country or international organization does it.",Provide humanitarian aid,Major Portion of Russian Humanitarian Aid Goes Directly to Aleppo - Envoy to UN,"(2016, 50, 3)",7.4,36.2012,37.1612,12,Muhafazat Halab,Unknown,6,Factiva,Russian Federation,Russia,NULL,42999994,Syria,Citizen (Syria),"General Population / Civilian / Social,Social",2016
1750,Aleppo,Syria,2016-12-16,NULL,2016-12-16,ICEWS25282227,"Turkey's Foreign Minister Mevlut Cavusoglu spoke '13 times' on Friday with his Iranian counterpart, Mohammad Javad Zarif, to discuss the situation in Syria's second city of Aleppo, a Turkish diplomatic source said.",Consult,Turkey FM speaks '13 times' with Iran counterpart on Aleppo,"(2016, 50, 3)",1,36.2012,37.1612,12,Muhafazat Halab,Agence France-Presse,1,Factiva,Turkey,Mevlut Cavusoglu,"Foreign Ministry,Unicameral,Executive,Legislative / Parliamentary,Government",43000244,Iran,Mohammad Javad Zarif,"Foreign Ministry,Social,Education,Executive,Government",2016
1751,Aleppo,Syria,2016-12-16,NULL,2016-12-16,ICEWS25282228,"Turkey's Foreign Minister Mevlut Cavusoglu spoke '13 times' on Friday with his Iranian counterpart, Mohammad Javad Zarif, to discuss the situation in Syria's second city of Aleppo, a Turkish diplomatic source said.",Consult,Turkey FM speaks '13 times' with Iran counterpart on Aleppo,"(2016, 50, 3)",1,36.2012,37.1612,12,Muhafazat Halab,Agence France-Presse,1,Factiva,Iran,Mohammad Javad Zarif,"Foreign Ministry,Social,Education,Executive,Government",43000244,Turkey,Mevlut Cavusoglu,"Foreign Ministry,Unicameral,Executive,Legislative / Parliamentary,Government",2016
1752,Aleppo,Syria,2016-12-16,NULL,2016-12-16,ICEWS25282279,"Reportedly, British Foreign Secretary Boris Johnson summoned the Russian and Iranian ambassadors to convey his 'profound concern' over the situation in the Syrian city of Aleppo on Thursday.",Make pessimistic comment,Iran summons British envoy over Syria remarks,"(2016, 50, 3)",-0.4,36.2012,37.1612,12,Muhafazat Halab,Xinhua News Agency,4,Factiva,Russian Federation,Russia,NULL,43000271,United Kingdom,Boris Johnson,"Local,Municipal,Center Right,Ideological,Government,Parties,(National) Major Party,Elite",2016
1753,Aleppo,Syria,2016-12-16,NULL,2016-12-16,ICEWS25282280,"Reportedly, British Foreign Secretary Boris Johnson summoned the Russian and Iranian ambassadors to convey his 'profound concern' over the situation in the Syrian city of Aleppo on Thursday.",Make pessimistic comment,Iran summons British envoy over Syria remarks,"(2016, 50, 3)",-0.4,36.2012,37.1612,12,Muhafazat Halab,Xinhua News Agency,4,Factiva,Iran,Foreign Affairs (Iran),"Foreign Ministry,Executive,Government",43000271,United Kingdom,Boris Johnson,"Local,Municipal,Center Right,Ideological,Government,Parties,(National) Major Party,Elite",2016
1754,Aleppo,Syria,2016-12-16,NULL,2016-12-16,ICEWS25282281,"Reportedly, British Foreign Secretary Boris Johnson summoned the Russian and Iranian ambassadors to convey his 'profound concern' over the situation in the Syrian city of Aleppo on Thursday.",Consult,Iran summons British envoy over Syria remarks,"(2016, 50, 3)",1,36.2012,37.1612,12,Muhafazat Halab,Xinhua News Agency,4,Factiva,United Kingdom,Boris Johnson,"Local,Municipal,Center Right,Ideological,Government,Parties,(National) Major Party,Elite",43000271,Iran,Foreign Affairs (Iran),"Foreign Ministry,Executive,Government",2016
1755,Aleppo,Syria,2016-12-16,NULL,2016-12-16,ICEWS25282283,"Reportedly, British Foreign Secretary Boris Johnson summoned the Russian and Iranian ambassadors to convey his 'profound concern' over the situation in the Syrian city of Aleppo on Thursday.",Consult,Iran summons British envoy over Syria remarks,"(2016, 50, 3)",1,36.2012,37.1612,12,Muhafazat Halab,Xinhua News Agency,4,Factiva,Iran,Foreign Affairs (Iran),"Foreign Ministry,Executive,Government",43000271,United Kingdom,Boris Johnson,"Local,Municipal,Center Right,Ideological,Government,Parties,(National) Major Party,Elite",2016
1756,Aleppo,Syria,2016-12-16,NULL,2016-12-16,ICEWS25282297,"Then Russia proposed the idea of joint efforts in order to secure withdrawal by the Jabhat al-Nusra terrorists from eastern Aleppo, which was not supported by the U.S. either, he said.",Reject,"With no help from U.S., Russia secures Jabhat al-Nusra terrorists' withdrawal from eastern Aleppo - Russia's General Staff","(2016, 50, 3)",-4,36.2012,37.1612,12,Muhafazat Halab,Interfax News Service,5,Factiva,United States,United States,NULL,43000279,Syria,Syria,NULL,2016
1757,Mosul,Iraq,2016-12-16,NULL,2016-12-16,ICEWS25282210,"MOSUL, Iraq, Dec. 16 (Xinhua) -- Iraqi security forces on Friday repelled four counter attacks by the Islamic State (IS) group militants in the battle ground city of Mosul, killing a total of 174 IS militants and destroying 13 suicide car bombs, the Iraqi army said.",Use conventional military force,"Iraqi forces repel 4 IS attacks in Mosul, killing 174 extremist militants","(2016, 50, 3)",-10,36.335,43.1189,12,Muhafazat Ninawa,Xinhua News Agency,1,Factiva,Iraq,Military Personnel - Special (Iraq),"Military,Government",43000295,Iraq,Militant (Iraq),Unidentified Forces,2016
1763,Aleppo,Syria,2016-12-16,NULL,2016-12-16,ICEWS25282395,"Aneela Rashid — Earlier in the day, the Russian Defense Ministry said that all eastern Aleppo districts had been freed from terrorists, while some hotbeds of militants' resistance remained.",Make statement,'I Just Want Truth to Come Out:' Syrian Army Captain Tells About Aleppo Victory,"(2016, 50, 3)",0,36.2012,37.1612,12,Muhafazat Halab,Unknown,2,Factiva,Russian Federation,Defense / Security Ministry (Russia),"Executive,Government,Defense / Security Ministry",43000495,Syria,Syria,NULL,2016
1764,Aleppo,Syria,2016-12-16,NULL,2016-12-16,ICEWS25282314,"Following Churkin's remarks, US Ambassador Samantha Power said Washington supports the French initiative and hopes the Council will vote on the draft 'over the weekend at least,' considering the urgency with which Aleppo residents need to be evacuated.",Praise or endorse,"Russia Questions Parts of French Plan for Aleppo, Welcomes Larger UN Role","(2016, 50, 3)",3.4,36.2012,37.1612,12,Muhafazat Halab,Unknown,5,Factiva,United States,United States,NULL,43000503,France,France,NULL,2016
1765,Aleppo,Syria,2016-12-16,NULL,2016-12-16,ICEWS25282312,"Turkish President Recep Tayyip Erdogan, normally not one to bite his tongue over atrocities committed by the Syrian regime, has been relatively silent over the last three months as Syrian government forces, supported by Russia and Iranian-backed Shiite militia, have besieged eastern Aleppo.",Praise or endorse,Turkey and Russia walk Syria tightrope,"(2016, 50, 3)",3.4,36.2012,37.1612,12,Muhafazat Halab,Deutsche Welle,5,Factiva,Russian Federation,Russia,NULL,43000522,Syria,Military (Syria),"Government,Military",2016
1766,Aleppo,Syria,2016-12-16,NULL,2016-12-16,ICEWS25282342,He warned Assad that he will not be able to 'slaughter his way to legitimacy'.,Threaten,Obama denounces Aleppo 'horror' as evacuation suspended,"(2016, 50, 3)",-4.4,36.2012,37.1612,12,Muhafazat Halab,Agence France-Presse,5,Factiva,United States,Barack Obama,"(National) Major Party,Center Left,Executive,Ideological,Parties,Executive Office,Government",43000538,Syria,Bashar al-Assad,"Ideological,Government,International Religious,Executive,National Ethnic,Shia,Executive Office,Religious Minority,Parties,(National) Major Party,National Religious,National Ethnic Minority,Far Right,Social",2016
1767,Aleppo,Syria,2016-12-16,NULL,2016-12-16,ICEWS25282404,"Following Churkin’s remarks, US Ambassador Samantha Power said Washington supports the French initiative and hopes the Council will vote on the draft 'over the weekend at least,' considering the urgency with which Aleppo residents need to be evacuated.",Make optimistic comment,"Russia Questions Parts of French Plan for Syria’s Aleppo, Welcomes Larger UN Role – Envoy","(2016, 50, 3)",0.4,36.2012,37.1612,12,Muhafazat Halab,Unknown,5,Factiva,United States,United States,NULL,43000557,NULL,UN Security Council,"Global,International Government Organization,Global Defense / Security IGOs,Global Diplomatic IGOs",2016
1768,Aleppo,Syria,2016-12-16,NULL,2016-12-16,ICEWS25282405,"Following Churkin’s remarks, US Ambassador Samantha Power said Washington supports the French initiative and hopes the Council will vote on the draft 'over the weekend at least,' considering the urgency with which Aleppo residents need to be evacuated.",Praise or endorse,"Russia Questions Parts of French Plan for Syria’s Aleppo, Welcomes Larger UN Role – Envoy","(2016, 50, 3)",3.4,36.2012,37.1612,12,Muhafazat Halab,Unknown,5,Factiva,United States,United States,NULL,43000557,France,France,NULL,2016
1778,Aleppo,Syria,2016-12-16,NULL,2016-12-16,ICEWS25282508,"Russia's ambassador to the UK, Alexander Yakovenko, appeared to have ridiculed British Foreign Secretary Boris Johnson the day after he was summoned to the Foreign Office over the humanitarian situation in Aleppo.",Criticize or denounce,Russian envoy says gave Johnson 'useful' update on Aleppo,"(2016, 50, 3)",-2,36.2012,37.1612,12,Muhafazat Halab,BBC Monitoring Former Soviet Union,2,Factiva,Russian Federation,Foreign Affairs (Russia),"Executive,Government,Foreign Ministry",43001089,United Kingdom,Boris Johnson,"Municipal,Local,(National) Major Party,Government,Parties,Center Right,Ideological,Elite",2016
1780,Aleppo,Syria,2016-12-16,NULL,2016-12-16,ICEWS25282672,"DAMASCUS -- The rebels breached a ceasefire in Syria's northern city of Aleppo on Friday, firing mortar shells and sniper shots at a crossing designed for their evacuation, state TV reported.",fight with small arms and light weapons,"Xinhua Middle East news summary at 2200 GMT, Dec. 16","(2016, 50, 3)",-10,36.2012,37.1612,12,Muhafazat Halab,Xinhua News Agency,1,Factiva,Syria,Armed Rebel (Syria),"Dissident,Rebel",43001226,Syria,Syria,NULL,2016
1781,Aleppo,Syria,2016-12-16,NULL,2016-12-16,ICEWS25282719,"'The UN and partners in Idlib have prepositioned supplies and are ready to provide assistance to all those in need and evacuated from eastern Aleppo,' he said.",Express intent to provide material aid,Thousands evacuated from Syria's Aleppo with UN help: spokesman,"(2016, 50, 3)",5.2,36.2012,37.1612,12,Muhafazat Halab,Xinhua News Agency,6,Factiva,NULL,United Nations,"Global Diplomatic IGOs,International Government Organization,Global",43001227,Syria,Citizen (Syria),"Social,General Population / Civilian / Social",2016
1782,Aleppo,Syria,2016-12-16,NULL,2016-12-16,ICEWS25282720,"'The UN and partners in Idlib have prepositioned supplies and are ready to provide assistance to all those in need and evacuated from eastern Aleppo,' he said.",Express intent to provide material aid,Thousands evacuated from Syria's Aleppo with UN help: spokesman,"(2016, 50, 3)",5.2,36.2012,37.1612,12,Muhafazat Halab,Xinhua News Agency,6,Factiva,Turkey,Citizen (Turkey),"General Population / Civilian / Social,Social",43001227,Syria,Citizen (Syria),"Social,General Population / Civilian / Social",2016
1783,Daraa,Syria,2016-12-16,NULL,2016-12-16,ICEWS25282725,"On March 18, security forces open fire on a protest, killing four people in what activists regard as the first deaths of the uprising.",Use conventional military force,Key events in rebel stronghold since uprising began six years ago,"(2016, 50, 3)",-10,32.6189,36.1021,12,Muhafazat Dar`a,Unknown,2,Factiva,Syria,Military Personnel - Special (Syria),"Military,Government",43001239,Syria,Citizen (Syria),"Social,General Population / Civilian / Social",2016
1784,Aleppo,Syria,2016-12-16,NULL,2016-12-16,ICEWS25282726,"July 2012: Rebel fighters seize eastern Aleppo, dividing the city.",Occupy territory,Key events in rebel stronghold since uprising began six years ago,"(2016, 50, 3)",-9.5,36.2012,37.1612,12,Muhafazat Halab,Unknown,4,Factiva,Syria,Combatant (Syria),Unidentified Forces,43001239,Syria,Syria,NULL,2016
1793,Aleppo,Syria,2016-12-16,NULL,2016-12-16,ICEWS25282917,François Delattre told reporters outside Security Council chambers that his country and Germany asked for the Friday meeting.,Make statement,"U.N. Security Council Holds Emergency Meeting on Syria, French Ambassador Says","(2016, 50, 3)",0,36.2012,37.1612,12,Muhafazat Halab,Dow Jones News Service,3,Factiva,France,François Delattre,"Executive,Foreign Ministry,Government",43002079,France,France,NULL,2016
1794,Aleppo,Syria,2016-12-16,NULL,2016-12-16,ICEWS25282918,François Delattre told reporters outside Security Council chambers that his country and Germany asked for the Friday meeting.,Make statement,"U.N. Security Council Holds Emergency Meeting on Syria, French Ambassador Says","(2016, 50, 3)",0,36.2012,37.1612,12,Muhafazat Halab,Dow Jones News Service,3,Factiva,France,François Delattre,"Executive,Foreign Ministry,Government",43002079,Germany,Germany,NULL,2016
1795,Aleppo,Syria,2016-12-16,NULL,2016-12-16,ICEWS25282919,"He said if an agreement can't be reached on safely evacuating civilians and enabling humanitarian aid into the besieged city under the eye of international observers, France and its partners could call for an emergency special session of the 193-member General Assembly.",Make statement,"U.N. Security Council Holds Emergency Meeting on Syria, French Ambassador Says","(2016, 50, 3)",0,36.2012,37.1612,12,Muhafazat Halab,Dow Jones News Service,4,Factiva,France,François Delattre,"Executive,Foreign Ministry,Government",43002079,France,France,NULL,2016
1796,Cairo,Egypt,2016-12-16,NULL,2016-12-16,ICEWS25283044,Egyptian authorities have announced the arrest of four jihadist suspects.,"Arrest, detain, or charge with legal action",Egypt church bombing raises calls to uproot bigotry,"(2016, 50, 3)",-5,30.0626,31.2497,12,Muhafazat al Qahirah,Agence France-Presse,6,Factiva,Egypt,Other Authorities / Officials (Egypt),Government,43002365,Egypt,Criminal (Egypt),"Dissident,Criminals / Gangs",2016
1797,Aleppo,Syria,2016-12-16,NULL,2016-12-16,ICEWS25283286,"Four people who were part of a convoy evacuating the besieged districts of east Aleppo were killed by Syrian government forces, witnesses told Al Jazeera, before the agreement to evacuate tens of thousands of fighters and civilians was suspended.",Use conventional military force,"Four evacuees killed, convoy sent back to east Aleppo","(2016, 50, 3)",-10,36.2012,37.1612,12,Muhafazat Halab,Al Jazeera English,2,Factiva,Syria,Military (Syria),"Government,Military",43002938,Syria,Citizen (Syria),"Social,General Population / Civilian / Social",2016
1798,Aleppo,Syria,2016-12-16,NULL,2016-12-16,ICEWS25283287,"Two men, who were part of the group, also said the entire convoy was briefly detained and told Al Jazeera's Amro Halabi, reporting from east Aleppo, that security forces opened fire on evacuees before forcing them to return to the war-torn city.",fight with small arms and light weapons,"Four evacuees killed, convoy sent back to east Aleppo","(2016, 50, 3)",-10,36.2012,37.1612,12,Muhafazat Halab,Al Jazeera English,3,Factiva,Syria,Military Personnel - Special (Syria),"Government,Military",43002938,Syria,Citizen (Syria),"Social,General Population / Civilian / Social",2016
1804,Tadmur,Syria,2016-12-17,NULL,2016-12-17,ICEWS25283120,Palmyra was seized by the Islamic State terror group while the Syrian army and its allies were fully engaged in the battle for Aleppo.,Occupy territory,Syrian army to turn sights on Palmyra after Aleppo secured; Isis recapture of city demonstrates that regime military is overstretched,"(2016, 50, 3)",-9.5,34.5608,38.2805,12,Muhafazat Hims,Irish Times,2,Factiva,Iraq,Islamic State of Iraq and the Levant,"Insurgents,Dissident,Sunni,Muslim,Fundamentalist,International Religious,Ideological",43002482,Syria,Syria,NULL,2016
1809,NULL,Syria,2016-12-17,NULL,2016-12-17,ICEWS25283258,"'The group also has conducted chemical weapons attacks in Iraq and Syria in defiance of the longstanding global norm against the use of these appalling weapons, and has enabled or directed terrorist attacks beyond the borders of its self-declared caliphate.'",Use conventional military force,US raises reward for IS chief al-Baghdadi from $10 million to $25 million,"(2016, 50, 3)",-10,33.5102,36.2913,12,NULL,Hindustan Times,6,Factiva,Iraq,Islamic State of Iraq and the Levant,"International Religious,Fundamentalist,Dissident,Insurgents,Muslim,Sunni,Ideological",43002910,Iraq,Iraq,NULL,2016
1810,NULL,Syria,2016-12-17,NULL,2016-12-17,ICEWS25283259,"'The group also has conducted chemical weapons attacks in Iraq and Syria in defiance of the longstanding global norm against the use of these appalling weapons, and has enabled or directed terrorist attacks beyond the borders of its self-declared caliphate.'",Use conventional military force,US raises reward for IS chief al-Baghdadi from $10 million to $25 million,"(2016, 50, 3)",-10,33.5102,36.2913,12,NULL,Hindustan Times,6,Factiva,Iraq,Islamic State of Iraq and the Levant,"International Religious,Fundamentalist,Dissident,Insurgents,Muslim,Sunni,Ideological",43002910,Syria,Syria,NULL,2016
1813,Aleppo,Syria,2016-12-17,NULL,2016-12-17,ICEWS25283444,"Denouncing the 'horror' in Aleppo, Obama called for impartial observers and warned President Bashar al-Assad that he would not be able to 'slaughter his way to legitimacy'.",Threaten,Obama denounces Aleppo 'horror' as evacuation suspended,"(2016, 50, 3)",-4.4,36.2012,37.1612,12,Muhafazat Halab,Agence France-Presse,2,Factiva,United States,Barack Obama,"Government,Ideological,Executive Office,Center Left,Executive,Parties,(National) Major Party",43003119,Syria,Bashar al-Assad,"Religious Minority,Ideological,Government,Social,International Religious,National Ethnic Minority,National Religious,Shia,Far Right,Executive,Executive Office,(National) Major Party,Parties,National Ethnic",2016
1814,Cairo,Egypt,2016-12-17,NULL,2016-12-17,ICEWS25283392,"CAIRO (AP) — When a suicide bomber blew himself up in a Cairo church a week ago, it marked a bloody escalation by Egypt's jihadi militants, raising fears that an insurgency which for years largely focused on fighting in the Sinai and killing policemen may now turn to unleash attacks on civilians in the country's capital.",Carry out suicide bombing,Egypt church attack prompts fears of militant escalation,"(2016, 50, 3)",-10,30.0626,31.2497,12,Muhafazat al Qahirah,Associated Press Newswires,1,Factiva,Egypt,Armed Gang (Egypt),Unidentified Forces,43003143,Egypt,Egypt,NULL,2016
1816,Mosul,Iraq,2016-12-17,NULL,2016-12-17,ICEWS25283551,It said the Shia militia was preparing to launch the six phase of battles in this axis in Mosul.,Make statement,Shia militias purge 'liberated' areas in Mosul,"(2016, 50, 3)",0,36.335,43.1189,12,Muhafazat Ninawa,BBC Monitoring Middle East,3,Factiva,Iraq,Media (Iraq),"Social,Media",43003336,Iraq,Militia (Iraq),Unidentified Forces,2016
