,City,Country,Datetime,District,Event Date,Event ID,Event Sentence,Event Text,Headline,ISO Week,Intensity,Latitude,Longitude,Month,Province,Publisher,Sentence Number,Source,Source Country,Source Name,Source Sectors,Story ID,Target Country,Target Name,Target Sectors,Year
596,Jarabulus,Syria,2017-01-25,NULL,2017-01-25,ICEWS25402098,"Turkish forces, along with Syrian opposition forces occupied Jarabulus in northern Syria and are currently carrying out an offensive on a strategic city of Al Bab.",Use conventional military force,"IS Militants Kill 1, Injure 5 Turkish Servicemen in Northern Syria - General Staff","(2017, 4, 3)",-10,36.8175,38.0111,1,Muhafazat Halab,Unknown,5,Factiva,Turkey,Military (Turkey),"Government,Military",43310521,Syria,Syria,NULL,2017
597,NULL,Lebanon,2017-01-25,NULL,2017-01-25,ICEWS25402070,"#AQuestionForTheCommunicationsMinister trended overnight on Tuesday as Twitter users demanded answers from Jamal al-Jarrah, Minister for Telecommunications.",Demand material cooperation,The Lebanese want answers from their telecommunications minister over unfair mobile companies,"(2017, 4, 3)",-5,33.8889,35.4944,1,NULL,Al-Bawaba News,2,Factiva,Lebanon,Citizen (Lebanon),"General Population / Civilian / Social,Social",43310554,Lebanon,Ministry (Lebanon),Government,2017
598,Riyadh,Saudi Arabia,2017-01-25,NULL,2017-01-25,ICEWS25402142,"MOSCOW, January 25 (Sputnik) – Iranian Foreign Ministry spokesman Bahram Qassemi criticized on Wednesday Riyadh's airstrikes carried out against civilians in Yemen, attributing them to Saudi Arabia's frustration with the 'fruitless war.'",Criticize or denounce,Iranian Foreign Ministry Slams Saudi Arabia's Continued Attacks on Yemeni Civilians,"(2017, 4, 3)",-2,24.6877,46.7219,1,Mintaqat ar Riyad,Unknown,1,Factiva,Yemen,Media Personnel (Yemen),"Media,Social",43310732,Saudi Arabia,Saudi Arabia,NULL,2017
599,Cairo,Egypt,2017-01-25,NULL,2017-01-25,ICEWS25401974,"CAIRO, January 25 (Sputnik) - Arab League Secretary-General Ahmed Aboul Gheit on Wednesday condemned Israel's plans to continue the policy of settlement construction on the occupied territories of the West Bank and East Jerusalem, the Arab League said in a statement.",Criticize or denounce,Arab League Chief Condemns Israeli West Bank Settlement Plans - Statement,"(2017, 4, 3)",-2,30.0626,31.2497,1,Muhafazat al Qahirah,Unknown,1,Factiva,Egypt,Ahmed Aboul Gheit,"International Government Organization,Regional,Elite,Regional Diplomatic IGOs",43310734,Israel,Israel,NULL,2017
600,Mosul,Iraq,2017-01-25,NULL,2017-01-25,ICEWS25402082,"The Iraqi military seized control of eastern Mosul from Islamic State, a significant step towards retaking the entire city, as children returned to school for the first time in more than two years.",Occupy territory,Kids return to school in Mosul,"(2017, 4, 3)",-9.5,36.335,43.1189,1,Muhafazat Ninawa,The Australian,1,Factiva,Iraq,Military (Iraq),"Military,Government",43310794,Iraq,Iraq,NULL,2017
601,NULL,Egypt,2017-01-25,NULL,2017-01-25,ICEWS25402167,"Brussels, 24/01/2017 (Agence Europe) – On Tuesday 24 January, the chair of the Egyptian Parliament's foreign affairs committee, Ahmed Said, said he would like the EU and Egypt to cooperate more on terrorism and immigration.",Express intent to engage in diplomatic cooperation (such as policy support),EGYPT; Ahmed Said calls for stronger cooperation with EU on terrorism and migration,"(2017, 4, 3)",4.5,30.0626,31.2497,1,NULL,Unknown,1,Factiva,NULL,European Union,"International Government Organization,Regional,Regional Diplomatic IGOs",43310826,Egypt,Egypt,NULL,2017
602,NULL,Egypt,2017-01-25,NULL,2017-01-25,ICEWS25402168,"Brussels, 24/01/2017 (Agence Europe) – On Tuesday 24 January, the chair of the Egyptian Parliament's foreign affairs committee, Ahmed Said, said he would like the EU and Egypt to cooperate more on terrorism and immigration.",Express intent to engage in diplomatic cooperation (such as policy support),EGYPT; Ahmed Said calls for stronger cooperation with EU on terrorism and migration,"(2017, 4, 3)",4.5,30.0626,31.2497,1,NULL,Unknown,1,Factiva,Egypt,Egypt,NULL,43310826,NULL,European Union,"International Government Organization,Regional,Regional Diplomatic IGOs",2017
608,Deir ez-Zor,Syria,2017-01-25,NULL,2017-01-25,ICEWS25402251,Russian Tupolev Tu-22M3 long-range bombers have carried out group strikes on the ISIL positions in the Syrian governorate of Deir ez-Zor over the last few days.,Use unconventional violence,Russian long-range aviation strikes should ensure crucial turn in Deir ez-Zor area - State Duma defense committee deputy head,"(2017, 4, 3)",-9,35.3359,40.1408,1,Dayr az Zawr,Interfax News Service,5,Factiva,Russian Federation,Citizen (Russia),"Social,General Population / Civilian / Social",43311052,Iraq,Islamic State of Iraq and the Levant,"Insurgents,Dissident,Fundamentalist,International Religious,Muslim,Sunni,Ideological",2017
609,Deir ez-Zor,Syria,2017-01-25,NULL,2017-01-25,ICEWS25402252,Russian Tupolev Tu-22M3 long-range bombers have carried out group strikes on the ISIL positions in the Syrian governorate of Deir ez-Zor over the last few days.,Use unconventional violence,Russian long-range aviation strikes should ensure crucial turn in Deir ez-Zor area - State Duma defense committee deputy head,"(2017, 4, 3)",-9,35.3359,40.1408,1,Dayr az Zawr,Interfax News Service,5,Factiva,Russian Federation,Citizen (Russia),"Social,General Population / Civilian / Social",43311052,Syria,Governor (Syria),"Government,Provincial,Local",2017
610,Amman,Jordan,2017-01-25,NULL,2017-01-25,ICEWS25402206,"'Moscow and Amman reaffirmed their principled position in support of the SAR's sovereignty, unity and territorial integrity.",Make statement,"Russian, Jordanian foreign ministers support Syria's sovereignty, coordination in fighting terrorists (Part 2)","(2017, 4, 3)",0,31.9552,35.945,1,Muhafazat `Amman,Interfax News Service,5,Factiva,Jordan,Jordan,NULL,43311053,Russian Federation,Russia,NULL,2017
611,Mosul,Iraq,2017-01-25,NULL,2017-01-25,ICEWS25402296,The Iraqi Defense Ministry said Monday that Iraqi forces had taken full control of eastern Mosul.,Make statement,US Airstrikes Target IS Fighters Fleeing Across Tigris River in Boats - Pentagon,"(2017, 4, 3)",0,36.335,43.1189,1,Muhafazat Ninawa,Unknown,6,Factiva,Iraq,Defense / Security Ministry (Iraq),"Executive,Defense / Security Ministry,Government",43311078,Iraq,Military (Iraq),"Military,Government",2017
612,Mosul,Iraq,2017-01-25,NULL,2017-01-25,ICEWS25402297,The Iraqi Defense Ministry said Monday that Iraqi forces had taken full control of eastern Mosul.,Occupy territory,US Airstrikes Target IS Fighters Fleeing Across Tigris River in Boats - Pentagon,"(2017, 4, 3)",-9.5,36.335,43.1189,1,Muhafazat Ninawa,Unknown,6,Factiva,Iraq,Military (Iraq),"Military,Government",43311078,Iraq,Iraq,NULL,2017
613,NULL,Syria,2017-01-25,NULL,2017-01-25,ICEWS25402270,"NEW YORK (Reuters) - A federal prosecutor on Wednesday urged jurors to convict an Arizona man who she said played a vital role in helping a New York college student travel to Syria, where he died fighting for Islamic State.",Make a visit,Prosecutor urges Arizona man's conviction for Islamic State support,"(2017, 4, 3)",1.9,33.5102,36.2913,1,NULL,Reuters News,1,Factiva,United States,United States,NULL,43311136,Syria,Syria,NULL,2017
614,NULL,Syria,2017-01-25,NULL,2017-01-25,ICEWS25402271,"NEW YORK (Reuters) - A federal prosecutor on Wednesday urged jurors to convict an Arizona man who she said played a vital role in helping a New York college student travel to Syria, where he died fighting for Islamic State.",Host a visit,Prosecutor urges Arizona man's conviction for Islamic State support,"(2017, 4, 3)",2.8,33.5102,36.2913,1,NULL,Reuters News,1,Factiva,Syria,Syria,NULL,43311136,United States,United States,NULL,2017
615,Deir ez-Zor,Syria,2017-01-25,NULL,2017-01-25,ICEWS25402307,"Before that, Tu-22M3s had struck ISIL targets last Saturday, on January 21.",Use unconventional violence,"Six Russian long-range bombers strike ISIL targets in Syria's Deir ez-Zor governorate, safely return to airfields - Defense Ministry (Part 2)","(2017, 4, 3)",-9,35.3359,40.1408,1,Dayr az Zawr,Interfax News Service,5,Factiva,Russian Federation,Militant (Russia),Unidentified Forces,43311146,Iraq,Islamic State of Iraq and the Levant,"Insurgents,Dissident,Fundamentalist,International Religious,Muslim,Sunni,Ideological",2017
616,Riyadh,Saudi Arabia,2017-01-25,NULL,2017-01-25,ICEWS25402274,"During these operations, Saudi security forces have arrested 16 extremists.","Arrest, detain, or charge with legal action",Saudi Arabia and the continuing war against terror,"(2017, 4, 3)",-5,24.6877,46.7219,1,Mintaqat ar Riyad,Al Arabiya,4,Factiva,Saudi Arabia,Military Personnel - Special (Saudi Arabia),"Military,Government",43311160,Saudi Arabia,Extremist (Saudi Arabia),"Dissident,Radicals / Extremists / Fundamentalists",2017
617,NULL,Saudi Arabia,2017-01-25,NULL,2017-01-25,ICEWS25402275,The two suicide bombers who blew themselves up in a rest house in the crowded neighborhood of al-Harazat were identified and it turned out they were potentially dangerous terrorists.,Carry out suicide bombing,Saudi Arabia and the continuing war against terror,"(2017, 4, 3)",-10,24.6877,46.7219,1,NULL,Al Arabiya,6,Factiva,Saudi Arabia,Armed Gang (Saudi Arabia),Unidentified Forces,43311160,Saudi Arabia,Saudi Arabia,NULL,2017
627,NULL,Syria,2017-01-25,NULL,2017-01-25,ICEWS25402629,"One soldier was martyred and five others injured in clashes with Daesh terrorists in the al-Bab and Kabr al Mukri regions of northern Syria, the army said in a statement.",Use unconventional violence,Turkish soldier martyred in north Syria operations,"(2017, 4, 3)",-9,36.5167,40.9,1,NULL,Unknown,2,Factiva,Iraq,Terrorist (Islamic State of Iraq and the Levant),"Sunni,Fundamentalist,International Religious,Insurgents,Dissident,Muslim,Ideological",43312282,Syria,Citizen (Syria),"General Population / Civilian / Social,Social",2017
628,NULL,Syria,2017-01-25,NULL,2017-01-25,ICEWS25402641,"NEW YORK, Jan 25 (Reuters) - A federal prosecutor on Wednesday urged jurors to convict an Arizona man who she said played a vital role in helping a New York college student travel to Syria, where he died fighting for Islamic State.",Make a visit,UPDATE 1-Prosecutor urges Arizona man's conviction for Islamic State support,"(2017, 4, 3)",1.9,33.5102,36.2913,1,NULL,Reuters News,3,Factiva,United States,United States,NULL,43312299,Syria,Syria,NULL,2017
629,NULL,Syria,2017-01-25,NULL,2017-01-25,ICEWS25402642,"NEW YORK, Jan 25 (Reuters) - A federal prosecutor on Wednesday urged jurors to convict an Arizona man who she said played a vital role in helping a New York college student travel to Syria, where he died fighting for Islamic State.",Host a visit,UPDATE 1-Prosecutor urges Arizona man's conviction for Islamic State support,"(2017, 4, 3)",2.8,33.5102,36.2913,1,NULL,Reuters News,3,Factiva,Syria,Syria,NULL,43312299,United States,United States,NULL,2017
630,Aleppo,Syria,2017-01-25,NULL,2017-01-25,ICEWS25402667,"In the meantime, the Kurdish fighters in the town of Manbij in Aleppo province engaged in fierce clashes with the ISIL after the latter launched fresh attacks on their positions in the villages of Jubb Makhzoum Southwest of Manbij and Tal Houdan, killing over 14 militants and wounding tens of others.",Use unconventional violence,"Syria: Kurdish Fighters Repel ISIL's Offensives in Raqqa, Aleppo Provinces","(2017, 4, 3)",-9,36.2012,37.1612,1,Muhafazat Halab,FARS News Agency,3,Factiva,Syria,Combatant (Syria),Unidentified Forces,43312301,Syria,Citizen (Syria),"General Population / Civilian / Social,Social",2017
631,Ash Sharqat,Iraq,2017-01-25,NULL,2017-01-25,ICEWS25402692,Iraq's joint military forces also destroyed a suicide vehicle of the terrorists and killed a large number of militants.,Use conventional military force,Iraq's Nujaba Hunts ISIL Terrorists along Mosul-Tikrit Road with Kornet Missiles,"(2017, 4, 3)",-10,35.486,43.2408,1,Muhafazat Salah ad Din,FARS News Agency,4,Factiva,Iraq,Military (Iraq),"Military,Government",43312302,Iraq,Militant (Iraq),Unidentified Forces,2017
632,Damascus,Syria,2017-01-25,NULL,2017-01-25,ICEWS25402681,"According to the Arab daily, tens of families of terrorists have also been sheltered in the refugee camps under the Syrian government's supervision and are treated like other people which is the reason why many militants surrender their weapons to the government and join peace.",Demobilize armed forces,Number of Syrian People in Refugee Camps Reduces after Security Returns to Damascus,"(2017, 4, 3)",9,33.5102,36.2913,1,Dimashq,FARS News Agency,5,Factiva,Syria,Militant (Syria),Unidentified Forces,43312303,Syria,Government (Syria),Government,2017
633,Mosul,Iraq,2017-01-25,NULL,2017-01-25,ICEWS25402680,The United Nations also said it is 'racing against the clock' to prepare emergency aid for hundreds of thousands of endangered civilians in Mosul as the Iraqi army began offensive to oust ISIL from the Western half of the city.,Reduce relations,Iraqi Forces Target ISIL Positions in Western Mosul,"(2017, 4, 3)",-4,36.335,43.1189,1,Muhafazat Ninawa,FARS News Agency,4,Factiva,Iraq,Iraq,NULL,43312304,Iraq,Islamic State of Iraq and the Levant,"Sunni,Fundamentalist,International Religious,Insurgents,Dissident,Muslim,Ideological",2017
634,Homs,Syria,2017-01-25,NULL,2017-01-25,ICEWS25402622,"TEHRAN (FNA)- The Syrian army continued its advances in the Eastern part of Homs province to maintain security at T4 airbase, and seized back a strategic region from the ISIL.",Occupy territory,Homs: Syrian Army Wins Back Strategic Region Near T4 Airbase,"(2017, 4, 3)",-9.5,34.7268,36.7234,1,Muhafazat Hims,FARS News Agency,1,Factiva,Syria,Military (Syria),"Military,Government",43312307,Syria,Syria,NULL,2017
635,Homs,Syria,2017-01-25,NULL,2017-01-25,ICEWS25402620,At least 20 ISIL terrorists were killed and many others were injured in tough battle with the Syrian army and popular forces while several others retreated from the battlefield to areas under their control.,Use conventional military force,Homs: Syrian Army Wins Back Strategic Region Near T4 Airbase,"(2017, 4, 3)",-10,34.7268,36.7234,1,Muhafazat Hims,FARS News Agency,3,Factiva,Syria,Military (Syria),"Military,Government",43312307,Syria,Citizen (Syria),"General Population / Civilian / Social,Social",2017
636,Tadmur,Syria,2017-01-25,NULL,2017-01-25,ICEWS25402621,"The Syrian army soldiers targeted ISIL's defense lines near the T4 airbase, East of the Fourth Station, Ba'ar al-Fawa'ereh region and a region near Jahar crossroad in the countryside of the ancient city of Palmyra (Tadmur), killing or wounding a number of terrorists and destroying their vehicles.",Use conventional military force,Homs: Syrian Army Wins Back Strategic Region Near T4 Airbase,"(2017, 4, 3)",-10,34.5608,38.2805,1,Muhafazat Hims,FARS News Agency,5,Factiva,Syria,Military (Syria),"Military,Government",43312307,Syria,Terrorist (Syria),"Dissident,Rebel",2017
637,Aleppo,Syria,2017-01-25,NULL,2017-01-25,ICEWS25402619,Informed sources disclosed earlier today that several commanders of al-Nusra Front have cut off ties with the group that has been attacking other rival militants in the provinces of Idlib and Aleppo in the last several days.,Use conventional military force,Infighting Intensifies: Al-Nusra Front Ends Presence of Jeish al-Mujahedeen in Lattakia,"(2017, 4, 3)",-10,36.2012,37.1612,1,Muhafazat Halab,FARS News Agency,5,Factiva,Syria,Jabhat al-Nusra,"Dissident,Radicals / Extremists / Fundamentalists",43312308,Syria,Militant (Syria),Unidentified Forces,2017
638,Manbij,Syria,2017-01-25,NULL,2017-01-25,ICEWS25402567,"TEHRAN (FNA)- The ISIL's emir in the city of Manbij in Northern Syria has surrendered himself to the predominantly Kurdish Syrian Democratic Forces (SDF), battlefield sources said on Wednesday.",Yield,ISIL's Bahraini Emir Surrenders to Kurdish Fighters,"(2017, 4, 3)",5,36.5281,37.9549,1,Muhafazat Halab,FARS News Agency,1,Factiva,Syria,Head of Government (Syria),"Executive Office,Government,Executive",43312309,Syria,Syrian Kurds,"Kurd (Ethnic Group),National Ethnic,International Ethnic,Social,National Ethnic Minority",2017
639,Manbij,Syria,2017-01-25,NULL,2017-01-25,ICEWS25402568,"'Abu Abdollah, the ISIL's Bahraini emir of Manbij city, is now in SDF's custody after he surrendered to the Kurdish fighters in the town of al-Khafaseh to the South of Manbij city,' a battlefield source said.",Retreat or surrender militarily,ISIL's Bahraini Emir Surrenders to Kurdish Fighters,"(2017, 4, 3)",10,36.5281,37.9549,1,Muhafazat Halab,FARS News Agency,2,Factiva,Bahrain,Head of Government (Bahrain),"Executive,Executive Office,Government",43312309,Syria,Combatant (Syrian Kurds),"Kurd (Ethnic Group),National Ethnic,International Ethnic,Social,National Ethnic Minority",2017
640,Manbij,Syria,2017-01-25,NULL,2017-01-25,ICEWS25402569,"'Abu Abdollah, the ISIL's Bahraini emir of Manbij city, is now in SDF's custody after he surrendered to the Kurdish fighters in the town of al-Khafaseh to the South of Manbij city,' a battlefield source said.",Retreat or surrender militarily,ISIL's Bahraini Emir Surrenders to Kurdish Fighters,"(2017, 4, 3)",10,36.5281,37.9549,1,Muhafazat Halab,FARS News Agency,2,Factiva,Bahrain,Head of Government (Bahrain),"Executive,Executive Office,Government",43312309,Syria,Syria,NULL,2017
641,Manbij,Syria,2017-01-25,NULL,2017-01-25,ICEWS25402570,Abu Aisha with Turkish nationality alongside four more ISIL members were killed in fierce clashes with the SDF fighters near al-Daleh square.,Use unconventional violence,ISIL's Bahraini Emir Surrenders to Kurdish Fighters,"(2017, 4, 3)",-9,36.5281,37.9549,1,Muhafazat Halab,FARS News Agency,5,Factiva,Syria,Combatant (Syrian Kurds),"Kurd (Ethnic Group),National Ethnic,International Ethnic,Social,National Ethnic Minority",43312309,Somalia,Fazul Abdullah Mohammed,"Sunni,Dissident,International Radicals / Extremists / Fundamentalists,International Religious,Insurgents,Muslim,International Dissident,International Insurgents",2017
642,Riyadh,Saudi Arabia,2017-01-25,NULL,2017-01-25,ICEWS25402654,"In recent remarks, Jubeir said that Saudi Arabia will work with the US President Donald Trump administration to contain Iran while strengthening ties with the US.",Express intent to engage in diplomatic cooperation (such as policy support),EC Secretary Slams Saudi FM's Remarks against Iran,"(2017, 4, 3)",4.5,24.6877,46.7219,1,Mintaqat ar Riyad,FARS News Agency,2,Factiva,Saudi Arabia,Saudi Arabia,NULL,43312316,United States,Donald Trump,"Executive Office,Executive,Government",2017
643,Riyadh,Saudi Arabia,2017-01-25,NULL,2017-01-25,ICEWS25402655,"In recent remarks, Jubeir said that Saudi Arabia will work with the US President Donald Trump administration to contain Iran while strengthening ties with the US.",Engage in diplomatic cooperation,EC Secretary Slams Saudi FM's Remarks against Iran,"(2017, 4, 3)",3.5,24.6877,46.7219,1,Mintaqat ar Riyad,FARS News Agency,2,Factiva,Saudi Arabia,Saudi Arabia,NULL,43312316,United States,United States,NULL,2017
644,NULL,Bahrain,2017-01-25,NULL,2017-01-25,ICEWS25402598,His Excellency Interior Minister Lt-General Shaikh Rashid bin Abdullah Al Khalifa received His Excellency Tunisian Interior Minister Hdi Majdoub and his accompanying delegation on Tuesday as part of his official visit to Bahrain.,Make a visit,Bahrain : HE Interior Minister praises strong Tunisia ties,"(2017, 4, 3)",1.9,26.2154,50.5832,1,NULL,FARS News Agency,1,Factiva,Tunisia,Domestic Affairs (Tunisia),"Interior / Home Ministry,Government,Executive",43312328,Bahrain,Bahrain,NULL,2017
645,NULL,Bahrain,2017-01-25,NULL,2017-01-25,ICEWS25402600,His Excellency Interior Minister Lt-General Shaikh Rashid bin Abdullah Al Khalifa received His Excellency Tunisian Interior Minister Hdi Majdoub and his accompanying delegation on Tuesday as part of his official visit to Bahrain.,Host a visit,Bahrain : HE Interior Minister praises strong Tunisia ties,"(2017, 4, 3)",2.8,26.2154,50.5832,1,NULL,FARS News Agency,1,Factiva,Bahrain,Bahrain,NULL,43312328,Tunisia,Domestic Affairs (Tunisia),"Interior / Home Ministry,Government,Executive",2017
646,NULL,Bahrain,2017-01-25,NULL,2017-01-25,ICEWS25402599,HE the Interior Minister said the visit was an opportunity to prepare a framework to activate the security cooperation agreement between the two countries signed during the Tunisian Presidents visit to Bahrain on 27 January 2016.,Make a visit,Bahrain : HE Interior Minister praises strong Tunisia ties,"(2017, 4, 3)",1.9,26.2154,50.5832,1,NULL,FARS News Agency,5,Factiva,Tunisia,Tunisia,NULL,43312328,Bahrain,Bahrain,NULL,2017
647,NULL,Bahrain,2017-01-25,NULL,2017-01-25,ICEWS25402601,HE the Interior Minister said the visit was an opportunity to prepare a framework to activate the security cooperation agreement between the two countries signed during the Tunisian Presidents visit to Bahrain on 27 January 2016.,Host a visit,Bahrain : HE Interior Minister praises strong Tunisia ties,"(2017, 4, 3)",2.8,26.2154,50.5832,1,NULL,FARS News Agency,5,Factiva,Bahrain,Bahrain,NULL,43312328,Tunisia,Tunisia,NULL,2017
651,NULL,Syria,2017-01-25,NULL,2017-01-25,ICEWS25402768,"WASHINGTON, January 26 (Sputnik) - US Congresswoman Tulsi Gabbard said in an interview that she met with Syrian President Bashar Assad during her visit to Syria in January.",Make a visit,US Congresswoman Gabbard Says She Met President Assad During January Trip to Syria,"(2017, 4, 3)",1.9,33.5102,36.2913,1,NULL,Unknown,1,Factiva,United States,Tulsi Gabbard,"Legislative / Parliamentary,Government",43312497,Syria,Syria,NULL,2017
652,NULL,Syria,2017-01-25,NULL,2017-01-25,ICEWS25402771,"WASHINGTON, January 26 (Sputnik) - US Congresswoman Tulsi Gabbard said in an interview that she met with Syrian President Bashar Assad during her visit to Syria in January.",Host a visit,US Congresswoman Gabbard Says She Met President Assad During January Trip to Syria,"(2017, 4, 3)",2.8,33.5102,36.2913,1,NULL,Unknown,1,Factiva,Syria,Syria,NULL,43312497,United States,Tulsi Gabbard,"Legislative / Parliamentary,Government",2017
653,NULL,Bahrain,2017-01-25,NULL,2017-01-25,ICEWS25402706,Hundreds of Bahraini citizens took to the streets to protest against the planned execution,Demonstrate or rally,Kuwaiti Prince Hanged for Killing Fellow Prince,"(2017, 4, 3)",-6.5,26.2154,50.5832,1,NULL,Unknown,1,Factiva,Bahrain,Citizen (Bahrain),"General Population / Civilian / Social,Social",43312558,NULL,Unspecified Actor,Unspecified,2017
654,Aleppo,Syria,2017-01-25,NULL,2017-01-25,ICEWS25402852,The US congresswoman who made a recent secret trip to war-torn Syria said Wednesday she met there with President Bashar al-Assad as part of her effort to end the years-long conflict.,Consult,US lawmaker says she met Assad on secret Syria trip,"(2017, 4, 3)",1,36.2012,37.1612,1,Muhafazat Halab,Agence France-Presse,1,Factiva,United States,Congress (United States),"Legislative / Parliamentary,Government",43312790,Syria,Bashar al-Assad,"Religious Minority,Social,Parties,(National) Major Party,National Ethnic Minority,National Religious,International Religious,Ideological,Executive,Executive Office,National Ethnic,Far Right,Government,Shia",2017
655,Aleppo,Syria,2017-01-25,NULL,2017-01-25,ICEWS25402854,The US congresswoman who made a recent secret trip to war-torn Syria said Wednesday she met there with President Bashar al-Assad as part of her effort to end the years-long conflict.,Make a visit,US lawmaker says she met Assad on secret Syria trip,"(2017, 4, 3)",1.9,36.2012,37.1612,1,Muhafazat Halab,Agence France-Presse,1,Factiva,United States,Congress (United States),"Legislative / Parliamentary,Government",43312790,Syria,Syria,NULL,2017
656,Aleppo,Syria,2017-01-25,NULL,2017-01-25,ICEWS25402856,The US congresswoman who made a recent secret trip to war-torn Syria said Wednesday she met there with President Bashar al-Assad as part of her effort to end the years-long conflict.,Consult,US lawmaker says she met Assad on secret Syria trip,"(2017, 4, 3)",1,36.2012,37.1612,1,Muhafazat Halab,Agence France-Presse,1,Factiva,Syria,Bashar al-Assad,"Religious Minority,Social,Parties,(National) Major Party,National Ethnic Minority,National Religious,International Religious,Ideological,Executive,Executive Office,National Ethnic,Far Right,Government,Shia",43312790,United States,Congress (United States),"Legislative / Parliamentary,Government",2017
657,Aleppo,Syria,2017-01-25,NULL,2017-01-25,ICEWS25402858,The US congresswoman who made a recent secret trip to war-torn Syria said Wednesday she met there with President Bashar al-Assad as part of her effort to end the years-long conflict.,Host a visit,US lawmaker says she met Assad on secret Syria trip,"(2017, 4, 3)",2.8,36.2012,37.1612,1,Muhafazat Halab,Agence France-Presse,1,Factiva,Syria,Syria,NULL,43312790,United States,Congress (United States),"Legislative / Parliamentary,Government",2017
658,Damascus,Syria,2017-01-25,NULL,2017-01-25,ICEWS25402853,"House Democrat Tulsi Gabbard this month traveled to Damascus and the decimated city of Aleppo on a fact-finding mission, where she met with refugees, Syrian opposition leaders and relatives of fighters on both sides of the divide, in addition to Assad.",Consult,US lawmaker says she met Assad on secret Syria trip,"(2017, 4, 3)",1,33.5102,36.2913,1,Dimashq,Agence France-Presse,2,Factiva,United States,Congress (United States),"Legislative / Parliamentary,Government",43312790,Syria,Syria,NULL,2017
