,City,Country,Datetime,District,Event Date,Event ID,Event Sentence,Event Text,Headline,ISO Week,Intensity,Latitude,Longitude,Month,Province,Publisher,Sentence Number,Source,Source Country,Source Name,Source Sectors,Story ID,Target Country,Target Name,Target Sectors,Year
525,NULL,Egypt,2016-02-09,NULL,2016-02-09,ICEWS24146438,"The spokesman also expressed his complete rejection of the statements made in the letter regarding arbitrary arrests, torture and disappearances in Egypt, which completely distorted the situation on the ground and constitute generalizations based on hearsay and intentional distortions by those striving to regain a foothold in Egypt after being rejected by the people.",Reject,Egypt says premature to judge results Italian student's death probe,"(2016, 6, 3)",-4,30.0626,31.2497,2,NULL,BBC Monitoring Newsfile,6,Factiva,Egypt,Citizen (Egypt),"Social,General Population / Civilian / Social",40295428,Egypt,Media Personnel (Egypt),"Media,Social",2016
526,As Saqlawiyah,Iraq,2016-02-09,NULL,2016-02-09,ICEWS24146445,"Separately, 12 IS militants were killed by the army artillery and helicopter gunships bombarded IS positions in Saqlawiyah area, just north of the IS-held city of Fallujah, about 50 km west of Baghdad, the source said.",fight with artillery and tanks,"34 IS militants killed in air strikes, shelling in Iraq","(2016, 6, 3)",-10,33.3964,43.6833,2,Muhafazat al Anbar,Xinhua News Agency,3,Factiva,Iraq,Military (Iraq),"Military,Government",40295440,Iraq,Militant (Iraq),Unidentified Forces,2016
527,Ramadi,Iraq,2016-02-09,NULL,2016-02-09,ICEWS24146443,"In earlier report on Tuesday, the Iraqi military said in a statement that the security forces recaptured the eastern part of the provincial capital city of Ramadi, which located some 110 km west of Baghdad.",Make statement,"34 IS militants killed in air strikes, shelling in Iraq","(2016, 6, 3)",0,33.4206,43.3078,2,Muhafazat al Anbar,Xinhua News Agency,5,Factiva,Iraq,Military (Iraq),"Military,Government",40295440,Iraq,Military Personnel - Special (Iraq),"Military,Government",2016
528,Ramadi,Iraq,2016-02-09,NULL,2016-02-09,ICEWS24146444,"In earlier report on Tuesday, the Iraqi military said in a statement that the security forces recaptured the eastern part of the provincial capital city of Ramadi, which located some 110 km west of Baghdad.",Occupy territory,"34 IS militants killed in air strikes, shelling in Iraq","(2016, 6, 3)",-9.5,33.4206,43.3078,2,Muhafazat al Anbar,Xinhua News Agency,5,Factiva,Iraq,Military Personnel - Special (Iraq),"Military,Government",40295440,Iraq,Iraq,NULL,2016
529,Aleppo,Syria,2016-02-09,NULL,2016-02-09,ICEWS24146403,* Syrian army is backed by Russia and Hezbollah,Cooperate militarily,EXCLUSIVE-INTERVIEW-Damascus vows to recapture Aleppo from rebels,"(2016, 6, 3)",7.4,36.2012,37.1612,2,Muhafazat Halab,Reuters News,2,Factiva,Russian Federation,Russia,NULL,40295456,Syria,Military (Syria),"Military,Government",2016
530,Aleppo,Syria,2016-02-09,NULL,2016-02-09,ICEWS24146404,* Syrian army is backed by Russia and Hezbollah,Cooperate militarily,EXCLUSIVE-INTERVIEW-Damascus vows to recapture Aleppo from rebels,"(2016, 6, 3)",7.4,36.2012,37.1612,2,Muhafazat Halab,Reuters News,2,Factiva,Lebanon,Hezbollah,"(National) Minor Party,Social,Shia,National Religious,Ideological,Parties,Far Left,Organized Violent,International Religious,Dissident",40295456,Syria,Military (Syria),"Military,Government",2016
531,Aleppo,Syria,2016-02-09,NULL,2016-02-09,ICEWS24146379,"The Syrian army, backed by Russian air strikes and Iranian and Lebanese Hezbollah fighters, has launched a major advance in recent weeks near Aleppo, once Syria's biggest city, now divided between rebel- and government-held sectors.",Cooperate militarily,Exclusive - Damascus vows to recapture Aleppo from rebels,"(2016, 6, 3)",7.4,36.2012,37.1612,2,Muhafazat Halab,Channel NewsAsia,3,Factiva,Iran,Iran,NULL,40295475,Syria,Military (Syria),"Military,Government",2016
532,Aleppo,Syria,2016-02-09,NULL,2016-02-09,ICEWS24146380,"The Syrian army, backed by Russian air strikes and Iranian and Lebanese Hezbollah fighters, has launched a major advance in recent weeks near Aleppo, once Syria's biggest city, now divided between rebel- and government-held sectors.",Cooperate militarily,Exclusive - Damascus vows to recapture Aleppo from rebels,"(2016, 6, 3)",7.4,36.2012,37.1612,2,Muhafazat Halab,Channel NewsAsia,3,Factiva,Lebanon,Combatant (Hezbollah),"(National) Minor Party,Social,Shia,National Religious,Ideological,Parties,Far Left,Organized Violent,International Religious,Dissident",40295475,Syria,Military (Syria),"Military,Government",2016
533,Aleppo,Syria,2016-02-09,NULL,2016-02-09,ICEWS24146446,"Syrian government forces, backed by Russian air strikes and Iranian and Lebanese Hezbollah fighters, have launched a major offensive in the countryside around Aleppo, which has been divided between government and rebel control for years.",Cooperate militarily,UN fears for cut-off Syrians,"(2016, 6, 3)",7.4,36.2012,37.1612,2,Muhafazat Halab,AAP Bulletins,2,Factiva,Iran,Iran,NULL,40295508,Syria,Military (Syria),"Military,Government",2016
534,Aleppo,Syria,2016-02-09,NULL,2016-02-09,ICEWS24146447,"Syrian government forces, backed by Russian air strikes and Iranian and Lebanese Hezbollah fighters, have launched a major offensive in the countryside around Aleppo, which has been divided between government and rebel control for years.",Cooperate militarily,UN fears for cut-off Syrians,"(2016, 6, 3)",7.4,36.2012,37.1612,2,Muhafazat Halab,AAP Bulletins,2,Factiva,Lebanon,Combatant (Hezbollah),"(National) Minor Party,Social,Shia,National Religious,Ideological,Parties,Far Left,Organized Violent,International Religious,Dissident",40295508,Syria,Military (Syria),"Military,Government",2016
535,Aleppo,Syria,2016-02-09,NULL,2016-02-09,ICEWS24146448,"Syrian government forces, backed by Russian air strikes and Iranian and Lebanese Hezbollah fighters, have launched a major offensive in the countryside around Aleppo, which has been divided between government and rebel control for years.",Use conventional military force,UN fears for cut-off Syrians,"(2016, 6, 3)",-10,36.2012,37.1612,2,Muhafazat Halab,AAP Bulletins,2,Factiva,Syria,Military (Syria),"Military,Government",40295508,Syria,Syria,NULL,2016
544,NULL,Syria,2016-02-09,NULL,2016-02-09,ICEWS24146489,The United Nations is also urging Turkey to open its borders to allow fleeing Syrians to cross into safe territory and to send aid supplies to the displaced.,Make an appeal or request,Stop bombing Syria's Aleppo: UN aid chief,"(2016, 6, 3)",3,35.7667,36.6667,2,Idlib,Agence France-Presse,6,Factiva,NULL,United Nations,"Global Diplomatic IGOs,International Government Organization,Global",40295661,Turkey,Turkey,NULL,2016
545,Doha,Qatar,2016-02-09,NULL,2016-02-09,ICEWS24146487,The delegations of the Palestinian groups Fatah and Hamas met in Doha on February 7-8.,Consult,Moscow welcomes agreements on ending intra-Palestinian split - Russian foreign ministry,"(2016, 6, 3)",1,25.2793,51.5224,2,Baladiyat ad Dawhah,ITAR Tass,2,Factiva,Occupied Palestinian Territory,Fatah,"Parties,Center Left,Ideological,(National) Major Party,Dissident",40295693,Occupied Palestinian Territory,Hamas,"International Religious,(National) Major Party,Nongovernmental Organization (International),Muslim,Parties,Dissident",2016
546,Doha,Qatar,2016-02-09,NULL,2016-02-09,ICEWS24146488,The delegations of the Palestinian groups Fatah and Hamas met in Doha on February 7-8.,Consult,Moscow welcomes agreements on ending intra-Palestinian split - Russian foreign ministry,"(2016, 6, 3)",1,25.2793,51.5224,2,Baladiyat ad Dawhah,ITAR Tass,2,Factiva,Occupied Palestinian Territory,Hamas,"International Religious,(National) Major Party,Nongovernmental Organization (International),Muslim,Parties,Dissident",40295693,Occupied Palestinian Territory,Fatah,"Parties,Center Left,Ideological,(National) Major Party,Dissident",2016
553,NULL,Iraq,2016-02-09,NULL,2016-02-09,ICEWS24146714,Attempts to change the status quo will likely be met by resistance from politicians and their supporters who have a stake in the continuation of the current state of affairs.,Express intent to meet or negotiate,Iraq PM calls for 'fundamental' change to cabinet,"(2016, 6, 3)",4,33.3406,44.4009,2,NULL,Agence France-Presse,5,Factiva,Iraq,Party Member (Iraq),Parties,40295831,Iraq,Citizen (Iraq),"Social,General Population / Civilian / Social",2016
554,NULL,Iraq,2016-02-09,NULL,2016-02-09,ICEWS24146715,Attempts to change the status quo will likely be met by resistance from politicians and their supporters who have a stake in the continuation of the current state of affairs.,Express intent to meet or negotiate,Iraq PM calls for 'fundamental' change to cabinet,"(2016, 6, 3)",4,33.3406,44.4009,2,NULL,Agence France-Presse,5,Factiva,Iraq,Citizen (Iraq),"Social,General Population / Civilian / Social",40295831,Iraq,Party Member (Iraq),Parties,2016
556,Baghdad,Iraq,2016-02-09,NULL,2016-02-09,ICEWS24146798,"BAGHDAD, Feb. 9 (Xinhua) -- Iraqi Prime Minister Haider al-Abadi on Tuesday called on the parliament and the leading political blocs to help carrying out substantial reshuffle in his cabinet to confront the country's economic crisis due to the sharp decrease in oil prices in the world markets.",Make an appeal or request,Iraqi PM urges political blocs to help carrying out substantial reshuffle in his cabinet,"(2016, 6, 3)",3,33.3406,44.4009,2,Muhafazat Baghdad,Xinhua News Agency,1,Factiva,Iraq,Haider Al-Abadi,"Fundamentalist,International Religious,Parties,(National) Major Party,Lower House,Executive Office,Ideological,Muslim,Executive,Legislative / Parliamentary,Shia,Government",40296250,Iraq,Legislature (Iraq),"Government,Legislative / Parliamentary",2016
557,Baghdad,Iraq,2016-02-09,NULL,2016-02-09,ICEWS24146797,Abadi said that his government has managed to avoid full economic collapse due to the sharp decline of oil prices during the past year and a half.,Make statement,Iraqi PM urges political blocs to help carrying out substantial reshuffle in his cabinet,"(2016, 6, 3)",0,33.3406,44.4009,2,Muhafazat Baghdad,Xinhua News Agency,3,Factiva,Iraq,Haider Al-Abadi,"Fundamentalist,International Religious,Parties,(National) Major Party,Lower House,Executive Office,Ideological,Muslim,Executive,Legislative / Parliamentary,Shia,Government",40296250,Iraq,Government (Iraq),Government,2016
558,Damascus,Syria,2016-02-09,NULL,2016-02-09,ICEWS24146761,"According to the sources on the ground, Syrian soldiers conducted fierce offensives on militants' positions in Tal al-sawwan town in Eastern Ghouta in Damascus province, leaving several militants dead or injured.",Use conventional military force,Syrian Soldiers Hit Militants Positions across Ghouta,"(2016, 6, 3)",-10,33.5102,36.2913,2,Dimashq,FARS News Agency,2,Factiva,Syria,Military (Syria),"Military,Government",40296370,Syria,Militant (Jabhat al-Nusra),"Radicals / Extremists / Fundamentalists,Dissident",2016
559,Damascus,Syria,2016-02-09,NULL,2016-02-09,ICEWS24146762,"In a separate attack in Western Ghouta in the surrounding areas of Khan Sheikh Palestinian refugee camp, dozens of armed militants were killed by the Syrian army soldiers, the sources added.",Use conventional military force,Syrian Soldiers Hit Militants Positions across Ghouta,"(2016, 6, 3)",-10,33.5102,36.2913,2,Dimashq,FARS News Agency,3,Factiva,Syria,Military (Syria),"Military,Government",40296370,Syria,Militant (Jabhat al-Nusra),"Radicals / Extremists / Fundamentalists,Dissident",2016
560,Homs,Syria,2016-02-09,NULL,2016-02-09,ICEWS24146801,TEHRAN (FNA)- The Syrian army clashed with ISIL militants on the outskirts of Qauryatayn town Southeast of Homs province on Tuesday.,Use conventional military force,Homs: ISIL Sustains Heavy Losses in Tough Battle with Syrian Army,"(2016, 6, 3)",-10,34.7268,36.7234,2,Muhafazat Hims,FARS News Agency,1,Factiva,Syria,Military (Syria),"Military,Government",40296375,Syria,Militant (Syria),Unidentified Forces,2016
561,Homs,Syria,2016-02-09,NULL,2016-02-09,ICEWS24146802,TEHRAN (FNA)- The Syrian army clashed with ISIL militants on the outskirts of Qauryatayn town Southeast of Homs province on Tuesday.,Use unconventional violence,Homs: ISIL Sustains Heavy Losses in Tough Battle with Syrian Army,"(2016, 6, 3)",-9,34.7268,36.7234,2,Muhafazat Hims,FARS News Agency,1,Factiva,Syria,Militant (Syria),Unidentified Forces,40296375,Syria,Military (Syria),"Military,Government",2016
562,Homs,Syria,2016-02-09,NULL,2016-02-09,ICEWS24146803,Scores of militants were killed and injured in fierce clashes with the Syrian troops near Qauryatayn.,Use conventional military force,Homs: ISIL Sustains Heavy Losses in Tough Battle with Syrian Army,"(2016, 6, 3)",-10,34.7268,36.7234,2,Muhafazat Hims,FARS News Agency,2,Factiva,Syria,Military (Syria),"Military,Government",40296375,Syria,Militant (Syria),Unidentified Forces,2016
563,Homs,Syria,2016-02-09,NULL,2016-02-09,ICEWS24146804,"Meantime, the Syrian air force pounded the military positions and gathering centers of the terrorists in Tir Ma'ala and al-Ghajar towns in the Northern parts of Homs province, inflicting heavy losses on them.",Use conventional military force,Homs: ISIL Sustains Heavy Losses in Tough Battle with Syrian Army,"(2016, 6, 3)",-10,34.7268,36.7234,2,Muhafazat Hims,FARS News Agency,3,Factiva,Syria,Air Force (Syria),"Military,Air Force,Government",40296375,Syria,Syria,NULL,2016
564,Tallbisah,Syria,2016-02-09,NULL,2016-02-09,ICEWS24146805,"Also in Northern Homs, the Syrian army killed and injured a large number of terrorists in tough battle with them in the outskirts of Talbiseh town.",Use conventional military force,Homs: ISIL Sustains Heavy Losses in Tough Battle with Syrian Army,"(2016, 6, 3)",-10,34.8406,36.7309,2,Muhafazat Hims,FARS News Agency,4,Factiva,Syria,Military (Syria),"Military,Government",40296375,Syria,Terrorist (Syria),"Dissident,Rebel",2016
565,Homs,Syria,2016-02-09,NULL,2016-02-09,ICEWS24146806,"The Syrian army alongside the National Defense Forces (NDF) and the Syrian Social Nationalist Party (SSNP) stormed the ISIL concentration centers and imposed full control over the Heights of 901, 903, 912 near the small hilltop village of Tar al-Kharoubah in the surroundings of the ancient Assyria town of Quaryatayn.",Use conventional military force,Homs: ISIL Sustains Heavy Losses in Tough Battle with Syrian Army,"(2016, 6, 3)",-10,34.7268,36.7234,2,Muhafazat Hims,FARS News Agency,6,Factiva,Lebanon,Syrian Social Nationalist Party,"Parties,(National) Minor Party",40296375,Syria,Military (Syria),"Military,Government",2016
566,Riyadh,Saudi Arabia,2016-02-09,NULL,2016-02-09,ICEWS24146796,"Iranian Armed Forces' Chief of Staff Major General Hassan Firouzabadi slammed the US for backing Saudi Arabia's malicious” activities, amid Riyadh's announcement of its preparedness to send ground forces to Syria.",Praise or endorse,Iran: Saudi Willingness to Invade Syria Reflects US Failure,"(2016, 6, 3)",3.4,24.6877,46.7219,2,Mintaqat ar Riyad,FARS News Agency,2,Factiva,United States,United States,NULL,40296377,Saudi Arabia,Saudi Arabia,NULL,2016
567,NULL,Syria,2016-02-09,NULL,2016-02-09,ICEWS24146913,The report details [press release] that thousands of detainees held by the Syrian government have been beaten or have died as a result of injuries sustained due to torture.,"Arrest, detain, or charge with legal action",UN rights office: Syria systematically exterminating detainees,"(2016, 6, 3)",-5,33.5102,36.2913,2,NULL,FARS News Agency,2,Factiva,Syria,Syria,NULL,40296635,Syria,Detainee (Syria),"Protestors / Popular Opposition / Mobs,Dissident",2016
570,NULL,Iraq,2016-02-09,NULL,2016-02-09,ICEWS24146992,"When Harper announced his decision to commit six CF-18s and 69 advisers on the ground in northern Iraq, he told the House of Commons three times in one speech that the advisers were engaged in a “non-combat” role.",Make statement,Let's call our anti-ISIS mission what it is: Tim Harper,"(2016, 6, 3)",0,37,43.25,2,NULL,The Toronto Star,5,Factiva,Canada,Stephen Harper,"Executive Office,Government,Executive,Parties,(National) Major Party,Elite,Legislative / Parliamentary,Lower House,Center Right,Ideological",40296846,Canada,Justin Trudeau,"Executive Office,Government,Executive,Parties,(National) Major Party,Ideological,Center Left",2016
571,Damascus,Syria,2016-02-09,NULL,2016-02-09,ICEWS24146931,"apos;aposUN investigators accused Damascus of 'extermination' in its jails and detention centres, saying prisoners were executed, tortured to death or held in such horrific conditions that they perished.",Accuse, New Briefs head;UN probe accuses Syrian govt of,"(2016, 6, 3)",-2,33.5102,36.2913,2,Dimashq,The Nation (Thailand),2,Factiva,Syria,Police (Syria),"Government,Police",40296848,Syria,Syria,NULL,2016
572,Aleppo,Syria,2016-02-09,NULL,2016-02-09,ICEWS24147006,"German Chancellor Angela Merkel says she is “horrified” by the impact that Russia’s relentless airstrikes on Aleppo, Syria’s largest city, are having on civilians.",Employ aerial weapons,Why the West is standing by amid Russia's campaign in Syria,"(2016, 6, 3)",-10,36.2012,37.1612,2,Muhafazat Halab,The Christian Science Monitor,1,Factiva,Russian Federation,Russia,NULL,40296869,Syria,Syria,NULL,2016
573,Aleppo,Syria,2016-02-09,NULL,2016-02-09,ICEWS24147004,"And as Russia’s bombing campaign has killed hundreds and sent a fresh wave of tens of thousands of civilians north to the border with Turkey, Secretary of State John Kerry has exhorted Russia to heed a United Nations Security Council resolution from December, calling on combatants in Syria to spare civilian populations.",Make an appeal or request,Why the West is standing by amid Russia's campaign in Syria,"(2016, 6, 3)",3,36.2012,37.1612,2,Muhafazat Halab,The Christian Science Monitor,2,Factiva,United States,John Kerry,"Upper House,Executive,Legislative / Parliamentary,Government,Ideological,Center Left,Cabinet,(National) Major Party,Foreign Ministry,Parties",40296869,Russian Federation,Russia,NULL,2016
574,Aleppo,Syria,2016-02-09,NULL,2016-02-09,ICEWS24147005,"And as Russia’s bombing campaign has killed hundreds and sent a fresh wave of tens of thousands of civilians north to the border with Turkey, Secretary of State John Kerry has exhorted Russia to heed a United Nations Security Council resolution from December, calling on combatants in Syria to spare civilian populations.",Make an appeal or request,Why the West is standing by amid Russia's campaign in Syria,"(2016, 6, 3)",3,36.2012,37.1612,2,Muhafazat Halab,The Christian Science Monitor,2,Factiva,Russian Federation,Russia,NULL,40296869,Syria,Combatant (Syria),Unidentified Forces,2016
581,Aleppo,Syria,2016-02-09,NULL,2016-02-09,ICEWS24147311,"The United Nations urged Turkey to let in tens of thousands of Syrians fleeing a regime offensive around Aleppo on Tuesday, adding to calls for Russia to end air strikes ahead of fresh peace efforts.",Make an appeal or request,"UN urges Turkey to open borders, end to bombing of Aleppo","(2016, 6, 3)",3,36.2012,37.1612,2,Muhafazat Halab,Agence France-Presse,1,Factiva,NULL,United Nations,"Global Diplomatic IGOs,International Government Organization,Global",40297334,Turkey,Turkey,NULL,2016
582,Aleppo,Syria,2016-02-09,NULL,2016-02-09,ICEWS24147312,UN refugee agency (UNHCR) spokesman William Spindler urged Turkey to open its border to 'all civilians from Syria who are fleeing danger and seeking international protection'.,Make an appeal or request,"UN urges Turkey to open borders, end to bombing of Aleppo","(2016, 6, 3)",3,36.2012,37.1612,2,Muhafazat Halab,Agence France-Presse,5,Factiva,NULL,William Spindler,"International Government Organization,Global Refugees IGOs,Global,Global Diplomatic IGOs",40297334,Turkey,Turkey,NULL,2016
583,Aleppo,Syria,2016-02-09,NULL,2016-02-09,ICEWS24147411,"His story is typical of accounts of the 'hell' that is life in the war-scarred region around the northern city of Aleppo, where up to 31,000 people have fled as government forces press an offensive against rebels, according to the UN.",Use conventional military force,Syrians recount 'hell' of Aleppo life under air strikes,"(2016, 6, 3)",-10,36.2012,37.1612,2,Muhafazat Halab,Agence France-Presse,3,Factiva,Syria,Military (Syria),"Military,Government",40297744,Syria,Armed Rebel (Syria),"Dissident,Rebel",2016
587,Damascus,Syria,2016-02-09,NULL,2016-02-09,ICEWS24148785,"Border Police officer Hadar Cohen was killed and another female officer wounded when the three Arab youths - armed with automatic weapons, knives and explosives - opened fire at the Damascus Gate.",Use unconventional violence,IDF Had Questioned Terrorist Before He Murdered Hadar Cohen.,"(2016, 6, 3)",-9,33.5102,36.2913,2,Dimashq,Israel Faxx,3,Factiva,Israel,Children (Israel),"General Population / Civilian / Social,Social",40300361,Israel,Police (Israel),"Police,Government",2016
589,Ramadi,Iraq,2016-02-09,NULL,2016-02-09,ICEWS24149244,The highly accurate Brimstone missiles were also used on Thursday to attack IS fighters engaged in close combat with Iraqi troops.,Use unconventional violence,RAF missiles destroy IS stronghold,"(2016, 6, 3)",-9,33.4206,43.3078,2,Muhafazat al Anbar,London Evening Standard,4,Factiva,Iraq,Combatant (Iraq),Unidentified Forces,40302181,Iraq,Military (Iraq),"Military,Government",2016
601,Aleppo,Syria,2016-02-10,NULL,2016-02-10,ICEWS24147538,"Syrian government forces, backed by Russian air strikes and Iranian and Lebanese Hezbollah fighters, have launched a major offensive |in the countryside around Aleppo, which has been divided between government and rebel control for years.",Cooperate militarily,Civilians cut off from food,"(2016, 6, 3)",7.4,36.2012,37.1612,2,Muhafazat Halab,Cape Times,2,Factiva,Iran,Iran,NULL,40297935,Syria,Military (Syria),"Government,Military",2016
602,Aleppo,Syria,2016-02-10,NULL,2016-02-10,ICEWS24147539,"Syrian government forces, backed by Russian air strikes and Iranian and Lebanese Hezbollah fighters, have launched a major offensive |in the countryside around Aleppo, which has been divided between government and rebel control for years.",Cooperate militarily,Civilians cut off from food,"(2016, 6, 3)",7.4,36.2012,37.1612,2,Muhafazat Halab,Cape Times,2,Factiva,Lebanon,Combatant (Hezbollah),"National Religious,Social,Parties,Shia,Organized Violent,International Religious,Far Left,(National) Minor Party,Ideological,Dissident",40297935,Syria,Military (Syria),"Government,Military",2016
603,Aleppo,Syria,2016-02-10,NULL,2016-02-10,ICEWS24147449,"When the battle for Syria's largest city and commercial hub, Aleppo, began in July 2012, the provincial governor appealed for troops to counter rebel advances.",Make an appeal or request,Battle for Aleppo could be key turning point of Syrian war; Capture of city essential if Assad to assert claim to be government,"(2016, 6, 3)",3,36.2012,37.1612,2,Muhafazat Halab,Irish Times,1,Factiva,Syria,Governor (Syria),"Government,Local,Provincial",40297955,Syria,Military (Syria),"Government,Military",2016
604,Damascus,Syria,2016-02-10,NULL,2016-02-10,ICEWS24147634,"The ambush, conducted by the so-called Jaish al-Islam, or the Islam Army, is believed to be a retaliation against the Syrian army's shelling of rebel-held areas in the east suburb of the capital city, the Syria Observatory for Human Rights (SOHR) said.",fight with artillery and tanks,45 Syrian soldiers killed in rebel ambush near Damascus,"(2016, 6, 3)",-10,33.5102,36.2913,2,Dimashq,Xinhua News Agency,2,Factiva,Syria,Military (Syria),"Government,Military",40298253,Syria,Syria,NULL,2016
605,Baghdad,Iraq,2016-02-10,NULL,2016-02-10,ICEWS24147679,"During the visit, the sides are expected to discuss improving the legal basis for cooperation between Russia and Iraq and broadening economic ties.",Engage in diplomatic cooperation,Russia’s governmental delegation heading for talks to Iraq,"(2016, 6, 3)",3.5,33.3406,44.4009,2,Muhafazat Baghdad,ITAR Tass,3,Factiva,Russian Federation,Russia,NULL,40298314,Iraq,Iraq,NULL,2016
606,Baghdad,Iraq,2016-02-10,NULL,2016-02-10,ICEWS24147680,"During the visit, the sides are expected to discuss improving the legal basis for cooperation between Russia and Iraq and broadening economic ties.",Engage in diplomatic cooperation,Russia’s governmental delegation heading for talks to Iraq,"(2016, 6, 3)",3.5,33.3406,44.4009,2,Muhafazat Baghdad,ITAR Tass,3,Factiva,Iraq,Iraq,NULL,40298314,Russian Federation,Russia,NULL,2016
607,Kobani,Syria,2016-02-10,NULL,2016-02-10,ICEWS24147652,"Davutoglu said: 'Bayirbucak Turkmen found Turkey behind them when they sought a shelter... Kurds from Haseke, Kobani made their way to Turkey when they sought a place to shelter in the face of Daesh oppression.'",Make statement,Premier tells ruling party meeting Turkey 'last castle' for Syrians,"(2016, 6, 3)",0,36.8909,38.3535,2,Muhafazat Halab,BBC Monitoring European,6,Factiva,Turkey,Ahmet Davutoglu,"Foreign Ministry,(National) Major Party,Parties,Center Right,Education,Ideological,Cabinet,Executive,Social,Government,Executive Office",40298330,Turkmenistan,Turkmenistan,NULL,2016
608,NULL,Syria,2016-02-10,NULL,2016-02-10,ICEWS24147731,"Russian military intervention in Syria has turned the course of that country's civil war against U.S.-backed rebel groups, increasing the likelihood that Syrian President Bashar al-Assad and his loyalists will remain in power, U.S. intelligence officials testified Tuesday.",Use conventional military force,"Russian airstrikes changed 'calculus completely' in Syria, officials say","(2016, 6, 3)",-10,33.5102,36.2913,2,NULL,The Washington Post,1,Factiva,Russian Federation,Russia,NULL,40298387,Syria,Syria,NULL,2016
