,City,Country,Datetime,District,Event Date,Event ID,Event Sentence,Event Text,Headline,ISO Week,Intensity,Latitude,Longitude,Month,Province,Publisher,Sentence Number,Source,Source Country,Source Name,Source Sectors,Story ID,Target Country,Target Name,Target Sectors,Year
954,Baghdad,Iraq,2017-02-17,NULL,2017-02-17,ICEWS25485111,The deputy spokesman assured the Iraqi people and government the United Nations will continue to support them in the fight against terrorism and violent extremism.,Make statement,UN Condemns Latest Terror Attacks by Islamic State in Bagdad - Spokesman,"(2017, 7, 3)",0,33.3406,44.4009,2,Muhafazat Baghdad,Unknown,4,Factiva,NULL,Farhan Haq,"Social,Global,International Government Organization,Media,Global Diplomatic IGOs",43511261,NULL,United Nations,"Global,International Government Organization,Global Diplomatic IGOs",2017
955,Raqqa,Syria,2017-02-17,NULL,2017-02-17,ICEWS25485371,"The Syria Democratic Forces (SDF), which include Arab groups and the powerful Kurdish YPG militia, have for months been fighting Islamic State in northern Syria around its de facto capital Raqqa.",Use conventional military force,Islamic State 'bureaucrats' fleeing stronghold in Syria - Pentagon,"(2017, 7, 3)",-10,35.9528,39.0079,2,Ar Raqqah,Reuters News,6,Factiva,Syria,Military (Syria),"Government,Military",43511490,Syria,Syria,NULL,2017
956,Homs,Syria,2017-02-17,NULL,2017-02-17,ICEWS25485264,Reports said on Thursday that the army continued military operations to liberate the ancient city of Palmyra in Homs province and advanced in vast areas after harsh clashes with the ISIL terrorists.,Use conventional military force,Syria: ISIL Terrorists Withdraw from More Lands West of Ancient Palmyra,"(2017, 7, 3)",-10,34.7268,36.7234,2,Muhafazat Hims,FARS News Agency,6,Factiva,Syria,Military (Syria),"Government,Military",43511492,Syria,Syria,NULL,2017
957,NULL,Syria,2017-02-17,NULL,2017-02-17,ICEWS25485372,Reports said earlier today that a senior field commander of Al-Nusra Front (recently renamed to Fatah al-Sham Front) was killed in clashes with Syrian Army troops in the Southern districts of the city of Dara'a.,Use conventional military force,"Dara'a: Terrorists Hit Residential Areas, Syrian Army Carries out Retaliatory Attack","(2017, 7, 3)",-10,32.85,36.2167,2,Muhafazat Dar`a,FARS News Agency,4,Factiva,Syria,Military (Syria),"Government,Military",43511494,Syria,Jabhat al-Nusra,"Dissident,Radicals / Extremists / Fundamentalists",2017
958,Homs,Syria,2017-02-17,NULL,2017-02-17,ICEWS25485293,"The army said its soldiers pushed terrorists into a trap in al-Tibeh, killing a number of them.",Make statement,Syrian Army Engages in Fierce Clashes with Al-Nusra Front in Homs,"(2017, 7, 3)",0,34.7268,36.7234,2,Muhafazat Hims,FARS News Agency,4,Factiva,Syria,Military (Syria),"Government,Military",43511495,Iran,Military (Iran),"Military,Government",2017
959,Homs,Syria,2017-02-17,NULL,2017-02-17,ICEWS25485295,"Al-Nusra and its allied terrorist groups stormed the positions of the government forces from the towns of Ein al-Hossein Janboul and al-Amiriyeh in Central Homs to capture the town of Ein al-Dananir and reach the key village of al-Moshrefeh, but the army soldiers repelled their offensive, killing over 15 militants.",Use conventional military force,Syrian Army Engages in Fierce Clashes with Al-Nusra Front in Homs,"(2017, 7, 3)",-10,34.7268,36.7234,2,Muhafazat Hims,FARS News Agency,6,Factiva,Iran,Military (Iran),"Military,Government",43511495,Syria,Terrorist Leader (Jabhat al-Nusra),"Dissident,Radicals / Extremists / Fundamentalists",2017
960,Tall `Afar,Iraq,2017-02-17,NULL,2017-02-17,ICEWS25485352,The head of the Department of the Ministry of Yazidis and Iraqi Kurdistan Hayri Bozani told Sputnik Turkey that Daesh terrorists abduct Yazidi children and then convert them into suicide bombers by exposing them to different sorts of training.,Make statement,Tragic Fate of Yazidi Children Forced to be Suicide Bombers by Daesh,"(2017, 7, 3)",0,36.3791,42.4481,2,Muhafazat Ninawa,Unknown,4,Factiva,Iraq,Iraqi Kurdistan,"International Ethnic,Kurd (Ethnic Group)",43511536,Iraq,Terrorist (Islamic State of Iraq and the Levant),"Muslim,Dissident,Insurgents,Fundamentalist,International Religious,Sunni,Ideological",2017
961,Tadmur,Syria,2017-02-17,NULL,2017-02-17,ICEWS25485221,"According to the ministry, the video proves that the Islamists had blown up the proscenium, the central part of the Roman-era amphitheater, and columns of the 16-column Tetrapylon, which dates back to 270 A.D.","Conduct suicide, car, or other non-military bombing",International Cultural Sites Center to Take All Actions to Save Palmyra Heritage,"(2017, 7, 3)",-10,34.5608,38.2805,2,Muhafazat Hims,Unknown,3,Factiva,Syria,Citizen (Syria),"Social,General Population / Civilian / Social",43511537,Syria,Syria,NULL,2017
962,Raqqa,Syria,2017-02-17,NULL,2017-02-17,ICEWS25485265,"WASHINGTON (Sputnik) — Earlier on Friday, the Russian Defense Ministry said a group of Tu-95MS Bear strategic bombers carried out airstrikes with X-101 cruise missiles against Daesh targets near Raqqa.",Make statement,Pentagon Comments on Russia's Airstrikes With Cruise Missiles in Raqqa,"(2017, 7, 3)",0,35.9528,39.0079,2,Ar Raqqah,Unknown,2,Factiva,Russian Federation,Defense / Security Ministry (Russia),"Executive,Government,Defense / Security Ministry",43511552,Syria,Military (Syria),"Government,Military",2017
963,Raqqa,Syria,2017-02-17,NULL,2017-02-17,ICEWS25485266,"WASHINGTON (Sputnik) — Earlier on Friday, the Russian Defense Ministry said a group of Tu-95MS Bear strategic bombers carried out airstrikes with X-101 cruise missiles against Daesh targets near Raqqa.",Employ aerial weapons,Pentagon Comments on Russia's Airstrikes With Cruise Missiles in Raqqa,"(2017, 7, 3)",-10,35.9528,39.0079,2,Ar Raqqah,Unknown,2,Factiva,Syria,Military (Syria),"Government,Military",43511552,Syria,Syria,NULL,2017
964,Raqqa,Syria,2017-02-17,NULL,2017-02-17,ICEWS25485324,Davis says the extremist group's administrative structure in Raqqa is beginning to crack.,Make statement,Pentagon cites evidence of Islamic State 'exodus' from Raqqa,"(2017, 7, 3)",0,35.9528,39.0079,2,Ar Raqqah,Associated Press Newswires,4,Factiva,United States,Department of Defense,"Executive,Defense / Security Ministry,Government",43511615,Iraq,Islamic State of Iraq and the Levant,"Muslim,Dissident,Insurgents,Fundamentalist,International Religious,Sunni,Ideological",2017
965,Raqqa,Syria,2017-02-17,NULL,2017-02-17,ICEWS25485198,"WASHINGTON, February 17 (Sputnik) - The United States has no particular reaction to the news that the Russian military has conducted cruise missile strikes against the Islamic State terror group, which is outlawed in Russia, near Syria's Raqqa, US Department of Defense spokesperson Jeff Davis said in a briefing on Friday.",Use conventional military force,US Without Particular Reaction to Russian Strikes in Syria’s Raqqa - Pentagon,"(2017, 7, 3)",-10,35.9528,39.0079,2,Ar Raqqah,Unknown,1,Factiva,Russian Federation,Armed Forces of the Russian Federation,"Military,Government",43511638,Iraq,Islamic State of Iraq and the Levant,"Muslim,Dissident,Insurgents,Fundamentalist,International Religious,Sunni,Ideological",2017
966,Raqqa,Syria,2017-02-17,NULL,2017-02-17,ICEWS25485222,"The Syria Democratic Forces (SDF), which include Arab groups and the powerful Kurdish YPG militia, have for months been fighting Islamic State in northern Syria around its de facto capital Raqqa.",Use conventional military force,Islamic State 'bureaucrats' fleeing stronghold in Syria: Pentagon,"(2017, 7, 3)",-10,35.9528,39.0079,2,Ar Raqqah,Reuters News,6,Factiva,Syria,Military (Syria),"Government,Military",43511643,Syria,Syria,NULL,2017
967,Tadmur,Syria,2017-02-17,NULL,2017-02-17,ICEWS25485408,"On Tuesday, the Syrian army, supported by the air force and militias, liberated the Hiyan gas field close to Syria's Palmyra in the province of Homs.",Praise or endorse,"Syrian Army, Militias Approaching Strategic Mountain Peak Near IS-Held Palmyra - Source","(2017, 7, 3)",3.4,34.5608,38.2805,2,Muhafazat Hims,Unknown,5,Factiva,Syria,Air Force (Syria),"Government,Military,Air Force",43511805,Syria,Military (Syria),"Government,Military",2017
968,Tadmur,Syria,2017-02-17,NULL,2017-02-17,ICEWS25485409,"On Tuesday, the Syrian army, supported by the air force and militias, liberated the Hiyan gas field close to Syria's Palmyra in the province of Homs.",Praise or endorse,"Syrian Army, Militias Approaching Strategic Mountain Peak Near IS-Held Palmyra - Source","(2017, 7, 3)",3.4,34.5608,38.2805,2,Muhafazat Hims,Unknown,5,Factiva,Syria,Militia (Syria),Unidentified Forces,43511805,Syria,Military (Syria),"Government,Military",2017
969,Alexandria,Egypt,2017-02-17,NULL,2017-02-17,ICEWS25485481,"On February 8, ICE agents detained about six Latino men who had just left a hypothermia shelter at the Rising Hope Mission Church in Alexandria, Virginia, according to the church.","Arrest, detain, or charge with legal action",US Senator Kaine Says Church in Virginia Feels Targeted by Immigration Raid - Letter,"(2017, 7, 3)",-5,31.2156,29.9553,2,Muhafazat al Iskandariyah,Unknown,2,Factiva,Egypt,Alexandria,"Provincial,Local,Government,Municipal",43511884,United States,Men (United States),"General Population / Civilian / Social,Social",2017
980,Jizan,Saudi Arabia,2017-02-17,NULL,2017-02-17,ICEWS25488962,A military official said that the army and popular forces destroyed a Bradley with a guided missile in the north of al-Bait al-Abyadh in Jizan.,Make statement,Army shoots dead two Saudi soldiers in Jizan,"(2017, 7, 3)",0,16.8892,42.5511,2,Mintaqat Jizan,Yemen News Agency (SABA),2,Factiva,Saudi Arabia,Military Personnel (Saudi Arabia),"Government,Military",43521561,Saudi Arabia,Saudi Arabian Defence Forces,"Government,Military",2017
981,Jizan,Saudi Arabia,2017-02-17,NULL,2017-02-17,ICEWS25488963,The missile forces of the army and popular committees also pounded Saudi-paid mercenaries off al-Khadhrah border crossing and al-Tala'ah site.,Use conventional military force,Army shoots dead two Saudi soldiers in Jizan,"(2017, 7, 3)",-10,16.8892,42.5511,2,Mintaqat Jizan,Yemen News Agency (SABA),5,Factiva,Saudi Arabia,Saudi Arabian Defence Forces,"Government,Military",43521561,Saudi Arabia,Armed Gang (Saudi Arabia),Unidentified Forces,2017
982,Dammam,Saudi Arabia,2017-02-17,NULL,2017-02-17,ICEWS25489254,"Spokesman for the province’s Media and Public Relations Administration, Mohamed bin Abdulaziz al-Safyan, said that the tunnels were closed as a precaution in order to ensure the safety of drivers in the area.",Make statement,Heavy rains force tunnels closure in Saudi Eastern Province,"(2017, 7, 3)",0,26.4344,50.1033,2,Al Mintaqah ash Sharqiyah,Al Arabiya,6,Factiva,Saudi Arabia,Media Personnel (Saudi Arabia),"Social,Media",43521741,Saudi Arabia,Saudi Arabia,NULL,2017
983,Alexandria,Egypt,2017-02-17,NULL,2017-02-17,ICEWS25488780,"Meanwhile, Haris Qamar, 26, from Burke, Virginia, was sentenced to 8-1/2 years in prison on Friday by a federal court in Alexandria, Virginia.","Arrest, detain, or charge with legal action","Wisconsin man, Virginia man each get prison for trying to join Islamic State","(2017, 7, 3)",-5,31.2156,29.9553,2,Muhafazat al Iskandariyah,Reuters News,5,Factiva,Egypt,Alexandria,"Municipal,Provincial,Local,Government",43521770,United States,Citizen (United States),"Social,General Population / Civilian / Social",2017
984,Beirut,Lebanon,2017-02-17,NULL,2017-02-17,ICEWS25488909,"Trump and administration officials have used strong rhetoric against Hezbollah's political patron Iran and to support its main enemy Israel, including putting Tehran 'on notice' over charges it violated a nuclear deal by test-firing a ballistic missile.",Praise or endorse,Harsh Hezbollah words aim to draw 'red lines' for Trump: source,"(2017, 7, 3)",3.4,33.8889,35.4944,2,Beyrouth,Reuters News,2,Factiva,United States,Donald Trump,"Executive,Executive Office,Government",43521821,Israel,Israel,NULL,2017
985,Damascus,Syria,2017-02-17,NULL,2017-02-17,ICEWS25489261,"DAMASCUS, Feb. 17 (Xinhua) -- The Syrian Foreign Ministry accused Turkey on Friday of bringing in equipment to build a separation wall in northern Syria, according to state news agency SANA.",Accuse,Damascus accuses Turkey of building separation wall in northern Syria,"(2017, 7, 3)",-2,33.5102,36.2913,2,Dimashq,Xinhua News Agency,1,Factiva,Syria,Foreign Affairs (Syria),"Government,Executive,Foreign Ministry",43521876,Turkey,Turkey,NULL,2017
986,Aleppo,Syria,2017-02-17,NULL,2017-02-17,ICEWS25489262,"Three days later, the Turkish forces entered the Syrian territory at a depth of 250 meters in the town of Arab Tuma in the northern countryside of Aleppo province, and began to make a two-kilometer road to build a separation barrier in that area.",Occupy territory,Damascus accuses Turkey of building separation wall in northern Syria,"(2017, 7, 3)",-9.5,36.2012,37.1612,2,Muhafazat Halab,Xinhua News Agency,4,Factiva,Turkey,Turkey,NULL,43521876,Syria,Syria,NULL,2017
1040,Jizan,Saudi Arabia,2017-02-18,NULL,2017-02-18,ICEWS25487477,"JIZAN, Feb. 18 (Saba) – The army and popular forces on Saturday shot dead a Saudi soldier and shelled enemy Saudi military sites in Jizan province, a military official told Saba.",fight with artillery and tanks,"Army shoots dead Saudi soldier, hits Saudi military sites in Jizan","(2017, 7, 3)",-10,16.8892,42.5511,2,Mintaqat Jizan,Yemen News Agency (SABA),2,Factiva,Saudi Arabia,Saudi Arabian Defence Forces,"Government,Military",43518546,Saudi Arabia,Saudi Arabia,NULL,2017
1041,Mosul,Iraq,2017-02-18,NULL,2017-02-18,ICEWS25487440,The leaflets published on Defence Ministry social media said the troops had begun advancing toward western Mosul.,Mobilize or increase armed forces,UPDATE 3-West Mosul residents told battle is imminent as Iraqi forces begin moving,"(2017, 7, 3)",-7.2,36.335,43.1189,2,Muhafazat Ninawa,Reuters News,5,Factiva,Iraq,Military (Iraq),"Military,Government",43518693,Iraq,Iraq,NULL,2017
1042,Mosul,Iraq,2017-02-18,NULL,2017-02-18,ICEWS25487318,The leaflets published on Defence Ministry social media said the troops had begun advancing toward western Mosul.,Mobilize or increase armed forces,West Mosul residents told battle is imminent as Iraqi forces begin moving,"(2017, 7, 3)",-7.2,36.335,43.1189,2,Muhafazat Ninawa,Reuters News,3,Factiva,Iraq,Military (Iraq),"Military,Government",43518780,Iraq,Iraq,NULL,2017
1043,Daraa,Syria,2017-02-18,NULL,2017-02-18,ICEWS25489302,"Russian jets have launched dozens of air strikes on rebel-held parts of Daraa in southern Syria on 18 February, killing at least 14, Qatar-based Al-Jazeera TV reported on the same day.",Employ aerial weapons,"At least 14 reported killed in Russian strikes on Daraa, southern Syria","(2017, 7, 3)",-10,32.6189,36.1021,2,Muhafazat Dar`a,BBC Monitoring Middle East,2,Factiva,Russian Federation,Russia,NULL,43519094,Syria,Syria,NULL,2017
1044,Damascus,Syria,2017-02-18,NULL,2017-02-18,ICEWS25489500,"Sixteen people, including two women, were killed Saturday when government forces launched a barrage of rockets that hit a funeral on the edges of the Syrian capital, a monitor said.",Use conventional military force,Syria regime shelling of funeral kills 16: monitor,"(2017, 7, 3)",-10,33.5102,36.2913,2,Dimashq,Agence France-Presse,1,Factiva,Syria,Military (Syria),"Government,Military",43519206,Syria,Citizen (Syria),"General Population / Civilian / Social,Social",2017
1045,Damascus,Syria,2017-02-18,NULL,2017-02-18,ICEWS25489499,"The Syrian Observatory for Human Rights said 'seven rockets and several shells hit areas on the edges of Qabun', a northeastern district of Damascus held by rebels.",Make statement,Syria regime shelling of funeral kills 16: monitor,"(2017, 7, 3)",0,33.5102,36.2913,2,Dimashq,Agence France-Presse,2,Factiva,Syria,Syrian Observatory for Human Rights,"Dissident,Exiles",43519206,Syria,Syria,NULL,2017
1046,Homs,Syria,2017-02-18,NULL,2017-02-18,ICEWS25488185,The army forces attacked ISIL's positions near the al-Baydha road in the Eastern parts of T4 military base in Eastern Homs and regained control of several points near al-Jahar oilfield and al-Hayal mountain.,Use conventional military force,Homs: Syrian Army Continues to Advance Near Al-Jahar Oilfield,"(2017, 7, 3)",-10,34.7268,36.7234,2,Muhafazat Hims,FARS News Agency,2,Factiva,Syria,Military (Syria),"Government,Military",43519375,Syria,Militant (Syria),Unidentified Forces,2017
1047,Beirut,Lebanon,2017-02-18,NULL,2017-02-18,ICEWS25487986,"BEIRUT, Feb 18 (Reuters) - Lebanese President Michel Aoun said on Saturday that any Israeli attempt to violate Lebanon's sovereignty would be met with the 'appropriate response', in a statement released by his office.",Make statement,UPDATE 1-Aoun: Israeli threats to Lebanese sovereignty will meet 'appropriate response',"(2017, 7, 3)",0,33.8889,35.4944,2,Beyrouth,Reuters News,2,Factiva,Lebanon,Michel Aoun,"Parties,Executive,Unicameral,Legislative / Parliamentary,(National) Minor Party,Government,Executive Office,Ideological,Center Right",43519414,Israel,Israel,NULL,2017
1048,Damascus,Syria,2017-02-18,NULL,2017-02-18,ICEWS25487923,"At least nine people were killed on Saturday when government forces launched a barrage of rockets that hit a funeral on the edges of the Syrian capital, a monitor said.",Use conventional military force,Syria regime shelling of funeral kills 9: monitor,"(2017, 7, 3)",-10,33.5102,36.2913,2,Dimashq,Agence France-Presse,1,Factiva,Syria,Military (Syria),"Government,Military",43519463,Syria,Citizen (Syria),"General Population / Civilian / Social,Social",2017
1049,Damascus,Syria,2017-02-18,NULL,2017-02-18,ICEWS25487922,"The Syrian Observatory for Human Rights said 'seven rockets and several shells hit areas on the edges of Qabun', a northeastern district of Damascus held by rebels.",Make statement,Syria regime shelling of funeral kills 9: monitor,"(2017, 7, 3)",0,33.5102,36.2913,2,Dimashq,Agence France-Presse,2,Factiva,Syria,Syrian Observatory for Human Rights,"Dissident,Exiles",43519463,Syria,Syria,NULL,2017
1050,Beirut,Lebanon,2017-02-18,NULL,2017-02-18,ICEWS25487989,"BEIRUT, Feb 18 (Reuters) - Lebanese President Michel Aoun said on Saturday that any Israeli attempt to violate Lebanon's sovereignty would be met with the 'appropriate response', in a statement released by his office.",Make statement,Aoun: Israeli threats to Lebanese sovereignty will meet 'appropriate response',"(2017, 7, 3)",0,33.8889,35.4944,2,Beyrouth,Reuters News,1,Factiva,Lebanon,Michel Aoun,"Parties,Executive,Unicameral,Legislative / Parliamentary,(National) Minor Party,Government,Executive Office,Ideological,Center Right",43519476,Israel,Israel,NULL,2017
1051,Baghdad,Iraq,2017-02-18,NULL,2017-02-18,ICEWS25487803,"'The European Union supports Iraq in its efforts to achieve reconciliation and bring reform', the spokesperson added in a press release, saying that the EU pledges to continue its political and financial support to the population and the authorities in the country in their fight for peace, democracy and pluralism.",Praise or endorse,IRAQ; EU says numerous terrorist attacks confirm importance of overcoming divisions,"(2017, 7, 3)",3.4,33.3406,44.4009,2,Muhafazat Baghdad,Unknown,2,Factiva,NULL,European Union,"International Government Organization,Regional Diplomatic IGOs,Regional",43519531,Iraq,Iraq,NULL,2017
1052,NULL,Iraq,2017-02-18,NULL,2017-02-18,ICEWS25487752,"'The EU supports Iraq in its efforts to achieve reconciliation and to the reform,' added the spokesperson in his press release.",Praise or endorse,"IRAK; pour l’UE, les nombreuses attaques terroristes confirment la nécessité de surmonter les divisions","(2017, 7, 3)",3.4,33.3406,44.4009,2,NULL,Unknown,2,Factiva,NULL,European Union,"International Government Organization,Regional Diplomatic IGOs,Regional",43519550,Iraq,Iraq,NULL,2017
1053,Baghdad,Iraq,2017-02-18,NULL,2017-02-18,ICEWS25487751,"She clarified that the Union undertook to continue its political and financial support to the population and to the Iraqi authorities in their struggle for peace, democracy and pluralism.",Make statement,"IRAK; pour l’UE, les nombreuses attaques terroristes confirment la nécessité de surmonter les divisions","(2017, 7, 3)",0,33.3406,44.4009,2,Muhafazat Baghdad,Unknown,3,Factiva,Iraq,Population (Iraq),"Social,General Population / Civilian / Social",43519550,Iraq,Labor Union (Iraq),"Social,Labor",2017
1054,Beirut,Lebanon,2017-02-18,NULL,2017-02-18,ICEWS25487756,"BEIRUT (AP) — U.S.-backed fighters captured a village in northern Syria Saturday from members of the Islamic State group, bringing them closer to cutting a road linking two major IS-held cities in the country and closing in on the extremists' de facto capital.",Occupy territory,US-backed Syrian fighters inch closer to IS 'capital',"(2017, 7, 3)",-9.5,33.8889,35.4944,2,Beyrouth,Associated Press Newswires,1,Factiva,Syria,Combatant (Syria),Unidentified Forces,43519571,Syria,Syria,NULL,2017
1055,Beirut,Lebanon,2017-02-18,NULL,2017-02-18,ICEWS25487757,"BEIRUT (AP) — U.S.-backed fighters captured a village in northern Syria Saturday from members of the Islamic State group, bringing them closer to cutting a road linking two major IS-held cities in the country and closing in on the extremists' de facto capital.",Occupy territory,US-backed Syrian fighters inch closer to IS 'capital',"(2017, 7, 3)",-9.5,33.8889,35.4944,2,Beyrouth,Associated Press Newswires,1,Factiva,Syria,Combatant (Syria),Unidentified Forces,43519571,Iraq,Islamic State of Iraq and the Levant,"Dissident,Fundamentalist,International Religious,Insurgents,Sunni,Muslim,Ideological",2017
1056,Mosul,Iraq,2017-02-18,NULL,2017-02-18,ICEWS25487754,The Britain-based Syrian Observatory for Human Rights and the SDF said Saturday that the predominantly-Kurdish force captured the village of Jawees.,Make statement,US-backed Syrian fighters inch closer to IS 'capital',"(2017, 7, 3)",0,36.335,43.1189,2,Muhafazat Ninawa,Associated Press Newswires,6,Factiva,Syria,Syrian Observatory for Human Rights,"Dissident,Exiles",43519571,Syria,Syrian Kurds,"Social,Kurd (Ethnic Group),International Ethnic,National Ethnic,National Ethnic Minority",2017
1057,Mosul,Iraq,2017-02-18,NULL,2017-02-18,ICEWS25487755,The Britain-based Syrian Observatory for Human Rights and the SDF said Saturday that the predominantly-Kurdish force captured the village of Jawees.,Make statement,US-backed Syrian fighters inch closer to IS 'capital',"(2017, 7, 3)",0,36.335,43.1189,2,Muhafazat Ninawa,Associated Press Newswires,6,Factiva,Syria,Military (Syria),"Government,Military",43519571,Syria,Syrian Kurds,"Social,Kurd (Ethnic Group),International Ethnic,National Ethnic,National Ethnic Minority",2017
1058,Riyadh,Saudi Arabia,2017-02-18,NULL,2017-02-18,ICEWS25487831,"RIYADH, Feb. 18 (Xinhua) -- A Saudi resident was injured in a projectile attack from Yemen on the border city of Najran on Saturday, local news channel Al Akhbariya reported.",Use conventional military force,Saudi resident injured in projectile attack from Yemen,"(2017, 7, 3)",-10,24.6877,46.7219,2,Mintaqat ar Riyad,Xinhua News Agency,1,Factiva,Yemen,Yemen,NULL,43519615,Saudi Arabia,Citizen (Saudi Arabia),"Social,General Population / Civilian / Social",2017
1059,Beirut,Lebanon,2017-02-18,NULL,2017-02-18,ICEWS25487808,"Shunned by many European leaders over her party's stance on immigration and anti-EU message, Le Pen's meeting with President Michel Aoun in Beirut is designed to add to her international credibility.",Consult,Le Pen to meet first head of state during Lebanon trip,"(2017, 7, 3)",1,33.8889,35.4944,2,Beyrouth,Agence France-Presse,4,Factiva,Lebanon,Presidential Candidate (Lebanon),Parties,43519635,Lebanon,Michel Aoun,"Parties,Executive,Unicameral,Legislative / Parliamentary,(National) Minor Party,Government,Executive Office,Ideological,Center Right",2017
1060,Beirut,Lebanon,2017-02-18,NULL,2017-02-18,ICEWS25487809,"Shunned by many European leaders over her party's stance on immigration and anti-EU message, Le Pen's meeting with President Michel Aoun in Beirut is designed to add to her international credibility.",Consult,Le Pen to meet first head of state during Lebanon trip,"(2017, 7, 3)",1,33.8889,35.4944,2,Beyrouth,Agence France-Presse,4,Factiva,Lebanon,Michel Aoun,"Parties,Executive,Unicameral,Legislative / Parliamentary,(National) Minor Party,Government,Executive Office,Ideological,Center Right",43519635,Lebanon,Presidential Candidate (Lebanon),Parties,2017
1061,NULL,Syria,2017-02-18,NULL,2017-02-18,ICEWS25488193,"In the meantime, Israeli soldiers deployed along the medical-logistical corridor have started criticizing their commanders due to Israel's unprecedented logistical back up for terrorist groups in Syria.",Mobilize or increase armed forces,Israel Backing Terrorists' Anti-Syria Operations via Setting up Medical Corridor,"(2017, 7, 3)",-7.2,32.85,36.2167,2,Muhafazat Dar`a,FARS News Agency,5,Factiva,Israel,Israeli Defense Forces,"Military,Government",43519728,Israel,Israel,NULL,2017
1062,NULL,Syria,2017-02-18,NULL,2017-02-18,ICEWS25488194,"A military source disclosed earlier today that the Al-Nusra Front has received almost $100,000 from some western countries, Arab States of the Persian Gulf and Israel to stage massive attacks on the Syrian Army in Dara'a.",Use unconventional violence,Israel Backing Terrorists' Anti-Syria Operations via Setting up Medical Corridor,"(2017, 7, 3)",-9,32.85,36.2167,2,Muhafazat Dar`a,FARS News Agency,6,Factiva,Israel,Citizen (Israel),"Social,General Population / Civilian / Social",43519728,Syria,Military (Syria),"Government,Military",2017
