,City,Country,Datetime,District,Event Date,Event ID,Event Sentence,Event Text,Headline,ISO Week,Intensity,Latitude,Longitude,Month,Province,Publisher,Sentence Number,Source,Source Country,Source Name,Source Sectors,Story ID,Target Country,Target Name,Target Sectors,Year
1532,Mosul,Iraq,2016-10-28,NULL,2016-10-28,ICEWS25111773,"A US aircraft has bombed a school in the town of Tel Keppe, less than 14 kilometers (8 miles) north of the Iraqi city of Mosul, resulting in casualties, Head of the Main Operations Department at Russia’s General Staff Lieutenant-General Sergei Rudskoi told a briefing on Friday.",Employ aerial weapons,US aircraft delivers strike on school near Mosul on October 24 - Russia’s Defense Ministry,"(2016, 43, 3)",-10,36.335,43.1189,10,Muhafazat Ninawa,Unknown,1,Factiva,United States,United States,NULL,42568937,Iraq,Education (Iraq),"Education,Social",2016
1533,Aleppo,Syria,2016-10-28,NULL,2016-10-28,ICEWS25111863,"'Lavrov and Kerry also discussed assistance to the solution of crises in Yemen and Libya as well as separate issues of bilateral agenda,' the Russian Foreign Ministry stressed.",Consult,Lavrov and Kerry discuss Syrian settlement; situations in Yemen and Libya - Russian Foreign Ministry,"(2016, 43, 3)",1,36.2012,37.1612,10,Muhafazat Halab,Unknown,5,Factiva,Russian Federation,Sergey Viktorovich Lavrov,"Parties,(National) Major Party,Foreign Ministry,Executive,Government,Cabinet,Ideological,Center Right",42568941,United States,John Kerry,"Parties,Upper House,(National) Major Party,Government,Foreign Ministry,Ideological,Legislative / Parliamentary,Center Left,Cabinet,Executive",2016
1534,Aleppo,Syria,2016-10-28,NULL,2016-10-28,ICEWS25111864,"'Lavrov and Kerry also discussed assistance to the solution of crises in Yemen and Libya as well as separate issues of bilateral agenda,' the Russian Foreign Ministry stressed.",Consult,Lavrov and Kerry discuss Syrian settlement; situations in Yemen and Libya - Russian Foreign Ministry,"(2016, 43, 3)",1,36.2012,37.1612,10,Muhafazat Halab,Unknown,5,Factiva,United States,John Kerry,"Parties,Upper House,(National) Major Party,Government,Foreign Ministry,Ideological,Legislative / Parliamentary,Center Left,Cabinet,Executive",42568941,Russian Federation,Sergey Viktorovich Lavrov,"Parties,(National) Major Party,Foreign Ministry,Executive,Government,Cabinet,Ideological,Center Right",2016
1535,Aleppo,Syria,2016-10-28,NULL,2016-10-28,ICEWS25111712,Toner noted the United States is working with the Organisation for the Prohibition of Chemical Weapons (OPCW) and the UN security Council to 'extend the instrumental work of the JIM and to send a clear message that the use of chemical weapons will not be tolerated.',Engage in diplomatic cooperation,Those Behind Chemical Weapons Usage in Syria to Bear Responsibility -DoS,"(2016, 43, 3)",3.5,36.2012,37.1612,10,Muhafazat Halab,Unknown,5,Factiva,United States,United States,NULL,42568953,NULL,Organization for the Prohibition of Chemical Weapons,"International Government Organization,Global Diplomatic IGOs,Global",2016
1536,Aleppo,Syria,2016-10-28,NULL,2016-10-28,ICEWS25111713,Toner noted the United States is working with the Organisation for the Prohibition of Chemical Weapons (OPCW) and the UN security Council to 'extend the instrumental work of the JIM and to send a clear message that the use of chemical weapons will not be tolerated.',Engage in diplomatic cooperation,Those Behind Chemical Weapons Usage in Syria to Bear Responsibility -DoS,"(2016, 43, 3)",3.5,36.2012,37.1612,10,Muhafazat Halab,Unknown,5,Factiva,United States,United States,NULL,42568953,NULL,UN Security Council,"Global Defense / Security IGOs,International Government Organization,Global,Global Diplomatic IGOs",2016
1537,Homs,Syria,2016-10-28,NULL,2016-10-28,ICEWS25111769,Al-Baath University students hold a rally in Homs in support of Russia's military operation in Syria,Demonstrate or rally,West 'Should Form Alliance With Russia' to Help Assad in Syria,"(2016, 43, 3)",-6.5,34.7268,36.7234,10,Muhafazat Hims,Unknown,1,Factiva,Syria,Student (Syria),"Education,Social",42568967,NULL,Unspecified Actor,Unspecified,2016
1538,Mosul,Iraq,2016-10-28,NULL,2016-10-28,ICEWS25111705,This was not the first statement made by Russian defense ministry's officials on civilian casualties as a result of US-led coalition's strikes in Iraq and Syria.,Use conventional military force,Coalition Hides War Crimes in Syria by Fabricating Russian Strikes - Russian MoD,"(2016, 43, 3)",-10,36.335,43.1189,10,Muhafazat Ninawa,Unknown,3,Factiva,United States,United States,NULL,42568971,Iraq,Iraq,NULL,2016
1539,Mosul,Iraq,2016-10-28,NULL,2016-10-28,ICEWS25111706,This was not the first statement made by Russian defense ministry's officials on civilian casualties as a result of US-led coalition's strikes in Iraq and Syria.,Use conventional military force,Coalition Hides War Crimes in Syria by Fabricating Russian Strikes - Russian MoD,"(2016, 43, 3)",-10,36.335,43.1189,10,Muhafazat Ninawa,Unknown,3,Factiva,United States,United States,NULL,42568971,Syria,Syria,NULL,2016
1540,Aleppo,Syria,2016-10-28,NULL,2016-10-28,ICEWS25111893,"Russia invites international organizations to investigate the shelling of residential areas in Northern Syrian city of Aleppo carried out by militant groups, he said.",Appeal for intelligence,"Militants' Shelling Kills 43, Wounds 96 in West Aleppo in 72 Hours - Russian MoD","(2016, 43, 3)",3.4,36.2012,37.1612,10,Muhafazat Halab,Unknown,5,Factiva,Russian Federation,Russia,NULL,42568977,NULL,International Government Organizations,International Government Organization,2016
1541,Aleppo,Syria,2016-10-28,NULL,2016-10-28,ICEWS25111739,"He also said that, at the same time, rebels from east Aleppo carried out an attack in the area of a humanitarian corridor near the Souq Al-Hai market.",Make statement,Russia says rebel attack on Aleppo repelled,"(2016, 43, 3)",0,36.2012,37.1612,10,Muhafazat Halab,BBC Monitoring Former Soviet Union,6,Factiva,Russian Federation,Military (Russia),"Government,Military",42569008,Syria,Armed Rebel (Syria),"Rebel,Dissident",2016
1542,Baghdad,Iraq,2016-10-28,NULL,2016-10-28,ICEWS25111823,"BAGHDAD (AP) — The Islamic State group is using tens of thousands of people as 'human shields' in and around Mosul while the Iraqi forces are waging a large-scale offensive aimed at retaking the country's second-largest city, the U.N. human rights office said Friday.",Use as human shield,Mosul Today: UN says IS using thousands as human shields,"(2016, 43, 3)",-8,33.3406,44.4009,10,Muhafazat Baghdad,Associated Press Newswires,1,Factiva,Iraq,Islamic State of Iraq and the Levant,"Fundamentalist,Sunni,Ideological,Muslim,Insurgents,International Religious,Dissident",42569017,Iraq,Citizen (Iraq),"General Population / Civilian / Social,Social",2016
1543,Mosul,Iraq,2016-10-28,NULL,2016-10-28,ICEWS25111824,"The extremist group has massacred perceived opponents on several occasions, and is widely believed to be rooting out anyone who could potentially rise up against it, focusing on Iraqis with military training or past links to security forces.",Engage in mass killings,Mosul Today: UN says IS using thousands as human shields,"(2016, 43, 3)",-10,36.335,43.1189,10,Muhafazat Ninawa,Associated Press Newswires,4,Factiva,Iraq,Islamic State of Iraq and the Levant,"Fundamentalist,Sunni,Ideological,Muslim,Insurgents,International Religious,Dissident",42569017,Iraq,Citizen (Iraq),"General Population / Civilian / Social,Social",2016
1562,Aleppo,Syria,2016-10-28,NULL,2016-10-28,ICEWS25112002,Russia has been accused by western powers and rights groups of indiscriminate bombings in the monthlong Syrian government operation to seize rebel-held eastern Aleppo.,Occupy territory,Russia loses election to UN rights council,"(2016, 43, 3)",-9.5,36.2012,37.1612,10,Muhafazat Halab,Agence France-Presse,5,Factiva,Russian Federation,Russia,NULL,42569238,Syria,Syria,NULL,2016
1563,Riyadh,Saudi Arabia,2016-10-28,NULL,2016-10-28,ICEWS25112018,"The European Union's diplomatic chief Federica Mogherini will visit Iran and Saudi Arabia this weekend for talks on the Syrian conflict, an EU statement said on Friday.",Express intent to meet or negotiate,"EU's Mogherini to visit Tehran, Riyadh for Syria talks","(2016, 43, 3)",4,24.6877,46.7219,10,Mintaqat ar Riyad,Agence France-Presse,1,Factiva,Italy,Federica Mogherini,"Parties,(National) Major Party,Regional Diplomatic IGOs,International Government Organization,Center Left,Regional,Ideological",42569239,Saudi Arabia,Saudi Arabia,NULL,2016
1564,Riyadh,Saudi Arabia,2016-10-28,NULL,2016-10-28,ICEWS25112013,"MOSCOW, October 28 (Sputnik) - The European Union's foreign policy chief, Federica Mogherini, plans to visit Iran and Saudi Arabia this and next week for Syrian crisis talks with regional stakeholders, the EU's diplomatic section said Friday.",Express intent to meet or negotiate,"EU Foreign Policy Chief to Visit Iran, Saudi Arabia for Syria Crisis 'Outreach' -Statement","(2016, 43, 3)",4,24.6877,46.7219,10,Mintaqat ar Riyad,Unknown,1,Factiva,Italy,Federica Mogherini,"Parties,(National) Major Party,Regional Diplomatic IGOs,International Government Organization,Center Left,Regional,Ideological",42569252,Saudi Arabia,Saudi Arabia,NULL,2016
1565,Mosul,Iraq,2016-10-28,NULL,2016-10-28,ICEWS25111929,"Iraqi F-16 fighter jets have destroyed a plant used by Islamic State militants (IS) to manufacture missiles in Rashid area in Mosul, state-run Iraqiya TV reported on 28 October.",Use conventional military force,Iraqi fighter jets destroy IS 'missile plant' in Mosul,"(2016, 43, 3)",-10,36.335,43.1189,10,Muhafazat Ninawa,BBC Monitoring Newsfile,2,Factiva,Iraq,Fighter Bomber (Iraq),"Government,Military",42569272,Iraq,Iraq,NULL,2016
1566,Mosul,Iraq,2016-10-28,NULL,2016-10-28,ICEWS25112020,"Dorrian said the pause was rather generalized, explaining that Iraqi forces were adjusting to IS tactics and moves thus far.",Make statement,Iraqis 'pausing' Mosul drive to consolidate gains: US,"(2016, 43, 3)",0,36.335,43.1189,10,Muhafazat Ninawa,Agence France-Presse,5,Factiva,Iraq,Military Personnel (Iraq),"Government,Military",42569319,Iraq,Military (Iraq),"Government,Military",2016
1567,Mosul,Iraq,2016-10-28,NULL,2016-10-28,ICEWS25112041,"On October 17, Iraqi forces supported by Kurdish Peshmerga and US troops began the operation to retake the city of Mosul from the Islamic State, which has held it since June 2014.",Praise or endorse,"Iraqi Forces Pausing Mosul Advance, US to Continue Airstrikes Against IS - Pentagon","(2016, 43, 3)",3.4,36.335,43.1189,10,Muhafazat Ninawa,Unknown,6,Factiva,United States,Military (United States),"Military,Government",42569337,Iraq,Military (Iraq),"Government,Military",2016
1568,Mosul,Iraq,2016-10-28,NULL,2016-10-28,ICEWS25111934,"As I write, Iraqi and Kurdish forces — supported by coalition airstrikes, artillery and advisers — are entering the third week of their attack on Mosul, probing the outskirts of the city.",Use unconventional violence,THE SLOW AND HARD RETAKING OF MOSUL,"(2016, 43, 3)",-9,36.335,43.1189,10,Muhafazat Ninawa,The Australian,2,Factiva,Iraq,Citizen (Iraq),"General Population / Civilian / Social,Social",42569409,Iraq,Iraq,NULL,2016
1587,Aleppo,Syria,2016-10-28,NULL,2016-10-28,ICEWS25112083,"Earlier Friday, Kremlin spokesman Dmitry Peskov said Putin believed an extension of the humanitarian pause was possible in order to evacuate wounded residents from Aleppo and allow militants to exit the city voluntarily.",Make statement,US Welcomes Reduced Violence in Aleppo After Russia Backs Extended Humanitarian Pause,"(2016, 43, 3)",0,36.2012,37.1612,10,Muhafazat Halab,Unknown,5,Factiva,Russian Federation,Dmitry Peskov,"Media,Executive,Executive Office,Social,Government",42569613,Russian Federation,Vladimir Putin,"Government,Parties,(National) Major Party,Executive,Center Right,Ideological,Executive Office,Elite",2016
1588,Aleppo,Syria,2016-10-28,NULL,2016-10-28,ICEWS25112207,"Oct 28 (Interfax) - Russian Foreign Minister Sergei Lavrov and U.S. Secretary of State John Kerry discussed steps to settle the situation in Aleppo in northern Syria in a telephone conversation on Friday, the Russian Foreign Ministry reported.",Discuss by telephone,"Lavrov, Kerry discuss steps to normalize situation in Aleppo over telephone - Russian Foreign Ministry","(2016, 43, 3)",1,36.2012,37.1612,10,Muhafazat Halab,Interfax News Service,2,Factiva,Russian Federation,Sergey Viktorovich Lavrov,"Government,Parties,Foreign Ministry,(National) Major Party,Cabinet,Executive,Center Right,Ideological",42569659,United States,John Kerry,"Executive,Government,Center Left,Ideological,Cabinet,(National) Major Party,Upper House,Parties,Legislative / Parliamentary,Foreign Ministry",2016
1589,Aleppo,Syria,2016-10-28,NULL,2016-10-28,ICEWS25112208,"Oct 28 (Interfax) - Russian Foreign Minister Sergei Lavrov and U.S. Secretary of State John Kerry discussed steps to settle the situation in Aleppo in northern Syria in a telephone conversation on Friday, the Russian Foreign Ministry reported.",Discuss by telephone,"Lavrov, Kerry discuss steps to normalize situation in Aleppo over telephone - Russian Foreign Ministry","(2016, 43, 3)",1,36.2012,37.1612,10,Muhafazat Halab,Interfax News Service,2,Factiva,United States,John Kerry,"Executive,Government,Center Left,Ideological,Cabinet,(National) Major Party,Upper House,Parties,Legislative / Parliamentary,Foreign Ministry",42569659,Russian Federation,Sergey Viktorovich Lavrov,"Government,Parties,Foreign Ministry,(National) Major Party,Cabinet,Executive,Center Right,Ideological",2016
1590,Aleppo,Syria,2016-10-28,NULL,2016-10-28,ICEWS25112146,"MOSCOW (Sputnik) — Earlier in the day, the Russian General Staff asked Putin to allow renew airstrikes in Aleppo.",Make an appeal or request,Putin Declines Russian MoD's Request on Need to Restart Airstrikes in Aleppo,"(2016, 43, 3)",3,36.2012,37.1612,10,Muhafazat Halab,Unknown,2,Factiva,Russian Federation,Russia,NULL,42569689,Russian Federation,Vladimir Putin,"Government,Parties,(National) Major Party,Executive,Center Right,Ideological,Executive Office,Elite",2016
1591,Mosul,Iraq,2016-10-28,NULL,2016-10-28,ICEWS25112215,"WASHINGTON (Sputnik) — US-coalition forces have continued to conduct airstrikes against Daesh tunnels and other targets, as Iraqi forces remain about six to 12 miles from the city of Mosul, the spokesman added.",Employ aerial weapons,"Iraqi Forces Pausing Mosul Advance, US to Continue Airstrikes Against Daesh","(2016, 43, 3)",-10,36.335,43.1189,10,Muhafazat Ninawa,Unknown,3,Factiva,United States,Military (United States),"Military,Government",42569702,Iraq,Islamic State of Iraq and the Levant,"Insurgents,Sunni,International Religious,Ideological,Muslim,Dissident,Fundamentalist",2016
1592,NULL,Syria,2016-10-28,NULL,2016-10-28,ICEWS25112077,And he said that 'not one Russian warplane entered that area' on that day.,Make statement,Russia foreign ministry says Syria school strike photos 'fake',"(2016, 43, 3)",0,35.7667,36.6667,10,Idlib,Agence France-Presse,6,Factiva,Russian Federation,Defense / Security Ministry (Russia),"Executive,Defense / Security Ministry,Government",42569740,Russian Federation,Russia,NULL,2016
1593,Mosul,Iraq,2016-10-28,NULL,2016-10-28,ICEWS25112165,"Oct 28 (Interfax-AVN) - The Russian Defense Ministry hopes the United States will conduct an objective inquiry into the war crimes committed near the Iraqi city of Mosul, the head of the Main Operative Directorate of the Russian Armed Forces General Staff, Lieut.",Make optimistic comment,Russian Defense Ministry hopes U.S. will conduct objective inquiry into war crimes after civilians killed in Iraq,"(2016, 43, 3)",0.4,36.335,43.1189,10,Muhafazat Ninawa,Interfax News Service,2,Factiva,Russian Federation,Defense / Security Ministry (Russia),"Executive,Defense / Security Ministry,Government",42569756,United States,United States,NULL,2016
1594,Mosul,Iraq,2016-10-28,NULL,2016-10-28,ICEWS25112195,"US-coalition forces have continued to conduct airstrikes against ISIS tunnels and other targets, as Iraqi forces remain about six to 12 miles from the city of Mosul, the spokesman added.",Employ aerial weapons,Iraqi forces pausing Mosul advance,"(2016, 43, 3)",-10,36.335,43.1189,10,Muhafazat Ninawa,Unknown,2,Factiva,United States,Military (United States),"Military,Government",42569776,Iraq,Islamic State of Iraq and the Levant,"Insurgents,Sunni,International Religious,Ideological,Muslim,Dissident,Fundamentalist",2016
1595,NULL,Lebanon,2016-10-28,NULL,2016-10-28,ICEWS25112139,LEBANESE DRUZE LEADER WALID JUMBLATT SAYS MAJORITY OF HIS DEMOCRATIC GATHERING POLITICAL BLOC WILL SUPPORT MICHEL AOUN FOR PRESIDENT AT MONDAY'S VOTE - STATEMENT,Express intent to engage in diplomatic cooperation (such as policy support),LEBANESE DRUZE LEADER WALID JUMBLATT SAYS MAJORITY OF HIS DEMOCRATIC GATHERING POLITICAL BLOC WILL SUPPORT MICHEL AOUN FOR PRESIDENT AT MONDAY'S VOTE - STATEMENT,"(2016, 43, 3)",4.5,33.8889,35.4944,10,NULL,Reuters News,1,Factiva,Lebanon,Walid Jumblatt,"Parties,Government,International Religious,Center Left,Legislative / Parliamentary,Ideological,(National) Minor Party,Druze",42569788,Lebanon,Michel Aoun,"Unicameral,Parties,Government,Center Right,Ideological,Legislative / Parliamentary,(National) Minor Party",2016
1604,Aleppo,Syria,2016-10-28,NULL,2016-10-28,ICEWS25112267,"Oct 28 (Interfax) - Russian Foreign Minister Sergei Lavrov and U.S. Secretary of State John Kerry discussed steps to settle the situation in Aleppo in northern Syria in a telephone conversation on Friday, the Russian Foreign Ministry reported.",Discuss by telephone,"Lavrov, Kerry discuss steps to normalize situation in Aleppo over telephone - Russian Foreign Ministry (Part 2)","(2016, 43, 3)",1,36.2012,37.1612,10,Muhafazat Halab,Interfax News Service,2,Factiva,Russian Federation,Sergey Viktorovich Lavrov,"Government,Cabinet,Executive,Ideological,Foreign Ministry,Parties,Center Right,(National) Major Party",42570015,United States,John Kerry,"Government,Executive,(National) Major Party,Cabinet,Parties,Upper House,Ideological,Center Left,Legislative / Parliamentary,Foreign Ministry",2016
1605,Aleppo,Syria,2016-10-28,NULL,2016-10-28,ICEWS25112268,"Oct 28 (Interfax) - Russian Foreign Minister Sergei Lavrov and U.S. Secretary of State John Kerry discussed steps to settle the situation in Aleppo in northern Syria in a telephone conversation on Friday, the Russian Foreign Ministry reported.",Discuss by telephone,"Lavrov, Kerry discuss steps to normalize situation in Aleppo over telephone - Russian Foreign Ministry (Part 2)","(2016, 43, 3)",1,36.2012,37.1612,10,Muhafazat Halab,Interfax News Service,2,Factiva,United States,John Kerry,"Government,Executive,(National) Major Party,Cabinet,Parties,Upper House,Ideological,Center Left,Legislative / Parliamentary,Foreign Ministry",42570015,Russian Federation,Sergey Viktorovich Lavrov,"Government,Cabinet,Executive,Ideological,Foreign Ministry,Parties,Center Right,(National) Major Party",2016
1606,Aleppo,Syria,2016-10-28,NULL,2016-10-28,ICEWS25112265,"'Sergei Lavrov and John Kerry also discussed measures to facilitate the settlement of crises in Yemen and Libya and also some issues on the bilateral agenda,' the Russian Foreign Ministry said.",Consult,"Lavrov, Kerry discuss steps to normalize situation in Aleppo over telephone - Russian Foreign Ministry (Part 2)","(2016, 43, 3)",1,36.2012,37.1612,10,Muhafazat Halab,Interfax News Service,5,Factiva,Russian Federation,Sergey Viktorovich Lavrov,"Government,Cabinet,Executive,Ideological,Foreign Ministry,Parties,Center Right,(National) Major Party",42570015,United States,John Kerry,"Government,Executive,(National) Major Party,Cabinet,Parties,Upper House,Ideological,Center Left,Legislative / Parliamentary,Foreign Ministry",2016
1607,Aleppo,Syria,2016-10-28,NULL,2016-10-28,ICEWS25112266,"'Sergei Lavrov and John Kerry also discussed measures to facilitate the settlement of crises in Yemen and Libya and also some issues on the bilateral agenda,' the Russian Foreign Ministry said.",Consult,"Lavrov, Kerry discuss steps to normalize situation in Aleppo over telephone - Russian Foreign Ministry (Part 2)","(2016, 43, 3)",1,36.2012,37.1612,10,Muhafazat Halab,Interfax News Service,5,Factiva,United States,John Kerry,"Government,Executive,(National) Major Party,Cabinet,Parties,Upper House,Ideological,Center Left,Legislative / Parliamentary,Foreign Ministry",42570015,Russian Federation,Sergey Viktorovich Lavrov,"Government,Cabinet,Executive,Ideological,Foreign Ministry,Parties,Center Right,(National) Major Party",2016
1608,Mosul,Iraq,2016-10-28,NULL,2016-10-28,ICEWS25112371,"Oct 28 (Interfax-AVN) - The Russian Defense Ministry hopes the United States will conduct an objective inquiry into the war crimes committed near the Iraqi city of Mosul, the head of the Main Operative Directorate of the Russian Armed Forces General Staff, Lieut.",Make optimistic comment,Russian Defense Ministry hopes U.S. will conduct objective inquiry into war crimes after civilians killed in Iraq (Part 2),"(2016, 43, 3)",0.4,36.335,43.1189,10,Muhafazat Ninawa,Interfax News Service,2,Factiva,Russian Federation,Defense / Security Ministry (Russia),"Defense / Security Ministry,Government,Executive",42570017,United States,United States,NULL,2016
1609,Doha,Qatar,2016-10-28,NULL,2016-10-28,ICEWS25112244,"Palestinian president and Fatah leader Mahmud Abbas has met the head of Hamas and his deputy in Qatar, a Palestinian official said Friday, in a sign of easing tensions.",Consult,Palestinian president meets Hamas chief,"(2016, 43, 3)",1,25.2793,51.5224,10,Baladiyat ad Dawhah,Agence France-Presse,1,Factiva,Occupied Palestinian Territory,"Head of Government (Palestinian Territory, Occupied)","Executive Office,Government,Executive",42570024,Qatar,Police (Qatar),"Government,Police",2016
1610,Doha,Qatar,2016-10-28,NULL,2016-10-28,ICEWS25112245,"Palestinian president and Fatah leader Mahmud Abbas has met the head of Hamas and his deputy in Qatar, a Palestinian official said Friday, in a sign of easing tensions.",Consult,Palestinian president meets Hamas chief,"(2016, 43, 3)",1,25.2793,51.5224,10,Baladiyat ad Dawhah,Agence France-Presse,1,Factiva,Occupied Palestinian Territory,Mahmoud Abbas,"Elite,Executive Office,Government,Executive",42570024,Qatar,Police (Qatar),"Government,Police",2016
1611,Doha,Qatar,2016-10-28,NULL,2016-10-28,ICEWS25112248,"Palestinian president and Fatah leader Mahmud Abbas has met the head of Hamas and his deputy in Qatar, a Palestinian official said Friday, in a sign of easing tensions.",Consult,Palestinian president meets Hamas chief,"(2016, 43, 3)",1,25.2793,51.5224,10,Baladiyat ad Dawhah,Agence France-Presse,1,Factiva,Qatar,Police (Qatar),"Government,Police",42570024,Occupied Palestinian Territory,"Head of Government (Palestinian Territory, Occupied)","Executive Office,Government,Executive",2016
1612,Doha,Qatar,2016-10-28,NULL,2016-10-28,ICEWS25112249,"Palestinian president and Fatah leader Mahmud Abbas has met the head of Hamas and his deputy in Qatar, a Palestinian official said Friday, in a sign of easing tensions.",Consult,Palestinian president meets Hamas chief,"(2016, 43, 3)",1,25.2793,51.5224,10,Baladiyat ad Dawhah,Agence France-Presse,1,Factiva,Qatar,Police (Qatar),"Government,Police",42570024,Occupied Palestinian Territory,Mahmoud Abbas,"Elite,Executive Office,Government,Executive",2016
1613,Aleppo,Syria,2016-10-28,NULL,2016-10-28,ICEWS25112324,"On Thursday, the Syrian army launched heavy fire an ISIL fuel convoy in Aleppo province, blowing up most of the tankers, as the terrorists were sustaining growing loss in the illegal trade of black gold in Syria.",fight with small arms and light weapons,"Fierce Clashes Underway Between Gov't Forces, Terrorists across Aleppo City","(2016, 43, 3)",-10,36.2012,37.1612,10,Muhafazat Halab,FARS News Agency,5,Factiva,Syria,Military (Syria),"Government,Military",42570049,Syria,Syria,NULL,2016
1614,Tallbisah,Syria,2016-10-28,NULL,2016-10-28,ICEWS25112285,"Also, a commander of Ahrar al-Sham terrorist group, called Faisal al-Awaz, and a number of other militants were killed in the army's special operations in Ain Hossein village near Talbiseh in the Northern parts of Homs.",Use conventional military force,Homs: Convoy of Terrorists' Vehicles Hit Hard in Syrian Gov't Forces' Attack,"(2016, 43, 3)",-10,34.8406,36.7309,10,Muhafazat Hims,FARS News Agency,6,Factiva,Syria,Military (Syria),"Government,Military",42570050,Syria,Militant (Syria),Unidentified Forces,2016
1615,Khan Shaykhun,Syria,2016-10-28,NULL,2016-10-28,ICEWS25112379,"The Syrian fighter jets also launched heavy air assaults on terrorists' centers in Khan Sheikhoun, Sarjeh, Ma'arat Mesrin, al-Bardeh and Heish in Idlib.",Employ aerial weapons,Terrorists' Centers in Three Provinces Receive Sever Blow in Syrian Airstrikes,"(2016, 43, 3)",-10,35.4421,36.651,10,Idlib,FARS News Agency,3,Factiva,Syria,Fighter Bomber (Syria),"Government,Military",42570051,Syria,Syria,NULL,2016
1616,NULL,Syria,2016-10-28,NULL,2016-10-28,ICEWS25112339,"Meantime, Saida Prison and the region to the East of al-Naima town in Eastern Dara'a was the scene of heavy fighting between the Syrian army men and militants.",Use unconventional violence,Syrian Army Engages in Fierce Clashes with Fatah Al-Sham Terrorists in Dara'a Province,"(2016, 43, 3)",-9,32.85,36.2167,10,Muhafazat Dar`a,FARS News Agency,3,Factiva,Syria,Men (Syria),"Social,General Population / Civilian / Social",42570053,Syria,Militant (Syria),Unidentified Forces,2016
