,City,Country,Datetime,District,Event Date,Event ID,Event Sentence,Event Text,Headline,ISO Week,Intensity,Latitude,Longitude,Month,Province,Publisher,Sentence Number,Source,Source Country,Source Name,Source Sectors,Story ID,Target Country,Target Name,Target Sectors,Year
1722,Cairo,Egypt,2016-02-13,NULL,2016-02-13,ICEWS24162847,"Cairo, Feb 13, 2016 (Aswat Masriya/All Africa Global Media via COMTEX) -- One-time defence minster, Egyptian President Abdel Fattah al-Sisi said Egypt has been able to 'break' terrorist organisations across the country, in a key speech before parliament on Saturday.",Make statement,Sisi Hands Over Legislative Authority to Egypt's House,"(2016, 6, 3)",0,30.0626,31.2497,2,Muhafazat al Qahirah,All Africa,1,Factiva,Egypt,Abdel Fattah Al-Sisi,"Government,Executive Office,Executive,Elite,International Religious,Sunni",40330994,Egypt,Egypt,NULL,2016
1723,Cairo,Egypt,2016-02-13,NULL,2016-02-13,ICEWS24162846,Sisi handed over legislative power from himself to the House.,Accede to demands for change in leadership,Sisi Hands Over Legislative Authority to Egypt's House,"(2016, 6, 3)",5,30.0626,31.2497,2,Muhafazat al Qahirah,All Africa,5,Factiva,Egypt,Abdel Fattah Al-Sisi,"Government,Executive Office,Executive,Elite,International Religious,Sunni",40330994,Egypt,House of Representatives (Egypt),"Government,Legislative / Parliamentary",2016
1724,NULL,Egypt,2016-02-13,NULL,2016-02-13,ICEWS24162859,"Feb 13, 2016 (Egypt State Information Service/All Africa Global Media via COMTEX) -- Parliament Speaker Ali Abdel Aal said the parliament as the legislative authority is adamant to shoulder the responsibility of settling the Egyptians' problems.",Make statement,Abdel Aal - Parl't Adamant to Settle All Egyptians' Problems,"(2016, 6, 3)",0,30.0626,31.2497,2,NULL,All Africa,1,Factiva,Egypt,Member of Legislative (Govt) (Egypt),"Government,Legislative / Parliamentary",40331003,Egypt,Legislature (Egypt),"Government,Legislative / Parliamentary",2016
1725,NULL,Egypt,2016-02-13,NULL,2016-02-13,ICEWS24162857,"Addressing Saturday's parliamentary session in which President Abdel Fattah El Sisi delivered a speech, Abdel Aal welcomed the president's participation in the session which coincides with the 150th anniversary of establishing the parliament in Egypt.",Praise or endorse,Abdel Aal - Parl't Adamant to Settle All Egyptians' Problems,"(2016, 6, 3)",3.4,30.0626,31.2497,2,NULL,All Africa,2,Factiva,Egypt,Member of Legislative (Govt) (Egypt),"Government,Legislative / Parliamentary",40331003,Egypt,Abdel Fattah Al-Sisi,"Government,Executive Office,Executive,Elite,International Religious,Sunni",2016
1726,NULL,Egypt,2016-02-13,NULL,2016-02-13,ICEWS24162858,He said Sisi is the president of all Egyptians with all their political inclinations.,Make statement,Abdel Aal - Parl't Adamant to Settle All Egyptians' Problems,"(2016, 6, 3)",0,30.0626,31.2497,2,NULL,All Africa,3,Factiva,Egypt,Member of Legislative (Govt) (Egypt),"Government,Legislative / Parliamentary",40331003,Egypt,Abdel Fattah Al-Sisi,"Government,Executive Office,Executive,Elite,International Religious,Sunni",2016
1727,NULL,Egypt,2016-02-13,NULL,2016-02-13,ICEWS24162860,"Feb 13, 2016 (Egypt State Information Service/All Africa Global Media via COMTEX) -- Egyptian Foreign Minister Sameh Shoukry held a meeting on Saturday 13/02/2016 with the UN envoy to Syria Staffan de Mistura.",Consult,FM Meets UN Envoy to Syria,"(2016, 6, 3)",1,30.0626,31.2497,2,NULL,All Africa,1,Factiva,NULL,United Nations,"International Government Organization,Global,Global Diplomatic IGOs",40331004,Egypt,Sameh Shoukry,"Government,Executive,Foreign Ministry",2016
1728,NULL,Egypt,2016-02-13,NULL,2016-02-13,ICEWS24162861,"Feb 13, 2016 (Egypt State Information Service/All Africa Global Media via COMTEX) -- Egyptian Foreign Minister Sameh Shoukry held a meeting on Saturday 13/02/2016 with the UN envoy to Syria Staffan de Mistura.",Consult,FM Meets UN Envoy to Syria,"(2016, 6, 3)",1,30.0626,31.2497,2,NULL,All Africa,1,Factiva,Egypt,Sameh Shoukry,"Government,Executive,Foreign Ministry",40331004,NULL,United Nations,"International Government Organization,Global,Global Diplomatic IGOs",2016
1729,Qabil,Egypt,2016-02-13,NULL,2016-02-13,ICEWS24162865,"Feb 13, 2016 (Egypt State Information Service/All Africa Global Media via COMTEX) -- Minister of Trade and Industry Tarek Qabil asserted that President Abdel Fattah El Sisi's upcoming visit to Japan, expected in late February, is an important step towards enhancing economic, trade and investment relations between the two countries and will offer a good chance to open new horizons for Egyptian exports on the Japanese market.",Express intent to meet or negotiate,Minister - Sisi's Visit to Japan Opens New Horizons for Egyptian Exports,"(2016, 6, 3)",4,31.0931,30.4152,2,Beheira Governorate,All Africa,1,Factiva,Egypt,Abdel Fattah Al-Sisi,"Government,Executive Office,Executive,Elite,International Religious,Sunni",40331005,Japan,Japan,NULL,2016
1730,Cairo,Egypt,2016-02-13,NULL,2016-02-13,ICEWS24162862,The remark was made in a statement released on Saturday 13/02/2016 by the Trade and Industry Ministry following Qabil's meeting with Japanese Ambassador in Cairo Takihiro Kagawa.,Consult,Minister - Sisi's Visit to Japan Opens New Horizons for Egyptian Exports,"(2016, 6, 3)",1,30.0626,31.2497,2,Muhafazat al Qahirah,All Africa,2,Factiva,Japan,Foreign Affairs (Japan),"Foreign Ministry,Executive,Government",40331005,Japan,Head of Government (Japan),"Executive,Government,Executive Office",2016
1731,Cairo,Egypt,2016-02-13,NULL,2016-02-13,ICEWS24162863,The remark was made in a statement released on Saturday 13/02/2016 by the Trade and Industry Ministry following Qabil's meeting with Japanese Ambassador in Cairo Takihiro Kagawa.,Consult,Minister - Sisi's Visit to Japan Opens New Horizons for Egyptian Exports,"(2016, 6, 3)",1,30.0626,31.2497,2,Muhafazat al Qahirah,All Africa,2,Factiva,Japan,Head of Government (Japan),"Executive,Government,Executive Office",40331005,Japan,Foreign Affairs (Japan),"Foreign Ministry,Executive,Government",2016
1732,Cairo,Egypt,2016-02-13,NULL,2016-02-13,ICEWS24162864,Qabil said that Sisi will meet with senior Japanese officials topped by the prime minister and the Japanese Emperor.,Express intent to meet or negotiate,Minister - Sisi's Visit to Japan Opens New Horizons for Egyptian Exports,"(2016, 6, 3)",4,30.0626,31.2497,2,Muhafazat al Qahirah,All Africa,3,Factiva,Egypt,Abdel Fattah Al-Sisi,"Government,Executive Office,Executive,Elite,International Religious,Sunni",40331005,Japan,Japan,NULL,2016
1745,NULL,Bahrain,2016-02-13,NULL,2016-02-13,ICEWS24163002,AI called for the government to take accountability not only for current conditions but for the security forces that committed abuses during the initial protests.,Make an appeal or request,Amnesty: Bahrain rights reform outlook bleak,"(2016, 6, 3)",3,26.2154,50.5832,2,NULL,FARS News Agency,4,Factiva,NULL,Amnesty International,"Human Rights IGOs,Nongovernmental Organization (International)",40331229,Bahrain,Bahrain,NULL,2016
1746,NULL,Iraq,2016-02-13,NULL,2016-02-13,ICEWS24163010,"A 13-year-old Iraqi girl's home burned after she criticised the governor of a central Iraq province in a televised interview, her father and police said on Saturday.",Criticize or denounce,Iraqi girl's home burned after she criticised governor,"(2016, 6, 3)",-2,32.6667,44.5833,2,Muhafazat Babil,Agence France-Presse,1,Factiva,Iraq,Children (Iraq),"General Population / Civilian / Social,Social",40331243,Iraq,Governor (Iraq),"Provincial,Local,Government",2016
1747,Douma,Syria,2016-02-13,NULL,2016-02-13,ICEWS24163011,"According to UN figures, some 486,700 people in Syria currently live in areas besieged by either government or rebel forces.",Use unconventional violence,Aid convoy enters rebel-held area near Syrian capital,"(2016, 6, 3)",-9,33.5718,36.4027,2,Muhafazat Rif Dimashq,Agence France-Presse,4,Factiva,Syria,Rebel Group (Syria),"Dissident,Rebel",40331244,Syria,Syria,NULL,2016
1748,Douma,Syria,2016-02-13,NULL,2016-02-13,ICEWS24163012,"According to UN figures, some 486,700 people in Syria currently live in areas besieged by either government or rebel forces.",Use conventional military force,Aid convoy enters rebel-held area near Syrian capital,"(2016, 6, 3)",-10,33.5718,36.4027,2,Muhafazat Rif Dimashq,Agence France-Presse,4,Factiva,Syria,Government (Syria),Government,40331244,Syria,Syria,NULL,2016
1749,NULL,Egypt,2016-02-13,Markaz Bani Suwayf,2016-02-13,ICEWS24163026,"In statements on Thursday, Ahmed Ibrahim said the ministry seeks to encourage businessmen to engage in a number of transportation projects.",Make statement,Transport Ministry Needs Egp 90 Billion for Upgrading Railway Sector,"(2016, 6, 3)",0,29.0833,31,2,Muhafazat Bani Suwayf,All Africa,2,Factiva,Libya,Ahmad Mohamed Ibrahim,"Executive Office,Executive,Government,Unicameral,Legislative / Parliamentary",40331257,Egypt,Ministry (Egypt),Government,2016
1750,NULL,Egypt,2016-02-13,Markaz Bani Suwayf,2016-02-13,ICEWS24163025,"The minister apologized to people injured in the Beni Suef train accident for the bad railway service, stressing that the ministry will be responsible for treating all injured.",Apologize,Transport Ministry Needs Egp 90 Billion for Upgrading Railway Sector,"(2016, 6, 3)",7,29.0833,31,2,Muhafazat Bani Suwayf,All Africa,3,Factiva,Egypt,Ministry (Egypt),Government,40331257,Egypt,Citizen (Egypt),"Social,General Population / Civilian / Social",2016
1751,NULL,Egypt,2016-02-13,NULL,2016-02-13,ICEWS24163024,Police arrested the train driver as he did not abide by instructions of the control tower and the train was about to collide with the Assiut train.,"Arrest, detain, or charge with legal action",Transport Ministry Needs Egp 90 Billion for Upgrading Railway Sector,"(2016, 6, 3)",-5,27.2,31.1,2,Muhafazat Asyut,All Africa,6,Factiva,Egypt,Police (Egypt),"Police,Government",40331257,Egypt,Citizen (Egypt),"Social,General Population / Civilian / Social",2016
1752,Cairo,Egypt,2016-02-13,NULL,2016-02-13,ICEWS24163029,The Egyptian diplomat asserted that Cairo is open to talks with its European partners and is keen on keeping them informed with the challenges that are currently facing Egypt and the whole region.,Make statement,"Egypt, Ireland Hold 3rd Round of Political Talks in Cairo","(2016, 6, 3)",0,30.0626,31.2497,2,Muhafazat al Qahirah,All Africa,6,Factiva,Egypt,Foreign Affairs (Egypt),"Foreign Ministry,Executive,Government",40331260,Egypt,Egypt,NULL,2016
1753,Sharm ash Shaykh,Egypt,2016-02-13,NULL,2016-02-13,ICEWS24163034,"Feb 13, 2016 (Egypt State Information Service/All Africa Global Media via COMTEX) -- Egypt, Sudan, and Ethiopia will hold a three-way summit in Egypt's Sharm el Sheikh to discuss the Nile water file and developments of the Ethiopian Renaissance Dam.",Express intent to meet or negotiate,Tripartite Summit in Sharm El-Sheikh to Discuss Nile Water File,"(2016, 6, 3)",4,27.9158,34.3299,2,Muhafazat Janub Sina',All Africa,1,Factiva,Egypt,Egypt,NULL,40331262,Ethiopia,Ethiopia,NULL,2016
1754,Sharm ash Shaykh,Egypt,2016-02-13,NULL,2016-02-13,ICEWS24163035,"Feb 13, 2016 (Egypt State Information Service/All Africa Global Media via COMTEX) -- Egypt, Sudan, and Ethiopia will hold a three-way summit in Egypt's Sharm el Sheikh to discuss the Nile water file and developments of the Ethiopian Renaissance Dam.",Express intent to meet or negotiate,Tripartite Summit in Sharm El-Sheikh to Discuss Nile Water File,"(2016, 6, 3)",4,27.9158,34.3299,2,Muhafazat Janub Sina',All Africa,1,Factiva,Sudan,Sudan,NULL,40331262,Ethiopia,Ethiopia,NULL,2016
1755,Sharm ash Shaykh,Egypt,2016-02-13,NULL,2016-02-13,ICEWS24163036,"Feb 13, 2016 (Egypt State Information Service/All Africa Global Media via COMTEX) -- Egypt, Sudan, and Ethiopia will hold a three-way summit in Egypt's Sharm el Sheikh to discuss the Nile water file and developments of the Ethiopian Renaissance Dam.",Express intent to meet or negotiate,Tripartite Summit in Sharm El-Sheikh to Discuss Nile Water File,"(2016, 6, 3)",4,27.9158,34.3299,2,Muhafazat Janub Sina',All Africa,1,Factiva,Ethiopia,Ethiopia,NULL,40331262,Egypt,Egypt,NULL,2016
1756,Sharm ash Shaykh,Egypt,2016-02-13,NULL,2016-02-13,ICEWS24163037,"Feb 13, 2016 (Egypt State Information Service/All Africa Global Media via COMTEX) -- Egypt, Sudan, and Ethiopia will hold a three-way summit in Egypt's Sharm el Sheikh to discuss the Nile water file and developments of the Ethiopian Renaissance Dam.",Express intent to meet or negotiate,Tripartite Summit in Sharm El-Sheikh to Discuss Nile Water File,"(2016, 6, 3)",4,27.9158,34.3299,2,Muhafazat Janub Sina',All Africa,1,Factiva,Sudan,Sudan,NULL,40331262,Egypt,Egypt,NULL,2016
1757,Sharm ash Shaykh,Egypt,2016-02-13,NULL,2016-02-13,ICEWS24163038,"Feb 13, 2016 (Egypt State Information Service/All Africa Global Media via COMTEX) -- Egypt, Sudan, and Ethiopia will hold a three-way summit in Egypt's Sharm el Sheikh to discuss the Nile water file and developments of the Ethiopian Renaissance Dam.",Express intent to meet or negotiate,Tripartite Summit in Sharm El-Sheikh to Discuss Nile Water File,"(2016, 6, 3)",4,27.9158,34.3299,2,Muhafazat Janub Sina',All Africa,1,Factiva,Ethiopia,Ethiopia,NULL,40331262,Sudan,Sudan,NULL,2016
1758,Sharm ash Shaykh,Egypt,2016-02-13,NULL,2016-02-13,ICEWS24163039,"Feb 13, 2016 (Egypt State Information Service/All Africa Global Media via COMTEX) -- Egypt, Sudan, and Ethiopia will hold a three-way summit in Egypt's Sharm el Sheikh to discuss the Nile water file and developments of the Ethiopian Renaissance Dam.",Express intent to meet or negotiate,Tripartite Summit in Sharm El-Sheikh to Discuss Nile Water File,"(2016, 6, 3)",4,27.9158,34.3299,2,Muhafazat Janub Sina',All Africa,1,Factiva,Egypt,Egypt,NULL,40331262,Sudan,Sudan,NULL,2016
1759,Sharm ash Shaykh,Egypt,2016-02-13,NULL,2016-02-13,ICEWS24163032,This was announced during talks Egypt's Foreign Minister Sameh Shoukry held with his Ethiopian counterpart Tedros Adhanom on the sidelines of Munich Security Conference.,Engage in negotiation,Tripartite Summit in Sharm El-Sheikh to Discuss Nile Water File,"(2016, 6, 3)",7,27.9158,34.3299,2,Muhafazat Janub Sina',All Africa,2,Factiva,Ethiopia,Tedros Adhanom,"Government,Executive,Foreign Ministry",40331262,Egypt,Sameh Shoukry,"Foreign Ministry,Executive,Government",2016
1760,Sharm ash Shaykh,Egypt,2016-02-13,NULL,2016-02-13,ICEWS24163033,This was announced during talks Egypt's Foreign Minister Sameh Shoukry held with his Ethiopian counterpart Tedros Adhanom on the sidelines of Munich Security Conference.,Engage in negotiation,Tripartite Summit in Sharm El-Sheikh to Discuss Nile Water File,"(2016, 6, 3)",7,27.9158,34.3299,2,Muhafazat Janub Sina',All Africa,2,Factiva,Egypt,Sameh Shoukry,"Foreign Ministry,Executive,Government",40331262,Ethiopia,Tedros Adhanom,"Government,Executive,Foreign Ministry",2016
1761,NULL,Egypt,2016-02-13,NULL,2016-02-13,ICEWS24163040,"Feb 13, 2016 (Egypt State Information Service/All Africa Global Media via COMTEX) -- President Abdel Fattah el Sisi congratulated the House of Representatives on the precious trust given to the MPs by the Egyptians.",Praise or endorse,Sisi Addresses House of Representatives,"(2016, 6, 3)",3.4,30.0626,31.2497,2,NULL,All Africa,1,Factiva,Egypt,Abdel Fattah Al-Sisi,"Sunni,Elite,Executive,Executive Office,Government,International Religious",40331263,Egypt,House of Representatives (Egypt),"Legislative / Parliamentary,Government",2016
1762,NULL,Egypt,2016-02-13,NULL,2016-02-13,ICEWS24163041,"Sisi, meanwhile, called on the MPs to stand for a moment of silence for all the country's martyrs, which he said that 'they sacrificed their lives for reaching this historic moment that we are passing through.'",Make an appeal or request,Sisi Addresses House of Representatives,"(2016, 6, 3)",3,30.0626,31.2497,2,NULL,All Africa,3,Factiva,Egypt,Abdel Fattah Al-Sisi,"Sunni,Elite,Executive,Executive Office,Government,International Religious",40331263,Egypt,Member of Parliament (Egypt),"Legislative / Parliamentary,Government",2016
1768,NULL,Iraq,2016-02-13,NULL,2016-02-13,ICEWS24163144,"MOSCOW, February 13 (Sputnik) - German Foreign Minister Frank-Walter Steinmeier met Iraqi Kurdish leader Masoud Barzani Saturday, expressing concerns that a statehood referendum would bring further destabilization, media reported.",Consult,German Foreign Minister Warns Iraqi Kurd Leader Against Statehood Referendum,"(2016, 6, 3)",1,36.2267,44.7611,2,Kurdistan,Unknown,1,Factiva,Iraq,Massoud Barzani,"Local,Provincial,(National) Minor Party,Nationalist,Kurd (Ethnic Group),Parties,Government,International Ethnic,Sunni,Ideological,International Religious",40331413,Germany,Frank-Walter Steinmeier,"Parties,Lower House,(National) Major Party,Legislative / Parliamentary,Government,Executive,Elite,Center Left,Ideological,Foreign Ministry,Protestant,International Religious",2016
1769,NULL,Iraq,2016-02-13,NULL,2016-02-13,ICEWS24163145,"MOSCOW, February 13 (Sputnik) - German Foreign Minister Frank-Walter Steinmeier met Iraqi Kurdish leader Masoud Barzani Saturday, expressing concerns that a statehood referendum would bring further destabilization, media reported.",Consult,German Foreign Minister Warns Iraqi Kurd Leader Against Statehood Referendum,"(2016, 6, 3)",1,36.2267,44.7611,2,Kurdistan,Unknown,1,Factiva,Germany,Frank-Walter Steinmeier,"Parties,Lower House,(National) Major Party,Legislative / Parliamentary,Government,Executive,Elite,Center Left,Ideological,Foreign Ministry,Protestant,International Religious",40331413,Iraq,Massoud Barzani,"Local,Provincial,(National) Minor Party,Nationalist,Kurd (Ethnic Group),Parties,Government,International Ethnic,Sunni,Ideological,International Religious",2016
1774,Azaz,Syria,2016-02-13,NULL,2016-02-13,ICEWS24163342,"'We have urged Syrian Kurdish and other forces affiliated with the YPG not to take advantage of a confused situation by seizing new territory,' Kirby said.",Occupy territory,US urges Turkey to halt Syria strikes,"(2016, 6, 3)",-9.5,36.5866,37.0463,2,Muhafazat Halab,Agence France-Presse,5,Factiva,Turkey,Turkish Kurds,"International Ethnic,Kurd (Ethnic Group)",40331800,Syria,Syria,NULL,2016
1775,Azaz,Syria,2016-02-13,NULL,2016-02-13,ICEWS24163350,"The shelling came just hours after Turkish Prime Minister Ahmet Davutoglu said on Saturday that Turkey, 'if necessary,' will take military actions against the Kurds in Syria.",Threaten,Turkey confirms military response to shelling from Syria,"(2016, 6, 3)",-4.4,36.5866,37.0463,2,Muhafazat Halab,Xinhua News Agency,6,Factiva,Turkey,Turkey,NULL,40331808,Syria,Syrian Kurds,"National Ethnic,International Ethnic,Social,Kurd (Ethnic Group),National Ethnic Minority",2016
1778,Al Fallujah,Iraq,2016-02-13,NULL,2016-02-13,ICEWS24163388,"In relevant remarks in October, Spokesman of Iraq's Kata'ib Hezbollah (Hezbollah Battalions) popular forces Jafar al-Hosseini disclosing that captured ISIL leaders have acknowledged receiving logistical backup and intelligence support from the US.",Praise or endorse,Source: Evidence Shows US Helping ISIL to Survive in Iraq,"(2016, 6, 3)",3.4,33.3558,43.7861,2,Muhafazat al Anbar,FARS News Agency,4,Factiva,United States,United States,NULL,40331951,Iraq,Islamic State of Iraq and the Levant,"Fundamentalist,International Religious,Sunni,Insurgents,Ideological,Muslim,Dissident",2016
1779,Al Fallujah,Iraq,2016-02-13,NULL,2016-02-13,ICEWS24163387,He reiterated that the US has provided the ISIL with intelligence about the Iraqi forces' positions and targets.,Share intelligence or information,Source: Evidence Shows US Helping ISIL to Survive in Iraq,"(2016, 6, 3)",7,33.3558,43.7861,2,Muhafazat al Anbar,FARS News Agency,6,Factiva,United States,United States,NULL,40331951,Iraq,Islamic State of Iraq and the Levant,"Fundamentalist,International Religious,Sunni,Insurgents,Ideological,Muslim,Dissident",2016
1780,Jizan,Saudi Arabia,2016-02-13,NULL,2016-02-13,ICEWS24163390,"TEHRAN (FNA)- The Yemeni army and popular forces attacked the Saudi forces' military positions in Jizan province in Southern Saudi Arabia, killing several of the kingdom's troops.",Use conventional military force,More Saudi Forces Killed in Yemenis' Attack on Jizan Border Region,"(2016, 6, 3)",-10,16.8892,42.5511,2,Mintaqat Jizan,FARS News Agency,1,Factiva,Yemen,Yemeni Armed Forces,"Government,Military",40331952,Saudi Arabia,Saudi Arabian Defence Forces,"Military,Government",2016
1781,Homs,Syria,2016-02-13,NULL,2016-02-13,ICEWS24163391,"In a relevant development earlier today, the Syrian Army troops and the National Defense Forces (NDF) repelled the ISIL terrorist group's assault in the Northeastern parts of Homs province, and forced them back from the battlefield.",Use conventional military force,"Dissident Source: Syrian Army Preparing to Win Back Key Town in Homs, Strategic Village in Hama","(2016, 6, 3)",-10,34.7268,36.7234,2,Muhafazat Hims,FARS News Agency,4,Factiva,Syria,Military (Syria),"Military,Government",40331953,Syria,Syria,NULL,2016
1782,Jizan,Saudi Arabia,2016-02-13,NULL,2016-02-13,ICEWS24163393,"'At least 73 Saudi forces have been killed as a result of our forces' assaults on their military positions in Jizan province,' a senior commander of Ansarullah, speaking on the condition of anonymity, told FNA on Saturday.",Use conventional military force,Tens of Saudi Forces Killed in 4 Days of Attacks in Jizan,"(2016, 6, 3)",-10,16.8892,42.5511,2,Mintaqat Jizan,FARS News Agency,2,Factiva,Saudi Arabia,Saudi Arabian Defence Forces,"Military,Government",40331954,Saudi Arabia,Saudi Arabia,NULL,2016
1783,Jizan,Saudi Arabia,2016-02-13,NULL,2016-02-13,ICEWS24163392,"Earlier on Saturday, the Yemeni forces attacked the Saudi army positions in Jizan and killed several of the kingdom's soldiers.",Use conventional military force,Tens of Saudi Forces Killed in 4 Days of Attacks in Jizan,"(2016, 6, 3)",-10,16.8892,42.5511,2,Mintaqat Jizan,FARS News Agency,3,Factiva,Yemen,Yemeni Armed Forces,"Government,Military",40331954,Saudi Arabia,Saudi Arabia,NULL,2016
1784,Aleppo,Syria,2016-02-13,NULL,2016-02-13,ICEWS24163399,YPG said earlier Turkish forces shelled the recently captured Minnigh airbase and village in Aleppo province.,fight with small arms and light weapons,Turkish Prime Minister Says N.Syria Airbase Shelling 'Retaliation' to Kurdish Forces,"(2016, 6, 3)",-10,36.2012,37.1612,2,Muhafazat Halab,Unknown,3,Factiva,Turkey,Military (Turkey),"Military,Government",40331973,Turkey,Turkey,NULL,2016
1785,Aleppo,Syria,2016-02-13,NULL,2016-02-13,ICEWS24163400,YPG said earlier Turkish forces shelled the recently captured Minnigh airbase and village in Aleppo province.,Make statement,Turkish Prime Minister Says N.Syria Airbase Shelling 'Retaliation' to Kurdish Forces,"(2016, 6, 3)",0,36.2012,37.1612,2,Muhafazat Halab,Unknown,3,Factiva,Syria,People's Protection Units,"Separatists,Dissident",40331973,Turkey,Military (Turkey),"Military,Government",2016
1788,Aleppo,Syria,2016-02-13,NULL,2016-02-13,ICEWS24163429,YPG said earlier Turkish forces shelled the recently captured Minnigh airbase and village in Aleppo province.,fight with small arms and light weapons,Turkish PM Says N.Syria Airbase Shelling 'Retaliation' to Kurdish Forces,"(2016, 6, 3)",-10,36.2012,37.1612,2,Muhafazat Halab,Unknown,4,Factiva,Turkey,Military (Turkey),"Military,Government",40332055,Turkey,Turkey,NULL,2016
1789,Aleppo,Syria,2016-02-13,NULL,2016-02-13,ICEWS24163430,YPG said earlier Turkish forces shelled the recently captured Minnigh airbase and village in Aleppo province.,Make statement,Turkish PM Says N.Syria Airbase Shelling 'Retaliation' to Kurdish Forces,"(2016, 6, 3)",0,36.2012,37.1612,2,Muhafazat Halab,Unknown,4,Factiva,Syria,People's Protection Units,"Dissident,Separatists",40332055,Turkey,Military (Turkey),"Military,Government",2016
1790,Azaz,Syria,2016-02-13,NULL,2016-02-13,ICEWS24163446,"The Syrian Observatory for Human Rights, which monitors Syria's war, said the shelling had targeted the air base and a village captured from insurgents by the PYD-backed YPG militia.",Investigate,Turkish military shells Kurds in Syria,"(2016, 6, 3)",-2,36.5866,37.0463,2,Muhafazat Halab,AAP Bulletins,5,Factiva,Syria,Syrian Observatory for Human Rights,"Dissident,Exiles",40332125,Syria,Syria,NULL,2016
1799,Azaz,Syria,2016-02-13,NULL,2016-02-13,ICEWS24163643,A Kurdish official said the Menagh base which was hit had been captured by the Kurdish-allied Jaysh al-Thuwwar group rather than the YPG.,Make statement,"Turkey strikes Kurdish militia in Syria, demands it withdraw","(2016, 6, 3)",0,36.5866,37.0463,2,Muhafazat Halab,Channel NewsAsia,4,Factiva,Turkey,Turkish Kurds,"International Ethnic,Kurd (Ethnic Group)",40332644,Syria,People's Protection Units,"Dissident,Separatists",2016
1809,Najran,Saudi Arabia,2016-02-13,NULL,2016-02-13,ICEWS24164684,"NAJRAN, Feb. 13 (Saba) – The army and popular committees forces destroyed a Saudi armored vehicle in Najran, killing its crew, a military official said on Saturday.",Use conventional military force,"Saudi vehicle destroyed in Najran, its crew killed","(2016, 6, 3)",-10,17.4924,44.1277,2,Mintaqat Najran,Yemen News Agency (SABA),1,Factiva,Saudi Arabia,Saudi Arabian Defence Forces,"Government,Military",40334896,Saudi Arabia,Citizen (Saudi Arabia),"General Population / Civilian / Social,Social",2016
1810,Najran,Saudi Arabia,2016-02-13,NULL,2016-02-13,ICEWS24164686,"He pointed out that snipers of the army and committees shot dead a Saudi soldier in the west of al-Tewal border outlet, as well as blowing up a Saudi troop carrier with an explosive device in the south of al-Manaq area.",fight with small arms and light weapons,"Saudi vehicle destroyed in Najran, its crew killed","(2016, 6, 3)",-10,17.4924,44.1277,2,Mintaqat Najran,Yemen News Agency (SABA),3,Factiva,Saudi Arabia,Citizen (Saudi Arabia),"General Population / Civilian / Social,Social",40334896,Saudi Arabia,Saudi Arabian Defence Forces,"Government,Military",2016
