,City,Country,Datetime,District,Event Date,Event ID,Event Sentence,Event Text,Headline,ISO Week,Intensity,Latitude,Longitude,Month,Province,Publisher,Sentence Number,Source,Source Country,Source Name,Source Sectors,Story ID,Target Country,Target Name,Target Sectors,Year
1195,Afrin,Syria,2018-02-02,NULL,2018-02-02,ICEWS28497840,"Turkey and allied Syrian rebels have since Jan. 20 pressed an offensive against the Kurdish enclave of Afrin in northern Syria, whose Kurdish fighters Ankara views as 'terrorists'.",Use unconventional violence,Syria Kurds outraged over mutilated body of female fighter; Syria Kurds outraged over mutilated body of female fighter,"(2018, 5, 3)",-9,36.5119,36.8695,2,Muhafazat Halab,Unknown,2,Factiva,Syria,Armed Rebel (Syria),"Rebel,Dissident",46471649,Syria,Syria,NULL,2018
1196,Afrin,Syria,2018-02-02,NULL,2018-02-02,ICEWS28497841,"The Syrian Observatory for Human Rights, a Britain-based monitor, said it received the video from a Syrian rebel fighting with Turkish forces in the Afrin offensive.",Use conventional military force,Syria Kurds outraged over mutilated body of female fighter; Syria Kurds outraged over mutilated body of female fighter,"(2018, 5, 3)",-10,36.5119,36.8695,2,Muhafazat Halab,Unknown,5,Factiva,Syria,Syria,NULL,46471649,Turkey,Military (Turkey),"Government,Military",2018
1197,Qana,Lebanon,2018-02-02,NULL,2018-02-02,ICEWS28497838,"Beirut -- BEIRUT: The Internal Security Forces arrested a suspect on drug-related charges in the town of Qana, east of Tyre, a statement from the agency announced Friday.","Arrest, detain, or charge with legal action",ISF arrests suspected drug dealer; ISF arrests suspected drug dealer,"(2018, 5, 3)",-5,33.2089,35.2994,2,Mohafazat Liban-Sud,Unknown,1,Factiva,Lebanon,Military Personnel - Special (Lebanon),"Military,Government",46471654,Lebanon,Criminal (Lebanon),"Dissident,Criminals / Gangs",2018
1198,Damascus,Syria,2018-02-02,NULL,2018-02-02,ICEWS28497827,"The bloodshed came a day after the latest suspected chlorine attack by the regime of President Bashar Assad on Ghouta, which has been besieged by government forces since 2013.",Use conventional military force,Regime attack on Syria's Ghouta kills 11: monitor; Regime attack on Syria's Ghouta kills 11: monitor,"(2018, 5, 3)",-10,33.5102,36.2913,2,Dimashq,Unknown,2,Factiva,Syria,Government (Syria),Government,46471655,Syria,Syria,NULL,2018
1199,Beirut,Lebanon,2018-02-02,NULL,2018-02-02,ICEWS28497842,"Beirut -- WASHINGTON: The Trump administration is willing to work with Congress to go through the process of determining whether a second memo, written by Democrats on the House Intelligence Committee, could be made public, the White House said Friday.",Express intent to engage in diplomatic cooperation (such as policy support),White House says ready to work with Congress on possible release of Democrats' memo; White House says ready to work with Congress on possible release of Democrats' memo,"(2018, 5, 3)",4.5,33.8889,35.4944,2,Beyrouth,Unknown,1,Factiva,United States,Donald Trump,"Executive Office,Government,Executive",46471656,Lebanon,Congress (Lebanon),"Legislative / Parliamentary,Government",2018
1206,NULL,Syria,2018-02-03,NULL,2018-02-03,ICEWS28498440,"The United States is investigating whether the Syrian government recently used sarin gas in attacks on the opposition, US Secretary of Defense Jim Mattis said Friday.",Investigate,US investigating possible sarin gas attacks in Syria: Defense Secretary Jim Mattis,"(2018, 5, 3)",-2,33.5102,36.2913,2,NULL,Deutsche Welle,3,Factiva,United States,United States,NULL,46473199,Syria,Syria,NULL,2018
1207,NULL,Saudi Arabia,2018-02-03,NULL,2018-02-03,ICEWS28498641,"Representatives of Tajikistan and Saudi Arabia discussed issues of cooperation between law-enforcement agencies of the two countries, local news agency TajikTA reported.",Consult,"Tajikistan, Saudi Arabia to strengthen co-op between law-enforcement agencies","(2018, 5, 3)",1,24.6877,46.7219,2,NULL,Unknown,1,Factiva,Saudi Arabia,Saudi Arabia,NULL,46473706,Tajikistan,Tajikistan,NULL,2018
1208,NULL,Saudi Arabia,2018-02-03,NULL,2018-02-03,ICEWS28498642,“Tajik Ambassador to Saudi Arabia Zarobiddin Kosimi met with Saudi Arabia’s attorney general Saud bin Abdullah al-Mujib.,Consult,"Tajikistan, Saudi Arabia to strengthen co-op between law-enforcement agencies","(2018, 5, 3)",1,24.6877,46.7219,2,NULL,Unknown,2,Factiva,Tajikistan,Foreign Affairs (Tajikistan),"Government,Executive,Foreign Ministry",46473706,Saudi Arabia,Attorney General (Saudi Arabia),"Judicial,Government",2018
1209,NULL,Saudi Arabia,2018-02-03,NULL,2018-02-03,ICEWS28498643,“Tajik Ambassador to Saudi Arabia Zarobiddin Kosimi met with Saudi Arabia’s attorney general Saud bin Abdullah al-Mujib.,Consult,"Tajikistan, Saudi Arabia to strengthen co-op between law-enforcement agencies","(2018, 5, 3)",1,24.6877,46.7219,2,NULL,Unknown,2,Factiva,Saudi Arabia,Attorney General (Saudi Arabia),"Judicial,Government",46473706,Tajikistan,Foreign Affairs (Tajikistan),"Government,Executive,Foreign Ministry",2018
1219,NULL,Egypt,2018-02-03,NULL,2018-02-03,ICEWS28498788,The Egyptian police have arrested six Muslim Brotherhood (MB) members on charges of 'plotting to carry out acts of violence during the upcoming presidential elections' scheduled for 26-28 March.,"Arrest, detain, or charge with legal action",Egypt arrests Brotherhood members for 'plotting election violence',"(2018, 5, 3)",-5,30.0626,31.2497,2,NULL,BBC Monitoring Middle East,2,Factiva,Egypt,Police (Egypt),"Police,Government",46474055,Egypt,Muslim Brotherhood,"Social,Muslim,Ideological,Parties,(National) Major Party,Fundamentalist,Sunni,National Religious,International Religious",2018
1220,Al Mansurah,Egypt,2018-02-03,NULL,2018-02-03,ICEWS28498787,"The police also confiscated '2,000 US dollars, 41,000 EGP [2,321.65 US], two laptops, a Hyundai Matrix vehicle and some documents containing their action plan in the upcoming period', the statement added.",Confiscate property,Egypt arrests Brotherhood members for 'plotting election violence',"(2018, 5, 3)",-9.2,31.0364,31.3807,2,Muhafazat ad Daqahliyah,BBC Monitoring Middle East,6,Factiva,Egypt,Police (Egypt),"Police,Government",46474055,United States,United States,NULL,2018
1225,Riyadh,Saudi Arabia,2018-02-03,NULL,2018-02-03,ICEWS28498916,"Several civilians have been killed and wounded on Friday when Saudi warplanes bombed two markets of Sarbi and Mahather and a main road in Farwh area in Yemen's Sa'ada province, Saba news agency reported.",Employ aerial weapons,Saudi Bombers Continue Massacring Civilians in Yemen,"(2018, 5, 3)",-10,24.6877,46.7219,2,Mintaqat ar Riyad,FARS News Agency,2,Factiva,Saudi Arabia,Saudi Arabia,NULL,46474356,Yemen,Citizen (Yemen),"General Population / Civilian / Social,Social",2018
1226,Afrin,Syria,2018-02-03,NULL,2018-02-03,ICEWS28498901,Sources affiliated to the Turkish army said on Friday that the army and affiliated militants captured the town of Bolbol in the Northern part of Afrin region after heavy fighting with the Kurdish fighters.,Occupy territory,"Turkish Army, Allied Militants Capture More Kurdish-Held Regions in Northern Syria","(2018, 5, 3)",-9.5,36.5119,36.8695,2,Muhafazat Halab,FARS News Agency,5,Factiva,Turkey,Turkish Army,"Government,Military,Army",46474362,Syria,Syria,NULL,2018
1227,Afrin,Syria,2018-02-03,NULL,2018-02-03,ICEWS28498902,Sources affiliated to the Turkish army said on Friday that the army and affiliated militants captured the town of Bolbol in the Northern part of Afrin region after heavy fighting with the Kurdish fighters.,Occupy territory,"Turkish Army, Allied Militants Capture More Kurdish-Held Regions in Northern Syria","(2018, 5, 3)",-9.5,36.5119,36.8695,2,Muhafazat Halab,FARS News Agency,5,Factiva,Syria,Militant (Syria),Unidentified Forces,46474362,Syria,Syria,NULL,2018
1228,Saraqib,Syria,2018-02-03,NULL,2018-02-03,ICEWS28498936,"The Ibaa News Agency of the al-Qaida-linked Levant Liberation Committee, said Russian and Syrian warplanes and helicopter gunships have been pounding Saraqeb and Tel Mardeekh village in Idlib province since the early hours of Saturday.",Employ aerial weapons,Rebel stronghold in northwestern Syria heavily bombed,"(2018, 5, 3)",-10,35.8645,36.8059,2,Idlib,Associated Press Newswires,3,Factiva,Syria,Syria,NULL,46474365,Syria,Citizen (Syria),"General Population / Civilian / Social,Social",2018
1229,Saraqib,Syria,2018-02-03,NULL,2018-02-03,ICEWS28498992,The sources said that the army men exchanged heavy fire with Al-Nusra Front (Tahrir al-Sham Hay'at or the Levant Liberation Board) in Southeastern Idlib and captured the villages of Tal Aloush and Ziyara Sam'an.,fight with small arms and light weapons,Syrian Army Continues Rapid Push towards Key Terrorist-Held Town in Eastern Idlib,"(2018, 5, 3)",-10,35.8645,36.8059,2,Idlib,FARS News Agency,2,Factiva,Syria,Men (Syria),"Social,General Population / Civilian / Social",46474497,Syria,Jabhat al-Nusra,"Dissident,Radicals / Extremists / Fundamentalists",2018
1230,Saraqib,Syria,2018-02-03,NULL,2018-02-03,ICEWS28498993,The sources said that the army men exchanged heavy fire with Al-Nusra Front (Tahrir al-Sham Hay'at or the Levant Liberation Board) in Southeastern Idlib and captured the villages of Tal Aloush and Ziyara Sam'an.,fight with small arms and light weapons,Syrian Army Continues Rapid Push towards Key Terrorist-Held Town in Eastern Idlib,"(2018, 5, 3)",-10,35.8645,36.8059,2,Idlib,FARS News Agency,2,Factiva,Syria,Jabhat al-Nusra,"Dissident,Radicals / Extremists / Fundamentalists",46474497,Syria,Men (Syria),"Social,General Population / Civilian / Social",2018
1231,Afrin,Syria,2018-02-03,NULL,2018-02-03,ICEWS28498998,The sources said that the army and affiliated militants captured the town of Bolbol in the Northern part of Afrin region after heavy fighting with the Kurdish fighters.,Occupy territory,More Kurdish Militia Killed in Turkish Army Operation in Northern Syria,"(2018, 5, 3)",-9.5,36.5119,36.8695,2,Muhafazat Halab,FARS News Agency,5,Factiva,Turkey,Turkish Army,"Government,Military,Army",46474500,Syria,Syria,NULL,2018
1232,Afrin,Syria,2018-02-03,NULL,2018-02-03,ICEWS28498999,The sources said that the army and affiliated militants captured the town of Bolbol in the Northern part of Afrin region after heavy fighting with the Kurdish fighters.,Occupy territory,More Kurdish Militia Killed in Turkish Army Operation in Northern Syria,"(2018, 5, 3)",-9.5,36.5119,36.8695,2,Muhafazat Halab,FARS News Agency,5,Factiva,Syria,Militant (Syria),Unidentified Forces,46474500,Syria,Syria,NULL,2018
1237,Afrin,Syria,2018-02-03,NULL,2018-02-03,ICEWS28499082,"Iraq has announced its rejection of Turkey's operation in Syria's northern Afrin region, reiterating its rejection of any foreign country's intervention in another country's affairs.",Reject,Iraq rejects Turkish 'intervention' in Afrin,"(2018, 5, 3)",-4,36.5119,36.8695,2,Muhafazat Halab,BBC Monitoring Middle East,2,Factiva,Iraq,Iraq,NULL,46474697,Turkey,Turkey,NULL,2018
1238,Baghdad,Iraq,2018-02-03,NULL,2018-02-03,ICEWS28499081,"Foreign Minister Ibrahim al-Jaafari told reporters on the sidelines of an ambassadors' conference at the ministry's headquarters in Baghdad that though Iraq maintains good relations with Turkey, it rejects the neighbouring country's 'transgression', as per a statement published on Jaafari's Facebook page on 3 February.",Engage in diplomatic cooperation,Iraq rejects Turkish 'intervention' in Afrin,"(2018, 5, 3)",3.5,33.3406,44.4009,2,Muhafazat Baghdad,BBC Monitoring Middle East,3,Factiva,Iraq,Iraq,NULL,46474697,Turkey,Turkey,NULL,2018
1239,Baghdad,Iraq,2018-02-03,NULL,2018-02-03,ICEWS28499083,"Foreign Minister Ibrahim al-Jaafari told reporters on the sidelines of an ambassadors' conference at the ministry's headquarters in Baghdad that though Iraq maintains good relations with Turkey, it rejects the neighbouring country's 'transgression', as per a statement published on Jaafari's Facebook page on 3 February.",Reject,Iraq rejects Turkish 'intervention' in Afrin,"(2018, 5, 3)",-4,33.3406,44.4009,2,Muhafazat Baghdad,BBC Monitoring Middle East,3,Factiva,Iraq,Iraq,NULL,46474697,Turkey,Turkey,NULL,2018
1240,Douma,Syria,2018-02-03,NULL,2018-02-03,ICEWS28499120,"The sources said that the army men, in an ambush operation, stormed a group of Jeish al-Islam terrorists at the entrance of the town of Harazma in Eastern Ghouta, killing seven terrorists and wounding fifteen more.",Use unconventional violence,Syrian Army Expands Security Zone around Vital Points in Eastern Damascus,"(2018, 5, 3)",-9,33.5718,36.4027,2,Muhafazat Rif Dimashq,FARS News Agency,6,Factiva,Syria,Men (Syria),"Social,General Population / Civilian / Social",46474781,Syria,Terrorist (Syria),"Dissident,Rebel",2018
1241,Saraqib,Syria,2018-02-03,NULL,2018-02-03,ICEWS28499126,"The Syrian Army's artillery and missile units and Air Force targeted the Al-Nusra positions and movements near the terrorist-held town of Saraqib, destroying a large depot of weapons and munitions and a number of vehicles.",fight with artillery and tanks,Terrorists' Main Arms Depots Destroyed in Syrian Army Attack in Idlib,"(2018, 5, 3)",-10,35.8645,36.8059,2,Idlib,FARS News Agency,2,Factiva,Syria,Military (Syria),"Military,Government",46474782,Syria,Syria,NULL,2018
1242,Hawar,Syria,2018-02-03,NULL,2018-02-03,ICEWS28499100,"In the meantime, three vehicles of the militants affiliated to the Turkish army were destroyed in the Kurdish fighters' attack near the village of Khalil in Shiheh region, Hawar news reported.",Use unconventional violence,Ankara-Backed Militant Commander Killed in Clashes with Kurds in Northern Syria,"(2018, 5, 3)",-9,36.229,36.9758,2,Muhafazat Halab,FARS News Agency,3,Factiva,Turkey,Combatant (Turkish Kurds),"International Ethnic,Kurd (Ethnic Group)",46474784,Turkey,Militant (Turkey),Unidentified Forces,2018
1243,Hawar,Syria,2018-02-03,NULL,2018-02-03,ICEWS28499101,"It added that the Kurdish fighters carried out an ambush operation against the Turkish soldiers and allied militants in the village of Za'ara North of Afrin, killing at least 20 of them.",Use unconventional violence,Ankara-Backed Militant Commander Killed in Clashes with Kurds in Northern Syria,"(2018, 5, 3)",-9,36.229,36.9758,2,Muhafazat Halab,FARS News Agency,4,Factiva,Turkey,Combatant (Turkish Kurds),"International Ethnic,Kurd (Ethnic Group)",46474784,Turkey,Military (Turkey),"Military,Government",2018
1244,Afrin,Syria,2018-02-03,NULL,2018-02-03,ICEWS28499099,Turkish Defense Minister Nurettin Canikli said on Wednesday that nearly 30 Turkish soldiers were killed in Ankara's Operation Olive Branch against Kurdish militias in Afrin region in Northwestern Aleppo.,Make statement,Ankara-Backed Militant Commander Killed in Clashes with Kurds in Northern Syria,"(2018, 5, 3)",0,36.5119,36.8695,2,Muhafazat Halab,FARS News Agency,5,Factiva,Turkey,Defense / Security Ministry (Turkey),"Defense / Security Ministry,Executive,Government",46474784,Turkey,Military (Turkey),"Military,Government",2018
1245,NULL,Syria,2018-02-03,NULL,2018-02-03,ICEWS28499113,"Accusing the government of Syrian President Bashar al-Assad of using chemical weapons against civilians, the US launched several dozen Tomahawk cruise missiles at a Syrian air base last April after a sarin gas attack on Khan Shaykhun in Idlib Province claimed at least 80 lives.",Accuse,Arab Analyst: US Likely to Use Chemical Weapons in False Flag against Syria,"(2018, 5, 3)",-2,33.5102,36.2913,2,NULL,FARS News Agency,6,Factiva,United States,United States,NULL,46474785,Syria,Bashar al-Assad,"National Ethnic,National Religious,National Ethnic Minority,Far Right,Executive,Executive Office,Shia,Social,Ideological,International Religious,Religious Minority,Government,(National) Major Party,Parties",2018
1246,Aleppo,Syria,2018-02-03,NULL,2018-02-03,ICEWS28499114,"The ministry said that representatives of militants in more regions endorsed the nationwide reconciliation plan and ended battle against the army, adding that the total number of villages, towns and regions that have thus far joined the peace agreement with the army stands at 2,344.",Make statement,Militants in More Regions Endorse Peace Agreement with Syrian Army,"(2018, 5, 3)",0,36.2012,37.1612,2,Muhafazat Halab,FARS News Agency,2,Factiva,Syria,Ministry (Syria),Government,46474788,Syria,Representatives (Syria),"Government,Legislative / Parliamentary",2018
1247,Bayt Jinn,Syria,2018-02-03,NULL,2018-02-03,ICEWS28499115,The sources said that the army has granted amnesty to 350 gunmen that had handed over their weapons to the army men and joined peace in Beit Jinn region in Southwestern Damascus.,Forgive,Militants in More Regions Endorse Peace Agreement with Syrian Army,"(2018, 5, 3)",7,33.3138,35.8797,2,Muhafazat Rif Dimashq,FARS News Agency,5,Factiva,Syria,Military (Syria),"Military,Government",46474788,Syria,Armed Gang (Syria),Unidentified Forces,2018
1248,Bayt Jinn,Syria,2018-02-03,NULL,2018-02-03,ICEWS28499116,The sources said that the army has granted amnesty to 350 gunmen that had handed over their weapons to the army men and joined peace in Beit Jinn region in Southwestern Damascus.,Demobilize armed forces,Militants in More Regions Endorse Peace Agreement with Syrian Army,"(2018, 5, 3)",9,33.3138,35.8797,2,Muhafazat Rif Dimashq,FARS News Agency,5,Factiva,Syria,Armed Gang (Syria),Unidentified Forces,46474788,Syria,Men (Syria),"Social,General Population / Civilian / Social",2018
1249,NULL,Iraq,2018-02-03,NULL,2018-02-03,ICEWS28499155,"The suspects have acted in the name of the IS or gone to conflict zones in Syria and Iraq, and they were 'preparing a terrorist act' in Istanbul, the state-run Anadolu Agency said.",Make a visit,82 IS suspects nabbed in Istanbul,"(2018, 5, 3)",1.9,33.3406,44.4009,2,NULL,Xinhua News Agency,2,Factiva,Turkey,Criminal (Turkey),"Criminals / Gangs,Dissident",46474922,Iraq,Iraq,NULL,2018
1250,NULL,Iraq,2018-02-03,NULL,2018-02-03,ICEWS28499157,"The suspects have acted in the name of the IS or gone to conflict zones in Syria and Iraq, and they were 'preparing a terrorist act' in Istanbul, the state-run Anadolu Agency said.",Host a visit,82 IS suspects nabbed in Istanbul,"(2018, 5, 3)",2.8,33.3406,44.4009,2,NULL,Xinhua News Agency,2,Factiva,Iraq,Iraq,NULL,46474922,Turkey,Criminal (Turkey),"Criminals / Gangs,Dissident",2018
1255,Damascus,Syria,2018-02-03,NULL,2018-02-03,ICEWS28499192,Turkey on Saturday said that Syrian President Bashar al-Assad should leave office 'at some point' in the future but denied there was any kind of contact between Ankara and Damascus over ending the seven year civil war.,Demand change in leadership,Turkey says Assad must go 'at some point',"(2018, 5, 3)",-5,33.5102,36.2913,2,Dimashq,Agence France-Presse,1,Factiva,Turkey,Turkey,NULL,46475034,Syria,Bashar al-Assad,"(National) Major Party,Government,Parties,National Religious,National Ethnic Minority,Ideological,International Religious,Religious Minority,Social,Shia,Executive Office,National Ethnic,Executive,Far Right",2018
1259,Jizan,Saudi Arabia,2018-02-03,NULL,2018-02-03,ICEWS28499246,"In border province of Jizan, the army and popular forces waged a military operation upon sites of Saudi army in al-Majazia and al-lahj village, killing and wounding a number of the soldiers and destroying two military trucks.",Use conventional military force,"Army causes heavy casualties on Saudi enemy army, its mercenaries","(2018, 5, 3)",-10,16.8892,42.5511,2,Mintaqat Jizan,Yemen News Agency (SABA),3,Factiva,Saudi Arabia,Saudi Army,"Military,Army,Government",46475156,Saudi Arabia,Saudi Arabian Defence Forces,"Military,Government",2018
1260,Najran,Saudi Arabia,2018-02-03,NULL,2018-02-03,ICEWS28499247,"Separately, the army and popular forces launched an artillery attack upon gatherings of Saudi soldiers in military site of Nahwqa in Najran border province.",fight with artillery and tanks,"Army causes heavy casualties on Saudi enemy army, its mercenaries","(2018, 5, 3)",-10,17.4924,44.1277,2,Mintaqat Najran,Yemen News Agency (SABA),6,Factiva,Saudi Arabia,Saudi Army,"Military,Army,Government",46475156,Saudi Arabia,Saudi Arabia,NULL,2018
1261,Najran,Saudi Arabia,2018-02-03,NULL,2018-02-03,ICEWS28499248,"Separately, the army and popular forces launched an artillery attack upon gatherings of Saudi soldiers in military site of Nahwqa in Najran border province.",fight with artillery and tanks,"Army causes heavy casualties on Saudi enemy army, its mercenaries","(2018, 5, 3)",-10,17.4924,44.1277,2,Mintaqat Najran,Yemen News Agency (SABA),6,Factiva,Saudi Arabia,Saudi Arabian Defence Forces,"Military,Government",46475156,Saudi Arabia,Saudi Arabia,NULL,2018
1262,Damascus,Syria,2018-02-03,NULL,2018-02-03,ICEWS28499253,"DAMASCUS, Feb. 3 (Xinhua) -- Syrian rebels on Saturday shot down a suspected Russian warplane that was carrying out airstrikes on the countryside of Idlib Province in the northwest of the country, a monitor group reported.",fight with artillery and tanks,Syrian rebels claim downing Russian warplane in Idlib,"(2018, 5, 3)",-10,33.5102,36.2913,2,Dimashq,Xinhua News Agency,1,Factiva,Syria,Armed Rebel (Syria),"Rebel,Dissident",46475159,Russian Federation,Russia,NULL,2018
1263,Saraqib,Syria,2018-02-03,NULL,2018-02-03,ICEWS28499251,But British Sky News TV said the Russian pilot was captured by the rebels.,Make statement,Syrian rebels claim downing Russian warplane in Idlib,"(2018, 5, 3)",0,35.8645,36.8059,2,Idlib,Xinhua News Agency,4,Factiva,United Kingdom,Media (United Kingdom),"Social,Media",46475159,Syria,Armed Rebel (Syria),"Rebel,Dissident",2018
1265,Damascus,Syria,2018-02-03,NULL,2018-02-03,ICEWS28499377,"DAMASCUS, February 3 (Sputnik) - Damascus condemns US groundless accusations of alleged use of chemical weapons in Syria's militant-held area of Eastern Ghouta, the Syrian Foreign Ministry said in a statement on Saturday.",Criticize or denounce,Damascus Decries US Accusations of Chemical Weapons Use in Eastern Ghouta,"(2018, 5, 3)",-2,33.5102,36.2913,2,Dimashq,Unknown,1,Factiva,Syria,Syria,NULL,46475381,United States,United States,NULL,2018
1266,Damascus,Syria,2018-02-03,NULL,2018-02-03,ICEWS28499378,"'The Foreign Ministry decisively condemns US groundless allegations against the Syrian leadership of chemical weapons use in Eastern Ghouta [in eastern suburbs of Damascus ],' the statement read, as quoted by the Syrian state-run SANA news agency.",Criticize or denounce,Damascus Decries US Accusations of Chemical Weapons Use in Eastern Ghouta,"(2018, 5, 3)",-2,33.5102,36.2913,2,Dimashq,Unknown,4,Factiva,Syria,Foreign Affairs (Syria),"Government,Executive,Foreign Ministry",46475381,United States,United States,NULL,2018
1267,Damascus,Syria,2018-02-03,NULL,2018-02-03,ICEWS28499346,"AMMAN (Reuters) - The Syrian foreign ministry denied on Saturday U.S. allegations it had used chemical weapons against rebel-held Eastern Ghouta enclave near Damascus, saying the accusations were 'lies' without evidence.",Deny responsibility,Syria denies U.S. claims it used chemical weapons used against rebel-held areas,"(2018, 5, 3)",-5,33.5102,36.2913,2,Dimashq,Reuters News,1,Factiva,Syria,Foreign Affairs (Syria),"Government,Executive,Foreign Ministry",46475382,United States,United States,NULL,2018
1268,Damascus,Syria,2018-02-03,NULL,2018-02-03,ICEWS28499345,U.S. Defense Secretary Jim Mattis said on Friday the Syrian government had repeatedly used chlorine as a weapon.,Make statement,Syria denies U.S. claims it used chemical weapons used against rebel-held areas,"(2018, 5, 3)",0,33.5102,36.2913,2,Dimashq,Reuters News,2,Factiva,United States,Defense / Security Ministry (United States),"Executive,Government,Defense / Security Ministry",46475382,Syria,Government (Syria),Government,2018
1269,Damascus,Syria,2018-02-03,NULL,2018-02-03,ICEWS28499327,"Syria on Saturday denied recent accusations by the United States that it had used chemical weapons on opposition forces near the capital Damascus, shrugging them off as 'lies.'",Deny responsibility,Syria blasts US accusations on chemical weapons use as 'lies',"(2018, 5, 3)",-5,33.5102,36.2913,2,Dimashq,Agence France-Presse,1,Factiva,Syria,Syria,NULL,46475396,United States,United States,NULL,2018
1270,NULL,Syria,2018-02-03,NULL,2018-02-03,ICEWS28499376,The Russian Defence Ministry has confirmed that a Russian warplane has been shot down in Syria and its pilot has been killed.,Make statement,Russian military confirm pilot killed as warplane shot down in Syria,"(2018, 5, 3)",0,35.7667,36.6667,2,Idlib,BBC Monitoring Newsfile,2,Factiva,Russian Federation,Defense / Security Ministry (Russia),"Executive,Defense / Security Ministry,Government",46475408,Russian Federation,Russia,NULL,2018
1278,Afrin,Syria,2018-02-03,NULL,2018-02-03,ICEWS28499441,"ISTANBUL (Reuters) - Five Turkish soldiers were killed when their tank was hit in an attack carried out by Kurdish YPG militia fighters on Saturday in northwest Syria's Afrin region, Turkey's armed forces said.",Use unconventional violence,Five Turkish soldiers killed in attack on tank in Syria's Afrin: army,"(2018, 5, 3)",-9,36.5119,36.8695,2,Muhafazat Halab,Reuters News,1,Factiva,Turkey,Combatant (Turkish Kurds),"Kurd (Ethnic Group),International Ethnic",46475518,Syria,Syria,NULL,2018
1279,NULL,Syria,2018-02-03,NULL,2018-02-03,ICEWS28499402,"RUSSIAN DEFENCE MINISTRY SAYS RUSSIAN WARPLANE DOWNED IN SYRIA, PILOT KILLED - TASS",Make statement,"RUSSIAN DEFENCE MINISTRY SAYS RUSSIAN WARPLANE DOWNED IN SYRIA, PILOT KILLED - TASS","(2018, 5, 3)",0,33.5102,36.2913,2,NULL,Reuters News,1,Factiva,Russian Federation,Defense / Security Ministry (Russia),"Government,Defense / Security Ministry,Executive",46475522,Russian Federation,Russia,NULL,2018
