,City,Country,Datetime,District,Event Date,Event ID,Event Sentence,Event Text,Headline,ISO Week,Intensity,Latitude,Longitude,Month,Province,Publisher,Sentence Number,Source,Source Country,Source Name,Source Sectors,Story ID,Target Country,Target Name,Target Sectors,Year
701,Manbij,Syria,2016-08-17,NULL,2016-08-17,ICEWS24854218,"'The US-backed Democratic Syrian forces obviously made a deal with Daesh fighters, letting them escape from the town of Manbij.",Sign formal agreement,'Letting Daesh Escape From Manbij' is Part of US Policy of Fueling Conflicts,"(2016, 33, 3)",8,36.5281,37.9549,8,Muhafazat Halab,Unknown,4,Factiva,Syria,Military (Syria),"Government,Military",41961408,Iraq,Combatant (Islamic State of Iraq and the Levant),"International Religious,Sunni,Ideological,Insurgents,Dissident,Fundamentalist,Muslim",2016
702,Manbij,Syria,2016-08-17,NULL,2016-08-17,ICEWS24854220,"'The US-backed Democratic Syrian forces obviously made a deal with Daesh fighters, letting them escape from the town of Manbij.",Sign formal agreement,'Letting Daesh Escape From Manbij' is Part of US Policy of Fueling Conflicts,"(2016, 33, 3)",8,36.5281,37.9549,8,Muhafazat Halab,Unknown,4,Factiva,Iraq,Combatant (Islamic State of Iraq and the Levant),"International Religious,Sunni,Ideological,Insurgents,Dissident,Fundamentalist,Muslim",41961408,Syria,Military (Syria),"Government,Military",2016
703,NULL,Syria,2016-08-17,NULL,2016-08-17,ICEWS24854351,"Jordan has allowed a sick Syrian child to enter the country from a border area where thousands of refugees are stranded, the army said Wednesday, after an online campaign.",Yield,Jordan allows in ill Syrian child after support campaign,"(2016, 33, 3)",5,33.5102,36.2913,8,NULL,Agence France-Presse,1,Factiva,Jordan,Citizen (Jordan),"General Population / Civilian / Social,Social",41961438,Syria,Children (Syria),"General Population / Civilian / Social,Social",2016
704,Manbij,Syria,2016-08-17,NULL,2016-08-17,ICEWS24854264,"'The US-backed Democratic Syrian forces obviously made a deal with Daesh [Islamic State] fighters, letting them escape from the town of Manbij.",Sign formal agreement,Hmeimim Group Says US Allowing IS Escape From Manbij Proves Policy of Fueling Conflicts,"(2016, 33, 3)",8,36.5281,37.9549,8,Muhafazat Halab,Unknown,4,Factiva,Syria,Military (Syria),"Government,Military",41961469,Iraq,Combatant (Islamic State of Iraq and the Levant),"International Religious,Sunni,Ideological,Insurgents,Dissident,Fundamentalist,Muslim",2016
705,Manbij,Syria,2016-08-17,NULL,2016-08-17,ICEWS24854265,"'The US-backed Democratic Syrian forces obviously made a deal with Daesh [Islamic State] fighters, letting them escape from the town of Manbij.",Sign formal agreement,Hmeimim Group Says US Allowing IS Escape From Manbij Proves Policy of Fueling Conflicts,"(2016, 33, 3)",8,36.5281,37.9549,8,Muhafazat Halab,Unknown,4,Factiva,Iraq,Combatant (Islamic State of Iraq and the Levant),"International Religious,Sunni,Ideological,Insurgents,Dissident,Fundamentalist,Muslim",41961469,Syria,Military (Syria),"Government,Military",2016
712,Hamdaniyah,Syria,2016-08-17,NULL,2016-08-17,ICEWS24854408,"The Syrian army is backed by Russian fighter jets, and the Syrian army's missile and artillery backup.",Cooperate militarily,"URGENT: Syrian Army Recaptures 50 Percent of Aleppo's Artillery, Technical Air Force Academy Buildings","(2016, 33, 3)",7.4,35.4247,36.8546,8,Idlib,FARS News Agency,6,Factiva,Russian Federation,Fighter Bomber (Russia),"Military,Government",41961760,Syria,Military (Syria),"Government,Military",2016
713,Aleppo,Syria,2016-08-17,NULL,2016-08-17,ICEWS24854442,"TEHRAN (FNA)- At least seven civilians, including two women and a child, lost their lives in a rocket attack by foreign-sponsored militants against a residential district in Syria's conflict-plagued Northern city of Aleppo.",Use unconventional violence,Militants' Rocket Attack Kills 7 Civilians in Syria’s Aleppo,"(2016, 33, 3)",-9,36.2012,37.1612,8,Muhafazat Halab,FARS News Agency,1,Factiva,Syria,Militant (Syria),Unidentified Forces,41961761,Syria,Syria,NULL,2016
714,Tallbisah,Syria,2016-08-17,NULL,2016-08-17,ICEWS24854413,"In a relevant development on Tuesday, the Syrian army continued its military gains in the Northern part of Homs province, destroying their command headquarters and killing over a dozen terrorists in the surrounding areas of the city of Talbiseh.",Use conventional military force,ISIL Sustains Heavy Losses in Syrian Airstrikes in Eastern Homs,"(2016, 33, 3)",-10,34.8406,36.7309,8,Muhafazat Hims,FARS News Agency,5,Factiva,Syria,Military (Syria),"Government,Military",41961767,Syria,Syria,NULL,2016
715,Amman,Jordan,2016-08-17,NULL,2016-08-17,ICEWS24854417,The Russian Foreign Ministry said that Bogdanov had handed over a personal message from Russian President Vladimir Putin to Abbas.,Make statement,Putin’s personal message handed over to Palestinian president,"(2016, 33, 3)",0,31.9552,35.945,8,Muhafazat `Amman,Unknown,2,Factiva,Russian Federation,Foreign Affairs (Russia),"Foreign Ministry,Executive,Government",41961828,Russian Federation,Mikhail Bogdanov,"Foreign Ministry,Executive,Government",2016
716,Deir ez-Zor,Syria,2016-08-17,NULL,2016-08-17,ICEWS24854555,"MOSCOW, August 17 (Sputnik) – Russia delivered 25 metric tons of humanitarian aid to the Syria’s provinces of Aleppo and Homs as well as to the city of Deir ez-Zor besieged by Islamic State (IS, or ISIS) jihadists, a daily bulletin published on the Russian Defense Ministry’s website on Wednesday said.",Provide humanitarian aid,Russia Delivers 25 Tonnes of Humanitarian Aid to Syria – Defense Ministry,"(2016, 33, 3)",7.4,35.3359,40.1408,8,Dayr az Zawr,Unknown,1,Factiva,Russian Federation,Russia,NULL,41962046,Syria,Syria,NULL,2016
724,Damascus,Syria,2016-08-17,NULL,2016-08-17,ICEWS24854657,"'In Damascus province, units of the Jaysh al-Islam group, which ranks itself among the opposition, conducted mortar fire at the localities of Kabun, Haush-Duara, Nashabia, Douma and Jobar,' it said.",fight with small arms and light weapons,Syria ceasefire violated six times during the day - Russian reconciliation center,"(2016, 33, 3)",-10,33.5102,36.2913,8,Dimashq,Unknown,3,Factiva,Syria,Jaysh al-Islam,"Rebel,Dissident",41962591,Syria,Syria,NULL,2016
725,Doha,Qatar,2016-08-17,NULL,2016-08-17,ICEWS24854583,"Aug 17 (Interfax) - Russian Special Presidential Envoy for the Middle East and African Countries, Deputy Foreign Minister Mikhail Bogdanov discussed the Middle Eastern issues, including the situation involving Syria, with Qatar's ministers of defense and interior affairs in Doha, Russian Foreign Ministry said on Wednesday.",Engage in negotiation,"Representatives of Russia, Qatar discuss Middle Eastern agenda in Doha, including Syrian settlement - Russian Foreign Ministry","(2016, 33, 3)",7,25.2793,51.5224,8,Baladiyat ad Dawhah,Interfax News Service,2,Factiva,Russian Federation,Mikhail Bogdanov,"Government,Executive,Foreign Ministry",41962631,Qatar,Defense / Security Ministry (Qatar),"Government,Executive,Defense / Security Ministry",2016
726,Doha,Qatar,2016-08-17,NULL,2016-08-17,ICEWS24854585,"Aug 17 (Interfax) - Russian Special Presidential Envoy for the Middle East and African Countries, Deputy Foreign Minister Mikhail Bogdanov discussed the Middle Eastern issues, including the situation involving Syria, with Qatar's ministers of defense and interior affairs in Doha, Russian Foreign Ministry said on Wednesday.",Engage in negotiation,"Representatives of Russia, Qatar discuss Middle Eastern agenda in Doha, including Syrian settlement - Russian Foreign Ministry","(2016, 33, 3)",7,25.2793,51.5224,8,Baladiyat ad Dawhah,Interfax News Service,2,Factiva,Qatar,Defense / Security Ministry (Qatar),"Government,Executive,Defense / Security Ministry",41962631,Russian Federation,Mikhail Bogdanov,"Government,Executive,Foreign Ministry",2016
732,Damascus,Syria,2016-08-17,NULL,2016-08-17,ICEWS24854808,"TEHRAN (FNA)- This just in: Beijing and Damascus have agreed that the Chinese military will provide humanitarian aid to Syria, including the training of Syrian military personnel.",Express intent to cooperate,ISIL Days Numbered: China Joins Iran-Russia Anti-Terrorism Efforts in Syria,"(2016, 33, 3)",4,33.5102,36.2913,8,Dimashq,FARS News Agency,1,Factiva,Syria,Syria,NULL,41962799,China,China,NULL,2016
733,Damascus,Syria,2016-08-17,NULL,2016-08-17,ICEWS24854809,It also came after a meeting in Damascus between Director of the Office for International Military Cooperation of China's Central Military Commission Guan Youfei and Syrian Defense Minister Fahad Jassim al-Freij.,Consult,ISIL Days Numbered: China Joins Iran-Russia Anti-Terrorism Efforts in Syria,"(2016, 33, 3)",1,33.5102,36.2913,8,Dimashq,FARS News Agency,3,Factiva,China,Guan Youfei,"Defense / Security Ministry,Government,Executive",41962799,Syria,Fahed al-Jasem el-Freij,"Defense / Security Ministry,Military,Government,Executive",2016
734,Damascus,Syria,2016-08-17,NULL,2016-08-17,ICEWS24854810,It also came after a meeting in Damascus between Director of the Office for International Military Cooperation of China's Central Military Commission Guan Youfei and Syrian Defense Minister Fahad Jassim al-Freij.,Consult,ISIL Days Numbered: China Joins Iran-Russia Anti-Terrorism Efforts in Syria,"(2016, 33, 3)",1,33.5102,36.2913,8,Dimashq,FARS News Agency,3,Factiva,Syria,Fahed al-Jasem el-Freij,"Defense / Security Ministry,Military,Government,Executive",41962799,China,Guan Youfei,"Defense / Security Ministry,Government,Executive",2016
735,Aleppo,Syria,2016-08-17,NULL,2016-08-17,ICEWS24854792,"The Syrian fighter jets strongly pounded the terrorists' centers in al-Bab road, Qaterchi region, al-Sha'ar, al-Jazmati, Qzi Askar, al-Meyser, al-Movaselat and Karm al-Tarab on Wednesday.",Use unconventional violence,"Syrian, Russian Air Forces Conduct 200 Air Raids on Terrorists' Military Positions Near Aleppo City","(2016, 33, 3)",-9,36.2012,37.1612,8,Muhafazat Halab,FARS News Agency,2,Factiva,Syria,Combatant (Syria),Unidentified Forces,41962800,Syria,Citizen (Syria),"Social,General Population / Civilian / Social",2016
736,Aleppo,Syria,2016-08-17,NULL,2016-08-17,ICEWS24854793,The Jeish al-Fatah terrorists' military convoy came under Russian air raids on a road linking military academy buildings to al-Ramousiyeh region.,Employ aerial weapons,"Syrian, Russian Air Forces Conduct 200 Air Raids on Terrorists' Military Positions Near Aleppo City","(2016, 33, 3)",-10,36.2012,37.1612,8,Muhafazat Halab,FARS News Agency,6,Factiva,Russian Federation,Russia,NULL,41962800,Syria,Syria,NULL,2016
737,Mosul,Iraq,2016-08-17,NULL,2016-08-17,ICEWS24854783,"TEHRAN (FNA)- The Iraqi army backed by the country's air force continued its military advances in Nineveh province, killing scores of terrorists, including ISIL's security commander in the city of Mosul.",Use conventional military force,Iraq: ISIL's Security Chief Killed in Nineveh's Mosul City,"(2016, 33, 3)",-10,36.335,43.1189,8,Muhafazat Ninawa,FARS News Agency,1,Factiva,Iraq,Military (Iraq),"Military,Government",41962801,Iraq,Terrorist (Iraq),"Dissident,Rebel",2016
738,Mosul,Iraq,2016-08-17,NULL,2016-08-17,ICEWS24854784,"Abu Fares al-Jahishi, ISIL's security commander, was killed in Iraqi fighter jets' strikes on an ISIL military base in Mosul city.",Employ aerial weapons,Iraq: ISIL's Security Chief Killed in Nineveh's Mosul City,"(2016, 33, 3)",-10,36.335,43.1189,8,Muhafazat Ninawa,FARS News Agency,2,Factiva,Iraq,Fighter Bomber (Iraq),"Military,Government",41962801,Iraq,Islamic State of Iraq and the Levant,"Fundamentalist,International Religious,Muslim,Insurgents,Dissident,Ideological,Sunni",2016
739,Deir ez-Zor,Syria,2016-08-17,NULL,2016-08-17,ICEWS24854852,"Yesterday, Russian Sukhoi-34 jets took off from the Hamadan base in western Iran and carried out a group aerial strike against ISIS targets in Deir Ezzor province, the Defence Ministry said, calling the operation a success.",Employ aerial weapons,Russian jets use Iran base to bomb ISIS in Syria,"(2016, 33, 3)",-10,35.3359,40.1408,8,Dayr az Zawr,Unknown,4,Factiva,Russian Federation,Russia,NULL,41963014,Iraq,Islamic State of Iraq and the Levant,"Sunni,Muslim,Ideological,Fundamentalist,Insurgents,Dissident,International Religious",2016
749,Madayah,Syria,2016-08-17,NULL,2016-08-17,ICEWS24855198,"A 10-year-old Syrian girl shot in Madaya was evacuated on Sunday to a Damascus hospital after an online campaign, but another dozen children remain inside the town in urgent need of medical care.",Provide humanitarian aid,Children in Syria's Madaya await urgent medical help,"(2016, 33, 3)",7.4,35.471,36.5767,8,Idlib,Agence France-Presse,5,Factiva,Syria,Healthcare Facility (Syria),"Social,Medical / Health",41964170,Syria,Syria,NULL,2016
750,Tadmur,Syria,2016-08-17,NULL,2016-08-17,ICEWS24855525,"Russia has requested from Iraq and Iran airspace permission for transporting cruise missiles into Syria Russian warplanes have been deployed to the Hamedan Air Base in western Iran and some of the 22 strategic TU-22M3 bombers have already carried out sorties against ISIS targets in Syria, Iran's Al-Masdar News reported Their deployment to Hamedan reduces by 60% the 2,150km flight distance from Russia's Modzok airfield to Palmyra, Syria to just 900km.",Make an appeal or request,"Russia Posts 22 Jets in Iran for Syria, Plans to Use Cruise Missiles.","(2016, 33, 3)",3,34.5608,38.2805,8,Muhafazat Hims,Israel Faxx,2,Factiva,Russian Federation,Russia,NULL,41965273,Iraq,Iraq,NULL,2016
751,Tadmur,Syria,2016-08-17,NULL,2016-08-17,ICEWS24855526,"Russia has requested from Iraq and Iran airspace permission for transporting cruise missiles into Syria Russian warplanes have been deployed to the Hamedan Air Base in western Iran and some of the 22 strategic TU-22M3 bombers have already carried out sorties against ISIS targets in Syria, Iran's Al-Masdar News reported Their deployment to Hamedan reduces by 60% the 2,150km flight distance from Russia's Modzok airfield to Palmyra, Syria to just 900km.",Make an appeal or request,"Russia Posts 22 Jets in Iran for Syria, Plans to Use Cruise Missiles.","(2016, 33, 3)",3,34.5608,38.2805,8,Muhafazat Hims,Israel Faxx,2,Factiva,Russian Federation,Russia,NULL,41965273,Iran,Iran,NULL,2016
761,NULL,Syria,2016-08-18,NULL,2016-08-18,ICEWS24855501,Experts say a Chinese military delegation's meeting with Syrian army officials is a warning to the US over its involvement in the South China Sea dispute.,Consult,"China morning headlines: Syria meeting, Suu Kyi visit","(2016, 33, 3)",1,33.5102,36.2913,8,NULL,BBC Monitoring Asia Pacific,3,Factiva,Syria,Syria,NULL,41965008,China,Military Personnel (China),"Government,Military",2016
762,Damascus,Syria,2016-08-18,NULL,2016-08-18,ICEWS24855500,"Guan Youfei, a rear admiral in the People's Liberation Army, met Syria's defence minister Fahd al-Freij on Tuesday 16 August.",Consult,"China morning headlines: Syria meeting, Suu Kyi visit","(2016, 33, 3)",1,33.5102,36.2913,8,Dimashq,BBC Monitoring Asia Pacific,4,Factiva,China,Guan Youfei,"Government,Defense / Security Ministry,Executive",41965008,Syria,Ministry of Defense,"Defense / Security Ministry,Executive,Government",2016
763,Damascus,Syria,2016-08-18,NULL,2016-08-18,ICEWS24855502,"Guan Youfei, a rear admiral in the People's Liberation Army, met Syria's defence minister Fahd al-Freij on Tuesday 16 August.",Consult,"China morning headlines: Syria meeting, Suu Kyi visit","(2016, 33, 3)",1,33.5102,36.2913,8,Dimashq,BBC Monitoring Asia Pacific,4,Factiva,Syria,Ministry of Defense,"Defense / Security Ministry,Executive,Government",41965008,China,Guan Youfei,"Government,Defense / Security Ministry,Executive",2016
764,Damascus,Syria,2016-08-18,NULL,2016-08-18,ICEWS24855498,China's Defence Ministry also said without offering details that Guan had met a Russian general stationed in Damascus to discuss 'issues of common interest'.,Make statement,"China morning headlines: Syria meeting, Suu Kyi visit","(2016, 33, 3)",0,33.5102,36.2913,8,Dimashq,BBC Monitoring Asia Pacific,5,Factiva,China,Defense / Security Ministry (China),"Government,Defense / Security Ministry,Executive",41965008,China,Guan Youfei,"Government,Defense / Security Ministry,Executive",2016
767,NULL,Syria,2016-08-18,NULL,2016-08-18,ICEWS24855552,That came as Russian bombers launched an air raid on Syria from Iranian soil for a second day.,Use unconventional violence,World News -- Analysis: Tehran Walks Fine Line on Moscow's Military Presence,"(2016, 33, 3)",-9,33.5102,36.2913,8,NULL,The Wall Street Journal,4,Factiva,Russian Federation,Citizen (Russia),"Social,General Population / Civilian / Social",41965463,Syria,Syria,NULL,2016
776,Najran,Saudi Arabia,2016-08-18,NULL,2016-08-18,ICEWS24855827,"CAIRO -- Seven people were killed in Saudi Arabia when a missile fired from Yemen struck a commercial district in the city of Najran, the kingdom's official news media confirmed on Wednesday.",fight with artillery and tanks,Missile Fired From Yemen Kills Saudis,"(2016, 33, 3)",-10,17.4924,44.1277,8,Mintaqat Najran,The New York Times,1,Factiva,Yemen,Yemen,NULL,41965787,Saudi Arabia,Citizen (Saudi Arabia),"General Population / Civilian / Social,Social",2016
777,Najran,Saudi Arabia,2016-08-18,NULL,2016-08-18,ICEWS24855826,"Gen. Sharaf Luqman, said Yemeni forces had escalated their missile strikes against Saudi Arabia in retaliation.",Use conventional military force,Missile Fired From Yemen Kills Saudis,"(2016, 33, 3)",-10,17.4924,44.1277,8,Mintaqat Najran,The New York Times,5,Factiva,Yemen,Yemeni Armed Forces,"Military,Government",41965787,Saudi Arabia,Saudi Arabia,NULL,2016
778,Damascus,Syria,2016-08-18,NULL,2016-08-18,ICEWS24855775,"BEIJING (AP) — A top Chinese military officer visited Syria this week in a show of support for President Bashar Assad's embattled regime, official media reported Thursday.",Make a visit,Chinese admiral visits Syria in show of support,"(2016, 33, 3)",1.9,33.5102,36.2913,8,Dimashq,Associated Press Newswires,1,Factiva,China,Military Personnel (China),"Military,Government",41965866,Syria,Syria,NULL,2016
779,Damascus,Syria,2016-08-18,NULL,2016-08-18,ICEWS24855777,"BEIJING (AP) — A top Chinese military officer visited Syria this week in a show of support for President Bashar Assad's embattled regime, official media reported Thursday.",Host a visit,Chinese admiral visits Syria in show of support,"(2016, 33, 3)",2.8,33.5102,36.2913,8,Dimashq,Associated Press Newswires,1,Factiva,Syria,Syria,NULL,41965866,China,Military Personnel (China),"Military,Government",2016
780,Damascus,Syria,2016-08-18,NULL,2016-08-18,ICEWS24855774,Rear Adm. Guan Youfei met on Sunday with Syrian Defense Minister Fahd Jassem al-Freij in Damascus.,Consult,Chinese admiral visits Syria in show of support,"(2016, 33, 3)",1,33.5102,36.2913,8,Dimashq,Associated Press Newswires,2,Factiva,China,Guan Youfei,"Defense / Security Ministry,Executive,Government",41965866,Syria,Fahed al-Jasem el-Freij,"Government,Executive,Military,Defense / Security Ministry",2016
781,Damascus,Syria,2016-08-18,NULL,2016-08-18,ICEWS24855776,Rear Adm. Guan Youfei met on Sunday with Syrian Defense Minister Fahd Jassem al-Freij in Damascus.,Consult,Chinese admiral visits Syria in show of support,"(2016, 33, 3)",1,33.5102,36.2913,8,Dimashq,Associated Press Newswires,2,Factiva,Syria,Fahed al-Jasem el-Freij,"Government,Executive,Military,Defense / Security Ministry",41965866,China,Guan Youfei,"Defense / Security Ministry,Executive,Government",2016
782,Damascus,Syria,2016-08-18,NULL,2016-08-18,ICEWS24855772,"Xinhua said Guan expressed China's willingness to boost military cooperation with Syria, while the newspaper Global Times cited the Chinese Defense Ministry as saying that both sides agreed to further cooperate on personnel training and humanitarian aid from the Chinese military.",Express intent to engage in diplomatic cooperation (such as policy support),Chinese admiral visits Syria in show of support,"(2016, 33, 3)",4.5,33.5102,36.2913,8,Dimashq,Associated Press Newswires,4,Factiva,China,Guan Youfei,"Defense / Security Ministry,Executive,Government",41965866,Syria,Syria,NULL,2016
783,Damascus,Syria,2016-08-18,NULL,2016-08-18,ICEWS24855708,"Guan Youfei, a rear admiral in the People's Liberation Army, met Syria's defence minister Fahd al-Freij in Damascus on Tuesday.",Consult,"China, Taiwan press discuss Syria role, Suu Kyi visit","(2016, 33, 3)",1,33.5102,36.2913,8,Dimashq,BBC Monitoring Asia Pacific,5,Factiva,China,Guan Youfei,"Defense / Security Ministry,Executive,Government",41965879,Syria,Ministry of Defense,"Government,Executive,Defense / Security Ministry",2016
784,Damascus,Syria,2016-08-18,NULL,2016-08-18,ICEWS24855709,"Guan Youfei, a rear admiral in the People's Liberation Army, met Syria's defence minister Fahd al-Freij in Damascus on Tuesday.",Consult,"China, Taiwan press discuss Syria role, Suu Kyi visit","(2016, 33, 3)",1,33.5102,36.2913,8,Dimashq,BBC Monitoring Asia Pacific,5,Factiva,Syria,Ministry of Defense,"Government,Executive,Defense / Security Ministry",41965879,China,Guan Youfei,"Defense / Security Ministry,Executive,Government",2016
785,Damascus,Syria,2016-08-18,NULL,2016-08-18,ICEWS24855707,China's Defence Ministry also said without offering details that Guan had met a Russian general stationed in the Syrian capital to discuss 'issues of common interest'.,Make statement,"China, Taiwan press discuss Syria role, Suu Kyi visit","(2016, 33, 3)",0,33.5102,36.2913,8,Dimashq,BBC Monitoring Asia Pacific,6,Factiva,China,Defense / Security Ministry (China),"Defense / Security Ministry,Executive,Government",41965879,China,Guan Youfei,"Defense / Security Ministry,Executive,Government",2016
791,NULL,Iraq,2016-08-18,NULL,2016-08-18,ICEWS24856120,Human Rights Watch (HRW) on Thursday welcomed a statement by influential Iraqi cleric Moqtada al-Sadr urging an end to violence against gay and gender non-conforming people.,Praise or endorse,HRW hails Iraq cleric's call against anti-gay violence,"(2016, 33, 3)",3.4,33.3406,44.4009,8,NULL,Agence France-Presse,1,Factiva,NULL,Human Rights Watch,"NGO Ministry,Human Rights IGOs,Government,Nongovernmental Organization (International),Executive",41966731,Iraq,Muqtada Al-Sadr,"(National) Minor Party,Ideological,Fundamentalist,Shia,Dissident,Radicals / Extremists / Fundamentalists,International Religious,Parties",2016
792,Ramadi,Iraq,2016-08-18,NULL,2016-08-18,ICEWS24856126,'Security forces so far has killed 700 ISIS [Daesh] members since the beginning of Khalidiya Island liberation battles.,Use conventional military force,Iraqi Military Kills 700 Daesh Militants During Liberation of Area Near Ramadi,"(2016, 33, 3)",-10,33.4206,43.3078,8,Muhafazat al Anbar,Unknown,3,Factiva,Iraq,Military Personnel - Special (Iraq),"Government,Military",41966747,Iraq,Islamic State of Iraq and the Levant,"Ideological,Muslim,Sunni,Fundamentalist,Dissident,International Religious,Insurgents",2016
798,NULL,Iraq,2016-08-18,NULL,2016-08-18,ICEWS24856209,"Police arrested a suspected PKK member accused of parking the car in front of the police station, Anadolu reported.","Arrest, detain, or charge with legal action","Police station attack leaves 3 dead, 73 injured","(2016, 33, 3)",-5,36.2267,44.7611,8,Kurdistan,EFE News Service,6,Factiva,Turkey,Police (Turkey),"Police,Government",41967251,Turkey,Kurdistan Workers' Party,"Dissident,Kurd (Ethnic Group),International Ethnic,Separatists",2016
799,Damascus,Syria,2016-08-18,NULL,2016-08-18,ICEWS24856286,"Speaking of 'torture, inhumane conditions and mass deaths' being systematically perpetrated, the organization urged the international community to mediate to settle those abuses that amount to 'crimes against humanity.'",Appeal to engage in or accept mediation,"Amnesty International denounces torture, deaths in Syrian prisons","(2016, 33, 3)",4,33.5102,36.2913,8,Dimashq,EFE News Service,4,Factiva,NULL,Amnesty International,"Nongovernmental Organization (International),Human Rights IGOs",41967255,NULL,Unidentified State Actor,NULL,2016
800,NULL,Iraq,2016-08-18,NULL,2016-08-18,ICEWS24856213,"The car bombings -- less than 12 hours apart -- killed at least six people in total and injured over 200, officials said Thursday, blaming the outlawed Kurdistan Workers' Party (PKK).",Accuse,Six dead as PKK intensifies bombing campaign in Turkey,"(2016, 33, 3)",-2,36.2267,44.7611,8,Kurdistan,Agence France-Presse,2,Factiva,Turkey,Citizen (Turkey),"Social,General Population / Civilian / Social",41967282,Turkey,Kurdistan Workers' Party,"Dissident,Kurd (Ethnic Group),International Ethnic,Separatists",2016
806,Deir ez-Zor,Syria,2016-08-18,NULL,2016-08-18,ICEWS24856473,The ministry said Tu-22M3 long-range bombers and Su-34 fighter bombers struck Islamic State targets in the Syrian province of Deir al-Zor.,Use unconventional violence,Russia launches third day of Syria strikes from Iran,"(2016, 33, 3)",-9,35.3359,40.1408,8,Dayr az Zawr,Reuters News,2,Factiva,Syria,Citizen (Syria),"Social,General Population / Civilian / Social",41967595,Syria,Syria,NULL,2016
807,Deir ez-Zor,Syria,2016-08-18,NULL,2016-08-18,ICEWS24856474,The ministry said Tu-22M3 long-range bombers and Su-34 fighter bombers struck Islamic State targets in the Syrian province of Deir al-Zor.,Use conventional military force,Russia launches third day of Syria strikes from Iran,"(2016, 33, 3)",-10,35.3359,40.1408,8,Dayr az Zawr,Reuters News,2,Factiva,Syria,Fighter Bomber (Syria),"Government,Military",41967595,Syria,Syria,NULL,2016
