,City,Country,Datetime,District,Event Date,Event ID,Event Sentence,Event Text,Headline,ISO Week,Intensity,Latitude,Longitude,Month,Province,Publisher,Sentence Number,Source,Source Country,Source Name,Source Sectors,Story ID,Target Country,Target Name,Target Sectors,Year
557,Damascus,Syria,2018-01-10,NULL,2018-01-10,ICEWS28416197,"GENEVA, Jan 10 (Reuters) - Syrian government forces and their allies have killed at least 85 civilians since Dec. 31 in stepped-up attacks against the besieged rebel enclave of Eastern Ghouta, the U.N. human rights chief said on Wednesday.",Use conventional military force,UPDATE 1-UN says Syrian forces killed 85 civilians in besieged zone,"(2018, 2, 3)",-10,33.5102,36.2913,1,Dimashq,Reuters News,2,Factiva,Syria,Military (Syria),"Military,Government",46273690,Syria,Citizen (Syria),"Social,General Population / Civilian / Social",2018
558,NULL,Bahrain,2018-01-10,NULL,2018-01-10,ICEWS28416237,"Rahul Gandhi, who returned to India after visiting Bahrain, thanked that country's leaders and its people for their love and hospitality.",Make a visit,Rahul's first visit to Amethi as party chief next week,"(2018, 2, 3)",1.9,26.2154,50.5832,1,NULL,Indo-Asian News Service,3,Factiva,India,Rahul Gandhi,"(National) Major Party,Parties,Government,Government Major Party (In Government)",46273692,Bahrain,Bahrain,NULL,2018
559,NULL,Bahrain,2018-01-10,NULL,2018-01-10,ICEWS28416239,"Rahul Gandhi, who returned to India after visiting Bahrain, thanked that country's leaders and its people for their love and hospitality.",Host a visit,Rahul's first visit to Amethi as party chief next week,"(2018, 2, 3)",2.8,26.2154,50.5832,1,NULL,Indo-Asian News Service,3,Factiva,Bahrain,Bahrain,NULL,46273692,India,Rahul Gandhi,"(National) Major Party,Parties,Government,Government Major Party (In Government)",2018
560,NULL,Egypt,2018-01-10,NULL,2018-01-10,ICEWS28416275,"During his two-day visit, President Isaias will hold talks with other senior Egyptian officials on strengthening bilateral relations, implementation of already agreed programs as well as developments in the regional and international issues of interest to both countries.",Express intent to meet or negotiate,President Isaias Leaves for Egypt,"(2018, 2, 3)",4,30.0626,31.2497,1,NULL,Unknown,6,Factiva,Egypt,Head of Government (Egypt),"Executive,Government,Executive Office",46273748,Egypt,Egypt,NULL,2018
562,Beirut,Lebanon,2018-01-10,NULL,2018-01-10,ICEWS28416515,BEIRUT (AP) — A Lebanese prosecutor has begun questioning an Uber driver suspected in the murder of a British woman who worked at the U.K. Embassy in Beirut.,Investigate,Lebanese prosecutor questions suspected killer of UK woman,"(2018, 2, 3)",-2,33.8889,35.4944,1,Beyrouth,Associated Press Newswires,1,Factiva,Lebanon,Lawyer/Attorney (Lebanon),"Legal,Social",46273935,United Kingdom,Foreign Affairs (United Kingdom),"Foreign Ministry,Executive,Government",2018
563,NULL,Syria,2018-01-10,NULL,2018-01-10,ICEWS28416328,"Turkey on Wednesday warned Iran and Russia to make their Syrian regime ally stop bombing the rebel-held northern Idlib province, as tensions mounted ahead of mooted peace talks later this month.",Threaten,"Turkey tensions with Iran, Russia mount ahead of Syria meet","(2018, 2, 3)",-4.4,35.7667,36.6667,1,Idlib,Agence France-Presse,1,Factiva,Turkey,Turkey,NULL,46274121,Iran,Iran,NULL,2018
564,NULL,Syria,2018-01-10,NULL,2018-01-10,ICEWS28416329,"Turkey on Wednesday warned Iran and Russia to make their Syrian regime ally stop bombing the rebel-held northern Idlib province, as tensions mounted ahead of mooted peace talks later this month.",Threaten,"Turkey tensions with Iran, Russia mount ahead of Syria meet","(2018, 2, 3)",-4.4,35.7667,36.6667,1,Idlib,Agence France-Presse,1,Factiva,Turkey,Turkey,NULL,46274121,Russian Federation,Russia,NULL,2018
565,NULL,Syria,2018-01-10,NULL,2018-01-10,ICEWS28416323,Cavusoglu said 95 percent of the violations in Idlib were carried out by the regime and the groups backing the regime.,Make statement,"Turkey tensions with Iran, Russia mount ahead of Syria meet","(2018, 2, 3)",0,35.7667,36.6667,1,Idlib,Agence France-Presse,6,Factiva,Turkey,Mevlut Cavusoglu,"Legislative / Parliamentary,Unicameral,Government,Executive,Foreign Ministry",46274121,Syria,Government (Syria),Government,2018
566,Cairo,Egypt,2018-01-10,NULL,2018-01-10,ICEWS28416493,"Foreign Minister Sameh Shoukry will hold on Wednesday 10/1/2018 talks with his Tanzanian counterpart Augustine Mahiga, now visiting Egypt.",Express intent to meet or negotiate,"Egypt, Tanzania FMs to Hold Talks Wednesday in Cairo","(2018, 2, 3)",4,30.0626,31.2497,1,Muhafazat al Qahirah,Unknown,1,Factiva,Egypt,Sameh Shoukry,"Government,Foreign Ministry,Executive",46274188,Tanzania,Augustine Mahiga,"Government,Executive,Foreign Ministry",2018
567,Najran,Saudi Arabia,2018-01-10,NULL,2018-01-10,ICEWS28416785,Yemeni Houthi rebel snipers killed two Saudi soldiers and shelled other Saudi military positions in the kingdom's border region of Najran on 10 January.,Use unconventional violence,Yemen Houthi snipers 'kill two Saudi soldiers' in border region,"(2018, 2, 3)",-9,17.4924,44.1277,1,Mintaqat Najran,BBC Monitoring Middle East,2,Factiva,Yemen,Citizen (Yemen),"General Population / Civilian / Social,Social",46274345,Saudi Arabia,Saudi Arabian Defence Forces,"Military,Government",2018
568,Najran,Saudi Arabia,2018-01-10,NULL,2018-01-10,ICEWS28416786,Yemeni Houthi rebel snipers killed two Saudi soldiers and shelled other Saudi military positions in the kingdom's border region of Najran on 10 January.,fight with artillery and tanks,Yemen Houthi snipers 'kill two Saudi soldiers' in border region,"(2018, 2, 3)",-10,17.4924,44.1277,1,Mintaqat Najran,BBC Monitoring Middle East,2,Factiva,Yemen,Citizen (Yemen),"General Population / Civilian / Social,Social",46274345,Saudi Arabia,Saudi Arabia,NULL,2018
569,NULL,Saudi Arabia,2018-01-10,NULL,2018-01-10,ICEWS28416590,"The government has demanded Prince al-Waleed, Saudi Arabia's richest businessman, pay over $6 billion to settle accusations of money laundering, bribery and extortion -- allegations the prince is fighting, according to people close to him.",Demand,French Ex-Presidents Tell Saudis of Concern About Billionaire's Arrest,"(2018, 2, 3)",-5,24.6877,46.7219,1,NULL,Dow Jones News Service,4,Factiva,Saudi Arabia,Government (Saudi Arabia),Government,46274413,Saudi Arabia,Royal Administration (Saudi Arabia),Government,2018
570,NULL,Lebanon,2018-01-10,NULL,2018-01-10,ICEWS28416653,"Lebanese President Michel Aoun has reaffirmed that the country's long-awaited parliamentary elections, set to take place in May this year, will be held as planned.",Make statement,Lebanon's Aoun says polls to be held on time,"(2018, 2, 3)",0,33.8889,35.4944,1,NULL,BBC Monitoring Middle East,2,Factiva,Lebanon,Michel Aoun,"Center Right,Ideological,Government,Parties,Executive,Executive Office,(National) Minor Party,Unicameral,Legislative / Parliamentary",46274419,Lebanon,Lebanon,NULL,2018
571,NULL,Syria,2018-01-10,NULL,2018-01-10,ICEWS28416605,Syrian opposition outlets have been reporting on Turkey's 'summoning' of the Russian and Iranian ambassadors in objection to the Syrian government's heavy ongoing assault on Idlib Province.,Use conventional military force,Syrian media reports on Turkey's objection to Idlib attacks,"(2018, 2, 3)",-10,35.7667,36.6667,1,Idlib,BBC Monitoring Middle East,2,Factiva,Syria,Government (Syria),Government,46274535,Syria,Syria,NULL,2018
572,Tripoli,Lebanon,2018-01-10,NULL,2018-01-10,ICEWS28416965,"A Syrian refugee in Lebanon set himself on fire Wednesday outside a UN office in desperation at aid getting cut off to his family, suffering serious burns.","Protest violently, riot",Syrian refugee sets himself ablaze at UN office in Lebanon,"(2018, 2, 3)",-7.5,34.4367,35.8497,1,Mohafazat Liban-Nord,Agence France-Presse,1,Factiva,Syria,Refugee (Syria),"Refugees / Displaced,Social",46274822,NULL,Unspecified Actor,Unspecified,2018
580,Cairo,Egypt,2018-01-10,NULL,2018-01-10,ICEWS28417086,"CAIRO, Jan. 10 (Xinhua) -- Egyptian President Abdel-Fattah al-Sisi urged the government on Wednesday to continue efforts to solve structural problems facing the Egyptian economy for decades, state-run MENA news agency reported.",Make an appeal or request,Egypt's Sisi urges to solve structural problems in economic development,"(2018, 2, 3)",3,30.0626,31.2497,1,Muhafazat al Qahirah,Xinhua News Agency,1,Factiva,Egypt,Abdel Fattah Al-Sisi,"International Religious,Executive,Elite,Government,Executive Office,Sunni",46275069,Egypt,Government (Egypt),Government,2018
581,Cairo,Egypt,2018-01-10,NULL,2018-01-10,ICEWS28417087,Sisi's comments came during his meeting with Acting Premier and Housing Minister Mostafa Madbouli and Finance Minister Amr al-Garhy.,Consult,Egypt's Sisi urges to solve structural problems in economic development,"(2018, 2, 3)",1,30.0626,31.2497,1,Muhafazat al Qahirah,Xinhua News Agency,2,Factiva,Egypt,Abdel Fattah Al-Sisi,"International Religious,Executive,Elite,Government,Executive Office,Sunni",46275069,Egypt,Mostafa Madbouly,Government,2018
582,Cairo,Egypt,2018-01-10,NULL,2018-01-10,ICEWS28417088,Sisi's comments came during his meeting with Acting Premier and Housing Minister Mostafa Madbouli and Finance Minister Amr al-Garhy.,Consult,Egypt's Sisi urges to solve structural problems in economic development,"(2018, 2, 3)",1,30.0626,31.2497,1,Muhafazat al Qahirah,Xinhua News Agency,2,Factiva,Egypt,Abdel Fattah Al-Sisi,"International Religious,Executive,Elite,Government,Executive Office,Sunni",46275069,Egypt,Amr al-Garhy,"Executive,Government,Finance / Economy / Commerce / Trade Ministry",2018
583,Cairo,Egypt,2018-01-10,NULL,2018-01-10,ICEWS28417089,Sisi's comments came during his meeting with Acting Premier and Housing Minister Mostafa Madbouli and Finance Minister Amr al-Garhy.,Consult,Egypt's Sisi urges to solve structural problems in economic development,"(2018, 2, 3)",1,30.0626,31.2497,1,Muhafazat al Qahirah,Xinhua News Agency,2,Factiva,Egypt,Mostafa Madbouly,Government,46275069,Egypt,Abdel Fattah Al-Sisi,"International Religious,Executive,Elite,Government,Executive Office,Sunni",2018
584,Cairo,Egypt,2018-01-10,NULL,2018-01-10,ICEWS28417090,Sisi's comments came during his meeting with Acting Premier and Housing Minister Mostafa Madbouli and Finance Minister Amr al-Garhy.,Consult,Egypt's Sisi urges to solve structural problems in economic development,"(2018, 2, 3)",1,30.0626,31.2497,1,Muhafazat al Qahirah,Xinhua News Agency,2,Factiva,Egypt,Amr al-Garhy,"Executive,Government,Finance / Economy / Commerce / Trade Ministry",46275069,Egypt,Abdel Fattah Al-Sisi,"International Religious,Executive,Elite,Government,Executive Office,Sunni",2018
591,NULL,Syria,2018-01-10,Mintaqat Markaz Idlib,2018-01-10,ICEWS28417201,"Nearly 100,000 people have fled since the beginning of December the fighting in the doors of the province of Idleb, in the north-west of Syria, where the regime leads an offensive against the jihadists, announced on Wednesday the United Nations.",Use conventional military force,Syrie: 100.000 déplacés en un mois de combats aux portes d'Idleb (ONU),"(2018, 2, 3)",-10,35.9069,36.7568,1,Idlib,Yogam Communications SARL,1,Factiva,Syria,Government (Syria),Government,46275357,Syria,Citizen (Syria),"General Population / Civilian / Social,Social",2018
592,NULL,Syria,2018-01-10,NULL,2018-01-10,ICEWS28417304,"Regime forces backed by Russian warplanes launched an offensive on December 25 in Idlib province, the last in the country that remained fully outside the government's control.",Use conventional military force,Syria regime battles jihadists for airbase: monitor,"(2018, 2, 3)",-10,35.7667,36.6667,1,Idlib,Agence France-Presse,2,Factiva,Syria,Military (Syria),"Military,Government",46275377,Syria,Syria,NULL,2018
593,NULL,Syria,2018-01-10,NULL,2018-01-10,ICEWS28417303,"The Syrian Observatory for Human Rights, a Britain-based war monitor, said regime forces were able to enter Abu Duhur airbase under air cover and were engaged in fierce fighting with the jihadists.",Make statement,Syria regime battles jihadists for airbase: monitor,"(2018, 2, 3)",0,35.7667,36.6667,1,Idlib,Agence France-Presse,5,Factiva,Syria,Syrian Observatory for Human Rights,"Exiles,Dissident",46275377,Syria,Military (Syria),"Military,Government",2018
594,Doha,Qatar,2018-01-10,NULL,2018-01-10,ICEWS28417294,"On this occasion, Bourita conveyed to HH Sheikh Tamim bin Hamad al-Thani the greetings of HM the King and his wishes of further progress and prosperity for the Qatari people, QNA added.",Engage in symbolic act,HM the King Sends Written Message to Emir of Qatar,"(2018, 2, 3)",0,25.2793,51.5224,1,Baladiyat ad Dawhah,Unknown,3,Factiva,Qatar,Citizen (Qatar),"Social,General Population / Civilian / Social",46275451,Qatar,Tamim bin Hamad Al Thani,"International Religious,Transportation Ministry,Food Ministry,Executive,Military,Executive Office,Defense / Security Ministry,Muslim,Post / Tecoms Ministry,Agriculture / Fishing / Forestry Ministry,Environment Ministry,Finance / Economy / Commerce / Trade Ministry,Water Ministry,Education Ministry,Elite,Government",2018
595,Beirut,Lebanon,2018-01-10,NULL,2018-01-10,ICEWS28417391,Beirut -- BEIRUT: The Internal Security Forces Wednesday announced the arrest of the suspected leader of a drug dealing gang operating in Beirut and Mount Lebanon.,"Arrest, detain, or charge with legal action",ISF arrest suspect wanted on 72 drug charges; ISF arrest suspect wanted on 72 drug charges,"(2018, 2, 3)",-5,33.8889,35.4944,1,Beyrouth,Unknown,1,Factiva,Lebanon,Military Personnel - Special (Lebanon),"Military,Government",46275515,Lebanon,Criminal (Lebanon),"Dissident,Criminals / Gangs",2018
596,Harbata,Lebanon,2018-01-10,NULL,2018-01-10,ICEWS28417392,"He was arrested Jan. 4 during an ISF Information Branch raid on his residence in the Bekaa area of Harbata, the statement said.","Arrest, detain, or charge with legal action",ISF arrest suspect wanted on 72 drug charges; ISF arrest suspect wanted on 72 drug charges,"(2018, 2, 3)",-5,34.2083,36.2639,1,Mohafazat Baalbek-Hermel,Unknown,3,Factiva,Lebanon,Lebanon,NULL,46275515,Lebanon,Criminal (Lebanon),"Dissident,Criminals / Gangs",2018
597,Harbata,Lebanon,2018-01-10,NULL,2018-01-10,ICEWS28417393,He was subsequently arrested by the ISF.,"Arrest, detain, or charge with legal action",ISF arrest suspect wanted on 72 drug charges; ISF arrest suspect wanted on 72 drug charges,"(2018, 2, 3)",-5,34.2083,36.2639,1,Mohafazat Baalbek-Hermel,Unknown,5,Factiva,Lebanon,Military Personnel - Special (Lebanon),"Military,Government",46275515,Lebanon,Criminal (Lebanon),"Dissident,Criminals / Gangs",2018
598,NULL,Syria,2018-01-10,NULL,2018-01-10,ICEWS28417395,"Beirut -- Russia's Defense Ministry has asked the Turkish military to tighten control over armed groups in the Idlib de-escalation zone in Syria after two groups of drones attacked Russian bases last week, the ministry's newspaper said on Wednesday.",Make an appeal or request,Russia asks Turkey to tighten control over Idlib after drone attack; Russia asks Turkey to tighten control over Idlib after drone attack,"(2018, 2, 3)",3,35.7667,36.6667,1,Idlib,Unknown,1,Factiva,Russian Federation,Defense / Security Ministry (Russia),"Government,Executive,Defense / Security Ministry",46275519,Turkey,Military (Turkey),"Government,Military",2018
599,Beirut,Lebanon,2018-01-10,NULL,2018-01-10,ICEWS28417334,"Beirut -- BEIRUT: A young man accused of blackmailing women by threatening to share photos of them on Facebook and the online marketplace OLX was arrested by the Internal Security Forces, an ISF statement reported Wednesday.","Arrest, detain, or charge with legal action",ISF arrests Lebanese extortionist targeting women; ISF arrests Lebanese extortionist targeting women,"(2018, 2, 3)",-5,33.8889,35.4944,1,Beyrouth,Unknown,1,Factiva,Lebanon,Military Personnel - Special (Lebanon),"Military,Government",46275522,Lebanon,Men (Lebanon),"Social,General Population / Civilian / Social",2018
600,Beirut,Lebanon,2018-01-10,NULL,2018-01-10,ICEWS28417339,"The detainee, one of the 12 wounded, told The Associated Press on Wednesday that the soldiers opened fire to halt a protest by the detainees against restrictions on closer contact with visitors.",Make statement,"Security forces open fire on Yemen detainees, wounding 12; Security forces open fire on Yemen detainees, wounding 12","(2018, 2, 3)",0,33.8889,35.4944,1,Beyrouth,Unknown,4,Factiva,Lebanon,Detainee (Lebanon),"Dissident,Protestors / Popular Opposition / Mobs",46275526,Lebanon,Military (Lebanon),"Military,Government",2018
601,Beirut,Lebanon,2018-01-10,NULL,2018-01-10,ICEWS28417340,"The detainee, one of the 12 wounded, told The Associated Press on Wednesday that the soldiers opened fire to halt a protest by the detainees against restrictions on closer contact with visitors.",Demonstrate or rally,"Security forces open fire on Yemen detainees, wounding 12; Security forces open fire on Yemen detainees, wounding 12","(2018, 2, 3)",-6.5,33.8889,35.4944,1,Beyrouth,Unknown,4,Factiva,Lebanon,Detainee (Lebanon),"Dissident,Protestors / Popular Opposition / Mobs",46275526,NULL,Unspecified Actor,Unspecified,2018
602,Aleppo,Syria,2018-01-10,NULL,2018-01-10,ICEWS28417356,"The government-controlled Syrian Central Military Media said on Wednesday that Syrian troops are fighting militants, including members of al-Qaida-linked Levant Liberation Committee, in different areas near Abu Zuhour.",Make statement,Syrian troops approaching rebel-held air base in the north; Syrian troops approaching rebel-held air base,"(2018, 2, 3)",0,36.2012,37.1612,1,Muhafazat Halab,Unknown,4,Factiva,Syria,Media (Syria),"Social,Media",46275529,Syria,Military (Syria),"Government,Military",2018
603,Beirut,Lebanon,2018-01-10,NULL,2018-01-10,ICEWS28417323,"During his weekly meeting with lawmakers, Berri told visitors to his Ain al-Tineh residence that the electoral law would not be amended, because any changes would risk jeopardizing the elections, a statement from his office said.",Consult,Amendments risk jeopardizing electoral law: Berri; Amendments risk jeopardizing electoral law: Berri,"(2018, 2, 3)",1,33.8889,35.4944,1,Beyrouth,Unknown,2,Factiva,Lebanon,Nabih Berri,"Government,International Religious,Unicameral,Shia,Legislative / Parliamentary,(National) Minor Party,Ideological,Parties,Center Right",46275534,Lebanon,Lawmaker (Lebanon),"Legislative / Parliamentary,Government",2018
604,Beirut,Lebanon,2018-01-10,NULL,2018-01-10,ICEWS28417324,"During his weekly meeting with lawmakers, Berri told visitors to his Ain al-Tineh residence that the electoral law would not be amended, because any changes would risk jeopardizing the elections, a statement from his office said.",Consult,Amendments risk jeopardizing electoral law: Berri; Amendments risk jeopardizing electoral law: Berri,"(2018, 2, 3)",1,33.8889,35.4944,1,Beyrouth,Unknown,2,Factiva,Lebanon,Lawmaker (Lebanon),"Legislative / Parliamentary,Government",46275534,Lebanon,Nabih Berri,"Government,International Religious,Unicameral,Shia,Legislative / Parliamentary,(National) Minor Party,Ideological,Parties,Center Right",2018
605,Beirut,Lebanon,2018-01-10,NULL,2018-01-10,ICEWS28417417,"Also on Wednesday, Aoun met with visiting French Senator Bruno Retailleau.",Make a visit,"Aoun says elections to be held on time, meets French officials; Aoun says elections to be held on time, meets French officials","(2018, 2, 3)",1.9,33.8889,35.4944,1,Beyrouth,Unknown,5,Factiva,Lebanon,Michel Aoun,"Executive,Government,Executive Office,Unicameral,(National) Minor Party,Legislative / Parliamentary,Ideological,Parties,Center Right",46275542,France,Senate (France),"Government,Upper House,Legislative / Parliamentary",2018
606,Beirut,Lebanon,2018-01-10,NULL,2018-01-10,ICEWS28417418,"Also on Wednesday, Aoun met with visiting French Senator Bruno Retailleau.",Host a visit,"Aoun says elections to be held on time, meets French officials; Aoun says elections to be held on time, meets French officials","(2018, 2, 3)",2.8,33.8889,35.4944,1,Beyrouth,Unknown,5,Factiva,France,Senate (France),"Government,Upper House,Legislative / Parliamentary",46275542,Lebanon,Michel Aoun,"Executive,Government,Executive Office,Unicameral,(National) Minor Party,Legislative / Parliamentary,Ideological,Parties,Center Right",2018
607,Beirut,Lebanon,2018-01-10,NULL,2018-01-10,ICEWS28417437,"On Dec. 22, an 80-year-old Venezuelan woman was detained at Beirut’s Rafik Hariri International Airport when she was found to be carrying 31 kilograms of cocaine in her luggage on arrival.","Arrest, detain, or charge with legal action",Foreign Ministry deny consul's involvement in drug trafficking; Foreign Ministry deny consul's involvement in drug trafficking,"(2018, 2, 3)",-5,33.8889,35.4944,1,Beyrouth,Unknown,5,Factiva,Lebanon,Lebanon,NULL,46275543,Venezuela,Women (Venezuela),"Social,General Population / Civilian / Social",2018
608,Doha,Qatar,2018-01-10,NULL,2018-01-10,ICEWS28417525,"During a press conference in Doha, Lulwa al-Khater, spokesman of the Department of Foreign Affairs, said that the Qatar 'will make every effort' in order to obtain compensation for businesses.",Make statement,Le Qatar a déclaré hier que l'embargo décrété contre lui en juin par quatre pays...,"(2018, 2, 3)",0,25.2793,51.5224,1,Baladiyat ad Dawhah,Le Quotidien,2,Factiva,Qatar,Media Personnel (Qatar),"Social,Media",46276104,Qatar,Qatar,NULL,2018
609,Beirut,Lebanon,2018-01-10,NULL,2018-01-10,ICEWS28417471,Beirut -- BEIRUT: The Internal Security Forces Wednesday announced the arrest of two persons suspected of involvement in the theft of tens of thousands of dollars from a Fransabank in Metn’s Mansourieh last month.,"Arrest, detain, or charge with legal action",ISF arrests 2 more Fransabank robbery suspects; ISF arrests 2 more Fransabank robbery suspects,"(2018, 2, 3)",-5,33.8889,35.4944,1,Beyrouth,Unknown,1,Factiva,Lebanon,Military Personnel - Special (Lebanon),"Government,Military",46276195,Lebanon,Citizen (Lebanon),"General Population / Civilian / Social,Social",2018
610,Ech Chouaifat,Lebanon,2018-01-10,NULL,2018-01-10,ICEWS28417472,"The suspects, identified as Lebanese nationals H.Z., born in 1982, and H.A., born in 1987, were arrested on Jan. 6 in the Aley area of Choueifat, the ISF said in a statement.","Arrest, detain, or charge with legal action",ISF arrests 2 more Fransabank robbery suspects; ISF arrests 2 more Fransabank robbery suspects,"(2018, 2, 3)",-5,33.8086,35.5178,1,Mohafazat Mont-Liban,Unknown,2,Factiva,Lebanon,Lebanon,NULL,46276195,Lebanon,Criminal (Lebanon),"Criminals / Gangs,Dissident",2018
611,Beirut,Lebanon,2018-01-10,NULL,2018-01-10,ICEWS28417477,Beirut -- BEIRUT: A Lebanese prosecutor has begun questioning an Uber driver suspected in the murder of a British woman who worked at the U.K. Embassy in Beirut.,Investigate,Prosecutor questions suspected killer of UK diplomat; Prosecutor questions suspected killer of UK diplomat,"(2018, 2, 3)",-2,33.8889,35.4944,1,Beyrouth,Unknown,1,Factiva,Lebanon,Lawyer/Attorney (Lebanon),"Legal,Social",46276202,United Kingdom,Foreign Affairs (United Kingdom),"Government,Foreign Ministry,Executive",2018
612,Beirut,Lebanon,2018-01-10,NULL,2018-01-10,ICEWS28417685,"Beirut -- BEIRUT: Economy Minister Raed Khoury Wednesday signed a deal with management consulting firm McKinsey and Company to help restructure Lebanon’s economy, according to a statement from Prime Minister Saad Hariri’s office.",Sign formal agreement,Economy minister signs deal with McKinsey; Economy minister signs deal with McKinsey,"(2018, 2, 3)",8,33.8889,35.4944,1,Beyrouth,Unknown,1,Factiva,Lebanon,Ministry (Lebanon),Government,46276204,Lebanon,Business (Lebanon),"Business,Social",2018
613,Beirut,Lebanon,2018-01-10,NULL,2018-01-10,ICEWS28417686,"Beirut -- BEIRUT: Economy Minister Raed Khoury Wednesday signed a deal with management consulting firm McKinsey and Company to help restructure Lebanon’s economy, according to a statement from Prime Minister Saad Hariri’s office.",Sign formal agreement,Economy minister signs deal with McKinsey; Economy minister signs deal with McKinsey,"(2018, 2, 3)",8,33.8889,35.4944,1,Beyrouth,Unknown,1,Factiva,Lebanon,Business (Lebanon),"Business,Social",46276204,Lebanon,Ministry (Lebanon),Government,2018
614,Beirut,Lebanon,2018-01-10,NULL,2018-01-10,ICEWS28417684,"Bloomberg reported Tuesday that the six-month agreement with McKinsey would begin next week, with the company working with various ministries and economic bodies to formulate a new economic vision for the country, which is the Arab world’s most indebted nation.",Engage in diplomatic cooperation,Economy minister signs deal with McKinsey; Economy minister signs deal with McKinsey,"(2018, 2, 3)",3.5,33.8889,35.4944,1,Beyrouth,Unknown,2,Factiva,Lebanon,Business (Lebanon),"Business,Social",46276204,Lebanon,Ministry (Lebanon),Government,2018
615,Tripoli,Lebanon,2018-01-10,NULL,2018-01-10,ICEWS28417809,"Beirut -- TRIPOLI, Lebanon: A Syrian refugee in Lebanon set himself on fire Wednesday outside a U.N. office in desperation at aid getting cut off to his family, suffering serious burns.","Protest violently, riot",Syrian refugee sets himself ablaze at U.N. office in Tripoli; Syrian refugee sets himself ablaze at U.N. office,"(2018, 2, 3)",-7.5,34.4367,35.8497,1,Mohafazat Liban-Nord,Unknown,1,Factiva,Syria,Refugee (Syria),"Refugees / Displaced,Social",46276296,NULL,Unspecified Actor,Unspecified,2018
