,City,Country,Datetime,District,Event Date,Event ID,Event Sentence,Event Text,Headline,ISO Week,Intensity,Latitude,Longitude,Month,Province,Publisher,Sentence Number,Source,Source Country,Source Name,Source Sectors,Story ID,Target Country,Target Name,Target Sectors,Year
1026,Beirut,Lebanon,2016-11-03,NULL,2016-11-03,ICEWS25130710,"BEIRUT (Reuters) - Lebanon's president asked Sunni leader Saad al-Hariri to form a new government on Thursday, after he won the support of a majority of MPs including the influential parliament speaker who said he would cooperate with efforts to set up the new cabinet.",Praise or endorse,"Lebanon's Hariri named new PM, wins speaker's support","(2016, 44, 3)",3.4,33.8889,35.4944,11,Beyrouth,Reuters News,1,Factiva,Lebanon,Member of Parliament (Lebanon),"Government,Legislative / Parliamentary",42615951,Lebanon,Head of Government (Lebanon),"Executive,Government,Executive Office",2016
1027,Beirut,Lebanon,2016-11-03,NULL,2016-11-03,ICEWS25130711,"Hariri's nomination is part of a political deal that resulted in him endorsing one of his political opponents, Christian leader Michel Aoun, as head of state.",Praise or endorse,"Lebanon's Hariri named new PM, wins speaker's support","(2016, 44, 3)",3.4,33.8889,35.4944,11,Beyrouth,Reuters News,2,Factiva,Lebanon,Head of Government (Lebanon),"Executive,Government,Executive Office",42615951,Lebanon,Michel Aoun,"Government,Legislative / Parliamentary,(National) Minor Party,Parties,Ideological,Center Right,Unicameral",2016
1028,Beirut,Lebanon,2016-11-03,NULL,2016-11-03,ICEWS25130764,"BEIRUT (AP) — Lebanon's newly elected president, Michel Aoun, has asked former Prime Minister Saad Hariri to form a new government.","Appeal for change in institutions, regime",Lebanese president asks ex-PM Hariri to form new government,"(2016, 44, 3)",-0.3,33.8889,35.4944,11,Beyrouth,Associated Press Newswires,1,Factiva,Lebanon,Michel Aoun,"Government,Legislative / Parliamentary,(National) Minor Party,Parties,Ideological,Center Right,Unicameral",42615976,Lebanon,Saad Hariri,"(National) Minor Party,International Religious,Elite,Parties,Ideological,Center Right,Sunni",2016
1029,Beirut,Lebanon,2016-11-03,NULL,2016-11-03,ICEWS25130765,His election was made possible after Hariri endorsed him for president based on an understanding that Aoun would then appoint him as prime minister.,Praise or endorse,Lebanese president asks ex-PM Hariri to form new government,"(2016, 44, 3)",3.4,33.8889,35.4944,11,Beyrouth,Associated Press Newswires,5,Factiva,Lebanon,Saad Hariri,"(National) Minor Party,International Religious,Elite,Parties,Ideological,Center Right,Sunni",42615976,Lebanon,Michel Aoun,"Government,Legislative / Parliamentary,(National) Minor Party,Parties,Ideological,Center Right,Unicameral",2016
1030,Beirut,Lebanon,2016-11-03,NULL,2016-11-03,ICEWS25130726,"BEIRUT (Reuters) - Lebanese President Michel Aoun asked Sunni politician Saad al-Hariri on Thursday to form a new government, the presidency said in a statement, after he secured the support of a majority of MPs.","Appeal for change in institutions, regime",Lebanese president asks Hariri to form new government,"(2016, 44, 3)",-0.3,33.8889,35.4944,11,Beyrouth,Reuters News,1,Factiva,Lebanon,Michel Aoun,"Government,Legislative / Parliamentary,(National) Minor Party,Parties,Ideological,Center Right,Unicameral",42615984,Lebanon,Saad Hariri,"(National) Minor Party,International Religious,Elite,Parties,Ideological,Center Right,Sunni",2016
1031,Mosul,Iraq,2016-11-03,NULL,2016-11-03,ICEWS25130748,"The Shia-dominated Popular Mobilisation Forces (PMF) have 'fully recaptured' the village of Ain al-Jahsh western Mosul, pro-Sadrist TV channel Al-Ahd quoted its correspondent as saying in an 'urgent' screen caption at 1025 gmt on 3 November.",Occupy territory,Iraqi Shia militias 'fully recapture' village western Mosul,"(2016, 44, 3)",-9.5,36.335,43.1189,11,Muhafazat Ninawa,BBC Monitoring Newsfile,2,Factiva,Iraq,Military (Iraq),"Government,Military",42616002,Iraq,Iraq,NULL,2016
1032,NULL,Syria,2016-11-03,NULL,2016-11-03,ICEWS25130658,"Hariri was endorsed by 110 members of the 127-seat parliament, with only the Shiite Hezbollah movement, the Syrian Social National Party and the Lebanese Baath party -- all supporters of Syria's government -- declining to back him as prime minister.",Praise or endorse,Saad Hariri named Lebanon's new prime minister: presidency,"(2016, 44, 3)",3.4,33.5102,36.2913,11,NULL,Agence France-Presse,4,Factiva,Syria,National Party (Syria),Parties,42616015,Lebanon,Saad Hariri,"(National) Minor Party,International Religious,Elite,Parties,Ideological,Center Right,Sunni",2016
1033,NULL,Lebanon,2016-11-03,NULL,2016-11-03,ICEWS25130659,"Hariri was endorsed by 110 members of the 127-seat parliament, with only the Shiite Hezbollah movement, the Syrian Social National Party and the Lebanese Baath party -- all supporters of Syria's government -- declining to back him as prime minister.",Praise or endorse,Saad Hariri named Lebanon's new prime minister: presidency,"(2016, 44, 3)",3.4,33.8889,35.4944,11,NULL,Agence France-Presse,4,Factiva,Lebanon,Baath Party,"Arab,International Ethnic,(National) Minor Party,Ideological,Parties,Far Left",42616015,Lebanon,Saad Hariri,"(National) Minor Party,International Religious,Elite,Parties,Ideological,Center Right,Sunni",2016
1034,NULL,Lebanon,2016-11-03,NULL,2016-11-03,ICEWS25130661,"Hariri was endorsed by 110 members of the 127-seat parliament, with only the Shiite Hezbollah movement, the Syrian Social National Party and the Lebanese Baath party -- all supporters of Syria's government -- declining to back him as prime minister.",Reject,Saad Hariri named Lebanon's new prime minister: presidency,"(2016, 44, 3)",-4,33.8889,35.4944,11,NULL,Agence France-Presse,4,Factiva,Syria,National Party (Syria),Parties,42616015,Lebanon,Saad Hariri,"(National) Minor Party,International Religious,Elite,Parties,Ideological,Center Right,Sunni",2016
1035,NULL,Lebanon,2016-11-03,NULL,2016-11-03,ICEWS25130662,"Hariri was endorsed by 110 members of the 127-seat parliament, with only the Shiite Hezbollah movement, the Syrian Social National Party and the Lebanese Baath party -- all supporters of Syria's government -- declining to back him as prime minister.",Reject,Saad Hariri named Lebanon's new prime minister: presidency,"(2016, 44, 3)",-4,33.8889,35.4944,11,NULL,Agence France-Presse,4,Factiva,Lebanon,Baath Party,"Arab,International Ethnic,(National) Minor Party,Ideological,Parties,Far Left",42616015,Lebanon,Saad Hariri,"(National) Minor Party,International Religious,Elite,Parties,Ideological,Center Right,Sunni",2016
1036,NULL,Lebanon,2016-11-03,NULL,2016-11-03,ICEWS25130660,"But his return was assured as part of the deal he struck to throw his support behind former general Michel Aoun, a Hezbollah ally.",Rally support on behalf of,Saad Hariri named Lebanon's new prime minister: presidency,"(2016, 44, 3)",3.8,33.8889,35.4944,11,NULL,Agence France-Presse,5,Factiva,Lebanon,Saad Hariri,"(National) Minor Party,International Religious,Elite,Parties,Ideological,Center Right,Sunni",42616015,Lebanon,Michel Aoun,"Government,Legislative / Parliamentary,(National) Minor Party,Parties,Ideological,Center Right,Unicameral",2016
1037,Qada' Talkif,Iraq,2016-11-03,NULL,2016-11-03,ICEWS25130733,"On Friday, Rudskoy said that on October 24, the US Air Force strike hit a school in Tall Kayf and caused multiple casualties.",Make statement,Russian General Staff Presents Alleged Photo of US Airstrike on Iraqi Town of Tall Kayf,"(2016, 44, 3)",0,36.4911,43.1203,11,Muhafazat Ninawa,Unknown,2,Factiva,Iraq,High Ranking Military Personnel (Iraq),"Government,Military",42616027,United States,United States,NULL,2016
1038,Qada' Talkif,Iraq,2016-11-03,NULL,2016-11-03,ICEWS25130734,"On Friday, Rudskoy said that on October 24, the US Air Force strike hit a school in Tall Kayf and caused multiple casualties.",Make statement,Russian General Staff Presents Alleged Photo of US Airstrike on Iraqi Town of Tall Kayf,"(2016, 44, 3)",0,36.4911,43.1203,11,Muhafazat Ninawa,Unknown,2,Factiva,Iraq,High Ranking Military Personnel (Iraq),"Government,Military",42616027,Iraq,Air Force (Iraq),"Government,Air Force,Military",2016
1039,Beirut,Lebanon,2016-11-03,NULL,2016-11-03,ICEWS25130753,"BEIRUT (AP) — Lebanon's newly elected president, Michel Aoun, asks former prime minister, Saad Hariri, to form new government.","Appeal for change in institutions, regime","Lebanon's newly elected president, Michel Aoun, asks former prime minister, Saad Hariri, to form new government","(2016, 44, 3)",-0.3,33.8889,35.4944,11,Beyrouth,Associated Press Newswires,1,Factiva,Lebanon,Michel Aoun,"Government,Legislative / Parliamentary,(National) Minor Party,Parties,Ideological,Center Right,Unicameral",42616062,Lebanon,Saad Hariri,"(National) Minor Party,International Religious,Elite,Parties,Ideological,Center Right,Sunni",2016
1040,Mosul,Iraq,2016-11-03,NULL,2016-11-03,ICEWS25130766,"'The US continues to bombard the civilian dwelling areas in Mosul as well as in other settlements in Iraq's Nineveh Governorate,' he said.",Use conventional military force,Coalition warplanes continue airstrikes on civilian dwelling areas in Iraq - Russian Defense Ministry,"(2016, 44, 3)",-10,36.335,43.1189,11,Muhafazat Ninawa,Unknown,2,Factiva,United States,United States,NULL,42616116,Iraq,Iraq,NULL,2016
1041,Al Hamdaniyah,Syria,2016-11-03,NULL,2016-11-03,ICEWS25130573,"'On October 30, armed groups in 1070 neighborhood carried out a strike on the Dahiyat al-Assad and Al-Hamdaniyah districts using home-made projectiles stuffed with a chemical warfare agent.",Conduct strike or boycott,About 40 people wounded in gunmen shelling in Aleppo October 30 - General Staff,"(2016, 44, 3)",-6.5,36.1816,37.1119,11,Muhafazat Halab,Unknown,2,Factiva,Syria,Armed Band (Syria),Unidentified Forces,42616117,NULL,Unspecified Actor,Unspecified,2016
1042,Al Hamdaniyah,Syria,2016-11-03,NULL,2016-11-03,ICEWS25130574,"'On October 30, armed groups in 1070 neighborhood carried out a strike on the Dahiyat al-Assad and Al-Hamdaniyah districts using home-made projectiles stuffed with a chemical warfare agent.",Use unconventional violence,About 40 people wounded in gunmen shelling in Aleppo October 30 - General Staff,"(2016, 44, 3)",-9,36.1816,37.1119,11,Muhafazat Halab,Unknown,2,Factiva,Syria,Armed Band (Syria),Unidentified Forces,42616117,Syria,Citizen (Syria),"Social,General Population / Civilian / Social",2016
1043,Mosul,Iraq,2016-11-03,NULL,2016-11-03,ICEWS25130605,"A school building and some homes were damaged as a result of the US airstrikes on Iraq’s Mosul on October 24, chief of the Main Operational Directorate of Russia’s General Staff Lieutenant General Sergei Rudskoi told a briefing.",Employ aerial weapons,"School building, homes damaged by US airstrikes on Mosul on October 24 - Russian Defense Ministry","(2016, 44, 3)",-10,36.335,43.1189,11,Muhafazat Ninawa,Unknown,1,Factiva,United States,United States,NULL,42616120,Iraq,Iraq,NULL,2016
1044,Mosul,Iraq,2016-11-03,NULL,2016-11-03,ICEWS25130585,"Earlier in the day, media reported that Baghdadi had released an audiotape, on which he called on Iraqis to defend Mosul against the Iraqi army, which has been trying to to retake it from the militants.",Make an appeal or request,IS Leader Baghdadi Arrives in Iraq's Mosul Amid Army Operation to Retake City - Reports,"(2016, 44, 3)",3,36.335,43.1189,11,Muhafazat Ninawa,Unknown,3,Factiva,Iraq,Abu Bakr al-Baghdadi,"Insurgents,Fundamentalist,Dissident,International Religious,Radicals / Extremists / Fundamentalists,Muslim,Ideological,Sunni",42616125,Iraq,Citizen (Iraq),"Social,General Population / Civilian / Social",2016
1045,Mosul,Iraq,2016-11-03,NULL,2016-11-03,ICEWS25130584,"On October 17, Iraqi Prime Minister Haider Abadi announced the start of a military operation to recapture Mosul from IS, which is outlawed in Russia, with the help of airstrikes by the US-led international coalition.",Make statement,IS Leader Baghdadi Arrives in Iraq's Mosul Amid Army Operation to Retake City - Reports,"(2016, 44, 3)",0,36.335,43.1189,11,Muhafazat Ninawa,Unknown,6,Factiva,Iraq,Haider Al-Abadi,"Fundamentalist,Legislative / Parliamentary,Lower House,International Religious,Ideological,Executive,Executive Office,Shia,Government,(National) Major Party,Parties,Muslim",42616125,Iraq,Iraq,NULL,2016
1046,Baghdad,Iraq,2016-11-03,NULL,2016-11-03,ICEWS25130683,"Moscow/Baghdad, Nov 3 (IANS) The US-led coalition forces supporting the siege of the Islamic State's de-facto capital Mosul on Thursday hit residential areas in and around the Iraqi city, the Russian military reported.",Praise or endorse,US jets strike residential areas in Iraq's Mosul,"(2016, 44, 3)",3.4,33.3406,44.4009,11,Muhafazat Baghdad,Indo-Asian News Service,1,Factiva,United States,Military (United States),"Government,Military",42616129,Iraq,Iraq,NULL,2016
1047,Mosul,Iraq,2016-11-03,NULL,2016-11-03,ICEWS25130684,"'The US is continuing to carry out airstrikes on residential areas in Mosul and towns in the Nineveh governorate,' Lt Gen Sergey Rudosky said, RT online reported.",Employ aerial weapons,US jets strike residential areas in Iraq's Mosul,"(2016, 44, 3)",-10,36.335,43.1189,11,Muhafazat Ninawa,Indo-Asian News Service,2,Factiva,United States,United States,NULL,42616129,Iraq,Iraq,NULL,2016
1051,Beirut,Lebanon,2016-11-03,NULL,2016-11-03,ICEWS25131059,"BEIRUT, Nov 3 (Reuters) - Lebanon's president asked Sunni leader Saad al-Hariri to form a new government on Thursday, after he won the support of a majority of MPs including the influential parliament speaker who said he would cooperate with efforts to set up the new cabinet.",Make an appeal or request,"UPDATE 1-Lebanon's Hariri named new PM, wins speaker's support","(2016, 44, 3)",3,33.8889,35.4944,11,Beyrouth,Reuters News,2,Factiva,Lebanon,Head of Government (Lebanon),"Executive,Government,Executive Office",42616557,Lebanon,Saad Hariri,"Ideological,Center Right,International Religious,Elite,Parties,(National) Minor Party,Sunni",2016
1052,Beirut,Lebanon,2016-11-03,NULL,2016-11-03,ICEWS25131060,"BEIRUT, Nov 3 (Reuters) - Lebanon's president asked Sunni leader Saad al-Hariri to form a new government on Thursday, after he won the support of a majority of MPs including the influential parliament speaker who said he would cooperate with efforts to set up the new cabinet.",Praise or endorse,"UPDATE 1-Lebanon's Hariri named new PM, wins speaker's support","(2016, 44, 3)",3.4,33.8889,35.4944,11,Beyrouth,Reuters News,2,Factiva,Lebanon,Member of Parliament (Lebanon),"Legislative / Parliamentary,Government",42616557,Lebanon,Head of Government (Lebanon),"Executive,Government,Executive Office",2016
1053,Beirut,Lebanon,2016-11-03,NULL,2016-11-03,ICEWS25131061,"Hariri's nomination is part of a political deal that resulted in him endorsing one of his political opponents, Christian leader Michel Aoun, as head of state.",Praise or endorse,"UPDATE 1-Lebanon's Hariri named new PM, wins speaker's support","(2016, 44, 3)",3.4,33.8889,35.4944,11,Beyrouth,Reuters News,3,Factiva,Lebanon,Head of Government (Lebanon),"Executive,Government,Executive Office",42616557,Lebanon,Michel Aoun,"Ideological,Center Right,Parties,Legislative / Parliamentary,(National) Minor Party,Unicameral,Government",2016
1054,Al Muhallabiyah,Iraq,2016-11-03,NULL,2016-11-03,ICEWS25130933,"Amiri said the militias also intended ultimately to cut off the main highway between Mosul and Tal Afar, but said that the Muhalabiya route was the priority because it was the one used by the militants since they took over Mosul two years ago.",Make statement,UPDATE 1-Iraqi Shi'ite forces to cut western supply route from Mosul,"(2016, 44, 3)",0,36.2663,42.7074,11,Muhafazat Ninawa,Reuters News,5,Factiva,Iraq,Hadi Al-Amiri,"Parties,Ideological,International Religious,Shia,Executive,Cabinet,Fundamentalist,Government,Transportation Ministry,(National) Minor Party",42616558,Iraq,Militia (Iraq),Unidentified Forces,2016
1055,NULL,Lebanon,2016-11-03,NULL,2016-11-03,ICEWS25130968,"Hariri, who has already served as prime minister once before, has a political career marked by his opposition to the powerful Shiite movement Hezbollah, which is allied with Aoun.",Criticize or denounce,"Lebanon's new PM a vocal critic of Hezbollah, Syria","(2016, 44, 3)",-2,33.8889,35.4944,11,NULL,Agence France-Presse,3,Factiva,Lebanon,Head of Government (Lebanon),"Executive,Government,Executive Office",42616580,Lebanon,Hezbollah,"Dissident,Ideological,Far Left,International Religious,Social,National Religious,Parties,Shia,Organized Violent,(National) Minor Party",2016
1056,Beirut,Lebanon,2016-11-03,NULL,2016-11-03,ICEWS25130922,"BEIRUT, Nov. 3 (Xinhua) -- Lebanese President Michel Aoun on Thursday asked former prime minister Saad Hariri to form a new government, Aoun's office said in a statement.","Appeal for change in institutions, regime",1st LD: Former PM Hariri asked to form new government in Lebanon,"(2016, 44, 3)",-0.3,33.8889,35.4944,11,Beyrouth,Xinhua News Agency,1,Factiva,Lebanon,Michel Aoun,"Ideological,Center Right,Parties,Legislative / Parliamentary,(National) Minor Party,Unicameral,Government",42616583,Lebanon,Saad Hariri,"Ideological,Center Right,International Religious,Elite,Parties,(National) Minor Party,Sunni",2016
1057,Beirut,Lebanon,2016-11-03,NULL,2016-11-03,ICEWS25130923,"Aoun, 83, a Christian former army chief, was elected president on Monday in the Lebanese parliament, ending a vacancy that lasted almost two and a half years.",Praise or endorse,1st LD: Former PM Hariri asked to form new government in Lebanon,"(2016, 44, 3)",3.4,33.8889,35.4944,11,Beyrouth,Xinhua News Agency,3,Factiva,Lebanon,Legislature (Lebanon),"Legislative / Parliamentary,Government",42616583,Lebanon,Michel Aoun,"Ideological,Center Right,Parties,Legislative / Parliamentary,(National) Minor Party,Unicameral,Government",2016
1058,Beirut,Lebanon,2016-11-03,NULL,2016-11-03,ICEWS25130924,"Aoun, 83, a Christian former army chief, was elected president on Monday in the Lebanese parliament, ending a vacancy that lasted almost two and a half years.",Praise or endorse,1st LD: Former PM Hariri asked to form new government in Lebanon,"(2016, 44, 3)",3.4,33.8889,35.4944,11,Beyrouth,Xinhua News Agency,3,Factiva,Lebanon,Legislature (Lebanon),"Legislative / Parliamentary,Government",42616583,Lebanon,Army Personnel (Lebanon),"Military,Government",2016
1059,Beirut,Lebanon,2016-11-03,NULL,2016-11-03,ICEWS25130921,"Hariri, who heads al-Mustaqbal Movement, said he hopes a government of 'national accord' would be formed soon.",Make optimistic comment,1st LD: Former PM Hariri asked to form new government in Lebanon,"(2016, 44, 3)",0.4,33.8889,35.4944,11,Beyrouth,Xinhua News Agency,5,Factiva,Lebanon,Saad Hariri,"Ideological,Center Right,International Religious,Elite,Parties,(National) Minor Party,Sunni",42616583,Lebanon,Government (Lebanon),Government,2016
1060,Qada' Talkif,Iraq,2016-11-03,NULL,2016-11-03,ICEWS25131019,"A school and nearby homes suffered during US Air Force strikes on the Iraqi city of Tall Kayf near Mosul on October 24, Lt. Gen. Sergei Rudskoy, chief of the Russian General Staff Main Operational Directorate, said at a press briefing.",Use conventional military force,US-led Coalition Airstrikes on Populated Areas Near Mosul Lead to Casualties,"(2016, 44, 3)",-10,36.4911,43.1203,11,Muhafazat Ninawa,Unknown,5,Factiva,United States,United States,NULL,42616592,Iraq,Iraq,NULL,2016
1061,Mosul,Iraq,2016-11-03,NULL,2016-11-03,ICEWS25130997,"Earlier in the day, media reported that Baghdadi had released an audiotape, on which he called on Iraqis to defend Mosul against the Iraqi army, which has been trying to to retake it from the militants.",Make an appeal or request,Devil in His Cave: Daesh Leader is in Iraq's Mosul Amid Operation to Retake City,"(2016, 44, 3)",3,36.335,43.1189,11,Muhafazat Ninawa,Unknown,5,Factiva,Iraq,Abu Bakr al-Baghdadi,"Ideological,Insurgents,Radicals / Extremists / Fundamentalists,International Religious,Fundamentalist,Dissident,Muslim,Sunni",42616599,Iraq,Citizen (Iraq),"Social,General Population / Civilian / Social",2016
1062,Aleppo,Syria,2016-11-03,NULL,2016-11-03,ICEWS25130908,"As the evacuation failed and the humanitarian pause ended, the Syrian government launched an offensive against the militants.",Use conventional military force,"Russia, Syria Taking All Possible Steps to Solve Humanitarian Issues in Aleppo","(2016, 44, 3)",-10,36.2012,37.1612,11,Muhafazat Halab,Unknown,6,Factiva,Syria,Government (Syria),Government,42616602,Syria,Militant (Syria),Unidentified Forces,2016
1063,Beirut,Lebanon,2016-11-03,NULL,2016-11-03,ICEWS25131071,Hariri was speaking at the presidential palace after being asked by President Michel Aoun to form the new government.,"Appeal for change in institutions, regime",Lebanon's Hariri hopes for quick government formation,"(2016, 44, 3)",-0.3,33.8889,35.4944,11,Beyrouth,Reuters News,2,Factiva,Lebanon,Michel Aoun,"Ideological,Center Right,Parties,Legislative / Parliamentary,(National) Minor Party,Unicameral,Government",42616625,Lebanon,Saad Hariri,"Ideological,Center Right,International Religious,Elite,Parties,(National) Minor Party,Sunni",2016
1064,Mosul,Iraq,2016-11-03,NULL,2016-11-03,ICEWS25130814,"The leader of the so-called &amp;quot;Islamic State&amp;quot; (IS), in a rare video on Thursday urged his fighters to hold their ground in Mosul, where Iraqi forces are leading a battle to retake the Sunni extremists&amp;#39; stronghold.",Make an appeal or request,'Islamic State' leader Baghdadi issues rare video urging troops to fight,"(2016, 44, 3)",3,36.335,43.1189,11,Muhafazat Ninawa,Deutsche Welle,3,Factiva,Iraq,Abu Bakr al-Baghdadi,"Ideological,Insurgents,Radicals / Extremists / Fundamentalists,International Religious,Fundamentalist,Dissident,Muslim,Sunni",42616646,Iraq,Combatant (Iraq),Unidentified Forces,2016
1065,Mosul,Iraq,2016-11-03,NULL,2016-11-03,ICEWS25130813,"If authentic, it would be the first video in nearly a year from Baghdadi, who told IS fighters to make the enemy&amp;#39;s &amp;quot;blood flow like rivers&amp;quot; and &amp;quot;decimate their territories.'",Make statement,'Islamic State' leader Baghdadi issues rare video urging troops to fight,"(2016, 44, 3)",0,36.335,43.1189,11,Muhafazat Ninawa,Deutsche Welle,6,Factiva,Iraq,Abu Bakr al-Baghdadi,"Ideological,Insurgents,Radicals / Extremists / Fundamentalists,International Religious,Fundamentalist,Dissident,Muslim,Sunni",42616646,Iraq,Combatant (Iraq),Unidentified Forces,2016
1066,Mosul,Iraq,2016-11-03,NULL,2016-11-03,ICEWS25130887,"Iraqi forces took control of Kukjeli and al-Qudis neighborhoods of eastern Mosul on Thursday and are currently at the gates of al-Karama district, where they clashed with the Islamic State militants.",Use conventional military force,Iraqi forces take control of neighborhoods in eastern Mosul,"(2016, 44, 3)",-10,36.335,43.1189,11,Muhafazat Ninawa,EFE News Service,2,Factiva,Iraq,Military (Iraq),"Military,Government",42616675,Iraq,Militant (Iraq),Unidentified Forces,2016
1067,Mosul,Iraq,2016-11-03,NULL,2016-11-03,ICEWS25130888,"Iraqi forces took control of Kukjeli and al-Qudis neighborhoods of eastern Mosul on Thursday and are currently at the gates of al-Karama district, where they clashed with the Islamic State militants.",Use unconventional violence,Iraqi forces take control of neighborhoods in eastern Mosul,"(2016, 44, 3)",-9,36.335,43.1189,11,Muhafazat Ninawa,EFE News Service,2,Factiva,Iraq,Militant (Iraq),Unidentified Forces,42616675,Iraq,Military (Iraq),"Military,Government",2016
1068,Mosul,Iraq,2016-11-03,NULL,2016-11-03,ICEWS25130889,"Iraqi forces took control of Kukjeli and al-Qudis neighborhoods of eastern Mosul on Thursday and are currently at the gates of al-Karama district, where they clashed with the Islamic State militants.",Occupy territory,Iraqi forces take control of neighborhoods in eastern Mosul,"(2016, 44, 3)",-9.5,36.335,43.1189,11,Muhafazat Ninawa,EFE News Service,2,Factiva,Iraq,Military (Iraq),"Military,Government",42616675,Iraq,Iraq,NULL,2016
1069,Mosul,Iraq,2016-11-03,NULL,2016-11-03,ICEWS25130886,"These developments came two days after the Iraqi army entered Kukjeli and took control over the local television headquarters of Mosul, forcing most radical fighters to withdraw from the eastern part of the city.",Retreat or surrender militarily,Iraqi forces take control of neighborhoods in eastern Mosul,"(2016, 44, 3)",10,36.335,43.1189,11,Muhafazat Ninawa,EFE News Service,5,Factiva,Iraq,Combatant (Iraq),Unidentified Forces,42616675,Iraq,Iraq,NULL,2016
1070,Beirut,Lebanon,2016-11-03,NULL,2016-11-03,ICEWS25130983,"Hariri received the support of 110 or 127 members of parliament, according to a presidential statement broadcast on Lebanese television.",Praise or endorse,Saad Hariri named as new prime minister of Lebanon,"(2016, 44, 3)",3.4,33.8889,35.4944,11,Beyrouth,EFE News Service,4,Factiva,Lebanon,Member of Parliament (Lebanon),"Legislative / Parliamentary,Government",42616677,Lebanon,Saad Hariri,"Ideological,Center Right,International Religious,Elite,Parties,(National) Minor Party,Sunni",2016
1071,Hamdaniyah,Syria,2016-11-03,NULL,2016-11-03,ICEWS25130977,"The group said that they are engaged in preparatory attacks 'using various types of weapons' on pro-government forces in the 3,000 Apartments Project in Al-Hamdaniya neighbourhood in Aleppo's west.",Use conventional military force,'Second phase' of jihadist-rebel offensive in Aleppo launched,"(2016, 44, 3)",-10,35.4247,36.8546,11,Idlib,BBC Monitoring Newsfile,3,Factiva,Syria,Ahrar ash-Sham,"Dissident,Insurgents",42616703,Syria,Military (Syria),"Government,Military",2016
