,City,Country,Datetime,District,Event Date,Event ID,Event Sentence,Event Text,Headline,ISO Week,Intensity,Latitude,Longitude,Month,Province,Publisher,Sentence Number,Source,Source Country,Source Name,Source Sectors,Story ID,Target Country,Target Name,Target Sectors,Year
892,Al Qatif,Saudi Arabia,2016-01-05,NULL,2016-01-05,ICEWS24000878,TEHRAN (FNA)- Hundreds of Saudi soldiers and security forces raided people's houses in the region of Qatif in the Eastern part of the kingdom on Tuesday beating residents and arresting tens of people.,"Arrest, detain, or charge with legal action",Saudi Security Forces Raid Qatif Region Again,"(2016, 1, 3)",-5,26.5208,50.0245,1,Al Mintaqah ash Sharqiyah,FARS News Agency,1,Factiva,Saudi Arabia,Royal Administration (Saudi Arabia),Government,40008713,Saudi Arabia,Citizen (Saudi Arabia),"Social,General Population / Civilian / Social",2016
893,Al Qatif,Saudi Arabia,2016-01-05,NULL,2016-01-05,ICEWS24000879,TEHRAN (FNA)- Hundreds of Saudi soldiers and security forces raided people's houses in the region of Qatif in the Eastern part of the kingdom on Tuesday beating residents and arresting tens of people.,Use conventional military force,Saudi Security Forces Raid Qatif Region Again,"(2016, 1, 3)",-10,26.5208,50.0245,1,Al Mintaqah ash Sharqiyah,FARS News Agency,1,Factiva,Saudi Arabia,Saudi Arabian Defence Forces,"Government,Military",40008713,Saudi Arabia,Citizen (Saudi Arabia),"Social,General Population / Civilian / Social",2016
894,Al Qatif,Saudi Arabia,2016-01-05,NULL,2016-01-05,ICEWS24000880,TEHRAN (FNA)- Hundreds of Saudi soldiers and security forces raided people's houses in the region of Qatif in the Eastern part of the kingdom on Tuesday beating residents and arresting tens of people.,Use conventional military force,Saudi Security Forces Raid Qatif Region Again,"(2016, 1, 3)",-10,26.5208,50.0245,1,Al Mintaqah ash Sharqiyah,FARS News Agency,1,Factiva,Saudi Arabia,Military Personnel - Special (Saudi Arabia),"Government,Military",40008713,Saudi Arabia,Citizen (Saudi Arabia),"Social,General Population / Civilian / Social",2016
895,Al Qatif,Saudi Arabia,2016-01-05,NULL,2016-01-05,ICEWS24000877,"On Monday, the Saudi police killed a young man and injured an eight-year-old boy during popular protests in Qatif region in the Eastern part of the kingdom to condemn Sheikh Nimr's execution and suppression of the Shiite minority by the Riyadh government.",Criticize or denounce,Saudi Security Forces Raid Qatif Region Again,"(2016, 1, 3)",-2,26.5208,50.0245,1,Al Mintaqah ash Sharqiyah,FARS News Agency,4,Factiva,Saudi Arabia,Children (Saudi Arabia),"Social,General Population / Civilian / Social",40008713,Saudi Arabia,Government (Saudi Arabia),Government,2016
896,Al Qatif,Saudi Arabia,2016-01-05,NULL,2016-01-05,ICEWS24000881,"On Monday, the Saudi police killed a young man and injured an eight-year-old boy during popular protests in Qatif region in the Eastern part of the kingdom to condemn Sheikh Nimr's execution and suppression of the Shiite minority by the Riyadh government.",Use conventional military force,Saudi Security Forces Raid Qatif Region Again,"(2016, 1, 3)",-10,26.5208,50.0245,1,Al Mintaqah ash Sharqiyah,FARS News Agency,4,Factiva,Saudi Arabia,Police (Saudi Arabia),"Police,Government",40008713,Saudi Arabia,Men (Saudi Arabia),"Social,General Population / Civilian / Social",2016
897,Al Qatif,Saudi Arabia,2016-01-05,NULL,2016-01-05,ICEWS24000882,"On Monday, the Saudi police killed a young man and injured an eight-year-old boy during popular protests in Qatif region in the Eastern part of the kingdom to condemn Sheikh Nimr's execution and suppression of the Shiite minority by the Riyadh government.",Use conventional military force,Saudi Security Forces Raid Qatif Region Again,"(2016, 1, 3)",-10,26.5208,50.0245,1,Al Mintaqah ash Sharqiyah,FARS News Agency,4,Factiva,Saudi Arabia,Police (Saudi Arabia),"Police,Government",40008713,Saudi Arabia,Children (Saudi Arabia),"Social,General Population / Civilian / Social",2016
898,Al Qatif,Saudi Arabia,2016-01-05,NULL,2016-01-05,ICEWS24000883,Ali Omran al-Dawood was killed when the Saudi police started shooting at the protesters in the village of Awamiyah in Qatif region.,Use conventional military force,Saudi Security Forces Raid Qatif Region Again,"(2016, 1, 3)",-10,26.5208,50.0245,1,Al Mintaqah ash Sharqiyah,FARS News Agency,5,Factiva,Saudi Arabia,Police (Saudi Arabia),"Police,Government",40008713,Saudi Arabia,Protester (Saudi Arabia),"Dissident,Protestors / Popular Opposition / Mobs",2016
899,Ayn Tarma,Syria,2016-01-05,NULL,2016-01-05,ICEWS24000846,The militant group's gathering centers in Ein Tarma in Eastern Ghouta were massively shelled by the Syrian army's artillery.,fight with artillery and tanks,A Dozen Terrorists Killed in Syrian Army Artillery Attack in Eastern Ghouta,"(2016, 1, 3)",-10,33.516,36.3508,1,Muhafazat Rif Dimashq,FARS News Agency,2,Factiva,Syria,Military (Syria),"Military,Government",40008716,Syria,Syria,NULL,2016
900,Ayn Tarma,Syria,2016-01-05,NULL,2016-01-05,ICEWS24000844,"Initial battlefield reports said, at least, a dozen terrorists were killed and dozens more were injured in the Syrian army raid on their military positions in Ein Tarma.",Use conventional military force,A Dozen Terrorists Killed in Syrian Army Artillery Attack in Eastern Ghouta,"(2016, 1, 3)",-10,33.516,36.3508,1,Muhafazat Rif Dimashq,FARS News Agency,3,Factiva,Syria,Syria,NULL,40008716,Syria,Citizen (Syria),"General Population / Civilian / Social,Social",2016
901,Damascus,Syria,2016-01-05,NULL,2016-01-05,ICEWS24000845,"The army seized control over Harasta al-Qantara village to the Northwest of Marj al-Sultan in Eastern Ghouta in Damascus province after clashes with terrorists of Jeish al-Islam, Faylaq al-Rahman, Ajnad al-Sham and Faylaq Omar.",Occupy territory,A Dozen Terrorists Killed in Syrian Army Artillery Attack in Eastern Ghouta,"(2016, 1, 3)",-9.5,33.5102,36.2913,1,Dimashq,FARS News Agency,5,Factiva,Syria,Military (Syria),"Military,Government",40008716,Syria,Syria,NULL,2016
902,Riyadh,Saudi Arabia,2016-01-05,NULL,2016-01-05,ICEWS24000898,"Turkey joined in condemning Iran on Tuesday, with Prime Minister Ahmet Davutoglu saying that the breakdown of security for Saudi diplomatic missions in Iran was 'unacceptable.'",Criticize or denounce,Kuwait Recalls Ambassador From Tehran as Iran-Saudi Tensions Spread -- 2nd Update,"(2016, 1, 3)",-2,24.6877,46.7219,1,Mintaqat ar Riyad,Dow Jones News Service,6,Factiva,Turkey,Turkey,NULL,40008721,Iran,Iran,NULL,2016
903,NULL,Saudi Arabia,2016-01-05,NULL,2016-01-05,ICEWS24000862,Sunni Muslim Saudi Arabia and Shiite Iran have been battling each other for supremacy in the Middle East for decades - a reality that might make the weekend's breaking-off of diplomatic relations between the two rivals seem like business as usual.,Use unconventional violence,Iran-Saudi tensions show why it's so hard for US to disentangle from Mideast,"(2016, 1, 3)",-9,24.6877,46.7219,1,NULL,The Christian Science Monitor,1,Factiva,Iran,Citizen (Iran),"Social,General Population / Civilian / Social",40008724,Saudi Arabia,Saudi Arabia,NULL,2016
916,Riyadh,Saudi Arabia,2016-01-05,NULL,2016-01-05,ICEWS24000975,Riyadh and Tehran have attended previous talks and support opposing sides in the war.,Consult,Saudis signal backing for Syria talks despite row with Iran,"(2016, 1, 3)",1,24.6877,46.7219,1,Mintaqat ar Riyad,Trend News Agency (Azerbaijan),2,Factiva,Saudi Arabia,Saudi Arabia,NULL,40008956,Iran,Iran,NULL,2016
917,Amman,Jordan,2016-01-05,NULL,2016-01-05,ICEWS24000982,"Momani says about 50 to 100 refugees are permitted entry each day, with priority given to women, children, the elderly and sick people.",Make statement,"Jordan confirms 12,000 Syrian refugees amassed at border","(2016, 1, 3)",0,31.9552,35.945,1,Muhafazat `Amman,United News of Bangladesh Limited,6,Factiva,Jordan,Mohammed al-Momani,Government,40008981,Jordan,Refugee (Jordan),"Refugees / Displaced,Social",2016
918,Riyadh,Saudi Arabia,2016-01-05,NULL,2016-01-05,ICEWS24000974,"In particular, the Saudi embassy in the capital Tehran and the consulate in the city of Mashhad were attacked, after which Riyadh broke off diplomatic ties with Tehran on Jan. 3.",Reduce or break diplomatic relations,Ankara shouldn’t interfere in Riyadh-Tehran conflict,"(2016, 1, 3)",-4,24.6877,46.7219,1,Mintaqat ar Riyad,Trend News Agency (Azerbaijan),6,Factiva,Saudi Arabia,Saudi Arabia,NULL,40009037,Iran,Iran,NULL,2016
919,Riyadh,Saudi Arabia,2016-01-05,NULL,2016-01-05,ICEWS24001003,"There is concern that the rift between Riyadh and Tehran, both of which have attended previous talks on Syria and which support opposing sides in the war, could set back diplomatic efforts to bring peace.",Criticize or denounce,"UPDATE 1-Saudis back Syria talks despite row with Iran, says UN envoy","(2016, 1, 3)",-2,24.6877,46.7219,1,Mintaqat ar Riyad,Reuters News,5,Factiva,Iran,Iran,NULL,40009047,Saudi Arabia,Saudi Arabia,NULL,2016
920,Riyadh,Saudi Arabia,2016-01-05,NULL,2016-01-05,ICEWS24001001,"Staffan de Mistura, speaking after he met Saudi Foreign Minister Adel bin Ahmed Al-Jubeir and the Syrian opposition in Riyadh, said there was a clear determination by the Saudi side that current regional tensions would not have a negative impact on the momentum of the talks and on the continuation of the political process in Geneva.",Consult,"UPDATE 1-Saudis back Syria talks despite row with Iran, says UN envoy","(2016, 1, 3)",1,24.6877,46.7219,1,Mintaqat ar Riyad,Reuters News,6,Factiva,NULL,Staffan de Mistura,"Global,International Government Organization,Global Diplomatic IGOs",40009047,Saudi Arabia,Foreign Affairs (Saudi Arabia),"Foreign Ministry,Executive,Government",2016
921,Riyadh,Saudi Arabia,2016-01-05,NULL,2016-01-05,ICEWS24001004,"Staffan de Mistura, speaking after he met Saudi Foreign Minister Adel bin Ahmed Al-Jubeir and the Syrian opposition in Riyadh, said there was a clear determination by the Saudi side that current regional tensions would not have a negative impact on the momentum of the talks and on the continuation of the political process in Geneva.",Consult,"UPDATE 1-Saudis back Syria talks despite row with Iran, says UN envoy","(2016, 1, 3)",1,24.6877,46.7219,1,Mintaqat ar Riyad,Reuters News,6,Factiva,Saudi Arabia,Foreign Affairs (Saudi Arabia),"Foreign Ministry,Executive,Government",40009047,NULL,Staffan de Mistura,"Global,International Government Organization,Global Diplomatic IGOs",2016
922,Riyadh,Saudi Arabia,2016-01-05,NULL,2016-01-05,ICEWS24001056,"There is concern that the rift between Riyadh and Tehran, both of which have attended previous talks on Syria and which support opposing sides in the war, could set back diplomatic efforts to bring peace.",Criticize or denounce,"Saudis back Syria talks despite row with Iran, says UN envoy","(2016, 1, 3)",-2,24.6877,46.7219,1,Mintaqat ar Riyad,Channel NewsAsia,4,Factiva,Iran,Iran,NULL,40009055,Saudi Arabia,Saudi Arabia,NULL,2016
923,Riyadh,Saudi Arabia,2016-01-05,NULL,2016-01-05,ICEWS24001054,"Staffan de Mistura, speaking after he met Saudi Foreign Minister Adel bin Ahmed Al-Jubeir and the Syrian opposition in Riyadh, said there was a clear determination by the Saudi side that current regional tensions would not have a negative impact on the momentum of the talks and on the continuation of the political process in Geneva.",Consult,"Saudis back Syria talks despite row with Iran, says UN envoy","(2016, 1, 3)",1,24.6877,46.7219,1,Mintaqat ar Riyad,Channel NewsAsia,5,Factiva,NULL,Staffan de Mistura,"Global,International Government Organization,Global Diplomatic IGOs",40009055,Saudi Arabia,Foreign Affairs (Saudi Arabia),"Foreign Ministry,Executive,Government",2016
924,Riyadh,Saudi Arabia,2016-01-05,NULL,2016-01-05,ICEWS24001057,"Staffan de Mistura, speaking after he met Saudi Foreign Minister Adel bin Ahmed Al-Jubeir and the Syrian opposition in Riyadh, said there was a clear determination by the Saudi side that current regional tensions would not have a negative impact on the momentum of the talks and on the continuation of the political process in Geneva.",Consult,"Saudis back Syria talks despite row with Iran, says UN envoy","(2016, 1, 3)",1,24.6877,46.7219,1,Mintaqat ar Riyad,Channel NewsAsia,5,Factiva,Saudi Arabia,Foreign Affairs (Saudi Arabia),"Foreign Ministry,Executive,Government",40009055,NULL,Staffan de Mistura,"Global,International Government Organization,Global Diplomatic IGOs",2016
929,Damascus,Syria,2016-01-05,NULL,2016-01-05,ICEWS24001152,"BEIRUT (Reuters) - Syrian opposition leaders told a U.N. envoy on Tuesday Damascus must take confidence-building steps including a prisoner release and a halt to attacks on civilian areas before they will go to negotiations set for this month, opposition officials said.",Demand,Syria opposition tells U.N. envoy Damascus must halt bombing before talks,"(2016, 1, 3)",-5,33.5102,36.2913,1,Dimashq,Reuters News,1,Factiva,Syria,Opposition Supporter (Syria),"Dissident,Protestors / Popular Opposition / Mobs",40009258,NULL,United Nations,"International Government Organization,Global Diplomatic IGOs,Global",2016
930,Cairo,Egypt,2016-01-05,NULL,2016-01-05,ICEWS24001084,"Prison authorities told them other inmates they requested to see were not in the prison, and requested their full names to check on their whereabouts.",Make statement,"Egypt rights group visits prison, but says access lacking","(2016, 1, 3)",0,30.0626,31.2497,1,Muhafazat al Qahirah,Associated Press Newswires,6,Factiva,Egypt,Other Authorities / Officials (Egypt),Government,40009269,Egypt,Criminal (Egypt),"Criminals / Gangs,Dissident",2016
931,Riyadh,Saudi Arabia,2016-01-05,NULL,2016-01-05,ICEWS24001090,GCC convenes extraordinary meeting to discuss relations with Iran,Consider policy option,"EFE News Briefs for Tuesday, Jan. 5 (1900 GMT)","(2016, 1, 3)",0,24.6877,46.7219,1,Mintaqat ar Riyad,EFE News Service,1,Factiva,NULL,Gulf Cooperation Council,"International Government Organization,Regional,Regional Diplomatic IGOs",40009281,Iran,Iran,NULL,2016
933,Riyadh,Saudi Arabia,2016-01-05,NULL,2016-01-05,ICEWS24001094,There has been alarm that Saudi Arabia's move to break off diplomatic relations with Iran could derail fragile peace efforts in Yemen.,Reduce or break diplomatic relations,UN urges ceasefire in Yemen amid Saudi-Iran rift,"(2016, 1, 3)",-4,24.6877,46.7219,1,Mintaqat ar Riyad,Agence France-Presse,4,Factiva,Saudi Arabia,Saudi Arabia,NULL,40009304,Iran,Iran,NULL,2016
934,Riyadh,Saudi Arabia,2016-01-05,NULL,2016-01-05,ICEWS24001077,Riyadh and Tehran have attended previous talks and support opposing sides in the war.,Consult,Saudis signal backing for Syria talks despite row with Iran,"(2016, 1, 3)",1,24.6877,46.7219,1,Mintaqat ar Riyad,Channel NewsAsia,2,Factiva,Saudi Arabia,Saudi Arabia,NULL,40009330,Iran,Iran,NULL,2016
938,Baghdad,Iraq,2016-01-05,NULL,2016-01-05,ICEWS24001301,"BAGHDAD (AP) — While many Iraqi Shiites took to the streets in outrage over Saudi Arabia's execution of a prominent Shiite cleric, the country's prime minister has had to walk a more cautious line, trying to contain Iraq's own explosive sectarian tensions.",Demonstrate or rally,"Iraq must walk a fine line amid Iranian, Saudi tensions","(2016, 1, 3)",-6.5,33.3406,44.4009,1,Muhafazat Baghdad,Associated Press Newswires,1,Factiva,Iraq,Citizen (Iraq),"General Population / Civilian / Social,Social",40009749,NULL,Unspecified Actor,Unspecified,2016
939,Baghdad,Iraq,2016-01-05,NULL,2016-01-05,ICEWS24001302,"Shiite-led Iran has been the most vocal in its condemnation, and protesters stormed Saudi diplomatic missions in Iran over the weekend.","Protest violently, riot","Iraq must walk a fine line amid Iranian, Saudi tensions","(2016, 1, 3)",-7.5,33.3406,44.4009,1,Muhafazat Baghdad,Associated Press Newswires,3,Factiva,Iran,Protester (Iran),"Dissident,Protestors / Popular Opposition / Mobs",40009749,NULL,Unspecified Actor,Unspecified,2016
940,Nahiyat Barwanah,Iraq,2016-01-05,NULL,2016-01-05,ICEWS24001287,"An Anbar provincial security source told Xinhua that the Iraqi security forces, backed by Iraqi and international aircraft, carried out an offensive during the day on IS militants and managed to recapture Barwana area and al-Sakran village near Haditha, after the extremist militants seized parts of the two areas in a major attack the day before.",Cooperate militarily,U.S.-led coalition says IS loses 40 percent of land in Iraq,"(2016, 1, 3)",7.4,34.0958,42.3888,1,Muhafazat al Anbar,Xinhua News Agency,6,Factiva,Iraq,Iraq,NULL,40009755,Iraq,Military Personnel - Special (Iraq),"Military,Government",2016
941,Nahiyat Barwanah,Iraq,2016-01-05,NULL,2016-01-05,ICEWS24001288,"An Anbar provincial security source told Xinhua that the Iraqi security forces, backed by Iraqi and international aircraft, carried out an offensive during the day on IS militants and managed to recapture Barwana area and al-Sakran village near Haditha, after the extremist militants seized parts of the two areas in a major attack the day before.",Use conventional military force,U.S.-led coalition says IS loses 40 percent of land in Iraq,"(2016, 1, 3)",-10,34.0958,42.3888,1,Muhafazat al Anbar,Xinhua News Agency,6,Factiva,Iraq,Military Personnel - Special (Iraq),"Military,Government",40009755,Iraq,Militant (Iraq),Unidentified Forces,2016
942,Nahiyat Barwanah,Iraq,2016-01-05,NULL,2016-01-05,ICEWS24001289,"An Anbar provincial security source told Xinhua that the Iraqi security forces, backed by Iraqi and international aircraft, carried out an offensive during the day on IS militants and managed to recapture Barwana area and al-Sakran village near Haditha, after the extremist militants seized parts of the two areas in a major attack the day before.",Occupy territory,U.S.-led coalition says IS loses 40 percent of land in Iraq,"(2016, 1, 3)",-9.5,34.0958,42.3888,1,Muhafazat al Anbar,Xinhua News Agency,6,Factiva,Iraq,Militant (Iraq),Unidentified Forces,40009755,Iraq,Iraq,NULL,2016
947,Cairo,Egypt,2016-01-05,NULL,2016-01-05,ICEWS24001383,"CAIRO, January 6 (Sputnik) - Chinese President Xi Jinping will visit the Egyptian capital of Cairo on January 20-22 , the Egyptian Foreign Ministry said.",Express intent to meet or negotiate,Chinese Leader to Visit Egypt on January 20-22 - Cairo,"(2016, 1, 3)",4,30.0626,31.2497,1,Muhafazat al Qahirah,Unknown,1,Factiva,China,Xi Jinping,"Government Major Party (In Government),(National) Major Party,Parties,Government,Executive,Elite,Military,Legislative / Parliamentary,Executive Office,Unicameral",40009906,Egypt,Egypt,NULL,2016
948,NULL,Saudi Arabia,2016-01-05,NULL,2016-01-05,ICEWS24001450,State oil company Saudi Aramco said none of its employees had been injured but gave no further details.,Make statement,UPDATE 1-Four armed men set Saudi Aramco bus on fire in oil province,"(2016, 1, 3)",0,22.5,51,1,Al Mintaqah ash Sharqiyah,Reuters News,3,Factiva,Saudi Arabia,Saudi Aramco,"State Owned Enterprises,State-Owned Heavy Industrial / Chemical,Government",40009910,Saudi Arabia,Employee (Saudi Arabia),"Social,Labor",2016
949,Riyadh,Saudi Arabia,2016-01-05,NULL,2016-01-05,ICEWS24001467,Riyadh and Tehran have attended previous talks and support opposing sides in the war.,Consult,Saudis signal backing for Syria talks despite row with Iran; Saudis signal backing for Syria talks despite row,"(2016, 1, 3)",1,24.6877,46.7219,1,Mintaqat ar Riyad,Daily Star,3,Factiva,Saudi Arabia,Saudi Arabia,NULL,40009935,Iran,Iran,NULL,2016
950,Beirut,Lebanon,2016-01-05,NULL,2016-01-05,ICEWS24001401,"Machnouk also said former Prime Minister Saad Hariri was pursuing efforts to protect stability in Lebanon as part of an initiative aimed at facilitating the election of a new president, refuting reports that the initiative had unraveled.",Make statement,Machnouk: Lebanon more vulnerable to regional unrest; Machnouk: Lebanon more vulnerable,"(2016, 1, 3)",0,33.8889,35.4944,1,Beyrouth,Daily Star,2,Factiva,Lebanon,Nouhad Machnouk,"Government,Executive,Interior / Home Ministry",40009938,Lebanon,Saad Hariri,"Elite,Parties,International Religious,Ideological,Center Right,(National) Minor Party,Sunni",2016
951,Aarsal,Lebanon,2016-01-05,NULL,2016-01-05,ICEWS24001390,Beirut -- BEIRUT: Military Prosecutor Saqr Saqr Tuesday charged a Lebanese man for belonging to Daesh [ISIS] and taking part in the 2014 gunbattles against the Lebanese Army in the northeastern border town of Arsal.,"Arrest, detain, or charge with legal action",Judge charges Lebanese for belonging to Daesh; Judge charges Lebanese for belonging to Daesh,"(2016, 1, 3)",-5,34.1794,36.4208,1,Mohafazat Baalbek-Hermel,Daily Star,1,Factiva,Lebanon,Saqr Saqr,"Legal,Social",40009939,Lebanon,Men (Lebanon),"General Population / Civilian / Social,Social",2016
952,Aarsal,Lebanon,2016-01-05,NULL,2016-01-05,ICEWS24001391,The state-run National News Agency said Saqr also charged another Lebanese man for other offenses.,"Arrest, detain, or charge with legal action",Judge charges Lebanese for belonging to Daesh; Judge charges Lebanese for belonging to Daesh,"(2016, 1, 3)",-5,34.1794,36.4208,1,Mohafazat Baalbek-Hermel,Daily Star,6,Factiva,Lebanon,Saqr Saqr,"Legal,Social",40009939,Lebanon,Men (Lebanon),"General Population / Civilian / Social,Social",2016
953,Beirut,Lebanon,2016-01-05,NULL,2016-01-05,ICEWS24001369,"Beirut -- BEIRUT: The Lebanese Army Tuesday arrested two people involved in a south Lebanon gunfight, the state-run National News Agency reported.","Arrest, detain, or charge with legal action",Army arrests two people in Sidon’s gunfight; Army arrests two people in Sidon’s gunfight,"(2016, 1, 3)",-5,33.8889,35.4944,1,Beyrouth,Daily Star,1,Factiva,Lebanon,Military (Lebanon),"Government,Military",40009941,Lebanon,Citizen (Lebanon),"General Population / Civilian / Social,Social",2016
954,Sidon,Lebanon,2016-01-05,NULL,2016-01-05,ICEWS24001370,"The NNA said the Army arrested Mohammad S. and Mohammad N. after they engaged in a skirmish in Sidon’s Zaroub al-Njasa neighborhood, which left a nearby minimarket slightly damaged.","Arrest, detain, or charge with legal action",Army arrests two people in Sidon’s gunfight; Army arrests two people in Sidon’s gunfight,"(2016, 1, 3)",-5,33.5599,35.3756,1,Mohafazat Liban-Sud,Daily Star,2,Factiva,Lebanon,Military (Lebanon),"Government,Military",40009941,Lebanon,Citizen (Lebanon),"General Population / Civilian / Social,Social",2016
955,Marjayoun,Lebanon,2016-01-05,NULL,2016-01-05,ICEWS24001419,"Beirut -- MARJAYOUN, Lebanon: U.N. Secretary-General Ban Ki-moon condemned Hezbollah’s operation against the Israeli patrol and expressed his concern over Israel’s retaliatory strikes in UNIFIL’s area of operations.",Make pessimistic comment,Ban condemns Hezbollah’s attack on Israeli patrol; Ban condemns Hezbollah’s attack on Israeli patrol,"(2016, 1, 3)",-0.4,33.3603,35.5911,1,Mohafazat Nabatiye,Daily Star,1,Factiva,South Korea,Ban Ki Moon,"International Government Organization,Foreign Ministry,Elite,Executive,Government,Global Diplomatic IGOs,Global",40009943,Israel,Israel,NULL,2016
956,Marjayoun,Lebanon,2016-01-05,NULL,2016-01-05,ICEWS24001420,"Beirut -- MARJAYOUN, Lebanon: U.N. Secretary-General Ban Ki-moon condemned Hezbollah’s operation against the Israeli patrol and expressed his concern over Israel’s retaliatory strikes in UNIFIL’s area of operations.",Criticize or denounce,Ban condemns Hezbollah’s attack on Israeli patrol; Ban condemns Hezbollah’s attack on Israeli patrol,"(2016, 1, 3)",-2,33.3603,35.5911,1,Mohafazat Nabatiye,Daily Star,1,Factiva,South Korea,Ban Ki Moon,"International Government Organization,Foreign Ministry,Elite,Executive,Government,Global Diplomatic IGOs,Global",40009943,Lebanon,Hezbollah,"National Religious,Far Left,Parties,International Religious,Ideological,Dissident,(National) Minor Party,Organized Violent,Social,Shia",2016
957,Marjayoun,Lebanon,2016-01-05,NULL,2016-01-05,ICEWS24001421,"Beirut -- MARJAYOUN, Lebanon: U.N. Secretary-General Ban Ki-moon condemned Hezbollah’s operation against the Israeli patrol and expressed his concern over Israel’s retaliatory strikes in UNIFIL’s area of operations.",Use conventional military force,Ban condemns Hezbollah’s attack on Israeli patrol; Ban condemns Hezbollah’s attack on Israeli patrol,"(2016, 1, 3)",-10,33.3603,35.5911,1,Mohafazat Nabatiye,Daily Star,1,Factiva,Israel,Israel,NULL,40009943,Lebanon,Lebanon,NULL,2016
958,Beirut,Lebanon,2016-01-05,NULL,2016-01-05,ICEWS24001440,"The operators Zain and Orascom agreed to the extension which was put into effect Jan. 1 2016, until the Cabinet settles the matter.",Express intent to cooperate,Harb weighs all options to run cellular network; Harb weighs all options to run cellular network,"(2016, 1, 3)",4,33.8889,35.4944,1,Beyrouth,Daily Star,4,Factiva,NULL,Zain,"Utilities Business,Multinational Corporation,Social,Business",40009946,Egypt,Orascom,"Business,Social",2016
959,Beirut,Lebanon,2016-01-05,NULL,2016-01-05,ICEWS24001441,"The operators Zain and Orascom agreed to the extension which was put into effect Jan. 1 2016, until the Cabinet settles the matter.",Express intent to cooperate,Harb weighs all options to run cellular network; Harb weighs all options to run cellular network,"(2016, 1, 3)",4,33.8889,35.4944,1,Beyrouth,Daily Star,4,Factiva,Egypt,Orascom,"Business,Social",40009946,NULL,Zain,"Utilities Business,Multinational Corporation,Social,Business",2016
960,Beirut,Lebanon,2016-01-05,NULL,2016-01-05,ICEWS24001439,Harb told The Daily Star Prime Minister Tammam Salam was keen to activate Cabinet’s work but may not be able to discuss contentiousissues during its first meeting.,Make statement,Harb weighs all options to run cellular network; Harb weighs all options to run cellular network,"(2016, 1, 3)",0,33.8889,35.4944,1,Beyrouth,Daily Star,5,Factiva,Lebanon,Ministry (Lebanon),Government,40009946,Lebanon,Tammam Salam,"Executive Office,Elite,Government,Executive",2016
