,City,Country,Datetime,District,Event Date,Event ID,Event Sentence,Event Text,Headline,ISO Week,Intensity,Latitude,Longitude,Month,Province,Publisher,Sentence Number,Source,Source Country,Source Name,Source Sectors,Story ID,Target Country,Target Name,Target Sectors,Year
1073,Aleppo,Syria,2016-12-08,NULL,2016-12-08,ICEWS25250864,Steinmeier also called for an immediate ceasefire in Aleppo and stressed the urgency of the return to the political process of resolving the conflict in Syria.,Appeal to others to settle dispute,Berlin Urges Moscow to Work With OSCE Council of Ministers to Reduce Tension in Europe,"(2016, 49, 3)",4,36.2012,37.1612,12,Muhafazat Halab,Unknown,4,Factiva,Germany,Frank-Walter Steinmeier,"Elite,Parties,Foreign Ministry,(National) Major Party,Executive,Legislative / Parliamentary,Government,Center Left,Ideological,Lower House,Protestant,International Religious",42920180,Syria,Syria,NULL,2016
1074,Aleppo,Syria,2016-12-08,NULL,2016-12-08,ICEWS25250858,Syria's foreign ministry said this week that any truce in Aleppo would need to guarantee the withdrawal of all rebels from the city.,Make statement,World News: Syrian Rebels Seek Talks on Aleppo's Fate --- Cease-fire proposal comes as opposition faces prospect of defeat in divided city,"(2016, 49, 3)",0,36.2012,37.1612,12,Muhafazat Halab,The Wall Street Journal,4,Factiva,Syria,Foreign Affairs (Syria),"Government,Executive,Foreign Ministry",42920187,Syria,Syria,NULL,2016
1075,Sitrah,Bahrain,2016-12-08,NULL,2016-12-08,ICEWS25250843,International-facing English-language Press TV reported that Bahraini police fired tear gas to disperse people protesting against May's visit.,Demonstrate or rally,"Iran morning headlines: Currency change, May in Bahrain","(2016, 49, 3)",-6.5,26.1547,50.6206,12,Northern Governorate,BBC Monitoring Caucasus,5,Factiva,Bahrain,Citizen (Bahrain),"Social,General Population / Civilian / Social",42920207,NULL,Unspecified Actor,Unspecified,2016
1076,Sitrah,Bahrain,2016-12-08,NULL,2016-12-08,ICEWS25250844,International-facing English-language Press TV reported that Bahraini police fired tear gas to disperse people protesting against May's visit.,Use tactics of violent repression,"Iran morning headlines: Currency change, May in Bahrain","(2016, 49, 3)",-9,26.1547,50.6206,12,Northern Governorate,BBC Monitoring Caucasus,5,Factiva,Bahrain,Police (Bahrain),"Government,Police",42920207,Bahrain,Citizen (Bahrain),"Social,General Population / Civilian / Social",2016
1077,Baghdad,Iraq,2016-12-08,NULL,2016-12-08,ICEWS25250878,"Al-Jabouri did not provide specifics, or the breakdown of the casualties, but said he holds the Iraqi government responsible.",Accuse,"Iraqi official: Anti-IS airstrike killed, wounded civilians","(2016, 49, 3)",-2,33.3406,44.4009,12,Muhafazat Baghdad,Associated Press Newswires,4,Factiva,Iraq,Salim al-Juburi,"Legislative / Parliamentary,Government",42920211,Iraq,Government (Iraq),Government,2016
1082,NULL,Egypt,2016-12-08,NULL,2016-12-08,ICEWS25251070,Russian Helicopters Director General Alexander Mikheyev earlier said Russia signed a contract with Egypt for the delivery of 46 Ka-52 craft.,Sign formal agreement,Export supplies of Ka-52 helicopters to begin in 2017,"(2016, 49, 3)",8,30.0626,31.2497,12,NULL,Unknown,4,Factiva,Egypt,Egypt,NULL,42920520,Russian Federation,Russia,NULL,2016
1089,Aleppo,Syria,2016-12-08,NULL,2016-12-08,ICEWS25251267,"In an interview published on Thursday in the state-owned newspaper al-Watan, Assad described his forces' fight in Aleppo as one against terrorism and a conspiracy to destroy and divide Syria, allegedly led by Turkey.",Make statement,The Latest: Assad: Aleppo win 'big gain' but not end of war,"(2016, 49, 3)",0,36.2012,37.1612,12,Muhafazat Halab,Associated Press Newswires,4,Factiva,Syria,Bashar al-Assad,"National Ethnic,Parties,(National) Major Party,National Ethnic Minority,National Religious,Government,Religious Minority,International Religious,Social,Ideological,Shia,Executive Office,Far Right,Executive",42921134,Syria,Military (Syria),"Government,Military",2016
1090,Aleppo,Syria,2016-12-08,NULL,2016-12-08,ICEWS25251294,"On Monday, a Russian mobile military hospital in Aleppo was shelled, allegedly by the Syrian opposition militants, killing two military medics and wounding another.",fight with small arms and light weapons,ICRC Says Criticism Against Its Reaction on Attack on Russian Hospital in Aleppo Unfounded,"(2016, 49, 3)",-10,36.2012,37.1612,12,Muhafazat Halab,Unknown,2,Factiva,Syria,Militant (Syria),Unidentified Forces,42921144,Russian Federation,Healthcare Facility (Russia),"Social,Medical / Health",2016
1091,Baghdad,Iraq,2016-12-08,NULL,2016-12-08,ICEWS25251249,"Jabouri, the most senior Sunni Muslim politician in mainly Shi'ite-ruled Iraq, said the air strikes had targeted 'civilian shopping centers, causing the martyrdom and wounding of dozens', and called for the perpetrators to be punished.",Rally opposition against,Iraq parliament speaker demands inquiry into deadly Qaim air strikes,"(2016, 49, 3)",-2,33.3406,44.4009,12,Muhafazat Baghdad,Reuters News,5,Factiva,Iraq,Party Member (Iraq),Parties,42921198,Iraq,Muslim (Iraq),"Muslim,Social,International Religious,National Religious",2016
1092,Mosul,Iraq,2016-12-08,NULL,2016-12-08,ICEWS25251292,"Meanwhile, the IS-affiliated Amaq news agency reported that the jihadis carried out five car bombings in the al-Salam area over the past 24 hours.",Carry out car bombing,Heavy clashes in Mosul as Iraqi troops advance,"(2016, 49, 3)",-10,36.335,43.1189,12,Muhafazat Ninawa,Indo-Asian News Service,6,Factiva,Iraq,Citizen (Iraq),"General Population / Civilian / Social,Social",42921207,Iraq,Iraq,NULL,2016
1093,Damascus,Syria,2016-12-08,NULL,2016-12-08,ICEWS25251223,Israeli Hebrew press on 8 December probed recent reports about an Israeli attack near Damascus and the defence minister's remarks in which he confirmed his country's involvement in Syria to prevent the transfer of weapons to Hezbollah.,Make statement,Israel's Hebrew press probes 'involvement' in Syria crisis,"(2016, 49, 3)",0,33.5102,36.2913,12,Dimashq,BBC Monitoring Middle East,2,Factiva,Syria,Ministry of Defense,"Government,Defense / Security Ministry,Executive",42921210,Syria,Syria,NULL,2016
1094,Damascus,Syria,2016-12-08,NULL,2016-12-08,ICEWS25251224,Israeli Hebrew press on 8 December probed recent reports about an Israeli attack near Damascus and the defence minister's remarks in which he confirmed his country's involvement in Syria to prevent the transfer of weapons to Hezbollah.,Use conventional military force,Israel's Hebrew press probes 'involvement' in Syria crisis,"(2016, 49, 3)",-10,33.5102,36.2913,12,Dimashq,BBC Monitoring Middle East,2,Factiva,Israel,Israel,NULL,42921210,Syria,Syria,NULL,2016
1095,NULL,Bahrain,2016-12-08,NULL,2016-12-08,ICEWS25251201,"His comments, filmed and posted on the Guardian's website, came as British Prime Minister Theresa May returned from a summit in Bahrain where she pledged to strengthen ties with Gulf states including Saudi Arabia.",Make a visit,"Saudi, Iran engaging in 'proxy wars': UK foreign minister","(2016, 49, 3)",1.9,26.2154,50.5832,12,NULL,Agence France-Presse,4,Factiva,United Kingdom,Theresa May,"Legislative / Parliamentary,Center Right,Elite,Women / Children / Social / Welfare / Development / Religion Ministry,Government,Ideological,(National) Major Party,Parties,Interior / Home Ministry,Executive,Cabinet",42921219,Bahrain,Bahrain,NULL,2016
1096,NULL,Bahrain,2016-12-08,NULL,2016-12-08,ICEWS25251204,"His comments, filmed and posted on the Guardian's website, came as British Prime Minister Theresa May returned from a summit in Bahrain where she pledged to strengthen ties with Gulf states including Saudi Arabia.",Host a visit,"Saudi, Iran engaging in 'proxy wars': UK foreign minister","(2016, 49, 3)",2.8,26.2154,50.5832,12,NULL,Agence France-Presse,4,Factiva,Bahrain,Bahrain,NULL,42921219,United Kingdom,Theresa May,"Legislative / Parliamentary,Center Right,Elite,Women / Children / Social / Welfare / Development / Religion Ministry,Government,Ideological,(National) Major Party,Parties,Interior / Home Ministry,Executive,Cabinet",2016
1097,Aleppo,Syria,2016-12-08,NULL,2016-12-08,ICEWS25251144,"Two Russian medical specialists - Nadezhda Durachenko and Galina Mikhailova - were killed on December 5 when militants shelled a mobile military hospital in Aleppo, while pediatrician Vadim Arsentyev was severely wounded.",Use unconventional violence,China condemns militant attack on Russian hospital in Aleppo - Foreign Ministry,"(2016, 49, 3)",-9,36.2012,37.1612,12,Muhafazat Halab,Unknown,5,Factiva,Syria,Militant (Syria),Unidentified Forces,42921245,Russian Federation,Medical Personnel (Russia),"Nongovernmental Organizations / Activists,Medical / Health NGOs",2016
1098,Aleppo,Syria,2016-12-08,NULL,2016-12-08,ICEWS25251145,"Two Russian medical specialists - Nadezhda Durachenko and Galina Mikhailova - were killed on December 5 when militants shelled a mobile military hospital in Aleppo, while pediatrician Vadim Arsentyev was severely wounded.",fight with small arms and light weapons,China condemns militant attack on Russian hospital in Aleppo - Foreign Ministry,"(2016, 49, 3)",-10,36.2012,37.1612,12,Muhafazat Halab,Unknown,5,Factiva,Syria,Militant (Syria),Unidentified Forces,42921245,Syria,Healthcare Facility (Syria),"Medical / Health,Social",2016
1099,Aleppo,Syria,2016-12-08,NULL,2016-12-08,ICEWS25251399,"MOSCOW (Sputnik) — On Monday, a Russian mobile military hospital in Aleppo was shelled, allegedly by the Syrian opposition militants, killing two military medics and wounding another.",fight with small arms and light weapons,ICRC Says Criticism Against Its Reaction on Attack on Russian Hospital Unfounded,"(2016, 49, 3)",-10,36.2012,37.1612,12,Muhafazat Halab,Unknown,2,Factiva,Syria,Militant (Syria),Unidentified Forces,42921655,Russian Federation,Healthcare Facility (Russia),"Social,Medical / Health",2016
1100,Aleppo,Syria,2016-12-08,NULL,2016-12-08,ICEWS25251348,"A Syrian government soldier gestures a v-sign under the Syrian national flag near a general view of eastern Aleppo after they took control of al-Sakhour neigbourhood in Aleppo, Syria in this handout picture provided by SANA on November 28, 2016",Occupy territory,Threats of 'New Absurd' Sanctions Over Syria Groundless - Kremlin,"(2016, 49, 3)",-9.5,36.2012,37.1612,12,Muhafazat Halab,Unknown,1,Factiva,Syria,Military (Syria),"Military,Government",42921659,Syria,Syria,NULL,2016
1101,Aleppo,Syria,2016-12-08,NULL,2016-12-08,ICEWS25251452,Steinmeier also called for an immediate ceasefire in Aleppo and stressed the urgency of the return to the political process of resolving the conflict in Syria.,Appeal to others to settle dispute,Berlin Urges Moscow to Work With OSCE to Reduce Tension in Europe,"(2016, 49, 3)",4,36.2012,37.1612,12,Muhafazat Halab,Unknown,4,Factiva,Germany,Frank-Walter Steinmeier,"Protestant,Center Left,Government,International Religious,Executive,Lower House,Legislative / Parliamentary,Ideological,Parties,Foreign Ministry,(National) Major Party,Elite",42921666,Syria,Syria,NULL,2016
1102,Beirut,Lebanon,2016-12-08,NULL,2016-12-08,ICEWS25251364,"The news comes after a wide campaign against the article, which involved a protest by women dressed in blood-stained wedding dresses in Beirut on 6 December.",Demonstrate or rally,Lebanese parliamentarians agree to repeal 'rape impunity' article,"(2016, 49, 3)",-6.5,33.8889,35.4944,12,Beyrouth,BBC Monitoring Middle East,5,Factiva,Lebanon,Women (Lebanon),"General Population / Civilian / Social,Social",42921797,NULL,Unspecified Actor,Unspecified,2016
1103,Beirut,Lebanon,2016-12-08,NULL,2016-12-08,ICEWS25251363,Newly-appointed Prime Minister Saad Hariri welcomed parliament's decision in a tweet shared on 7 December.,Praise or endorse,Lebanese parliamentarians agree to repeal 'rape impunity' article,"(2016, 49, 3)",3.4,33.8889,35.4944,12,Beyrouth,BBC Monitoring Middle East,6,Factiva,Lebanon,Saad Hariri,"Center Right,International Religious,Parties,Sunni,Ideological,Elite,(National) Minor Party",42921797,Lebanon,Legislature (Lebanon),"Government,Legislative / Parliamentary",2016
1104,Aleppo,Syria,2016-12-08,NULL,2016-12-08,ICEWS25251471,"President Bashar al-Assad said victory for his forces in Aleppo would be a 'huge step' in ending Syria's war, as government troops battled Thursday to retake more rebel ground.",Make statement,Confident Assad eyes victory in Aleppo,"(2016, 49, 3)",0,36.2012,37.1612,12,Muhafazat Halab,Agence France-Presse,1,Factiva,Syria,Bashar al-Assad,"National Religious,National Ethnic Minority,National Ethnic,Far Right,Ideological,Social,Government,Religious Minority,International Religious,Shia,Executive,(National) Major Party,Parties,Executive Office",42921804,Syria,Military (Syria),"Military,Government",2016
1105,Cairo,Egypt,2016-12-08,NULL,2016-12-08,ICEWS25251468,"CAIRO (Reuters) - Egyptian women's rights advocate Azza Soliman was freed on bail late on Wednesday after being accused by an investigating judge of establishing an illegal entity and receiving foreign funding to harm Egypt, her foundation and fellow activists said.",Accuse,Egyptian women's rights advocate Azza Soliman freed on bail,"(2016, 49, 3)",-2,30.0626,31.2497,12,Muhafazat al Qahirah,Reuters News,1,Factiva,Egypt,Court Judge (Egypt),"Government,Judicial",42921812,Egypt,Citizen (Egypt),"Social,General Population / Civilian / Social",2016
1106,Cairo,Egypt,2016-12-08,NULL,2016-12-08,ICEWS25251469,She had been detained by police earlier in the day.,"Arrest, detain, or charge with legal action",Egyptian women's rights advocate Azza Soliman freed on bail,"(2016, 49, 3)",-5,30.0626,31.2497,12,Muhafazat al Qahirah,Reuters News,3,Factiva,Egypt,Police (Egypt),"Police,Government",42921812,Egypt,Citizen (Egypt),"Social,General Population / Civilian / Social",2016
1107,Manama,Bahrain,2016-12-08,NULL,2016-12-08,ICEWS25251481,A Gulf Cooperation Council conference attended by British Prime Minister Theresa May ended on Wednesday.,Consult,IS calls for attacks on US bases in uneasy island of Bahrain,"(2016, 49, 3)",1,26.2154,50.5832,12,Capital Governorate,Associated Press Newswires,6,Factiva,United Kingdom,Theresa May,"Elite,Women / Children / Social / Welfare / Development / Religion Ministry,Interior / Home Ministry,(National) Major Party,Parties,Ideological,Cabinet,Executive,Legislative / Parliamentary,Center Right,Government",42921824,NULL,Gulf Cooperation Council,"International Government Organization,Regional Diplomatic IGOs,Regional",2016
1108,Manama,Bahrain,2016-12-08,NULL,2016-12-08,ICEWS25251483,A Gulf Cooperation Council conference attended by British Prime Minister Theresa May ended on Wednesday.,Consult,IS calls for attacks on US bases in uneasy island of Bahrain,"(2016, 49, 3)",1,26.2154,50.5832,12,Capital Governorate,Associated Press Newswires,6,Factiva,NULL,Gulf Cooperation Council,"International Government Organization,Regional Diplomatic IGOs,Regional",42921824,United Kingdom,Theresa May,"Elite,Women / Children / Social / Welfare / Development / Religion Ministry,Interior / Home Ministry,(National) Major Party,Parties,Ideological,Cabinet,Executive,Legislative / Parliamentary,Center Right,Government",2016
1109,Aleppo,Syria,2016-12-08,NULL,2016-12-08,ICEWS25251365,"WASHINGTON -- Canada, the United States and four other Western powers called Wednesday for an immediate ceasefire in the Syrian city of Aleppo and accused Russia of blocking efforts to halt the bloodshed.",Appeal to others to settle dispute,"World leaders condemn Russia, as rebels call for Aleppo ceasefire","(2016, 49, 3)",4,36.2012,37.1612,12,Muhafazat Halab,The Toronto Star,1,Factiva,United States,United States,NULL,42921847,Syria,Syria,NULL,2016
1110,Aleppo,Syria,2016-12-08,NULL,2016-12-08,ICEWS25251367,"WASHINGTON -- Canada, the United States and four other Western powers called Wednesday for an immediate ceasefire in the Syrian city of Aleppo and accused Russia of blocking efforts to halt the bloodshed.",Accuse of aggression,"World leaders condemn Russia, as rebels call for Aleppo ceasefire","(2016, 49, 3)",-2,36.2012,37.1612,12,Muhafazat Halab,The Toronto Star,1,Factiva,United States,United States,NULL,42921847,Russian Federation,Russia,NULL,2016
1111,Aleppo,Syria,2016-12-08,NULL,2016-12-08,ICEWS25251366,They said the UN should investigate reports of war crimes in Syria.,Demand intelligence cooperation,"World leaders condemn Russia, as rebels call for Aleppo ceasefire","(2016, 49, 3)",-5,36.2012,37.1612,12,Muhafazat Halab,The Toronto Star,3,Factiva,France,France,NULL,42921847,NULL,United Nations,"International Government Organization,Global Diplomatic IGOs,Global",2016
1118,Aleppo,Syria,2016-12-08,NULL,2016-12-08,ICEWS25251567,"Gen. Igor Konashenkov said December 5 militants of the so-called Syrian opposition attacked a Russian mobile military hospital in Aleppo, killing two Russian military medics and wounding one.",Use unconventional violence,China Condemns Attack Against Russian Hospital in Aleppo - Foreign Ministry,"(2016, 49, 3)",-9,36.2012,37.1612,12,Muhafazat Halab,Unknown,4,Factiva,Syria,Militant (Syria),Unidentified Forces,42922197,Russian Federation,Citizen (Russia),"Social,General Population / Civilian / Social",2016
1119,Aleppo,Syria,2016-12-08,NULL,2016-12-08,ICEWS25251568,"Gen. Igor Konashenkov said December 5 militants of the so-called Syrian opposition attacked a Russian mobile military hospital in Aleppo, killing two Russian military medics and wounding one.",Use unconventional violence,China Condemns Attack Against Russian Hospital in Aleppo - Foreign Ministry,"(2016, 49, 3)",-9,36.2012,37.1612,12,Muhafazat Halab,Unknown,4,Factiva,Syria,Militant (Syria),Unidentified Forces,42922197,Russian Federation,Healthcare Facility (Russia),"Social,Medical / Health",2016
1120,Aleppo,Syria,2016-12-08,NULL,2016-12-08,ICEWS25251646,ANKARA (Reuters) - Turkish President Tayyip Erdogan's spokesman on Thursday said the Syrian Kurdish YPG militia was working together with the forces of Syrian President Bashar al-Assad in the north of Aleppo province.,Engage in diplomatic cooperation,Turkey says Syrian Kurdish YPG working with Assad's forces north of Aleppo,"(2016, 49, 3)",3.5,36.2012,37.1612,12,Muhafazat Halab,Reuters News,1,Factiva,Syria,Militia (People's Protection Units),"Dissident,Separatists",42922258,Syria,Bashar al-Assad,"Executive Office,International Religious,Social,Shia,Far Right,(National) Major Party,Parties,National Ethnic Minority,Government,National Religious,Religious Minority,Ideological,National Ethnic,Executive",2016
1121,Aleppo,Syria,2016-12-08,NULL,2016-12-08,ICEWS25251598,"The meeting of RF Foreign Minister Sergei Lavrov and his US counterpart John Kerry scheduled on the sidelines of the Hamburg OSCE meeting was another attempt to coordinate the plan of evacuation of the rebel forces and establish a truce in the eastern part of the city, where the Syrian army is waging a successful offensive.",Consult,THEY WANT TO BREAK THE DEADLOCK IN ALEPPO THROUGH CORRIDORS,"(2016, 49, 3)",1,36.2012,37.1612,12,Muhafazat Halab,WPS: What the Papers Say,3,Factiva,Russian Federation,Sergey Viktorovich Lavrov,"Executive,Parties,(National) Major Party,Government,Cabinet,Ideological,Center Right,Foreign Ministry",42922293,United States,John Kerry,"Executive,Legislative / Parliamentary,Government,Upper House,Parties,Cabinet,Foreign Ministry,Ideological,Center Left,(National) Major Party",2016
1122,Aleppo,Syria,2016-12-08,NULL,2016-12-08,ICEWS25251599,"The meeting of RF Foreign Minister Sergei Lavrov and his US counterpart John Kerry scheduled on the sidelines of the Hamburg OSCE meeting was another attempt to coordinate the plan of evacuation of the rebel forces and establish a truce in the eastern part of the city, where the Syrian army is waging a successful offensive.",Consult,THEY WANT TO BREAK THE DEADLOCK IN ALEPPO THROUGH CORRIDORS,"(2016, 49, 3)",1,36.2012,37.1612,12,Muhafazat Halab,WPS: What the Papers Say,3,Factiva,United States,John Kerry,"Executive,Legislative / Parliamentary,Government,Upper House,Parties,Cabinet,Foreign Ministry,Ideological,Center Left,(National) Major Party",42922293,Russian Federation,Sergey Viktorovich Lavrov,"Executive,Parties,(National) Major Party,Government,Cabinet,Ideological,Center Right,Foreign Ministry",2016
1123,NULL,Syria,2016-12-08,NULL,2016-12-08,ICEWS25251572,"Remarks by EU Foreign Policy Chief, Federica Mogherini, who said that humanitarian aid to Syria is provided solely by the EU are an outright distortion of facts, Russian Deputy Foreign Minister, Sergei Ryabkov, said on Thursday.",Provide humanitarian aid,Russian diplomat castigates EU for distorting facts about humanitarian aid to Syria,"(2016, 49, 3)",7.4,33.5102,36.2913,12,NULL,Unknown,1,Factiva,NULL,European Union,"International Government Organization,Regional,Regional Diplomatic IGOs",42922354,Syria,Syria,NULL,2016
1124,Aleppo,Syria,2016-12-08,NULL,2016-12-08,ICEWS25251573,"'In light of this, I would also mention a statement made by the EU High Representative for Foreign Affairs and Security Policy who said that humanitarian aid to Syria is provided by the EU only,' he resumed.",Provide humanitarian aid,Russian diplomat castigates EU for distorting facts about humanitarian aid to Syria,"(2016, 49, 3)",7.4,36.2012,37.1612,12,Muhafazat Halab,Unknown,5,Factiva,NULL,European Union,"International Government Organization,Regional,Regional Diplomatic IGOs",42922354,Syria,Syria,NULL,2016
1125,NULL,Syria,2016-12-08,NULL,2016-12-08,ICEWS25251560,"The Russian Foreign Ministry has expressed surprise at the remarks by EU High Representative for Foreign Affairs and Security Policy, Federica Mogherini, who said that the EU is the only supplier of humanitarian aid to Syria.",Make statement,Russian Foreign Ministry surprised by Mogherini’s words about humanitarian aid to Syria,"(2016, 49, 3)",0,33.5102,36.2913,12,NULL,Unknown,1,Factiva,Italy,Federica Mogherini,"Regional,(National) Major Party,Parties,International Government Organization,Regional Diplomatic IGOs,Ideological,Center Left",42922358,NULL,European Union,"International Government Organization,Regional,Regional Diplomatic IGOs",2016
1126,Aleppo,Syria,2016-12-08,NULL,2016-12-08,ICEWS25251561,"'We were surprised to read Federica Mogherini’s December 3 remarks who said that the European Union and its member-countries are allegedly the only supplier of humanitarian aid for the Syrian population,' the Russian Foreign Ministry said in a statement on Thursday.",Make statement,Russian Foreign Ministry surprised by Mogherini’s words about humanitarian aid to Syria,"(2016, 49, 3)",0,36.2012,37.1612,12,Muhafazat Halab,Unknown,2,Factiva,Italy,Federica Mogherini,"Regional,(National) Major Party,Parties,International Government Organization,Regional Diplomatic IGOs,Ideological,Center Left",42922358,NULL,European Union,"International Government Organization,Regional,Regional Diplomatic IGOs",2016
1127,Aleppo,Syria,2016-12-08,NULL,2016-12-08,ICEWS25251650,"Gen. Igor Konashenkov said December 5 militants of the so-called Syrian opposition attacked a Russian mobile military hospital in Aleppo, killing two Russian military medics and wounding one.",Use unconventional violence,Putin Says Regrets Lack of Reaction From Human Rights Defenders to Russian Hospital Attack,"(2016, 49, 3)",-9,36.2012,37.1612,12,Muhafazat Halab,Unknown,5,Factiva,Syria,Militant (Syria),Unidentified Forces,42922366,Russian Federation,Citizen (Russia),"Social,General Population / Civilian / Social",2016
1128,Aleppo,Syria,2016-12-08,NULL,2016-12-08,ICEWS25251651,"Gen. Igor Konashenkov said December 5 militants of the so-called Syrian opposition attacked a Russian mobile military hospital in Aleppo, killing two Russian military medics and wounding one.",Use unconventional violence,Putin Says Regrets Lack of Reaction From Human Rights Defenders to Russian Hospital Attack,"(2016, 49, 3)",-9,36.2012,37.1612,12,Muhafazat Halab,Unknown,5,Factiva,Syria,Militant (Syria),Unidentified Forces,42922366,Russian Federation,Healthcare Facility (Russia),"Social,Medical / Health",2016
1129,Aleppo,Syria,2016-12-08,NULL,2016-12-08,ICEWS25251498,The interview comes as government forces have swiftly recaptured most of formerly rebel-held eastern Aleppo in a three-week offensive.,Occupy territory,"Assad says Aleppo win has 'special importance', but war to continue","(2016, 49, 3)",-9.5,36.2012,37.1612,12,Muhafazat Halab,BBC Monitoring Middle East,4,Factiva,Syria,Military (Syria),"Military,Government",42922395,Syria,Armed Rebel (Syria),"Dissident,Rebel",2016
1137,NULL,Saudi Arabia,2016-12-08,NULL,2016-12-08,ICEWS25251776,"Ursula von der Leyen was to hold talks with her Saudi counterpart, Deputy Crown Prince Mohammed bin Salman, on enhancing the 'excellent bilateral relations' between the two countries, it said.",Engage in negotiation,German defence minister seeks training deal in Saudi,"(2016, 49, 3)",7,24.6877,46.7219,12,NULL,Agence France-Presse,2,Factiva,Saudi Arabia,Royal Administration (Saudi Arabia),Government,42922737,Germany,Ursula von der Leyen,"Center Right,Ideological,Executive,Cabinet,Government,Christian,Parties,(National) Major Party,International Religious,Elite,Defense / Security Ministry",2016
1138,NULL,Saudi Arabia,2016-12-08,NULL,2016-12-08,ICEWS25251774,"Von der Leyen is the latest German official to visit Saudi Arabia this year, reflecting 'a period of intensified exchange' between the two states, ambassador Dieter Haller said in the statement.",Make a visit,German defence minister seeks training deal in Saudi,"(2016, 49, 3)",1.9,24.6877,46.7219,12,NULL,Agence France-Presse,5,Factiva,Germany,Germany,NULL,42922737,Saudi Arabia,Saudi Arabia,NULL,2016
