,City,Country,Datetime,District,Event Date,Event ID,Event Sentence,Event Text,Headline,ISO Week,Intensity,Latitude,Longitude,Month,Province,Publisher,Sentence Number,Source,Source Country,Source Name,Source Sectors,Story ID,Target Country,Target Name,Target Sectors,Year
322,Douma,Syria,2018-01-09,NULL,2018-01-09,ICEWS28412954,"The sources added that the army's artillery and missile units pounded terrorists' strongholds in farms between Harasta and Douma, inflicting major losses on the militants.",fight with artillery and tanks,Syrian Army's Elite Forces Dispatched to Eastern Damascus,"(2018, 2, 3)",-10,33.5718,36.4027,1,Muhafazat Rif Dimashq,FARS News Agency,5,Factiva,Syria,Military (Syria),"Military,Government",46265595,Syria,Syria,NULL,2018
323,Douma,Syria,2018-01-09,NULL,2018-01-09,ICEWS28412953,"In the meantime, the army forces repelled terrorists' heavy offensive near Technical Institute in the Vehicles Management Center, killing or wounding a number of gunmen.",Use conventional military force,Syrian Army's Elite Forces Dispatched to Eastern Damascus,"(2018, 2, 3)",-10,33.5718,36.4027,1,Muhafazat Rif Dimashq,FARS News Agency,6,Factiva,Syria,Military (Syria),"Military,Government",46265595,Syria,Armed Gang (Syria),Unidentified Forces,2018
324,NULL,Syria,2018-01-09,NULL,2018-01-09,ICEWS28412854,The ministry said its forces repelled a series of drone attacks Saturday on the Hemeimeem air base and a naval facility in Tartus.,Use conventional military force,The Latest: Russia: Syria drone attacks required outside aid,"(2018, 2, 3)",-10,35.0043,36.1587,1,Muhafazat Tartus,Associated Press Newswires,4,Factiva,Syria,Military (Syria),"Military,Government",46265609,Syria,Syria,NULL,2018
325,Cairo,Egypt,2018-01-09,NULL,2018-01-09,ICEWS28412796,"'President Isaias Afwerki has departed to Cairo for a two-day working visit to Egypt upon the invitation of President Abdul Fattah al-Sisi,' Yemane Gebremeskel posted on his @hawelti account on 9 January.",Make a visit,Eritrean president begins Egypt visit,"(2018, 2, 3)",1.9,30.0626,31.2497,1,Muhafazat al Qahirah,BBC Monitoring Newsfile,3,Factiva,Eritrea,Isaias Afewerki,"Unicameral,Ideological,Government,Social,Orthodox,International Religious,Religious Majority,Elite,Legislative / Parliamentary,National Ethnic,(National) Major Party,Parties,Executive,Executive Office,National Religious,National Ethnic Majority,Far Left",46265667,Egypt,Egypt,NULL,2018
326,Cairo,Egypt,2018-01-09,NULL,2018-01-09,ICEWS28412799,"'President Isaias Afwerki has departed to Cairo for a two-day working visit to Egypt upon the invitation of President Abdul Fattah al-Sisi,' Yemane Gebremeskel posted on his @hawelti account on 9 January.",Host a visit,Eritrean president begins Egypt visit,"(2018, 2, 3)",2.8,30.0626,31.2497,1,Muhafazat al Qahirah,BBC Monitoring Newsfile,3,Factiva,Egypt,Egypt,NULL,46265667,Eritrea,Isaias Afewerki,"Unicameral,Ideological,Government,Social,Orthodox,International Religious,Religious Majority,Elite,Legislative / Parliamentary,National Ethnic,(National) Major Party,Parties,Executive,Executive Office,National Religious,National Ethnic Majority,Far Left",2018
327,Cairo,Egypt,2018-01-09,NULL,2018-01-09,ICEWS28412797,"President Isayas' visit to Cairo comes amid reports that Sudan has closed its border with Eritrea and deployed thousands of troops in the eastern Kassala State, over the alleged deployment of Egyptian forces in Eritrea, meanwhile the Sudanese army chief, Lt-Gen Emad al-Din Mustafa Adawi, is on a visit to Ethiopia.",Make a visit,Eritrean president begins Egypt visit,"(2018, 2, 3)",1.9,30.0626,31.2497,1,Muhafazat al Qahirah,BBC Monitoring Newsfile,5,Factiva,Eritrea,Isaias Afewerki,"Unicameral,Ideological,Government,Social,Orthodox,International Religious,Religious Majority,Elite,Legislative / Parliamentary,National Ethnic,(National) Major Party,Parties,Executive,Executive Office,National Religious,National Ethnic Majority,Far Left",46265667,Egypt,Egypt,NULL,2018
328,Cairo,Egypt,2018-01-09,NULL,2018-01-09,ICEWS28412798,"President Isayas' visit to Cairo comes amid reports that Sudan has closed its border with Eritrea and deployed thousands of troops in the eastern Kassala State, over the alleged deployment of Egyptian forces in Eritrea, meanwhile the Sudanese army chief, Lt-Gen Emad al-Din Mustafa Adawi, is on a visit to Ethiopia.",Reduce relations,Eritrean president begins Egypt visit,"(2018, 2, 3)",-4,30.0626,31.2497,1,Muhafazat al Qahirah,BBC Monitoring Newsfile,5,Factiva,Sudan,Sudan,NULL,46265667,Eritrea,Eritrea,NULL,2018
329,Cairo,Egypt,2018-01-09,NULL,2018-01-09,ICEWS28412800,"President Isayas' visit to Cairo comes amid reports that Sudan has closed its border with Eritrea and deployed thousands of troops in the eastern Kassala State, over the alleged deployment of Egyptian forces in Eritrea, meanwhile the Sudanese army chief, Lt-Gen Emad al-Din Mustafa Adawi, is on a visit to Ethiopia.",Host a visit,Eritrean president begins Egypt visit,"(2018, 2, 3)",2.8,30.0626,31.2497,1,Muhafazat al Qahirah,BBC Monitoring Newsfile,5,Factiva,Egypt,Egypt,NULL,46265667,Eritrea,Isaias Afewerki,"Unicameral,Ideological,Government,Social,Orthodox,International Religious,Religious Majority,Elite,Legislative / Parliamentary,National Ethnic,(National) Major Party,Parties,Executive,Executive Office,National Religious,National Ethnic Majority,Far Left",2018
330,Cairo,Egypt,2018-01-09,NULL,2018-01-09,ICEWS28412802,A Tanzanian delegation led by Foreign Minister Augustine Mahiga arrived in Cairo on Tuesday 9/1/2018 on a three-day visit to Egypt.,Make a visit,Tanzanian FM Arrives in Cairo,"(2018, 2, 3)",1.9,30.0626,31.2497,1,Muhafazat al Qahirah,Unknown,1,Factiva,Tanzania,Tanzania,NULL,46265685,Egypt,Egypt,NULL,2018
331,Cairo,Egypt,2018-01-09,NULL,2018-01-09,ICEWS28412803,A Tanzanian delegation led by Foreign Minister Augustine Mahiga arrived in Cairo on Tuesday 9/1/2018 on a three-day visit to Egypt.,Host a visit,Tanzanian FM Arrives in Cairo,"(2018, 2, 3)",2.8,30.0626,31.2497,1,Muhafazat al Qahirah,Unknown,1,Factiva,Egypt,Egypt,NULL,46265685,Tanzania,Tanzania,NULL,2018
332,Cairo,Egypt,2018-01-09,NULL,2018-01-09,ICEWS28412801,The Tanzanian delegation is scheduled to meet a number of Egyptian officials for talks on means of boosting bilateral relations as well as the latest developments on the regional and international arenas.,Express intent to meet or negotiate,Tanzanian FM Arrives in Cairo,"(2018, 2, 3)",4,30.0626,31.2497,1,Muhafazat al Qahirah,Unknown,2,Factiva,Tanzania,Tanzania,NULL,46265685,Egypt,Egypt,NULL,2018
333,NULL,Egypt,2018-01-09,NULL,2018-01-09,ICEWS28412938,"During a joint press conference with Irish Deputy Prime Minister and Minister for Foreign Affairs and Trade Simon Coveney, currently visiting Egypt, Shoukri said their talks covered regional and international issues, including the Palestinian cause and Egyptian-European Union relations and joint action to combat terror.",Make a visit,"Egypt, Ireland Agree to Hold Periodical Consultations","(2018, 2, 3)",1.9,30.0626,31.2497,1,NULL,Unknown,2,Factiva,Ireland,Government (Ireland),Government,46265686,Egypt,Egypt,NULL,2018
334,NULL,Egypt,2018-01-09,NULL,2018-01-09,ICEWS28412939,"During a joint press conference with Irish Deputy Prime Minister and Minister for Foreign Affairs and Trade Simon Coveney, currently visiting Egypt, Shoukri said their talks covered regional and international issues, including the Palestinian cause and Egyptian-European Union relations and joint action to combat terror.",Make a visit,"Egypt, Ireland Agree to Hold Periodical Consultations","(2018, 2, 3)",1.9,30.0626,31.2497,1,NULL,Unknown,2,Factiva,Ireland,Simon Coveney,"Defense / Security Ministry,Center Right,Executive,Ideological,Lower House,(National) Major Party,Government,Parties,Agriculture / Fishing / Forestry Ministry,Legislative / Parliamentary",46265686,Egypt,Egypt,NULL,2018
335,NULL,Egypt,2018-01-09,NULL,2018-01-09,ICEWS28412940,"During a joint press conference with Irish Deputy Prime Minister and Minister for Foreign Affairs and Trade Simon Coveney, currently visiting Egypt, Shoukri said their talks covered regional and international issues, including the Palestinian cause and Egyptian-European Union relations and joint action to combat terror.",Host a visit,"Egypt, Ireland Agree to Hold Periodical Consultations","(2018, 2, 3)",2.8,30.0626,31.2497,1,NULL,Unknown,2,Factiva,Egypt,Egypt,NULL,46265686,Ireland,Government (Ireland),Government,2018
336,NULL,Egypt,2018-01-09,NULL,2018-01-09,ICEWS28412941,"During a joint press conference with Irish Deputy Prime Minister and Minister for Foreign Affairs and Trade Simon Coveney, currently visiting Egypt, Shoukri said their talks covered regional and international issues, including the Palestinian cause and Egyptian-European Union relations and joint action to combat terror.",Host a visit,"Egypt, Ireland Agree to Hold Periodical Consultations","(2018, 2, 3)",2.8,30.0626,31.2497,1,NULL,Unknown,2,Factiva,Egypt,Egypt,NULL,46265686,Ireland,Simon Coveney,"Defense / Security Ministry,Center Right,Executive,Ideological,Lower House,(National) Major Party,Government,Parties,Agriculture / Fishing / Forestry Ministry,Legislative / Parliamentary",2018
337,Harasta,Syria,2018-01-09,NULL,2018-01-09,ICEWS28412814,"The renewed attack came amid intense battles that raged on in the Eastern Ghouta countryside of Damascus on Tuesday, mainly in the city of Harasta, where the army is fighting against the al-Qaida-linked Levant Liberation Committee (LLC), previously known as the Nusra Front.",Use conventional military force,5 killed in rebels' mortar shelling on Damascus,"(2018, 2, 3)",-10,33.5587,36.3652,1,Muhafazat Rif Dimashq,Xinhua News Agency,4,Factiva,Syria,Military (Syria),"Military,Government",46265782,NULL,Al Qaeda,"International Radicals / Extremists / Fundamentalists,Sunni,International Religious,International Dissident,International Insurgents",2018
338,Harasta,Syria,2018-01-09,NULL,2018-01-09,ICEWS28412815,"The renewed attack came amid intense battles that raged on in the Eastern Ghouta countryside of Damascus on Tuesday, mainly in the city of Harasta, where the army is fighting against the al-Qaida-linked Levant Liberation Committee (LLC), previously known as the Nusra Front.",Use conventional military force,5 killed in rebels' mortar shelling on Damascus,"(2018, 2, 3)",-10,33.5587,36.3652,1,Muhafazat Rif Dimashq,Xinhua News Agency,4,Factiva,NULL,Al Qaeda,"International Radicals / Extremists / Fundamentalists,Sunni,International Religious,International Dissident,International Insurgents",46265782,Syria,Military (Syria),"Military,Government",2018
339,NULL,Syria,2018-01-09,NULL,2018-01-09,ICEWS28412920,"Meanwhile, the War Media, the media wing of the Syrian army, said the Syrian forces are targeting the positions of the al-Qaida-linked Levant Liberation Committee (LLC), previously known as the Nusra Front, in the vicinity of Abu al-Duhur airbase.",Make statement,Syrian army closes in on key rebel-held airbase in Idlib province,"(2018, 2, 3)",0,35.7667,36.6667,1,Idlib,Xinhua News Agency,4,Factiva,Syria,Media (Syria),"Social,Media",46265784,Syria,Military (Syria),"Military,Government",2018
340,NULL,Syria,2018-01-09,NULL,2018-01-09,ICEWS28412760,"The message, titled: 'And it is due from us to aid those who believe', was promoted by key supporters of the group on the messaging app Telegram, who urged al-Qaeda members in Syria and each other to heed their leader's call for unity.",Make an appeal or request,Al-Qaeda reiterates call for jihadists' unity in Syria amid mounting pressure,"(2018, 2, 3)",3,35.7667,36.6667,1,Idlib,BBC Monitoring Middle East,4,Factiva,Syria,Citizen (Syria),"Social,General Population / Civilian / Social",46265822,NULL,Al Qaeda,"International Radicals / Extremists / Fundamentalists,Sunni,International Religious,International Dissident,International Insurgents",2018
341,NULL,Egypt,2018-01-09,NULL,2018-01-09,ICEWS28412791,Defense and Military Production Minister Sedki Sobhy said that the Egyptian army will remain a pillar of values and an example of hard work and devotion for the sake of the homeland.,Make statement,Egyptian Army Will Remain Pillar for Values - Minister,"(2018, 2, 3)",0,30.0626,31.2497,1,NULL,Unknown,1,Factiva,Egypt,Sedki Sobhi,"Defense / Security Ministry,Military,Executive,Government",46265848,Egypt,Egyptian Army,"Military,Government,Army",2018
342,NULL,Egypt,2018-01-09,NULL,2018-01-09,ICEWS28412792,The minister conveyed the greetings of President Abdel Fattah El Sisi to them on the occasion of the new year.,Make statement,Egyptian Army Will Remain Pillar for Values - Minister,"(2018, 2, 3)",0,30.0626,31.2497,1,NULL,Unknown,5,Factiva,Egypt,Sedki Sobhi,"Defense / Security Ministry,Military,Executive,Government",46265848,Egypt,Abdel Fattah Al-Sisi,"Sunni,International Religious,Executive,Government,Elite,Executive Office",2018
346,Kirkuk,Iraq,2018-01-09,NULL,2018-01-09,ICEWS28413069,"'Gunmen had opened fire from a car on two people and killed them in the Adan district,' Kirkuk police spokesman Afrasiaw Kamil said.",fight with small arms and light weapons,Gunmen kill two Kurds in Iraq's disputed Kirkuk,"(2018, 2, 3)",-10,35.4681,44.3922,1,Muhafazat Kirkuk,BBC Monitoring Middle East,3,Factiva,Iraq,Armed Gang (Iraq),Unidentified Forces,46266080,Iraq,Citizen (Iraq),"General Population / Civilian / Social,Social",2018
347,NULL,Syria,2018-01-09,NULL,2018-01-09,ICEWS28412984,"After preventing the attack, the Russian military analyzed the design of and ammunition inside the seized UAVs, saying that such drones could have been supplied to the militants only by a country that is capable of 'providing satellite navigation and remote control for the dropping of explosive devices.'",Make statement,US Spy Aircraft Flew Between Russian Bases in Syria During Drone Attack - MoD,"(2018, 2, 3)",0,35.0043,36.1587,1,Muhafazat Tartus,Unknown,5,Factiva,Russian Federation,Armed Forces of the Russian Federation,"Military,Government",46266174,Russian Federation,Russia,NULL,2018
348,Arish,Egypt,2018-01-09,NULL,2018-01-09,ICEWS28413090,"The extremists were killed in a shootout with police, when the security forces raided a suspected hideout in the city of Arish, according to the ministry.",Use conventional military force,Egypt’s Security Forces Kill 8 Extremists in Sinai Peninsula,"(2018, 2, 3)",-10,31.1316,33.7984,1,Muhafazat Shamal Sina',Unknown,2,Factiva,Egypt,Military Personnel - Special (Egypt),"Military,Government",46266180,Egypt,Egypt,NULL,2018
349,NULL,Syria,2018-01-09,NULL,2018-01-09,ICEWS28413173,Turkish Foreign Minister Mevlut Cavusoglu earlier said that the Syrian government forces were attacking moderate opposition militants in the Idlib province under the pretext of fighting terrorists.,Make statement,"Turkey Summons Russia, Iran Ambassadors Over Idlib De-Escalation Zone Violation - Reports","(2018, 2, 3)",0,35.7667,36.6667,1,Idlib,Unknown,3,Factiva,Turkey,Mevlut Cavusoglu,"Government,Unicameral,Legislative / Parliamentary,Foreign Ministry,Executive",46266416,Syria,Military (Syria),"Military,Government",2018
350,NULL,Syria,2018-01-09,NULL,2018-01-09,ICEWS28413175,Turkish Foreign Minister Mevlut Cavusoglu earlier said that the Syrian government forces were attacking moderate opposition militants in the Idlib province under the pretext of fighting terrorists.,Use conventional military force,"Turkey Summons Russia, Iran Ambassadors Over Idlib De-Escalation Zone Violation - Reports","(2018, 2, 3)",-10,35.7667,36.6667,1,Idlib,Unknown,3,Factiva,Syria,Military (Syria),"Military,Government",46266416,Syria,Militant (Syria),Unidentified Forces,2018
351,Amman,Jordan,2018-01-09,NULL,2018-01-09,ICEWS28413249,"On Sunday, the Jordanian Foreign Ministry announced that Amman approved UN humanitarian aid deliveries that would be transported through its territory to al-Rukban camp.",Praise or endorse,UN Aid to Refugee Camp on Syria-Jordan Border May Be Used for Arms Transfers - Watchdog,"(2018, 2, 3)",3.4,31.9552,35.945,1,Muhafazat `Amman,Unknown,2,Factiva,Jordan,Jordan,NULL,46266470,NULL,United Nations,"Global Diplomatic IGOs,International Government Organization,Global",2018
352,Damascus,Syria,2018-01-09,NULL,2018-01-09,ICEWS28413203,"In a press release cited by the official agency Sana, the Syrian army indicates having 'touched' a plane and 'repelled three Israeli Israeli attacks on military positions in the region of Qoutayfé' in the north-east of Damascus.",Use conventional military force,L'armée israélienne cible des positions militaires en Syrie,"(2018, 2, 3)",-10,33.5102,36.2913,1,Dimashq,Yogam Communications SARL,3,Factiva,Syria,Military (Syria),"Military,Government",46266486,Israel,Israel,NULL,2018
353,Hamah,Syria,2018-01-09,NULL,2018-01-09,ICEWS28413146,"The army forces engaged in fierce clashes with al-Nusra Front (Tahrir al-Sham Hay'at or the Levant Liberation Board) terrorists in Northeastern Hama, regaining control of the town of al-Rahjan.",Use conventional military force,Syrian Army Wins Back Control of Strategic Region in Hama,"(2018, 2, 3)",-10,35.1318,36.7578,1,Muhafazat Hamah,FARS News Agency,2,Factiva,Syria,Military (Syria),"Military,Government",46266492,Syria,Terrorist (Jabhat al-Nusra),"Dissident,Radicals / Extremists / Fundamentalists",2018
354,NULL,Iraq,2018-01-09,NULL,2018-01-09,ICEWS28413192,"Iraqi Prime Minister Haider al-Abadi has urged the parliament to approve the 2018 budget, saying that delays are unacceptable.",Make an appeal or request,Iraq's Abadi urges parliament to approve 2018 budget,"(2018, 2, 3)",3,33.3406,44.4009,1,NULL,BBC Monitoring Middle East,2,Factiva,Iraq,Haider Al-Abadi,"Muslim,Parties,(National) Major Party,Shia,Executive Office,International Religious,Ideological,Executive,Government,Lower House,Fundamentalist,Legislative / Parliamentary",46266495,Iraq,Legislature (Iraq),"Government,Legislative / Parliamentary",2018
355,Cairo,Egypt,2018-01-09,NULL,2018-01-09,ICEWS28413120,CAIRO (AP) — Egypt's president and his Eritrean counterpart met in Cairo on Monday amid heightened tensions with Sudan and Ethiopia over border disputes and the construction of a massive upstream Nile dam.,Consult,"Egypt, Eritrea leaders meet as Nile tensions rise","(2018, 2, 3)",1,30.0626,31.2497,1,Muhafazat al Qahirah,Associated Press Newswires,1,Factiva,Egypt,Head of Government (Egypt),"Government,Executive,Executive Office",46266508,Sudan,Sudan,NULL,2018
356,Cairo,Egypt,2018-01-09,NULL,2018-01-09,ICEWS28413121,CAIRO (AP) — Egypt's president and his Eritrean counterpart met in Cairo on Monday amid heightened tensions with Sudan and Ethiopia over border disputes and the construction of a massive upstream Nile dam.,Consult,"Egypt, Eritrea leaders meet as Nile tensions rise","(2018, 2, 3)",1,30.0626,31.2497,1,Muhafazat al Qahirah,Associated Press Newswires,1,Factiva,Egypt,Head of Government (Egypt),"Government,Executive,Executive Office",46266508,Ethiopia,Ethiopia,NULL,2018
357,Cairo,Egypt,2018-01-09,NULL,2018-01-09,ICEWS28413123,CAIRO (AP) — Egypt's president and his Eritrean counterpart met in Cairo on Monday amid heightened tensions with Sudan and Ethiopia over border disputes and the construction of a massive upstream Nile dam.,Consult,"Egypt, Eritrea leaders meet as Nile tensions rise","(2018, 2, 3)",1,30.0626,31.2497,1,Muhafazat al Qahirah,Associated Press Newswires,1,Factiva,Sudan,Sudan,NULL,46266508,Egypt,Head of Government (Egypt),"Government,Executive,Executive Office",2018
358,Cairo,Egypt,2018-01-09,NULL,2018-01-09,ICEWS28413124,CAIRO (AP) — Egypt's president and his Eritrean counterpart met in Cairo on Monday amid heightened tensions with Sudan and Ethiopia over border disputes and the construction of a massive upstream Nile dam.,Consult,"Egypt, Eritrea leaders meet as Nile tensions rise","(2018, 2, 3)",1,30.0626,31.2497,1,Muhafazat al Qahirah,Associated Press Newswires,1,Factiva,Ethiopia,Ethiopia,NULL,46266508,Egypt,Head of Government (Egypt),"Government,Executive,Executive Office",2018
359,Cairo,Egypt,2018-01-09,NULL,2018-01-09,ICEWS28413122,"Ethiopia denies it is cutting into Egypt's share of the Nile, and has accused Eritrea of training rebels to carry out sabotage attacks on the dam.",Accuse,"Egypt, Eritrea leaders meet as Nile tensions rise","(2018, 2, 3)",-2,30.0626,31.2497,1,Muhafazat al Qahirah,Associated Press Newswires,4,Factiva,Ethiopia,Ethiopia,NULL,46266508,Eritrea,Eritrea,NULL,2018
360,Beirut,Lebanon,2018-01-09,NULL,2018-01-09,ICEWS28413117,"BEIRUT, Jan. 9 (Xinhua) -- Lebanon's Prime Minister Saad Hariri on Tuesday expressed his gratitude for China's funding for a new conservatory in Lebanon.",Praise or endorse,Lebanon hails China's funding for building conservatory,"(2018, 2, 3)",3.4,33.8889,35.4944,1,Beyrouth,Xinhua News Agency,1,Factiva,Lebanon,Saad Hariri,"Parties,Government,International Religious,Executive Office,(National) Minor Party,Elite,Sunni,Ideological,Center Right,Executive",46266516,China,China,NULL,2018
361,Beirut,Lebanon,2018-01-09,NULL,2018-01-09,ICEWS28413116,"The Chinese ambassador said 'upon the request of the Lebanese government, the Chinese government decided to help Lebanon build this conservatory which will be the first comprehensive project the Chinese government will launch in Lebanon.'",Make statement,Lebanon hails China's funding for building conservatory,"(2018, 2, 3)",0,33.8889,35.4944,1,Beyrouth,Xinhua News Agency,5,Factiva,China,Foreign Affairs (China),"Government,Foreign Ministry,Executive",46266516,China,Government (China),Government,2018
362,Baghdad,Iraq,2018-01-09,NULL,2018-01-09,ICEWS28413209,"Brussels, 08/01/2018 (Agence Europe) – In a joint communication on elements for an EU strategy for Iraq, the European Commission and High Representative of the EU for Foreign Affairs and Security Policy proposed, on Monday 8 January, establishing a dialogue on migration with Iraq.",Engage in negotiation,IRAQ; EU wants to establish migration dialogue with Baghdad,"(2018, 2, 3)",7,33.3406,44.4009,1,Muhafazat Baghdad,Unknown,1,Factiva,NULL,European Commission,"International Government Organization,Regional Diplomatic IGOs,Regional",46266645,NULL,European Union,"International Government Organization,Regional Diplomatic IGOs,Regional",2018
363,Baghdad,Iraq,2018-01-09,NULL,2018-01-09,ICEWS28413210,"Brussels, 08/01/2018 (Agence Europe) – In a joint communication on elements for an EU strategy for Iraq, the European Commission and High Representative of the EU for Foreign Affairs and Security Policy proposed, on Monday 8 January, establishing a dialogue on migration with Iraq.",Engage in negotiation,IRAQ; EU wants to establish migration dialogue with Baghdad,"(2018, 2, 3)",7,33.3406,44.4009,1,Muhafazat Baghdad,Unknown,1,Factiva,NULL,European Union,"International Government Organization,Regional Diplomatic IGOs,Regional",46266645,NULL,European Commission,"International Government Organization,Regional Diplomatic IGOs,Regional",2018
364,Baghdad,Iraq,2018-01-09,NULL,2018-01-09,ICEWS28413238,"In this communication, the Commission and the High Representative explained that, on the basis of a technical visit of representatives of the EU in Iraq in December 2017, the EU' aims to develop a tailored approach of the management of migration for the benefit of the EU and Iraq'.",Make statement,IRAK; l’UE veut établir un dialogue sur la migration avec Bagdad,"(2018, 2, 3)",0,33.3406,44.4009,1,Muhafazat Baghdad,Unknown,2,Factiva,NULL,European Commission,"International Government Organization,Regional Diplomatic IGOs,Regional",46266659,NULL,European Union,"International Government Organization,Regional Diplomatic IGOs,Regional",2018
373,Amman,Jordan,2018-01-09,NULL,2018-01-09,ICEWS28413398,"AMMAN, Jan. 9 (Xinhua) -- U.S. Vice President Mike Pence will visit Jordan on Jan. 21 as part of a regional tour that also includes Egypt and Israel, the Jordan News Agency reported on Tuesday.",Express intent to meet or negotiate,U.S. vice president to visit Jordan during Mideast tour,"(2018, 2, 3)",4,31.9552,35.945,1,Muhafazat `Amman,Xinhua News Agency,1,Factiva,United States,Mike Pence,"Provincial,Local,Center Right,Ideological,(National) Major Party,Parties,Government,Executive Office,Executive,Legislative / Parliamentary,Lower House",46266762,Jordan,Jordan,NULL,2018
374,Amman,Jordan,2018-01-09,NULL,2018-01-09,ICEWS28413400,Farah added that Pence will also discuss with the Middle East leaders ways to work together to fight terrorism and improve national security.,Express intent to meet or negotiate,U.S. vice president to visit Jordan during Mideast tour,"(2018, 2, 3)",4,31.9552,35.945,1,Muhafazat `Amman,Xinhua News Agency,5,Factiva,United States,Mike Pence,"Provincial,Local,Center Right,Ideological,(National) Major Party,Parties,Government,Executive Office,Executive,Legislative / Parliamentary,Lower House",46266762,NULL,Middle East,NULL,2018
375,NULL,Syria,2018-01-09,NULL,2018-01-09,ICEWS28413347,"Speaking to reporters on Tuesday, Turkish Foreign Minister Mevlut Cavusoglu accused Syria's Assad government of launching attacks on moderate opposition in Idlib, which 'could damage the process of political resolution.'",Accuse,"Turkey summons Russian, Iranian ambassadors over Syria cease-fire violations","(2018, 2, 3)",-2,35.7667,36.6667,1,Idlib,Xinhua News Agency,3,Factiva,Turkey,Mevlut Cavusoglu,"Unicameral,Executive,Government,Legislative / Parliamentary,Foreign Ministry",46266763,Syria,Government (Syria),Government,2018
376,NULL,Syria,2018-01-09,NULL,2018-01-09,ICEWS28413348,"Speaking to reporters on Tuesday, Turkish Foreign Minister Mevlut Cavusoglu accused Syria's Assad government of launching attacks on moderate opposition in Idlib, which 'could damage the process of political resolution.'",Use conventional military force,"Turkey summons Russian, Iranian ambassadors over Syria cease-fire violations","(2018, 2, 3)",-10,35.7667,36.6667,1,Idlib,Xinhua News Agency,3,Factiva,Syria,Government (Syria),Government,46266763,Syria,Syria,NULL,2018
