,City,Country,Datetime,District,Event Date,Event ID,Event Sentence,Event Text,Headline,ISO Week,Intensity,Latitude,Longitude,Month,Province,Publisher,Sentence Number,Source,Source Country,Source Name,Source Sectors,Story ID,Target Country,Target Name,Target Sectors,Year
1386,Al Minya,Egypt,2016-02-25,NULL,2016-02-25,ICEWS24216984,An Egyptian court on Thursday sentenced three Coptic Christian teenagers to five years in jail for contempt of Islam after they were seen in a video mocking Muslim prayers.,"Arrest, detain, or charge with legal action",Egypt sentences Christian teens to 5 years for contempt of Islam,"(2016, 8, 3)",-5,28.1099,30.7503,2,Muhafazat al Minya,Agence France-Presse,1,Factiva,Egypt,Egypt,NULL,40440718,Egypt,Children (Egypt),"General Population / Civilian / Social,Social",2016
1387,Al Minya,Egypt,2016-02-25,NULL,2016-02-25,ICEWS24216983,"Defence lawyer Maher Naguib said the four had not intended to insult Islam in the video, but merely to mock the beheadings carried out by jihadists of the Islamic State group.",Criticize or denounce,Egypt sentences Christian teens to 5 years for contempt of Islam,"(2016, 8, 3)",-2,28.1099,30.7503,2,Muhafazat al Minya,Agence France-Presse,3,Factiva,Egypt,Defense Attorney (Egypt),"Government,Judicial",40440718,Iraq,Islamic State of Iraq and the Levant,"Ideological,Sunni,International Religious,Fundamentalist,Dissident,Muslim,Insurgents",2016
1393,Darayya,Syria,2016-02-25,NULL,2016-02-25,ICEWS24217238,"Syrian army helicopters dropped at least 30 barrel bombs on the besieged district of Daraya nearly 8 km (5 miles) south west of the centre of Damascus, the Observatory said.",Employ aerial weapons,"RPT-Syria govt says Nusra Front allies fire mortars on capital, one dead","(2016, 8, 3)",-10,33.4583,36.2326,2,Muhafazat Rif Dimashq,Reuters News,4,Factiva,Syria,Military (Syria),"Government,Military",40440916,Syria,Syria,NULL,2016
1394,Damascus,Syria,2016-02-25,NULL,2016-02-25,ICEWS24217274,"BEIRUT, Feb 25 (Reuters) - Russia bombed Syrian rebel-held areas in northwestern Syria on Thursday as government forces sought to take more ground at the Turkish border, ahead of a planned halt to fighting, which rebels predicted Damascus and Moscow would ignore.",Use conventional military force,WRAPUP 1-Russian jets in Syria pound Latakia ahead of fighting halt,"(2016, 8, 3)",-10,33.5102,36.2913,2,Dimashq,Reuters News,6,Factiva,Russian Federation,Russia,NULL,40440925,Syria,Syria,NULL,2016
1395,NULL,Saudi Arabia,2016-02-25,NULL,2016-02-25,ICEWS24217100,"BRUSSELS, Feb 25 (Reuters) - The European Parliament called on the European Union to impose an arms embargo against Saudi Arabia on Thursday, saying Britain, France and other EU governments should no longer sell weapons to a country accused of targeting civilians in Yemen.","Impose embargo, boycott, or sanctions",UPDATE 1-European Parliament calls for Saudi arms embargo,"(2016, 8, 3)",-8,24.6877,46.7219,2,NULL,Reuters News,4,Factiva,NULL,European Parliament,"Regional,International Government Organization,Regional Diplomatic IGOs",40441000,Saudi Arabia,Saudi Arabia,NULL,2016
1396,Raqqa,Syria,2016-02-25,NULL,2016-02-25,ICEWS24217285,WASHINGTON (AP) â€” Top U.S. defense officials say Syrian rebel forces are now preparing to go after the Islamic State's de facto headquarters of Raqqa after retaking the key eastern town of Shaddadeh.,Make statement,Carter: Syrian forces moving to retake key Syrian towns,"(2016, 8, 3)",0,35.9528,39.0079,2,Ar Raqqah,Associated Press Newswires,1,Factiva,United States,United States,NULL,40441021,Syria,Rebel Group (Syria),"Rebel,Dissident",2016
1397,Mosul,Iraq,2016-02-25,NULL,2016-02-25,ICEWS24217286,Defense Secretary Ash Carter says the largely Kurdish Syrian Democratic forces circled Shaddadeh and want to sever the northern artery between Raqqa and Mosul in Iraq.,Make statement,Carter: Syrian forces moving to retake key Syrian towns,"(2016, 8, 3)",0,36.335,43.1189,2,Muhafazat Ninawa,Associated Press Newswires,5,Factiva,United States,Ash Carter,"Government,Defense / Security Ministry,Executive",40441021,Romania,Democratic Force,"Center Left,Ideological,(National) Minor Party,Parties",2016
1398,Damascus,Syria,2016-02-25,NULL,2016-02-25,ICEWS24217208,"Damascus, SANA, Syria condemned Wednesday [24 February] the statements made by the US State Secretary John Kerry at the Senate Yesterday where he talked about prolonging the crisis in Syria and the possibility of its partition.",Criticize or denounce,Syria condemns Kerry's statement on possibility of country's 'partition',"(2016, 8, 3)",-2,33.5102,36.2913,2,Dimashq,BBC Monitoring Middle East,1,Factiva,Syria,Syria,NULL,40441082,United States,John Kerry,"Parties,(National) Major Party,Upper House,Cabinet,Executive,Foreign Ministry,Center Left,Government,Legislative / Parliamentary,Ideological",2016
1403,Aleppo,Syria,2016-02-25,NULL,2016-02-25,ICEWS24217479,"TEHRAN (FNA)- The Syrian army and popular forces launched a major counter-offensive on ISIL militants in Aleppo, winning back a village and standing at the gates of another one.",Use conventional military force,Army Captures Another Village in Aleppo,"(2016, 8, 3)",-10,36.2012,37.1612,2,Muhafazat Halab,FARS News Agency,1,Factiva,Syria,Military (Syria),"Government,Military",40441332,Syria,Militant (Syria),Unidentified Forces,2016
1404,Hamah,Syria,2016-02-25,NULL,2016-02-25,ICEWS24217490,"The Syrian warplanes targeted a number of positions and center points of terrorist groups in the Eastern province of Hama, killing dozens of militants and destroying their military hardware.",Employ aerial weapons,Source: FSA-Linked Commander Killed in Hama,"(2016, 8, 3)",-10,35.1318,36.7578,2,Muhafazat Hamah,FARS News Agency,3,Factiva,Syria,Syria,NULL,40441334,Syria,Militant (Syria),Unidentified Forces,2016
1405,Hamah,Syria,2016-02-25,NULL,2016-02-25,ICEWS24217489,"The Syrian army jets also attacked several terrorist positions in Kefr Zeita, some 39 kilometers Northwest of Hama, and regions around Hor Benafseh town.",Use conventional military force,Source: FSA-Linked Commander Killed in Hama,"(2016, 8, 3)",-10,35.1318,36.7578,2,Muhafazat Hamah,FARS News Agency,4,Factiva,Syria,Military (Syria),"Government,Military",40441334,Syria,Syria,NULL,2016
1406,Damascus,Syria,2016-02-25,NULL,2016-02-25,ICEWS24217462,'Damascus fully supports Moscow in the truce issue in Syria.,Praise or endorse,Ambassador Says Damascus Supports Moscow in Ceasefire Plan,"(2016, 8, 3)",3.4,33.5102,36.2913,2,Dimashq,FARS News Agency,2,Factiva,Syria,Syria,NULL,40441337,Russian Federation,Russia,NULL,2016
1407,Damascus,Syria,2016-02-25,NULL,2016-02-25,ICEWS24217463,Russia and the United States on Monday adopted a joint statement on truce in Syria as of February 27 midnight Damascus time.,Sign formal agreement,Ambassador Says Damascus Supports Moscow in Ceasefire Plan,"(2016, 8, 3)",8,33.5102,36.2913,2,Dimashq,FARS News Agency,4,Factiva,Russian Federation,Russia,NULL,40441337,United States,United States,NULL,2016
1408,Damascus,Syria,2016-02-25,NULL,2016-02-25,ICEWS24217464,Russia and the United States on Monday adopted a joint statement on truce in Syria as of February 27 midnight Damascus time.,Sign formal agreement,Ambassador Says Damascus Supports Moscow in Ceasefire Plan,"(2016, 8, 3)",8,33.5102,36.2913,2,Dimashq,FARS News Agency,4,Factiva,United States,United States,NULL,40441337,Russian Federation,Russia,NULL,2016
1409,Baghdad,Iraq,2016-02-25,NULL,2016-02-25,ICEWS24217352,"BAGHDAD (AP) â€” Security officials say suicide bombers hit a Shiite religious building and a military checkpoint in a Shiite-majority neighborhood of Baghdad, killing 15 people.",Make statement,Suicide bombings in Iraqi capital kill 15,"(2016, 8, 3)",0,33.3406,44.4009,2,Muhafazat Baghdad,Associated Press Newswires,1,Factiva,Iraq,Police (Iraq),"Government,Police",40441367,Iraq,Armed Gang (Iraq),Unidentified Forces,2016
1410,Baghdad,Iraq,2016-02-25,NULL,2016-02-25,ICEWS24217353,"BAGHDAD (AP) â€” Security officials say suicide bombers hit a Shiite religious building and a military checkpoint in a Shiite-majority neighborhood of Baghdad, killing 15 people.",Carry out suicide bombing,Suicide bombings in Iraqi capital kill 15,"(2016, 8, 3)",-10,33.3406,44.4009,2,Muhafazat Baghdad,Associated Press Newswires,1,Factiva,Iraq,Armed Gang (Iraq),Unidentified Forces,40441367,Iraq,Military (Iraq),"Government,Military",2016
1411,Baghdad,Iraq,2016-02-25,NULL,2016-02-25,ICEWS24217354,"BAGHDAD (AP) â€” Security officials say suicide bombers hit a Shiite religious building and a military checkpoint in a Shiite-majority neighborhood of Baghdad, killing 15 people.",Carry out suicide bombing,Suicide bombings in Iraqi capital kill 15,"(2016, 8, 3)",-10,33.3406,44.4009,2,Muhafazat Baghdad,Associated Press Newswires,1,Factiva,Iraq,Armed Gang (Iraq),Unidentified Forces,40441367,Iraq,Citizen (Iraq),"Social,General Population / Civilian / Social",2016
1412,Deir ez-Zor,Syria,2016-02-25,NULL,2016-02-25,ICEWS24217500,"Earlier on Thursday, the United Nations said that the WFP had dropped 21 tons of aid into city on Wednesday.",Make statement,UN Aid to Deir ez-Zor Lands on IS-Held Territory - Source,"(2016, 8, 3)",0,35.3359,40.1408,2,Dayr az Zawr,Unknown,4,Factiva,NULL,United Nations,"International Government Organization,Global Diplomatic IGOs,Global",40441389,NULL,World Food Program,"International Government Organization,Global Diplomatic IGOs,Global,Global Development IGOs",2016
1413,Raqqa,Syria,2016-02-25,NULL,2016-02-25,ICEWS24217406,"Mr. Carter said the encirclement of Shaddadi meant the supply lines between Raqqa, nominally Islamic State headquarters in Syria, and the northern Iraqi city of Mosul, which Islamic State seized in 2014, had been severed.",Make statement,"U.S.-Backed Forces in Syria Surround Islamic State Town, Pentagon Says","(2016, 8, 3)",0,35.9528,39.0079,2,Ar Raqqah,Dow Jones News Service,5,Factiva,United States,Ash Carter,"Government,Defense / Security Ministry,Executive",40441454,Syria,Syria,NULL,2016
1414,Baghdad,Iraq,2016-02-25,NULL,2016-02-25,ICEWS24217400,"'Two suicide bombers wearing explosive belts blew themselves up in front of the Rasul al-Azam (mosque) in the Shaala district' of Baghdad, a police official said, adding that more than 20 people were wounded in the blasts.",Carry out suicide bombing,At least 9 dead in suicide bombings at Baghdad Shiite mosque: police,"(2016, 8, 3)",-10,33.3406,44.4009,2,Muhafazat Baghdad,Agence France-Presse,2,Factiva,Iraq,Armed Gang (Iraq),Unidentified Forces,40441548,Iraq,Iraq,NULL,2016
1415,Raqqa,Syria,2016-02-25,NULL,2016-02-25,ICEWS24217555,"Prior to reaching Shaddadi, units of the Syrian Democratic Forces (SDF) took control of 47 villages along the route linking the cities of Raqqa and Mosul, the respective Syrian and Iraqi capitals of Daeshâ€™s self-proclaimed caliphate, Sputnik news reported earlier.",Occupy territory,"US-Backed Forces Sever Daeshâ€™s Last Supply Route Linking Syria, Iraq â€“ Pentagon Chief","(2016, 8, 3)",-9.5,35.9528,39.0079,2,Ar Raqqah,Unknown,5,Factiva,Syria,Military (Syria),"Government,Military",40441589,Syria,Syria,NULL,2016
1416,Mosul,Iraq,2016-02-25,NULL,2016-02-25,ICEWS24217556,"Prior to reaching Shaddadi, units of the Syrian Democratic Forces (SDF) took control of 47 villages along the route linking the cities of Raqqa and Mosul, the respective Syrian and Iraqi capitals of Daeshâ€™s self-proclaimed caliphate, Sputnik news reported earlier.",Occupy territory,"US-Backed Forces Sever Daeshâ€™s Last Supply Route Linking Syria, Iraq â€“ Pentagon Chief","(2016, 8, 3)",-9.5,36.335,43.1189,2,Muhafazat Ninawa,Unknown,5,Factiva,Syria,Military (Syria),"Government,Military",40441589,Iraq,Iraq,NULL,2016
1417,Darayya,Syria,2016-02-25,NULL,2016-02-25,ICEWS24217336,"Syrian army helicopters dropped at least 30 barrel bombs on the besieged district of Daraya nearly 8 km (5 miles) south west of the centre of Damascus, the Observatory said.",Employ aerial weapons,"Syria govt says Nusra Front allies fire mortars on capital, one dead","(2016, 8, 3)",-10,33.4583,36.2326,2,Muhafazat Rif Dimashq,Reuters News,3,Factiva,Syria,Military (Syria),"Government,Military",40441604,Syria,Syria,NULL,2016
1418,Baghdad,Iraq,2016-02-25,NULL,2016-02-25,ICEWS24217420,"BAGHDAD (Reuters) - Two suicide bombers blew themselves up at a Shi'ite mosque in Baghdad on Thursday, killing at least 15 people, police and medical sources said.",Carry out suicide bombing,Twin suicide bomb attack kills 15 at Shi'ite mosque in Baghdad,"(2016, 8, 3)",-10,33.3406,44.4009,2,Muhafazat Baghdad,Reuters News,1,Factiva,Iraq,Armed Gang (Iraq),Unidentified Forces,40441705,Iraq,Iraq,NULL,2016
1419,Damascus,Syria,2016-02-25,NULL,2016-02-25,ICEWS24217403,"BEIRUT: Russian warplanes bombed Syrian rebel-held areas in northwestern Syria and government forces pounded a suburb of the capital on Thursday, ahead of a planned halt to fighting which rebels predicted Damascus and Moscow would ignore.",Employ aerial weapons,"Russia, Syrian army pound rebels ahead of fighting halt","(2016, 8, 3)",-10,33.5102,36.2913,2,Dimashq,Channel NewsAsia,1,Factiva,Russian Federation,Russia,NULL,40441770,Syria,Syria,NULL,2016
1434,Baghdad,Iraq,2016-02-25,NULL,2016-02-25,ICEWS24217805,"Two suicide bombers blew themselves up at a Shi'ite mosque in Baghdad on Thursday, killing at least 15 people, Reuters reported with the reference to police and medical sources said.",Carry out suicide bombing,Twin suicide bomb attack kills 15 at mosque in Baghdad,"(2016, 8, 3)",-10,33.3406,44.4009,2,Muhafazat Baghdad,Trend News Agency (Azerbaijan),1,Factiva,Iraq,Armed Gang (Iraq),Unidentified Forces,40441996,Iraq,Iraq,NULL,2016
1435,Damascus,Syria,2016-02-25,NULL,2016-02-25,ICEWS24217697,"BEIRUT (AP) â€” The U.S. and Russia have agreed on a cessation of hostilities for Syria that is set to take effect at midnight Friday, local Damascus time.",Express intent to cooperate,A look at the proposed cease-fire for Syria,"(2016, 8, 3)",4,33.5102,36.2913,2,Dimashq,Associated Press Newswires,1,Factiva,United States,United States,NULL,40442128,Russian Federation,Russia,NULL,2016
1436,Damascus,Syria,2016-02-25,NULL,2016-02-25,ICEWS24217698,"BEIRUT (AP) â€” The U.S. and Russia have agreed on a cessation of hostilities for Syria that is set to take effect at midnight Friday, local Damascus time.",Express intent to cooperate,A look at the proposed cease-fire for Syria,"(2016, 8, 3)",4,33.5102,36.2913,2,Dimashq,Associated Press Newswires,1,Factiva,Russian Federation,Russia,NULL,40442128,United States,United States,NULL,2016
1437,Baghdad,Iraq,2016-02-25,NULL,2016-02-25,ICEWS24217618,"The guards at the entrance of the mosque discovered the two suicide bombers and opened fire on them, forcing them to blow up their vests at the gate, killing themselves in addition to seven people from the guards and the worshipers, while 31 others were wounded, the source said.",fight with small arms and light weapons,1st LD: 7 killed in 2 suicide bombings in Baghdad,"(2016, 8, 3)",-10,33.3406,44.4009,2,Muhafazat Baghdad,Xinhua News Agency,3,Factiva,Iraq,Citizen (Iraq),"General Population / Civilian / Social,Social",40442135,Iraq,Armed Gang (Iraq),Unidentified Forces,2016
1438,Aleppo,Syria,2016-02-25,NULL,2016-02-25,ICEWS24217783,"CAIRO (Sputnik) - On Monday, Russia and the United States announced an agreement on the cessation of hostilities between the Syrian government and armed opposition factions in the country.",Make statement,Syrian Ceasefire May Give Impetus to Political Process â€“ Opposition Member,"(2016, 8, 3)",0,36.2012,37.1612,2,Muhafazat Halab,Unknown,2,Factiva,Russian Federation,Russia,NULL,40442159,Syria,Government (Syria),Government,2016
1439,Aleppo,Syria,2016-02-25,NULL,2016-02-25,ICEWS24217784,"CAIRO (Sputnik) - On Monday, Russia and the United States announced an agreement on the cessation of hostilities between the Syrian government and armed opposition factions in the country.",Make statement,Syrian Ceasefire May Give Impetus to Political Process â€“ Opposition Member,"(2016, 8, 3)",0,36.2012,37.1612,2,Muhafazat Halab,Unknown,2,Factiva,United States,United States,NULL,40442159,Syria,Government (Syria),Government,2016
1440,Aleppo,Syria,2016-02-25,NULL,2016-02-25,ICEWS24217785,"CAIRO (Sputnik) - On Monday, Russia and the United States announced an agreement on the cessation of hostilities between the Syrian government and armed opposition factions in the country.",Make statement,Syrian Ceasefire May Give Impetus to Political Process â€“ Opposition Member,"(2016, 8, 3)",0,36.2012,37.1612,2,Muhafazat Halab,Unknown,2,Factiva,Russian Federation,Russia,NULL,40442159,United States,Opposition Coalition (United States),"Protestors / Popular Opposition / Mobs,Dissident",2016
1441,Raqqa,Syria,2016-02-25,NULL,2016-02-25,ICEWS24217808,"Prior to reaching Shaddadi, units of the Syrian Democratic Forces (SDF) took control of 47 villages along the route linking the cities of Raqqa and Mosul, the respective Syrian and Iraqi capitals of Daesh's self-proclaimed caliphate, Sputnik news reported earlier.",Occupy territory,"Pentagon: US-Backed Forces Cut Last Daesh Supply Route Linking Syria, Iraq","(2016, 8, 3)",-9.5,35.9528,39.0079,2,Ar Raqqah,Unknown,6,Factiva,Syria,Military (Syria),"Government,Military",40442164,Syria,Syria,NULL,2016
1442,Mosul,Iraq,2016-02-25,NULL,2016-02-25,ICEWS24217809,"Prior to reaching Shaddadi, units of the Syrian Democratic Forces (SDF) took control of 47 villages along the route linking the cities of Raqqa and Mosul, the respective Syrian and Iraqi capitals of Daesh's self-proclaimed caliphate, Sputnik news reported earlier.",Occupy territory,"Pentagon: US-Backed Forces Cut Last Daesh Supply Route Linking Syria, Iraq","(2016, 8, 3)",-9.5,36.335,43.1189,2,Muhafazat Ninawa,Unknown,6,Factiva,Syria,Military (Syria),"Government,Military",40442164,Iraq,Iraq,NULL,2016
1443,Baghdad,Iraq,2016-02-25,NULL,2016-02-25,ICEWS24217733,"BAGHDAD: Two suicide bombers blew themselves up at a Shi'ite mosque in Baghdad on Thursday, killing at least 15 people, police and medical sources said.",Carry out suicide bombing,Twin suicide bomb attack kills 15 at Shi'ite mosque in Baghdad,"(2016, 8, 3)",-10,33.3406,44.4009,2,Muhafazat Baghdad,Channel NewsAsia,1,Factiva,Iraq,Armed Gang (Iraq),Unidentified Forces,40442205,Iraq,Iraq,NULL,2016
1444,Baghdad,Iraq,2016-02-25,NULL,2016-02-25,ICEWS24217580,"'Two suicide bombers wearing explosive belts blew themselves up in front of the Rasul al-Azam (mosque) in the Shuala district' of Baghdad, a police official said, adding that more than 20 people were wounded in the blasts.",Carry out suicide bombing,At least 9 dead in blasts at Baghdad Shiite mosque: police,"(2016, 8, 3)",-10,33.3406,44.4009,2,Muhafazat Baghdad,Agence France-Presse,2,Factiva,Iraq,Armed Gang (Iraq),Unidentified Forces,40442225,Iraq,Iraq,NULL,2016
1451,Beirut,Lebanon,2016-02-25,NULL,2016-02-25,ICEWS24218004,"BEIRUT (AP) â€” Saudi Arabia has lashed out at Lebanon, cutting off billions of dollars of aid and telling its citizens to leave the country, after Beirut sided with Iran in the fallout over the execution of a Saudi Shiite cleric, in a diplomatic dispute that threatens Lebanon's struggling economy.",Praise or endorse,Saudi piles pressure on Lebanon for siding with Iran,"(2016, 8, 3)",3.4,33.8889,35.4944,2,Beyrouth,Associated Press Newswires,1,Factiva,Lebanon,Lebanon,NULL,40442393,Iran,Iran,NULL,2016
1452,Beirut,Lebanon,2016-02-25,NULL,2016-02-25,ICEWS24218005,"BEIRUT (AP) â€” Saudi Arabia has lashed out at Lebanon, cutting off billions of dollars of aid and telling its citizens to leave the country, after Beirut sided with Iran in the fallout over the execution of a Saudi Shiite cleric, in a diplomatic dispute that threatens Lebanon's struggling economy.",Criticize or denounce,Saudi piles pressure on Lebanon for siding with Iran,"(2016, 8, 3)",-2,33.8889,35.4944,2,Beyrouth,Associated Press Newswires,1,Factiva,Saudi Arabia,Saudi Arabia,NULL,40442393,Lebanon,Lebanon,NULL,2016
1453,Deir ez-Zor,Syria,2016-02-25,NULL,2016-02-25,ICEWS24217975,UN humanitarian chief Stephen Oâ€™Brien said initial reports from the Syrian Arab Red Crescent team on the ground indicated that pallets had landed in the target area as planned.,Make statement,UN Agency Confirms All Syria Aid Airdrops Missed Target â€“ Reports,"(2016, 8, 3)",0,35.3359,40.1408,2,Dayr az Zawr,Unknown,3,Factiva,NULL,United Nations,"International Government Organization,Global,Global Diplomatic IGOs",40442409,NULL,International Committee of the Red Cross,"Nongovernmental Organization (International),Nongovernmental Organizations / Activists,Medical / Health NGOs",2016
1454,Cairo,Egypt,2016-02-25,NULL,2016-02-25,ICEWS24217836,"'Arab parliament speakers assert the necessity of solidarity and union among Arab states to fight violence and terrorism to safeguard the Arab nation,' said the statement.",Make statement,Arab parliament speakers to prepare anti-terrorism charter,"(2016, 8, 3)",0,30.0626,31.2497,2,Muhafazat al Qahirah,Xinhua News Agency,4,Factiva,Egypt,Member of Legislative (Govt) (Egypt),"Legislative / Parliamentary,Government",40442463,Egypt,Labor Union (Egypt),"Social,Labor",2016
1455,Baghdad,Iraq,2016-02-25,NULL,2016-02-25,ICEWS24218035,"'Two suicide bombers wearing explosive belts blew themselves up in front of the Rasul al-Azam (mosque) in the Shuala district' of Baghdad, a police official said, adding that more than 20 people were wounded in the blasts.",Carry out suicide bombing,At least 9 dead in IS-claimed blasts at Baghdad mosque: police,"(2016, 8, 3)",-10,33.3406,44.4009,2,Muhafazat Baghdad,Agence France-Presse,3,Factiva,Iraq,Armed Gang (Iraq),Unidentified Forces,40442786,Iraq,Iraq,NULL,2016
1456,Baghdad,Iraq,2016-02-25,NULL,2016-02-25,ICEWS24218109,"BAGHDAD: Two suicide bombers blew themselves up at a Shi'ite mosque in Baghdad on Thursday, killing at least 15 people in an attack claimed by Islamic State militants.",Carry out suicide bombing,Two suicide bombers kill 15 at Shi'ite mosque in Baghdad,"(2016, 8, 3)",-10,33.3406,44.4009,2,Muhafazat Baghdad,Channel NewsAsia,1,Factiva,Iraq,Armed Gang (Iraq),Unidentified Forces,40442828,Iraq,Iraq,NULL,2016
1466,Baghdad,Iraq,2016-02-25,NULL,2016-02-25,ICEWS24218376,"BAGHDAD, Feb 25 (Reuters) - Two suicide bombers blew themselves up at a Shi'ite mosque in Baghdad on Thursday, killing at least 15 people, police and medical sources said.",Carry out suicide bombing,UPDATE 1-Twin suicide bomb attack kills 15 at Shi'ite mosque in Baghdad,"(2016, 8, 3)",-10,33.3406,44.4009,2,Muhafazat Baghdad,Reuters News,2,Factiva,Iraq,Armed Gang (Iraq),Unidentified Forces,40443132,Iraq,Iraq,NULL,2016
1479,NULL,Jordan,2016-02-25,NULL,2016-02-25,ICEWS24218509,"'They're pretty sheepish about it,' he told reporters while meeting with King Abdullah II of Jordan in the Oval Office.",Consult,Obama expects Senate to back down on threats to block hearing ; He hopes the flap over Supreme Court hearing will 'evolve' once a nominee is chosen and the panel can do its job,"(2016, 8, 3)",1,31.9552,35.945,2,NULL,USA Today,6,Factiva,Jordan,Abdullah II of Jordan,"Executive Office,Elite,Executive,Government",40443525,United States,Barack Obama,"(National) Major Party,Parties,Center Left,Executive,Executive Office,Government,Ideological",2016
1480,Damascus,Syria,2016-02-25,NULL,2016-02-25,ICEWS24218484,Maurer spoke Thursday in the Syrian capital Damascus after returning from the central city of Homs where he visited the neighborhood of Waer where a cease fire was recently reached.,Make a visit,AP Interview: Syria's need for humanitarian help rises,"(2016, 8, 3)",1.9,33.5102,36.2913,2,Dimashq,Associated Press Newswires,3,Factiva,NULL,Peter Maurer,"Nongovernmental Organization (International),Medical / Health NGOs,Nongovernmental Organizations / Activists",40443615,Syria,Syria,NULL,2016
1481,Damascus,Syria,2016-02-25,NULL,2016-02-25,ICEWS24218485,Maurer spoke Thursday in the Syrian capital Damascus after returning from the central city of Homs where he visited the neighborhood of Waer where a cease fire was recently reached.,Host a visit,AP Interview: Syria's need for humanitarian help rises,"(2016, 8, 3)",2.8,33.5102,36.2913,2,Dimashq,Associated Press Newswires,3,Factiva,Syria,Syria,NULL,40443615,NULL,Peter Maurer,"Nongovernmental Organization (International),Medical / Health NGOs,Nongovernmental Organizations / Activists",2016
1482,Beirut,Lebanon,2016-02-25,NULL,2016-02-25,ICEWS24218455,The tribunal is prosecuting five men connected with Hezbollah for their purported involvement in the killing of the former prime minister.,"Arrest, detain, or charge with legal action",Trial of Al-Akhbar editor moves to closed session; Al-Akhbar trial moves to closed session,"(2016, 8, 3)",-5,33.8889,35.4944,2,Beyrouth,Daily Star,3,Factiva,Lebanon,Public Courts (Lebanon),"Government,Judicial",40443661,Lebanon,Men (Lebanon),"Social,General Population / Civilian / Social",2016
1483,Beirut,Lebanon,2016-02-25,NULL,2016-02-25,ICEWS24218429,The mayor thanked Metn MP Michel Murr for presenting the solution to deal with the regionâ€™s waste â€œat the time the Cabinet is unable to even reach an inch toward a solution.â€,Praise or endorse,Mayor banks on planned thermal plant to resolve trash dilemma; Mayor banks on thermal plant to fix trash woes,"(2016, 8, 3)",3.4,33.8889,35.4944,2,Beyrouth,Daily Star,6,Factiva,Lebanon,City Mayor (Lebanon),"Local,Municipal,Government",40443662,NULL,Michel Murr,"International Religious,Christian",2016
